review_title,review_body
Expected more,"We went to mass at the Cathedral and that was a beautiful experience. But we were hoping there would be more to walk around and see or a self-guided tour, since the Cathedral has a lot of history attached to it. Maybe is not available on Sunday."
Easter Sunday Mass (English),"Very orderly mass arrangement during offering and communion. They divided into 3-4 sections for people to queue up by row and it was absolutely efficient, no chaos, and very fast.Unfortunately, during Easter Sunday, another mass followed right after our 9am, hence left little time to stay behind to pray to other saints.Beautiful church and the biggest catholic church in Seoul"
Tranquility in MyeongDong,"Located in the heart of Seoul, this gothic cathedral is the good place for pilgirimage. Although this first catholic church is just a step away from busy Myeongdong street, you can feel peace and quietness there. The English mass celebrated every Sunday at 9 a.m. You can also find many religious souvenirs in a shop at the cathedral area. This shop open at 9.30 a.m.The best photospot (for me) is near the stairs to cathedral. You can make a nice picture with a whole great Myeongdong Cathedral behind youPS: Don’t forget to give your warm greetings to Virgin Mary after the mass"
Blessed!,We stayed in Myeongdong and the Myeongdong Cathedral is just a few meters from where we stayed. I searched online to look for the time an English mass is held. It is held at 9 am on Sundays. We were blessed to be able to hear mass. The cathedral is beautiful! You have to climb several steps to get there. Sacred and solemn. There is a prayer area on the left side which is also so beautiful and solemn. 
A place to pray while in Myeong dong area,"The church is very near the hotel where we stayed.(Royal Hotel Seoul).It is just a few meters from the hotel.A must for all catholics while in seoul.After mass ,you can find a lot of coffee shop and restaurant within the area."
Nice church,The church is situated on a hill and look Gothic from the outside when we visit as most of the trees are bare. The church interior is beautiful. 
Nice,"Came across this cathedral during my visit to Myeongdong shopping district. Cool building, check it out."
A serene place in the midst of central Seoul,A rich history and presence of calm serenity. Downstairs is a great coffee shop and bakery. Good place for morning stroll.
Happy to Attend Mass in English in Seoul,"The opportunity to attend Mass was an unexpected benefit during a long two-week business trip through Japan and Korea. The Cathedral was a short cab ride from my hotel - the Millennium Seoul Hilton. The 9:00 Mass is in English. The Church was absolutely filled, which enhanced the experienced of worshipping in a foreign country. I had to use my Mass App to find the readings as I did not notice a Missal or Flyer with the readings pre-printed. Not a big deal for me. The Mass was reverent and the Cathedral grounds are lovely. As the 9:00 was ending, people were already lined up at the doors for the 10:00. After Mass, I wondered around the grounds, then into the adjoining streets to visit the food stalls that were opening for the day."
Serene,Beautiful church in the middle of busy Myeongdong. Easy to locate & a nice place to reflect. not very crowded
Western meets Seoul!,"Located in the heart of downtown Seol, Myeong-dong Cathedral is the first parish church of Korea and an important symbol of the Korean Catholic Church.Refreshingly English inside, it was a lovely building. The stained glass windows were restored by artist Lee Nam-gyu om 1982, the original art work was thought to have been created by the French Benedictine Brothers."
Stunning Historic Cathedral,"the Myeong-dong Cathedral is a magnificent building in the middle of the Myeong-dong district. The property is large and welcoming to all visitors who want to explore the property. The cathedral is built in a classical style with beautiful stained glass windows and if you are a fan of historical buildings and cathedrals, this a great place to stop."
Holy nightview !!," Standing right in the middle of Myeongdong street, Myeongdong catholic church welcomes everybody from everywhere.  You may get inside the chapel and feel the holy spirit of this place. A small but well equipped store is selling holy stuffs including bibles and rosaries. "
Convenient Service/Mass Hours,"There are week day masses in the morning and evening. Although, all are in Korean, it is a good way to start or end a hectic travel day."
romantic,I went there during winter with my korean boyfriend and it was really pretty and romantic ! I really enjoyed the ligts all around the catherdal and the atmospehre around it! 
Beautiful Cathedral in the middle of the buzzling Myeongdong,"Wonderful, old fashioned Cathedral in the heart of Seoul's Myeongdong, its very quiet and peaceful inside the Cathedral and well worth a visit "
I walked past this place by accident,This place is indeed a cathedral. It's a tall building with European features that likely has masses and other religious celebrations.
Silence and beautiful architecture ,This place made me surprised about silence and space. You can walk around and think about your life. Also there’s a cafe.
For the soul,"Great visit to see the structure but more importantly, to be thankful to have the opportunity to visit a great country - see its beauty, experience the way of life. Solemn. "
European style church,"passed by this on my trip to Myeong-dong. Quite iconic building and you can't miss it when you're there. I walked around during Christmas, but I was with my family of 2 kids and elderly parents, so didn't have chance to take photo or explore the church as the weather was too cold. Would love to explore again next time. "
Beautiful,Managed to visit on Xmas day and receive communion despite the crowds. Nice architecture as well and signs in English also.
Beautiful Church & Service,"This church is beautiful and has several different services throughout Sunday morning, including an English service at 9 am. It is packed though for every service and people begin lining up outside before a service time because they are scheduled back-to-back ( 8, 9, 10, 11, etc.)There's an underground area associated with the church with art galleries, shopping, and coffee that we went to after the service as well!"
Looked pretty,We saw this in passing while going back to our hotel. It looked very pretty and if we had more time then we would have visited the inside.
Beautiful and majestic!,"The first time you turn the corner and behold the cathedral, there is a sense of wow. As you climb the steps towards it, the sense of peace and majestic feeling overcomes you. It is so beautiful in the middle of a busy city. "
A quiet and peaceful place in a busy city,A nice landscape surrounding the holy building in the heart of Myeongdong area. The church is just opposite the Korean tourist information centre. 
Beautiful Gothic Church,"This church is really used alot in films, dramas, mvs, etc. probably because its the most striking looking of all. Coming from a Catholic country, I would necessarily call this church ""grand"" or anything. Its simple but beautiful. Inside, also looks simple, no wall/ceiling murals, fancy chandeliers or extravagant altars.This church also gives a glimpse of Korean Catholic faith and if you have time do go partake in mass here. "
Pass by when in Myeongdong,Picturesque and not to be missed when walking through Myeongdong market area. Don't forget to say your prayers inside the cathedral :)
A beautiful chirch,"My wife and I did not expect to see such a huge Catholic church right smack in the Myeondong shopping street. As Catholics, we were delighted that we could attend Sunday mass which is conducted in English. Do take note that there are daily masses but the English mass is only on Sunday at 9 am. It is easily accessible via public transport either via the subway train or taxi. For non believers in the religion, this place is beautiful for a short stop visit. "
English Mass on Sundays at 9am,"How to get there?Line 4: Myeong-dong Station Exit 9, 10; Line 2: Euljiro 1(il) ga Station Exit 5, 6; Euljiro 3 (sam) ga"
More like a church,"Myeong-dong Cathedral is the Church for Archdiocese of Seoul and was also the birthplace for the Roman Catholic Church community in Korea. It is located at one end of Myeongdong Street in Seoul. It looks quite impressive. Bishop Laurent Joseph Imbert, and priests Peter Simon and James; Pourthie Jean Antoine are buried here.Admission is free and services are held regularly."
A good place of history and for prayer,Stop by this attraction spot while you are visiting Myeongdong shopping street (preferably around noon). It offers a quiet environment for prayer and self-reflection.The cathedral holds its own history and there is free information leaflets explaining so.
Dissapointing,"I came here to full time before heading back home and was disappointed. Although it's called a cathedral in Europe this would be classed as a big church. I didn't find it overly decorative or interesting, the shopping streets nearby offered more. Apparently it's one of the oldest buildings in Seoul as lots were destroyed during the war but I was expecting more to be honest. There are plenty of better things to do in Seoul. "
Beautiful,It is right at the doorstep of Myeongdong shopping district and it is very beautiful at night. The cathedral is glorious.
Historical church ,"Within the myeongdong shopping district. They have 9am English mass. Going inside the church, you need to queue outside - very organize! The s church decor is stunning and adorable. The facade of the church is a good for photo ops. "
Quick glance,"Some photo opportunities perhaps but can't compare to those in Europe. But since it's just around Myeongdong, we happen to come across it. It's not a place where we would deliberately make plans to see necessarily."
Nice Cathedral - important for Catholics in Korea,Was staying close by and chose to take a look. Didn't know anything about the history of Catholics in Korea so guess I was expecting a much older building. Nice interior and stained glass. Not overly impressive or old by European standards. Little guide books they have were good to read to understand the history of the Catholic Church in Korea and the role of this building. 
Combine with shopping street ,This is just off Myeongdong shopping street. Since that's a must visit place I guess this is too.Building in great condition. Nice architecture. Beautiful stained glass inside and pictures ARE available allowed. Worth checking out definitely 
Myeong-dong Cathedral Review,Located in a quite central location for Seoul visitors. Nice cathedral to visit regardless of being a believer or not. Worth visiting for sure.
A grand iconic cathedral,"We went for Sunday mass at this cathedral. We took subway line 4 and stopped at Myeong-dong Station. Initially we had some trouble locating the entrance and went through an office building to reach it. The entrance is actually located along a side road, off the main Myeong-dong road. It is a very beautiful cathedral of Gothic design and is the centre of catholicism in Korea. We explored the grounds and it was peaceful. We saw bus loads of tourists visiting."
Missing atmosphere,"Quiet place hidden among skyscrapers and busy market streets. Pay attenbtion, there is one-way-roar only, you have to exit the same way, you entered before!"
Church!,I first visited this place on my first visit to Seoul (that was a Sunday) And I am enthralled by this place. One should visit this place while in Korea. 
Beautiful Gothic Cathedral,"If you love Gothic Cathedrals, this is a great spot, contrasting a lot of traditional and contemporary Korean architecture. Settled a 5 min walk away from one of the busiest shopping neighborhoods, it offers a nice pause from the buzz."
Historic Cathedral Church in Myeong-dong,"Very nice to see Myeong-dong Cathedral in the middle of Myeong-dong. This church is built on a 14,412 m2 site, the total floor area of the church is 1,498 m2 and it's dimensions are 69 m is in length, 28 m in width, and 23 m in height. The height of the bell tower is 46.7 m according to statue book in Myeong-dong. You can find more information in statue book on area myeong-dong cathedral. So many object photo you can take in here. If you want to go inside cathedral, come in monday to friday. Saturday to monday is close because there is a worship in here. Many tourist comes here."
Historic Cathedral right next to Myeongdong Shopping Area,"We were surprised to see the cathedral right next to this shopping area. There were a couple of English masses so we were able to join and understand. Though beautiful, it is not as ornate as its European counterparts. It is the oldest Catholic church in Korea and holds significant history for the country. It is on a hill at the end of Myeongdong street so it's location is lovely. There are quiet seating areas outside for prayers and meditation. When we were there, a full moon rose up behind the church as the evening mass ended. Stunning!"
Nice Cathedral,Very nice looking cathedral in the middle of Myeongdong. Nothing much going on with the cathedral except that it is situated on an elevated base so good photo shots.
I was surprized to see this church in Seoul.,"It was a surprise to see this church in Seoul. I was expecting people to be of different religions. But in fact, about 25% are Christian. The church is nice but not a real attraction for us coming from Europe where there is endless numbers of churches of this kind. But I see that many new churches are now in building process in Seoul. And it will be interesting to have a look at them later on."
Beautiful ,"Lovely cathedral. Excellent choir. We attended the youth mass at 7:30pm mass, Sunday. Lovely experience. The grotto to the Virgin Mary outside is inspiring. It's easy to get to: just at the end of the most busy food street in Myeondong which is located right across Lotte Shopping centre, next to the Ibis Ambassador Hotel,Myeondong. "
Just another Cathedrals,If you have been to Europe or North America there are probably better Cathedrals to see. This is a very modest building.
Worth a visit,The Cathedral is worth a visit even if it was for a change of atmosphere in a buzzing city. It is a strange sight in the usually buzzing city. An oasis of rest and quiteness with even a Lourdes like prayer cavern. It si atrange to see a usually tall building almost seemingto drown in the moderness of tall skysrapers.
A very solemn place,"I've been there twice already because Pope Francis visited this church during his visit in Seoul. This is located in the heart of downtown Seoul Myeondong and is the first parish church in Korea and the most important symbol of the Korean Catholic Church. Its called "" Myeong-rye-bang during Joseon Dynasty and was formed 1784. If you want to visit the church, look for Sejong Hotel and at the side of the hotel there is a road going to the church just follow it and at the end of it turn left and you will see the church. Sunday English mass at 7am and 9 am ( in the cathedral). Confession will be done before 9 am sunday mass."
In the heart of Myeong-dong,Visited the cathedral on our way to Myeong-dong shopping district.Nice cathedral.Worth a wall through.
Very nice!,"As Catholics, it was a must to visit, pay your respects and pray. It has beautiful exteriors as well as interiors. It's just sad the mass had just wrapped up. Amusing that it was situated in the middle of a busy and noisy shopping area though."
classic design cathedral,The cathedral is located in a corner of myeong dong street. The environment is comfy and beautiful. Good view to enjoy anther side of the city and appreciate the religious building. 
BEautiful cathedral,Close to Myeongdong station. Big church but you have to go up the stairs. THe structures are old but very beautiful
Peaceful in the heart of Myeongdong,"This cathedral is just a few minutes walk from the Royal Hotel where I was staying. Visited it on my last day. There is a lot of history and significance for this Cathedral.The bodies of 3 saints (martyred during the religious persecutions in the 1800's) are buried under the alter. The architecture itself is the first brick church in Korea - built in the Gothic style and is considered a historical site.On a nice sunny day, the backdrop of the church and the architecture of the church is photo opp worthy. My picture of the church actually has a rainbow that runs across the bottom half of the picture. I'd like to think that it is a nice hello from the heavens. As you walk into the courtyard of the Cathedral to your left is the grotto of the Blessed Virgin Mary where you can light a candle and pray. Inside is so peaceful and worshippers frequent the church throughout the day."
instagram worthy!,Beautiful cathedral that is worthy of an IG post :) this place is just a very short walk from Myeongdong 
.,"So fortunate and blessed to have visited the cathedral. After a long day walking the streets of Seoul, you can find peace, calmness just by sitting inside. A beautiful place for the soul."
An unexpected cathedral in the heart of Seoul,"The Myeong-dong Cathedral was something that I was not expecting to see in Seoul. It is a quiet place to visit, if you need some time away from the hustle and bustle of the city. I can truly recommend."
Myeongdong Cathedral,"the only church i pass by in seoul, hopefully next time i can visit other catholic church. they have english mass during sundays.. "
Nice Arcitecture,"Free to visit, Great architecture, please respect those praying inside. If you are into well designed buildings, or religious sites, this is a good one to visit if you are in Myeong-Dong and need a break from all the busy streets."
"If you're in Myeongdong, might as well",If you're in Myeongdong might as well visit this Cathedral as there isn't much to do in Myeongdong. Not sure what the hype is about for Myeongdong.
Untypical sight in Seoul,"It's refreshing to see a Gothic Catheral in the middle of the shopping area. I enjoyed a short walk around it, as I did not think it was open for people to go inside. There were many tourist taking photos from outside."
Beautiful ,It was lovely early morning visit. Calm and peaceful. We enjoyed the ambience. We were out walking and came to this Cathedral in the middle of a bustling city. 
a sunctuary for the tired and weary soul.......,"It was two weeks ago while walking along the busy shopping district of Myeong dong when we came across this beautiful magnificent church stuck in the middle of a commercial buildings in the heart of Seoul. We were awed by its beauty that we decided to attend mass even though it was in Korean. I am impressed by how the mass was celebrated, very solemn and sacred. It was an early evening mass on a Friday and almost full of churchgoers mostly Koreans office workers. I must admit that I was deeply touch by how the Korean catholics practiced their faith."
Famous catholic church in Korea,"I visited with a friend from overseas. It is easily accessible, located in one of the touristy area called Myeongdong."
A Rare Beautiful Gothic Building Structure ,"Located just a short walking distance from Exit 9 of Myeongdong Station, a place rich in history. The first parish church and place for the Catholic communityThe Church's beautiful architecture and lovely stained glasses are well maintain in in pristine condition. I belief that such pure Gothic architecture building style is a rare find in Seoul.If in need of some inner-peace & self-reflection time, a trip hear will fullfil the objective."
Cathedral..,"Found out that it was just walking distance from my hotel, on my last day in Seoul.. Had a quick breakfast in the morning so that have enough time to visit.... real glad..!!"
Interesting Sunday Mass,"I attend 9 AM English Sunday Mass. The mass is very sacred. However, please expect some tourist tours to appears until 3 minutes before the mass begin."
a holy in the crowd,"for the busy street like myeongdong, you still can find a quiet and peaceful place.. it is myeongdong cathedral. i love i'd been there. it's instagramable for me and my wife. it also have a good architecture and it's so easy to find. (i visit this cathedral on jan 2015)"
"Well done, right location and perfect view","Really well done, right location and perfect view! A little bit strange to see this cathedral in Seoul (at least for me) I was surprised to know that a certain part of people in Korea are catholic. Located on a hill, close to Myeongdong shopping district this cathedral looks awesome, especially in the evening when lights are on. Very modest inside but cozy at the same time. Opened till 21:00 if I am not wrong. Surely worth a visit. "
Amazing,Inside and out equally stunning. The quite places to pray ouside were very moving. Did find difficulties finding. No real direct access.
Beautiful Gothic Cathedral,Located on a hill in middle of city...elevators available.Cab driver could not find it!!!!!He had to ask for help 3 times!!!Wanted to buy a cross in gift shop but gift shop closed and is being updated.
"For a busy place like Myeongdong, this is a quiet and solemn sunctuary","For Christians, this is a must visit place. A very quiet and solemn place in the middle of busy Myeongdong. For foreign Catholics, there is a Sunday English mass at 9am. One of my favorite places is the park in front of the cathedral - my family lounges there with our coffee and tea during the late afternoons of spring and autumn."
Very Beautiful Church,"Coming from a predominantly catholic country, I did not expect Seoul to have such a beautiful cathedral as this. Conveniently located in the heart of Myeongdong , this church has a very nice brick structure with a lot of trees and gardens as well as a nice souvenir shop. I attended Palm Sunday mass here and it was very solemn. My only comment is that the pews do not have kneeling pads so its quite diffiult to kneel during the mass. Oh well, its just a small sacrifice to make to make church service more meaningful. Must visit for Catholic tourists in Korea."
Beautiful,Walk slightly up the hill and there it appears.A surprising structure that appears right after you've shopped to drop. Great contrast and great to behold.
What a beautiful cathedral!,Came to the cathedral in an early morning and then waited to join a mass at 9am on Sunday. The cathedral was on a small hill which was easily to recognize from the distance. The main building and main hall were so beautiful and brought peaceful feeling to us!
Amazing church building,We came across this cathedral during our shopping trips. It is very nicely build with red bricks. We only walked outside the building as the doors are closed. Hope to visit it next time.
Amazing Architecture,"I love the architecture of this church inside and out, and is definitely unique and different from what we see in the Philippines."
Peaceful yet stunning ,Visited this Roman Catholic Church in the middle of Myeongdong since it's just 10 minutes walk from our hotel. Wonderful exterior architecture with red & grey bricks. Love the colourful huge stained glasses at both side of the wall . It's well maintained as it was completed in 1898. Behind the church there's a small garden with beautiful landscapes & a statue of Virgin Mary . Worth a visit even you are not religious but love the gothic architecture!
It was a good 10 minute stop,"We learned that Korean Catholics number about 10% of South Korea's population. The stained glass was nice but not the most beautiful we've ever seen. If you're Catholic, they seem to have daily services, which may be important for your religious needs."
A pretty decent cathedral,A lot bigger on the inside than it looks from the outside. If you're into this kind of thing it is a pretty cathedral. I visited during Sunday mass and it was almost full. 
Seoul Korea visit ,Very nice church. Well maintained! Everyone who attends Mass in this Catholic church is so attentive and everyone participating in singing and response to prayers! We attended 3 daily Masses at 6:00 in the evening (18:00) and Sunday Mass at 10:00 am (in Korean language). There's one English Mass on Sunday at 9:00 am. 
Cafe under the Cathedral,"When you're going to visit this cathedral, don't miss to visit the cathedral cafe ""Jeonkwangsoo"" under the cathedral. You can enjoy very fresh and nice coffee with the cathedral souvenirs in the cozy and comfortable area. By the way, this cathedral dedicated to Our Lady of the Immaculate Conception, the principal patron saint of Korea and the Korean people, the cathedral is a community landmark and a notable symbol of Catholicism in Korea. The cathedral church is one of the earliest and most notable examples of Gothic Revival architecture in Korea."
Catholic Church in the City,"A very big place, and very nice church. There is also a cafe in the basement, and there are seats around the church, where you can sit."
Beautiful cathedral,Catholic church located at myeongdong. Very beatiuful cathedral and many tourist in there to pray n take photo.
Peace Be With You,"I happened to arrive just in time for Saturday night mass. I would definitely recommend checking the website so that you can see a service taking place. Of course I couldn't understand the words, but I was still moved by the music and the fellowship of the people-the church was very crowded! The architecture is simple and beautiful-the stained glass windows very pretty. It is a lovely place to rest and get a break from the teeming crowds of the market. Outside, there is a gift/book store with a nice selection of religious items and books. This is well worth the visit when you are in the area."
