review_title,review_body
City Views,"Had lunch on 59th floor, outstanding views of the the city. Enjoyable buffet lunch well presented, professional staff."
Great Views,"Stopped by here as it was along my travel plans for the day. The building is striking from the outside and in... a little pricy for the overall experience. The exterior elevators are quite thrilling for one with a great respect for heights. It was a bit of a challenge to find the actual entrance to the building/activities and it was quite crowded on the weekend I visited. As mentioned, it was along the travel route I had planned for the day and thought it would be nice to visit the Art Gallery (happened be to the show ""With My Friends"" geared toward children and how children interact with their environment - actually quite charming). Not sure that I would go back unless there were a particular event to attend or art show to see. City views are available in other locations..."
Just a tall building,"I don't know what I was expecting but this was just another modern building. The area is great though, so if you are in a position like me where you're travel buddy wants to visit, you can combine it with a nice walk by the river :)"
63 City,Took a 10-15 mins walk from the Yeoinaru station. First went to the aquarium but the place as smaller than expected. I would say not worth the price if you are not interested in sea creatures. The observatory and art museum was worth the time there as it overlooks the whole of S.Korea.Tip: I left 63 city around 7 and walked past the Han river towards Yeoinaru station and there was a great view there since there was a great sunset.
Worth a visit for the view,"This site is listed as a should do, so we did. We travelled by Metro to the Yeoinaru Station and took a ten minute walk to the building.The visit to the building is free when you purchase a Seoul Tourist Pass, otherwise entry to the 60th Floor viewing floor plus Art Gallery, and the aquarium in the basement costs 25000₩, I think.It was very quiet on the Tuesday of our visit. No crowds and we certainly enjoyed the view of the city and the river Han plus the numerous bridges crossing the river. The Art Gallery on that 60th Floor is interesting and ""easy to interpret"", with several focus on young children.The aquarium in the basement was not huge, with a good collection of sea life. The mermaid swim show at the end of the walk in the aquarium certainly got a lot of the children's attention."
63 CITY= 100 SCORE," 63 building in the highest building in my country, so people want to visit there, and after they visited, they always shocked because of the hight of the building. It was awesome!"
Worth the views,"It overlooks the Hangang river and as the name suggests, it has 63 floors - and is the tallest and most recognisable building in Korea. It is not just a tall building and houses attractions such as Seaworld and an observatory on the 60th floor."
Great view on the top.,You can see Han River from the top.There us an aquarium in the basement. It's not so big but there is a mermaid show. 
Beautiful scene,The night view at here is quite great. it is a wonderful experience stay in 63 tower for 1~2 hour. Very convenient to visit there by taking the subway or bus. You can go there at night when after dinner.
Worth one time visit,I visited twice. The view from the top is great. You can see Namsan Tower in the distance and the new Lotte Tower. That helps you realize how big Seoul is. Huge. It's an iconic building in Seoul so one should visit while in Seoul.
for a rainy day,"I didn't now what to expect. There are not so much inside to do. We've been there on a rainy day. The galleria was closed. We visited the aquarium aqua planet which is nice and artifully displayed but it is more for small children. The aquarium is relatively small. Shops were not very interesting. At sunset, the 63 building is shimmering with the sun (this was not at this rainy day). So it is better to see it from outside. "
Great view of the city,Seoul is a huge city and this building allows for a great view of it along the river. This is well worth a visit.
Tall building,"63 Square is one of the tallest buildings in Seoul. It is also a cultural complex. It has 63 Art observatory, museum, and Aqua Planet. The night view of Seoul from 63 Art, the highest gallery in the world is outstanding!!63 Art Galleria.... 13,000 won. Aqua Planet 23,000 won. Since 90% of the museum in Seoul are FREE and minimal admission fee for the palace. For the galleria and aquarium... 13,000 won and 23, 000 won is a little bit pricey. Subway Line 5, Yeouinaru Station, Exit 4"
The tallest building in Korea,"This is a very popular atraction in Seoul. It has an elevator which takes you to the roof, where there is an observatory. The city view from there is wonderful. At the ground floor there are many restaurants with good options of different kind of food. "
Nothing special,Nothing really special at 63 City. There is a Duty Free Shop there where tourists were brought there by tourist buses.
Awesome View!,"We went up to the top of the 63 building only to find buildings, buildings, and more buildings. There were so much condominiums and it was a bit hazy due to the smog but it was a really awesome view. There is a small coffee shop so you can rest a bit. There is also a small gift shop to buy little gifts."
63,"Amazing view from the top. Restaurants, acuariums, museums and shopping are available inside the building."
Not much to do.,"Saw 63 City from a lot of Korean shows so I came here after a walk at Yeouido Hangang Park. Besides from the tall design of the building, there is not a lot to do. There is an aquarium and an art museum inside. Tickets are quite expensive and its crowded with tourists, especially tourists from China. Seriously don't recommend people to come."
Only outside,"I visited 63 building only outside...în the park, so i can not Tell so much about this spot. It was the tallest building în Asia în 1985"
Amazing 63 building city,"This is the first time I travel to Korea and The 63 city buildings was the best with beautiful yellow glass roof, You can relax on the top with a cup of coffee & enjoy amazing view wit winding river HAN and bridges in sunny day.The yellow color of the glass is the feature of the building. 63 building (63 City) is the corporate headquarters of Hanwha, located on the Yeoido island, Seoul capital. 63 building is the world's highest that covered by gold glass."
Absolute waste of time,Everything is closed down. Waste of time. Going to other places of attraction would be more worthwhile 
Nice view from here,"View from this tallest and most recognized building in Korea is much better than fromthe Seoul Tower.Enter via 63 Square, they do charge an entrance fee of 13000 won for adult...There is a cafe where you can sit, relax and enjoy the view. "
Nice n clean,"I ve stayed in south korea fir two years, i learned korean a bit ,and there was my best period of life. People are so friendly and kind .a very fast growing nation.clean cities and minds. The culture has a big backgroud. I would looove to visit again"
Fantastic 63building,"Let me tell you about 63building in Seoul.63building is 249m high. You can go there by train, bus and taxi. You can take 6B or 10B bus from Incheon International Airport. It leaves every 1hour. If you want go by train. You can go underground airport than you'll find train station. But you'll arrive there after 1hour.The 63building started to be built in 1985. It took a long time. But many people visit 63building. Because there are many shopping malls, cinemas, an aquarium, restaurants and company offices. But there many expensive stores.What you especially want to see is the fantastic view. It is on the top floor. But it's not cheap too! It is 13,000won. If you go to the top floor you'll see Yeouido city. Also you can go to the Thrill Deck corner. The floor is made of transparent glass. Opposite there is Art Mall corner. There many pictures also the pictures change once a month. I think 63building is very good but it is a little expensive."
Amazing Views,"Amazing views from the 63 Building. Parking was plentiful, people were friendly, lots to see and do but the main attraction is the views from the top, well worth the stay for the sunset and city lights illumination."
Cityscape of Seoul,"I always have a soft spot for observation decks and 63 Building's was no exception. Admission was ₩13,000 and it is best to go up in the evening and on a clear day the views will be magnificent. The glass elevator was fun to be in, even though it only lasts for a minute or so."
A decently tall building.,"I would rather go to Seoul N Tower which is an outdoor activity while walking up a sprawling park. I have been to 63 City a few times and have eaten at the Chinese restaurant at the top from reservation only as well. The tower is located in the middle of Seoul, but best visited after a rainy day else visibility suffers. It is a great location to see the city and you can see a decent amount around. I would go with tempered expectations just because of smog and occasional dirty windows."
Nice view of Seoul,"I took some friends here who were visiting Seoul for the first time back in January during my extended stay in Seoul. Because the 63 Building/Hanhwa building was featured in a lot of Korean dramas/shows, they had wanted to visit, but I wasn't too impressed. You do get a nice view of Seoul (some of my friends told us after that we should have gone at night, but I'm not sure about the hours or the discrepancy in price), but I just don't think it was worth the admission fee."
Popular places to enjoy a magnificent view of Seoul City,"The 63 Buiding (63 City) is located near Hangang Park and not to forget, Yeoido Park and the well-known television broadcast stations KBS & MBC. From 63 City to Itaewon, it takes not so long for the distance via subway but it way too far walking down from Hangang Park to the subway station. If you are not that prefers to walk, then you could take a cab. But, believe me…it was fascinating to spend times walking since Hangang Park was ready to accompany your way along to the station. I mean, it worth a fresh air even it was afternoon! There are a few different attractions in th building. The main attractions are an aquarium, wax museum, IMAX cinema the lookout on the 60th floor which also doubles as an art museum. You can buy combination tickets to see multiple attractions for a discount. As is so often the case in Korea, you have to grab a queue ticket. Don't be a nonga (like me) and wait in the non-existent line. lol."
Who doesn't love views?!,"After walking the River, I saw this building and remembered it from many Korean variety shows I had watched in the past. They offer a foreigner discount which was a pleasant surprise. There was no wait, which was even better. Once we got to the top, it offered great views. No complaints on my end."
A great view of Seoul,"As great as the view from N Seoul Tower may be, what you really want to do it view Seoul from the observation floor in 63 Building. The N Seoul Tower provides a great focal point in the city skyline which makes for a better view and better pictures."
A wonderful view of Seoul,"Stunning view of the city. It was a nice afternoon spent visiting attractions and browsing the other shops. Eric Kayser bakery is excellent, I particularly liked the green tea cakes."
Best view of all of Seoul,"Went there yesterday evening before it got dark. Just a very slight haze, but we could see probably 15 miles. The view of the city is just incredible. I don't know how much the admission was since it was paid buy our tour director, but it was well worth it."
"A must-see, but price conscious visitors might take a pass.","The building itself is now fairly old, over 30 years, but it hasn't really aged at old, thanks to its cladding that make it look like it's a gold lingot (especially when the sun in low in the sky). Even more so than for foreigners, it is a veritable symbol of Korea, as one Asia's tallest building, and defined Korea as a rapidly emerging country. The attractions Inside are various (art gallery with observatory, wax museum, aquarium, shopping mall). Apart from the observation deck, the other attractions are ""only"" decent, and there are better wax museums in Northern Seoul - Grévin, better malls in many places -IFC mall also in Yeouido, Times Square...- and better aquarium at COEX or at the Lotte World Tower. So the main reason to visit would be going all the wait up to get a great view, and also enjoy a nice art collection. The view is indeed really nice, and without a doubt the best spot for a panoramic view of the Han river. However, it does come in pricey (20 000 KRW I believe), which might not warrant the price for some people. If you want to come up an equally expensive tower, Namsan Tower might be a bit more iconic, and climbing some mountains in Seoul (Inwangsan, Bugaksan, Gwanaksan, Guryongsan, Namsan) might give you an almost as beautiful spectacle as well, but for free."
A normal visit,"I was excited to visit this place when I reached Korea, since a lot of hype from friends of mine, when i got there, this place was just average but since there is a wax museum there and I never went to any Wax museum before, I tot i should give it a bit of points. Other than that, this place is just ok to me."
63 Building,"So I've been wanting to see this building in person since I played Sim City when I was a kid. I'm so happy I finally saw it. After having lunch at a little bbq joint in Yeouido, I decided to walk to this building. It was pretty far, it took me about 40 minutes to get here. Maybe I'm just slow at walking. But it was well worth it.A lot of stuff inside. They even have a museum at the top floor. The stuff in the museum is just ok for me. I paid for the amazing views not the artwork to be honest. It was well worth the visit."
"Multi attraction building, great views.","This is confusing, so stick with me on this. The 63 Building also called 63 City is really the Hanhwa Building. There are no flashing lights advertising 63 Building, so do not look for it. You will see Hanhwa Building at the top so head in that direction. You will not see anything referring to ""63"" until you are right in front of the building. You can take line 1, 5 or 9. I took line 5, purple line since I was in the Jongno/Insadong area. I got off at Yeouinaru station, walked for 30 minutes along the waterfront park. Only after reaching the building and picking up a brochure, did I realize there is a free shuttle from the subway stop. This is not stated in the guide book. So, my pain is your gain. Get off at this same station, take exit 4 and there should be a shuttle stop there. Line 1, dark blue, get off at Daebang station, exit 6. This building has an observatory deck which is also an art gallery, Sea World Aquarium, Wax Museum, and IMAX Theater. I really only wanted the observatory, which was 12,000 won. Go in main entrance, take a sharp left and walk all the way to the ticket counter. The views are spectacular, and me and my friend were the only 2 people there and then an Asian family of 4 joined us. We were the only people there, so I do not think it is that popular, but if you like a non busy uncluttered space you will like it here. The main floor has many restaurants and coffee shops. If your time is limited, I personally like N Seoul Tower better. See my review about it."
Viaggio63 is a fantastic Italian inspired restaurant ,I visited the 63 Hanwha building because it is such a beautiful structure on the banks of the Hangang. I was looking for place to eat and found Viaggio63. I received some of the most elegant service here. Impeccably dressed women provided perfect service so I hesitate to call them waitresses. I can recommend the Salmon Salad pizza which is smoked salmon and salad on a cooked pizza. Very tasty indeed
Good views of City.,"We drove and parked in the garage. Save your receipts for parking when you leave. We got the package that included the aquarium, wax museum, and gallery, which is the view. Skip or choose something else in place of the wax museum as it wasn't that great. The aquarium was ok, but wasn't anything spectacular or a must see. The gallery with the views was nice. The elevator ride was up was good so get near a window if you can unless you are afraid of heights. We ate at the food court which was standard fare without having to eat at the various restaurants. We went on a Sunday afternoon/ evening and the crowd was not bad. By the time we went to the top it was dark and we saw the city scape at night. At the time there was a great discount available so ask just in case, the clerk actually informed us of it as it was with the credit card we used to pay."
"Great mall, Seaworld and view from the top of the building","Plan on spending some time wondering around, window shopping, stopping for a bite to eat or a coffee. You can go to Seaworld or a wax museum. Or take the glass elevator to the very top for a wonderful 360 view of Seoul. You need to buy a ticket first, get a number and wait for your number to be called to buy your ticket. Do not let the long line scare you away, it goes fast. At the top is an art museum and small snack shop. But mainly you are going up for the view so try to go in a clearer day. Enjoy!"
Nice view,"My wife cousin treated us to a day here, nice little tour great view and the Buffett was super food from everywhere."
Great place to spend an afternoon,"I got there getting off on Daebang Station and got the bus no. 11, right in front os the station, coming out by exit 6 (I coundnt found the shuttle bus indicated in the official web site) and it took around 20min. We selected 3 attractions: performance, wax museum and art gallery. We purchase these 3 attractions by 35.000 won. At the beginning we just asked for the girl the performance and the wax museum and it will be 55,000 won so the kind attendent suggest one more attraction (the art gallery) for a lower price. There are the packages showed up in display panel which offers the attractions in a much lower price than taking each one separately but all offered the SeaWorld that I wasn't really interested in. So u can ask for packages in a cheaper price besides what they offer in the ticket booth display.All the attractions really worth in my opinion mainly the performance which was a Marionette show of 70 exciting minutes. Outstanding perfomance with led lights and breaking dance with English subtitles when it was needed.To get the gallery, which was Cinderella theme, I recommend to try get in first in the elevator because u can see all han river while you are going up because it is a ""glass elevator"". I went there in a Saturday night and it was really crowd and I rarely saw someone interested in the art, everybody goes there because of the view. The gallery is on 60 floor and the other 3 floor under it there are fency restaurants. And the others high floors u cannot access. Thus the high view is allowed just paying to watch the gallery or eating in one of the restaurants I mentioned. The wax museum was good to take funny pictures that I could do easily because there was no one there as I got there almost on the close time, 10pm."
The best!,We had walked more that 20mins getting to 63 Building from the Daebang Station. Missed our chance to enjoy the IMEX Theatre however the Skydeck is absolutely magnificient. The view of the city and Hangang River at night is simply magnificient.
not satisfied!,when i saw the pictures on the net and saw this place in korean dramas i said to myself i have to visit this place when i go to seoul...but i was really disappointed coz it's not worth it...there's not that much to see...the aquarium was so small yet crowded with people...and we did'nt have d chance to go up to the top to the viewing deck since there's a long long line of people waiting for their turn...
Nice views but nothing spectacular,"Nice views but through a window though, so could not take nice photos. Was not too crowded. The entrance was difficult to find."
Great view - Fish Market is close,"Enjoyed taking in the view up top at 63 City - the art gallery was also a nice touch while seeing the city landscape. The Fish Market is close, but not walkable - you'll need to take a cab to get there and across the highway."
"Art Gallery, 60th floor.","There's not enough information in English, so it may be complicated for those who can't speak basic Korean. I thought we would be able to go to the 63th floor, but apparently we can only reach the 60th one. The view at night is nice, but the internal illumination interferes with the photos so maybe it would be better to visit in the afternoon."
Korean Holiday,It was ok but not too impressive. We went to the sky art gallery that gave access to there observatory. I wasn't very impressed with the art gallery but the view of Seoul from the bldg observation was impressive. Not bad for $12 per person.
The View,Going there was accidental. After the river cruise we walked because we couldnt get a taxi. We could see it right away from afar. Decided to go up and have dinner in a japanese restaurant on the top floor. We didnt regret that we went up cause the view was great. We could see the lights around the city. Its the view that sold us out. 
"Multi-attraction destination, good for kids","Only because we are renting an apartment in Yeouido did we decide to walk to 63 Building. We purchased a 'big 3' ticket which for us included the observation deck, aquarium and IMAX (show on king penguins). Purchase your tickets by Visa and you get an extra 40% off the rate (70000 v 42000won for two adults). Observation deck OK with the art display - views would be much better on clear days; IMAX was good but the headset for translation into English did not work (but easy to follow anyway); and the aquarium was unworthy and in desperate need of updates to their animal enclosures. There are regular shuttle buses but we decided to walk the 10 minutes to Yeouinaru station. "
Skip everything except the art museum.,"I quite enjoy scenic views, and this is a good one. But as with many other cityscapes, it comes with a steep price. Unless you've got upwards of 200+ dollars to shell out for a dinner, I would recommend going to the ""art museum"" which I feel is mostly an excuse to charge people 12,000 won to go to the top of the building. The people looking at the art were outnumbered by people looking at the view 10 to 1.I have been to the ""Walking on the Clouds"" restaurant at the top, as well as the Imax, and both were expensive and nice for special occasions, but nothing blew me away. I would call this place a tourist trap, but most of the visitors are actually Korean, so it might be more of a status thing."
Awesome view--skip the aquarium.,"The sky art view was amazing, especially at night. The aquarium was just depressing...too small, not quite clean. I felt so sad for the animals, especially the penguins. Note: the wine bar on the 59th floor is beautiful, and very romantic...but it is by the (pricey) bottle only. Not a place for budget travelers."
Best visited during sunset,"The building appears to be golden in colour at afternoon till the sunset. Not very far from the building there is a recreational area or garden of some sort where a lot of people (family, friends and couple) do actually just relax and play something. From the garden, you can approach the building you will pass by a bridge and will need to cross the road. There are a lot of things inside the building (wax museum and stuff) bit we did not go to any of those."
Symbol of Yeuido,"Once the tallest building in Asia, it offers a lot of things to do, aquarium, wax museum, IMAX theater and observation hall at the top. They offer discount if we purchase at least 2 attractions. Beautiful scenery of Hangang Park can be seen from the top and Seoul generally as well. But its aquarium is quite disappointing, not worth money spent."
Good place to watch the sunset and get a birds eye view of Seoul,"There are a few different attractions in Building 63. The main attractions are an aquarium, wax museum, IMAX cinema the lookout on the 60th floor which also doubles as an art museum. You can buy combination tickets to see multiple attractions for a discount. If you are a foreigner/tourist, you can get a further $5 discount on the ticket price. During the day, we hired bikes in Hangang park and then went to City 63 (aka Building 63) in the afternoon to watch the sunset. You can find loads of pictures and some more info on my blog here. http://gdaykorea.blogspot.kr/2014/05/seoul-hanggang-park-bicycles-building-63.html"
Expensive but many things to do.,"There is an aquarium, wax museum and observation tower (with art gallery) in this building. It is pretty expensive as far as things go in Seoul and we found other areas were better than this one. The COEX aquarium was more extensive and the views from N. Seoul Tower were much better. If you are in the area it isn't a terrible idea to go but I wouldn't go out of my way to visit as there are other places with better suited to your needs."
Multi purpose attraction,"They have the observation deck, wax museum, art museum, aquarium and seasonal attraction for kids there. There is a small, pricey shopping area and nice food court. Mainly, the view from the building and nearby park is why I went. There is a free shuttle to the building from nearby stations for free."
