review_title,review_body
Lovely park to chill,"Visited in spring and trees were very beautiful. There were many locals and hardly any tourists. My boyfriend and I rented bikes and unexpectedly cycled pass Han river (if i'm not wrong). Overall the park is a 10/10 to me. Spring weather was great, pet-friendly park, picnics and even sports facilities like tennis courts. Managed to catch some live music performance well."
Peaceful parkland in heart of Seoul,"Site of the previous Yeouido Airport until the 1960's, then converted to parkland in the 1990's (includes a static C-47 as a reminder). Best for walking, jogging, cycling, basketball or just sitting enjoying the surrounds. Lots of amenities available. Underpass links to Hangang Park at North East end."
It's okay,"The Yeouido park is okay, nothing very special. I think most reviewers are confusing it with Yeouido Hangang park."
Spring,Alot of trees but alot of people as well.. You can sit in the park with a mat and some food to have a relaxing picnic
awesome cherry blossom viewing,"We came around 7.30 am and it's not crowded. We had a great time admiring cherry blossom, it's so good to take photos of it at early morning. "
Beautiful park with Sakura,"Visit the park on Apr 3, Sakura almost get flower, nearby the main river of Seoul. Easy to have beautiful pictures"
Second Visit Like First Time,"My second time actually visiting Yeouido but it feels like the first time because last time was autumn. I went there alone so I didnt rent a tent, ordered a chicken so I guess I missed something big but at least I got to observe how they celebrate Spring Festival. And the cherry blossoms are just as lovely as the people."
Nice place for a stroll,"Do pop by if you are nearby, otherwise I don't think it's worth it to come here. Went when cherry blossoms were in bloom, but there are many other places to view cherry blossoms as well. Overall a nice place for a stroll but only if you are nearby."
Beautiful area to enjoy Spring and relaxing,"This park and area are famous within the locals and tourist. Especially when I came here during cherry blossom season, better to come early to enjoy cherry blossom. This area is quite large. Can enjoy the city view, hangang river, nice weather, and picnics with your friends. I walk more further from Yeouido Hangang Park to see cherry blossom and i found the area that is really beautiful and enjoyable. Also there are some street food stall near the park. I love to spend some time here to relaxing my soul. And I think, during sunset time will be nice too even we can't see the sunset from this park."
Busy Park on 1st of April,"The park is very busy when we were there on the 1st of April. It was supposed to be the start of cherry blossom festival but only a few of the trees are blossoming.This park is where the Eland Cruise terminal is located that cruises along the Han river.Tip: To get to this park, take Yeouinaro line 5 and exit through exits 2 or 3"
Cherry Blossom Night View ,"A night walk after dinner around Yeouido park ~Wonderful place with nice cherry blossom view , cooling surrounding and nice scenery view!Lucky me ☺️ there are full of cherry blossom and drama/movie taking just around it ~ Running man Jeon so-min just finish her part and leaving in front of me ~ so regret that I can’t had a chance to take photograph with her "
Only one fully blooming sakura on early april 2019,I went there on 3apr2019.. the weather still around 9 to 10 degree celcius in yeouido hangang park And the flowers still hadnt fully blooming yet
One of must visits of cherry blossom,"Along the Yeouido street, full of cherry blossom. best time to visit about first week of april. better to check schedule first. "
Better to avoid cherry blossoms on weekends,"This is a huge park in Yeouido.One of the best parks to ride a bicycle in Seoul. And REALLY famous for cherry blossoms. So, if you don't want to mess with crowds, stay away on cherry blossom weekends."
visit,good place to see river view and can breathe fresh air. can see so many beautiful places from there.
Sukura Season,"It must be the most beautiful season when we visited the park, walking along the river bank was looked like passing a sukura flower tunnel. It was still a little bit cold for us who were from the warm Southwest China. There were also lots of local specialty street vendors."
Great walk in the park in the busy district,It was so nice to have this quietness in the middle of the busy district life. The sunshine made it spectacular!
A kind of Central Park in Seoul,"Visit this park, adjacent to the Han river and a new business and shopping district. Close to IFC underground shopping mall."
Yeouido park,"Been here many times with my friends.You can do a lot of things with friends and families. Celebrating birthdays here, picnic, camping, riding a boat and bicycle and so on....also many beautiful view for sight seeing.In spring time there's a cherry blossom. in summer time there's a water park.So its a great and recommendable park."
nice,"nice park to walk, i went there with the cherry blossom festival and i was in love with all the flowers"
Stroll and camp,"Great place to stroll for the night. There are available seats, and there's also the entire park where you can camp. Great view at night."
Nice park to strolling around!,"Went here just to strolling around. The park was so nicely build and taken care of. So clean and the surrrounding was so peaceful eventhough it is in the middle of the buzzling city. You can try to bring your lunch here (get it in the nearest convenient store) then sit down in the park, enjoy!"
Lot of sakura,"yeouido park would be a difference if you visit at the different season, the best season is spring! you can just seat on the grass, feel the spring breeze, cycling, picnic. during the spring, the park is so beautiful. note, sometimes, even tho it is spring, the weather still has no different from the winter. make sure, you check the forecast before you come. if you get out from the yeouido station, you still has to walk about 300m to the park. i usually get down at sindorim station and then get the bus straight to the yeoido park. or you can get down to yeouinaru station"
Nice,"I was planning to visit Seonyudo Park but was recommended by a Korean Friend to visit this instead. This park didn’t disappoint, the river view was nice on a bright sunny day. I hear the night view is amazing too but wasn’t there in the evening. There were many families having picnics along the stream and so nice to watch all the kids running around. I rented a bike for an hour (3000krw) so there isn’t a need to walk that much. According to a Friend, eating cup noodles is a Korean thing to do at Yeouido park where there are instant cooking stands at the shops. I didn’t try it since it was still pretty hot in summer but I can imagine it’d be nice to have some hot noodles here when the weather is chilly."
must see in sakura season,"if you live nearby this park in cherry blossom season then do not skip this place. it was really beautiful visit during March/April this year (2018). enjoyed the beautiful trees. it looks more beautiful in nature than it look in pictures. no much things to do. just for walking and relaxing with family. there is a small market for quick bite. also, there is a huge open yard for playing around. also, there is a street nearby full of cherry blossom trees. i loved it during this season. other seasons i am not sure how it looks."
Wonderful green oasis in the concrete jungle,"I swear by Yeouido Park because it has .. LAWNS!! These are very rare in central Seoul, but at Yeouido Park you can spread out a blanket and have a picnic in several spots. Even more, you can ride a bike along the shady perimeter circular route (or walk/jog if that's your thing). It's squeaky clean, has lots of big old trees for shade, and miraculously keeps out most of the car noise from the outside world. Once you get in to this rectangular little oasis, you really get refreshed. "
Rent a Bike,A few friends and I decided to see what Korean parks would be like and came out here for a quick visit. This park is much larger than it seems so rent a bike or even roller skates (there are places in the park to rent them) and tour around leisurely and enjoy the sights. I think it'll be nice for family with kids too! NOTE: I was here in the late summertime so it was hot that I didn't go too far but I heard in the springtime the cherry blossoms are beautiful.
Cherry Blossom is the main reason to visity,I have been searching many place to see the cherry blossom. it was such a nice place to see cherry blossom there.
Yes during cherry blossoms season!,"We visited Korea during the cherry blossoms seasons and went to Yeouido park to visit the cherry blossoms festival. It was great. I guess at any other period of the year this would just be a regular a bit boring park (even if you get a good view of downtown seoul from there), but during the cherry blossoms it was the best! so beautiful!"
Best place to unwind,"If you're traveling to take a break from your busy days, definitely visit this place. Bring a picnic mat or rent one, they also have tent rentals around if you're going on a big party. Get some food, head to the one and only Ministop inside the park for some ramyon and drink and ice cream and all of those good stuffs, or if you have a company who speaks Korean, order a chicken delivery. Just sitting there for a while feels really great, and sometimes they have performances, water sports, and everything else that are entertaining. Bonus: they have a beautiful illumination at night, I don't know if it's during Spring or the entire year, but it'll be great to check out."
Visit during cherry blossom,We visited during cherry blossom and lived the view.Superly crowded.recommended place at cherry blossom time.
Nice to take a break from the city bustle ,"Went here on a whim. Enjoyed the 2 hours spent here laying on the ground. Could’ve rented a bike but didn’t wanna rush to return it after. It’s such a nice park, teenagers and couples come here to have a picnic and watch the sun sets. It’s really nice "
Yeouido Park,"Nice park to have rest from huge city. Easily accessible by public transport. Facilities like restroom are available, food and drink also possible to find. Better to visit on a warm day."
"Very lovely park, rent a bike!","Lovely park near Financial district (I believe); my husband and I rented a tandem and drove around, so much fun! Lots to see, really lovely park. Don't miss when in the area!"
Beautiful Park with Cherry Blossoms,"We visited Seoul in April this year to mainly watch cherry blossoms at this park. The park is beautiful and large. There are many things to see in this park, including hundreds of cherry trees in the park, as well as on the streets circling the park.Even if we missed the Spring Flower Festival (being deferred to later days) when we were there in the first week of April, we enjoyed our walk around the park. We also enjoyed the walk along the Han River next to the park. The walk is lined with many street vendors selling local foods."
Yeouido Spring Flower Festival,We were there for the Spring Flower Festival. It's quite crowded and there're performance on the street.Walking along the park with this beautiful scene is very relaxing. We aligned at National Assembly Station and took a short walk to the park.
Great Park!,I visited this small park at the height of the Cherry Blossom bloom season in early April. It was especially beautiful at this time. The center of the park has a skate park and basketball courts and were filled with people enjoying the early spring weather. The outer edge of the park is a long walking path that passes under cherry blossom trees. A nice 30 minute stroll!
Beautiful Cherry Blossoms!,Great place to view cherry blossoms as the road is lined with thousands of cherry trees on either side. We visited one day before the festival started and could drive through the entire stretch. Excellent place to enjoy cherry blossoms in Seoul.
More restaurants near National Assembly station,"4 subway stations are around Yeouido-dong. More restaurants, cafe can be found at the road side ""Gukhoe-daero 68/70-gil"" near the National Assembly station. The atmosphere on weekdays and weekend are different. But restaurants many closed on Sunday.Travel around early to mid-April is the best Cherry Blossom season at Seoul. Yeouido Park is one of the most popular destinations for viewing cherry blossoms. Recommended to travel during the cherry blossom festival at night time."
Sea of Flowers,9 April onwards is the time where the Cherry blossoms flowers bloom. Should last about a week to 9 days. It is a great place to see in Seoul. Take a subway to National Assembly station line 9. Walk through the National Assembly for about 7 minutes. You will reach the park along the lake.
Nice park,"Nice park, large playground at central Plaza then followed by a nice stroll along lush of greens and trees, also flowers. You don't feel your are in the city center."
Yeouido Cherry Blossoms Festival,"Many cherry blossom trees are planted on the bank surrounding Yeouido. Every spring cherry blossoms burst their flower bud. Yeouido Cherry Blossoms Festival is being held from April 7. to 12 this year. The Elementary Local Self-Government, Youngdeungpo-Gu is providing many programs. Although I know the bank surrounding Yeouido is called Yoon Joong-Ro, I write just a review about Yeouido Park because the bank surrounding Yeouido can't be searched exactly."
Best time when cherry blossom festival,"Lucky me when come here in 1st week of April 2018 when all the street corner is full of cherry blossom and there is a cherry blossom festival in the park, to get here bu subway you can pick line 5 (purple line subway) and stop at the Yeouinaru station (527) subway...there are some streetfood corner if you are hungry after taking a walk and you can also have a dinner or lunch at the cruise near the river at Yeouido park"
Cherry Blossom ,"Best time to go today or this week, sunny days. Nice weather. Lots of Cherry Blossom. Most are white colour, only few are pink "
Casual and relax time ,Good place to relax and spent with kid. Bicycle rental is available and few stall of street food available. 
A great option for walking or biking nearby,A fairly calm place to spend an afternoon. There are food options nearby and it is comfortable with the breeze coming off the Han river. Many families come here with their young kids and there is a campsite there for some festivals. A place for many locals to come and unwind. This park is also popular among teenagers during the weekend. When the weather is warmer the smell of bar-barque is in the air.
Great for walking.,Been is Yeouido for more than a month give me the opportunity to walk this park almost every day. Is really grat in summer. But if you are in autumn/winter be sure to have a sweater with you can get really windy some times. You can rent a bike and enjoy a ride around the park
"Park, frozen pond, playground ","This park has a lot of facilities, not only for kids but also for adults and seniors. We visited this park on cold sunny day.This park was nice enough to walk around. The pond was frozen with leaves in it. In the middle of the park, there was King Sejong statue. "
Cherry Blossom Park,"Best way to catch the cherry blossom in full bloom would be to check the forecasts that are readily available on social media. We came mid week of April and caught the remaining of it. Best to come at its peak when all the trees are blooming. Late March or early April is a good time. Or check the official Spring season and give it a week to give time for the flowers to bloom.Some wild blossoms may also be seen in Gyeongbukgong and Changdokgung palaces.Visited the park on a weekend and it was packed! Everyone, both tourists and local come here to see the cherry blossoms so get ready for huge crowds on those days."
I Seoul U,"You can find the I Seoul U sign here. It's in the middle of an open area so it's not hard to miss. And, it's right by the river, so you get an amazing view of the water and of Seoul! Also, there are grassy areas to lay in and benches to sit on to enjoy the view."
best place to see cherry blossoms,"Yeouido park is super crowded during cherry blossoms period from early to mid April. There are more cherry blossom trees here than any other places in Seoul, that's why this is number 1 spot. Cherry blossoms are lined up along 1 km road. I visited in mid April 2017 when cherry blossoms at Seoul forest park, Kyungyee university, Namsan park and Seokchon lake were way beyond their peak. Yeouido park was still beautiful."
Rent a bike and ride,Long scenic bike ride near the lake. Lots of space for walking too. Numerous rest stops. Can get good views of the rivers and bridges. Loved this area. 
My favorite public park,"Not just my favorite park in Seoul, but my all time favorite. Better than Golden Gate Park in San Francisco (though it is much bigger). And New York Central Park can't even compare. I say this mainly because this park is keep very clean and in great condition. Lots of beautiful views and connecting to Han Park as well.April is the best time because of the cheery blossom trees blooming. The last time we were here, it was April, but really crowded because everyone else wants to come see the beautiful views. It is also a time of year when it is not hot and humid.There are places along the way where you can buy some drinks and snacks, and you will see many people on rented bicycles. Some locals bring their bikes. We have never seemed to have trouble parking. There is a fee in most areas at the park, but I consider it cheap.Just plain to spend a whole day there and have a picnic."
Rent a bike and take in the serene scenery!,"My daughters and I rented bikes on a cool Autumn morning, just as the leaved started changing. 9000 won for 3 bikes for an hour (tandem bikes are also available). It was money well spent! It was so lovely to bike around the park! The bike track is flat and suitable for all levels. It was so peaceful and relaxing. You could stop along the way and take in some of the gorgeous scenery. There are also 2 little cafes in the park if you feel like a snack. Highly recommended!Just note that to rent bikes you will need to present one piece of ID (e.g. passport). "
Beautiful park. Very clean and seating throughout.,"A haven in the midst of the city. Beautiful green space, well cared for and clean. Good place to chill out, read a book or just people watch."
Lovely for a bike ride,"Most Koreans seem to come here to set-up their tents and to enjoy their loved ones, which is an interesting happening to watch in itself. However, I chose to make a small bike ride circling the island. Lots of stuff to see underway and nice break-away from the busy city life!"
sakura bloom,it was so packed when i went here at Spring season.even though is not holiday but even the local people gather in here.Bloom everywhere!!! (human and flower) 
Best show in town to catch the cherry blossoms in their full splendor,"We specifically chose to visit Korea in the spring so we could catch the famous cherry blossoms in their full splendor, a decision that paid amazing dividends. With our son and daughter-in-law living in Korea, we were fortunate to have the best guides show us the best things Korea has to offer. We made it a whole day event, and luckily, we had the best weather for a long and pleasant walk through the park. The welcoming scenery was incredible! We've seen Washington DC during the cherry blossom season, and although it is a experience to cherish, Yeouido Park will by far always be second to none. What a magnificent site! We got there during the peak time and every tree and every bush was covered in blossoms. Pinks galore, whites and other colors were a true feast for our eyes. We chose to get a map, which you can pick up at the entrance, so we could find our way around. It was so wonderful to see how Koreans truly make use of such a stunning facility, we saw hundreds of local residents in sports attire taking to the numerous trails around the park. They obviously love to hike and enjoy the outdoor, and th. Are with which park official manage the park ought to be applauded. The park is very clean, it's kept in the most amazing condition, there are all kind of facilities throughout, clean restrooms in multiple spots, and even food stands to pick up light snacks. This was truly a wonderful day and the experience will last a life time. Beautiful park! We went in April, so be sure to take a light jacket or sweater, temperature can change rather quickly, so be pr pared. There are excellent sidewalks and flat parkways for parents pushing strollers, this is a great choice for families to visit. The park is huge!"
Nice sized park with many options,"This is a big park with many options within and around. You can rent a bike or inline skates to ride around, or just stroll around. There are nice restaurants next to the KBS building, or across the big road in IFC and around. You can buy snacks and beverages inside the park too.The park is linked to Han River park, and it is also a great park with even wider options. You can do water sports, ride a sightseeing ship, play at a shallow water fountain. Great for young kids. "
A must visit place ,"There are so many activities here. So you can try anything to spend you time. Also, running man also shot here few times!"
Great place to take a walk,There are a couple of decent photo ops here. It's a great place to take a break from the city. It's a pretty quiet park considering it's not that large and in the middle of the city. 
I love Seoul sign nearby,The park is pleasant to wander around and towards the river and past the bridge on the right you will find the photogenic I Love Seoul sign. Nearest metro station Yeouinaru on Line 5.Thanks for the vote if you found this review helpful.
Its not a park filled with Cherry blossoms but a wonderful open park,"we had gone to Yeouido park to see the Cherry blossoms. we were slightly disappointed , there were far too many people on the street where the cherry blossoms were. The street was also a main road. Every picture i took of the cherry blossoms had 50 other people in it. there was unfortunately also too many street stalls on the road side which detracted from any beautiful shot of the cherry blossoms. . if you want cherry blossoms, then do the homework again or go to the Busan Jinhae cherry blossoms festival. its better there. one location has a small stream surrounded by cherry blossoms on both banks. or go to the unused railway station to see cherry blossom trees on both sides . by the way cherry blossoms only flower for a week. come too early and you see a few, come too late and you see no cherry blossoms. here is a tip , look up the ' korea cherry blossom forecast ' published from February to early march. Yeouido park though is a lovely open space to have a picnic and see the river. or to catch a river cruise up the Han river. "
Worth to visit,"Even when the cherry blossom season is past, it is worth to go for a morning or evening leisure stroll (or rent a bike). "
A pretty relaxing place,"After visiting the quite nice Yeouido Hangang Park we checked out this park here. We missed Cherry blossom season by only a few days....but it was a pleasant walk here anyways.There's a good number of different walks, lanes and bike roads. We were here on a weekday and it was very relaxing. Only a few - mostly local - visitors. Nice and quiet. Good to catch a breath after visiting the busy downtown area.There's a big field quite in the middle of the park, a Statue of King Sejong the Great, several playgrounds, a coffee shop and lots of nice little spots with benches. A very nice place was at the pond with the pavillon (check the pic). For a moment you woulnd't have thought you're still in Seoul.A nice park, maybe not worth visiting just for itself, but if you also check out the nearby Hangang Park it's definitely worth a trip.Wanna know more about me and my trips? Check my profile."
The most amazing urban park!,"With many theme-based sections, this park has so much to see. And while you're in each section you'll feel secluded enough like you're in a separate park each time. We went walking through the park from 9 - 11pm and it was wonderous. The night time views were magical as we ended by the river front. It felt extremely safe late on a Saturday night and lots of people were still out and about, even after midnight when we made our way back to our guesthouse via subway which closes by midnight. This midnight park visit was really a gem from my first visit to Seoul."
great place to chill with friends.,this place is mostly famous for its cherry blossoms. if you visit this place in the beginning to spring you will be able to see the beautiful cherry blossoms tree and it is just amazing.
Beautiful Flowers,It's a breeze to walk through this park. Filled with so many beautiful bright flowers. I wished I could have seen the Cherry Blossom. Peaceful area to have a jog or cycle around 
Most enjoyable,The park has four distinct areas. Some lovely trees and shrubs. Missed tge cherry blossom sadly. A good place to people watch Korean families enjoying a day out. Watch out for the very dramatic sculpture.
Average Park,Not recommended if it's not cherry blossom season. Just a normal park where people are doing exercise. 
Great visit with the family,"We went here as a family during the cherry blossom season and the views/photos were spectacular. This is reasonably close to the Han River and the ""I Seoul You"" sign. Enjoy!"
cherry blossoms,visited during cherry blossom season it was so beautiful with endless cherry trees! it was very crowded but worth the visit :)
