review_title,review_body
Busan port and Fish Market,"The Busan port is a large commercial port, a bit far from town, but the only place a cruise ship will dock, so you either get a taxi to downtown or pay double and use the ship to shore excursions.One place you MUST see it the Fresh fish market, its unbelievable . The larges selection of see food i have ever seen."
Good if You Don't Mind Fish Smell,"It's a port. Of course it smells like fish and the sea. For some reason, that's an obligatory part of any review of Busan Port. As ports go, it's not the worst smelling I've been to. Worth a stop to see the boats and bustle. After all, it's currently the world's 5th largest port and South Korea's second largest city."
HUGE Port,Quite an impressive port...container yard is MASSIVE...worth a drive by...you will most certainly see this at some point in your trip
Most amazing seafood market,"If you are in Busan their seafood market is a must see. It is easily accessible by bus or walking from the port. It is the largest seafood market we have ever seen and if it lives in the sea it is at this market. A lot of the produce is also still alive and swimming or climbing around, quite fascinating but sad as you know it will soon be consumed.There is an outdoor section plus a six storey building. In addition the inside section has restaurants where you can eat the fresh seafood. This is definitely worth a visit and smell is not too bad as every thing is fresh."
busan by public transport,"Busan is a lovely city to visit....3rd busiest port in the world......and the public transport is very good, bus and train. We discovered that there is a hop on hop off bus which cost approx $8.50 Australian. One of the hop on hop off buses can be used to go to Haedong Yonggung Temple so you don't need to book a tour which will cost 10 times as much. This temple is the best positioned temple I have ever visited being position right on the sea.The hop on hop off buses go from Busan rail station , right hand side facing the building, first bus 9.20 a.m. . If you are going to the temple get of at Haeundae station, go into the station and look for exit 7, when you come out by this exit there is a bus stop , get bus #181 which will drop you about 10 minutes from the temple. You can also do the trip by train but it is a subway so no view.Another of the hop on hop off buses does a 4 hour tour for the same price visiting a museum, park including a cable car ( which you get at half price ) and temple . The bus gives you ample time (about 30 mins ) at each stop to look around."
Seafood Market,You must visit the Jagalchi Seafood Market. It's a large seafood market with lots of vendors with plenty of containers of live fish and seafood. There is also a large section of dried seafood. On the second floor are vendors where you can enjoy fresh seafood lunch. It's an experience you do not want to miss.
Nice views,"We stopped in Busan when we took a cruise in April 2012 . The area of the port where cruise ships dock is nice and interesting . The City Tour Bus makes a stop at the International Cruise Terminal every half-hour so it is a good way to travel around and see the major sights of Busan . The area called Taejongdae is not far from the Cruise terminal and is worth a visit .  After spending 6 hours visiting this lovely city , we stayed on the deck when the ship left the port to admire the views for more than 30 minutes ."
