review_title,review_body
Make sure to make it to the Workshops in the back,"A fun little excursion into a Bamboo world. It was obviously a date location for many locals with couples abound, strolling through and taking pictures. It only costs 2,000W per person and is worth the look around if you've never seen a bamboo garden. This was definitely the biggest one we saw in Korea. Still, you can probably walk a majority of the garden in about an hour or so unless you’re taking pictures every five minutes. Recommendation on the photos. On the weekend, it’ll be near impossible to get a clean shot of yourself with no one on the trail. So, to make this easier, there are a few locations where you can stand and pose with a roped off trail behind you. This will make taking that Kodak moment easier and thwn you can just enjoy being in the garden.Notes:There are a couple of places you can go into and it feels like a tunnel of bamboo. Very small paths that are dark even on a sunny day. This is fun.You can go to the back Hanok Experience to extend your visit by an hour or so depending on what’s open. They have workshops for making things back there. We visited the Bamboo Tea workshop room. They served us green tea with bamboo leaf infusion. It was a slow process of three brews with each brew losing the green tea flavor and enhancing the bamboo flavor. Cost was 2,000W per person and came as a welcome break. (If you liked it, you can buy some at the souvenir shop on your way back out). This back part is not easily accessible for anyone with a knee issue. We saw a number of older folk struggling on the way down (steep) and up.Below the souvenir rotunda (the tea house at the junction point), there’s a weaving workshop. The material there was very interesting and unique. The artist uses the local bamboo to make the products. If you have the Korean, custom orders are also possible.Overall, highly recommended. We had trouble finding information on how long to spend in the city of Damyang and thought it would just be an hour. Plan on at least a half day stay there as they do a lot of cool things with just bamboo (especially in the food department: bamboo hodoek, bamboo rice, bamboo alcohol to name a few). On top of that, they have other foods they are known for, like noodles."
Bamboo!!,"It's very impreasive.Bamboo forest and a Koreantraditional house village for you to stay.(Home stay program)There is a very popular Korean food, called Ddug galbi.Damyang is a very nice city for you to stay and this one is a wonderful place for you to visit."
"Damyang – bamboo here, bamboo there, bamboo everywhere...almost","But not for lemang (a traditional Malaysian cuisine with glutinous rice cooked in banana leaves inside a bamboo). OK, I was warned about it being “small” and ""nothing much"" so no expectation there. I wanted to spend my free weekend and it was a pleasant walk, could have been better if my college-going student guide had not seemed rush because he had been there many times. It is a place for a family outing to just walk, particularly with small kids – free to run and act cute or not. And there was a show where individuals sing and play their instruments entertaining visitors. A few old traditional Korean houses - if you have not been to Bukchon in Seoul. If you need some relaxing hour or two, time to while away, you won’t get lost in the Damyang bamboo forest."
Bamboo Forest (Garden),"Damyang's well-known bamboo garden is a pleasant place for pictures, and an enjoyable walk. It can get busy, but the garden area is large enough to accomodate plenty of visitors. It is difficult to clarify what this attraction really is. Is it a garden or a forest? Well it fits both descriptions, the area is often well-landscaped and chairs or pavilions can be found throughout the grounds. On the other hand there are areas where it really is just large areas of land surrounded by bamboo.The paths spread in multiple directions within the grounds. Visitors can see all there is too offer in 1-2 hours. There are not many areas in Korea where bamboo grows, but South Jeolla's climate is the most ideal on the Korean peninsula."
A surprisingly nice visit,"I went to Damyang for a night on a trip through some less frequented cities and towns in the southwestern part of Korea.Damyang was a very nice town overall, and I enjoyed the Bamboo Park a good deal. It was more than I expected, and a nice hike through bamboo forests and other random bits here and there. 2,000 to get in, including free (but busy) lockers for your bags, which was a good idea considering it's a decent bit of exercise."
