review_title,review_body
Small and Free,"My visit here occurred on my third time in Seoul and I did not regret missing it on my first two trips. Unlike other recreated villages I have gone to worldwide, this one offers only five traditional houses, which have been moved here. They provide a good cross-section of how Joseon Dynasty citizens lived, but none beckoned to linger; and no hands-on activities, such as wearing traditional garments, were available on an early weekday afternoon in November. Though there is no admission charge, the free access did not seem to stimulate interest, at least at this time of year. I saw only a handful of other visitors during my brief exploration. But this atmosphere proved to be a nice change from the crowds at popular tourist attractions, such as palaces. I enjoyed sitting by the pond here for a while and walking along one of the trails in the park at the rear of the complex.The village is near the Myeongdong area of Seoul. By subway, take Line 3 or 4, get off at Chungmuro Station and take Exit 3 or 4."
Beautiful and Educational,This is a great place to spend the afternoon exploring and seeing the traditional style of living and shops. Really loved it here and It's free and easy to walk around.
Birthday trip,"I loved this tour. The steep inclines and quaint houses and shops is reminiscent of our tour in Tuscany (on much smaller scale). So picturesque, I can understand the attraction for tourists. But I sympathize with the residents having to put up with us taking selfies in their doorways. We only stayed for about 30 minutes. It’s a real look into the history of South Korea."
Very nice,This Hanok village is easy to find and is walking distance from my hotel. The heritage houses are well maintained and is good to visit inspite of being free access
A peek at Joseon culture and traditional houses,I didn't have high expectations as I went to Bukchon Hanok Village before; so reckon it'll be similar ie cafes housed in traditional houses etc. But at Namsangol Hanok Village (NHV) surprises me at every turn. First you can experience 1 hour sleeping time in the hanok (for a small fee). I thought that's a very refreshing experience in true sense of the word. Next you can rent traditional costume and take photos or pretend you're in a period drama and walk around the village. We also came across a gentleman who is a falconer and told us many information on this ancient heritage of korean falconry. The cafe nestled in the middle of the village is also very quaint and the souvenirs are worth looking at.
Excellent ,"We visited yesterday, 20/07/19, a family of 6 aged between 6 - 69. No entrance fee that we noticed. Information hut was on your immediate right after entry. Lovely clean toilets all the way round the area. This trip was throughly enjoyed by all. It was a nice steady walk around the village and gardens. Fun games for the children to take part in as you walk, including a stamp collecting map for the children to find stamps as they walk around. Lovely village and So clean and well taken care of. Some very large Koi fish in the lake which the children enjoyed watching. We could have hired traditional dress at the entrance but with the humid heat we would have struggled. I would happily go again for a lovely peaceful stroll. "
Good,"It’s very close to our hotel. Its a good place to visit, cultural heritage with traditional houses. Fresh atmosphere. It’s free access. Also its not so many people like other tourist attractions, so i like it. "
Great way to experience Korean culture ,"This place is a hidden jewel if you experience some of the traditional Korean culture. The park itself is peaceful and very walkable. One must try “Experience Korea” items at a nominal fee such as making bow and arrows, making crafts, making game pieces, rice cakes, etc. The instructors are people who are experts at these Korean traditions and passionate about sharing them. "
Nice Village,Just take a short walk from Chungmuro station and you will reach this village. Admission is free. We walked around the few traditional houses and the pond nearby. It is small but peaceful and not crowded. A great place for a stroll and photos.
A good look into what Korean life was like,"This is a good place if you want to know what Korean culture is like. They have a replica of a Korean village with the traditional furniture. There were demonstrations of Korean activities, ranging from Korean toys, make Korean rice dumplings and a Korean tightrope walker."
Nothing interested us,"We stayed in Tmark hotel which was just opposite this village and we thought we could just come over to see what it has to offer. But found that the old buildings were converted to teahouse, shop, etc and the place is connected to a big park. Did not explore further as we had time constraint."
Good if you plan on partaking in any activities ,"The village is very pretty but pretty small. We were nearby and decided to take a stroll inside but did not book any of the activities offered (archery making, tea ceremony, costume rentals, etc). We visited on a Friday morning and it was quiet and empty. Ended up sitting by the pond for an hour and enjoying the nice day and atmosphere. "
Great for free attraction,"Hanok cluster, folk game zone, pavilions, ponds, time capsule square, etc.It's a great place to spend 2~3 hours.The location is really good as well. 3 min walk from Metro #3, #4 Chungmuro Station. Near the metro station, there's a bus to N Seoul Tower, too."
recreated village..nice to know traditional culture.,i was taken to this village as a tour package and found it quite interesting place to explore korean traditional culture. it is a recreated village by the government to preserve Korean traditional for the people. nice visit.
Hanok Village,"this is the best place to experience the people staying in hanok those era. after viewing all the hanoks in this village, feels like staying in a hanok for my next trip just for the experience. free entrance too."
Worth a walk to see the exhibits,"After walking Namsan Park, we happened upon a pathway to take us back to our hotel which cut through the Namsangol Hanok Village area. On the day we visited, there was a free exhibition and we took advantage of the opportunity to look at both exterior buildings and the interiors."
Traditional village,"Nice place to visit just near Myeongdong where we stayed.Not much crowd, so you can walk, sit and enjoy the place.Its traditional village, depending on the season there are scheduled events. Check during your visit."
An interesting (and free) Hanok Village and park to visit,"My partner and I had spent a couple of hours around Gwangjiang Market, and decided to walk the 2+ kilometeres back to our hotel on the western edge of Myeongdong. As we are want to do, we like to make the occasional detour if we think a street, or distant object/building might hold some interest. Such was the case as we were returning to our hotel. We came across the entrance to this traditional Village and park, and ended up spending more than an hour wandering around the traditional buildings, and the large park at the rear.We were not able to get into many buildings, and the one building complex that looked interesting happened to be conducting a wedding reception on the day of our visit, which meant we were not permitted to enter anyway. On the day of our visit there were some temporary food stalls operating, and I got the impression from some signage that this park and the architected surrounds/seating etc. at the northern end that the Seoul Food Festival was to be held on this site.We enjoyed our time at this site, and provides the ability to take some really wonderful photos, of the Hanok Village buildings themselves, the large park at the rear, and the higher levels of the park provide some pleasant views of the nearby city areas as well. A relaxing and pleasant place to visit."
Korean history ,Nice historic park for learning about ancient Korean lifestyles and living. Surrounding park has nice trails. Many local weddings take place here. Relaxing place to spend an hour or two.
Great place for pictures ,This village is as beautiful as the buchon. They are different but both will be worth the visit. The plus point is it’s near the subway station. The cafe located within the premise has a nice ambience. I had the ginger citron tea and it was fantastic. 
A beautiful Park,This is a relaxing and great place to visit in the afternoon. It is easy to navigate and very clean. An audio tour is recommended to get the beautiful history and background on this lovely site.
"Recreated Hanok Village, FREE to explore","Namsangol is a sprawling open space, great for kids to run around freely. There's definitely less tourists here, so taking pictures is easy. Unlike Bukchon Hanok Village where you have to mind your voice volume in respect to the residents, few guests get annoyed by noise here. It's a pretty quiet park, because that's how it feels like to me."
Cultural!,It's free to go in. It's huge and beautiful. It's connected to the park where you can also seethe Seoul Tower from afar. They have lots of free programs you can attend - interactive or just to watch and learn. Lots of traditional games you can play. 
Step back in to the past ,A great way to preserve the old buildings and you can also do calligraphy classes here to very picturesque 
Lovely place and many activities for kids,"This place is conveniently located right in the heart of the city and worth visiting. Unlike Bukchon Hanok Village where you could only admire the houses from the outside, here you can actually get inside and walk around the houses. We were there on Sunday and there was a real traditional Korean wedding hosted so we got to observe the beautiful ceremony as well as the venue. Inside, there were few activities for kids to do too. While our daughter got dressed in Hanbok dress (10,000 won for one hour), our son enjoyed making a wooden bow and arrows. There were also craft and tae kwon do show in the afternoon. All in all, it was a very nice place to visit."
Lovely Traditional Place,I found this beautiful traditional village across the street from our guesthouse in Seoul. It has 5 restored Korean traditional houses. The village is not to big but has a beautiful scenery with autumn leaves from the trees. This is as perfect as Bukchon village or Korean Folk Village if you are looking for traditional instagrammable pictures and not crowded too. Entrance is free and also has autumn festival for foreigners. We attended one last Oct 27 of this year. The village also has a path to Namsam park. This village can be found on Chungmuro Station exit 3 or 4 just look for the signages. This place is lovely!
Replacement for korean folk village,"If you don't want to paid for korean folk village and still want to enjoy some Korean history village, then can have a short trip here. Nothing much compare as this is free. Please come on weekend as more activity else it just a <1 hour trip. There is a free guide offering if you interested."
Charming recreation of Korean village,Well done exhibits of typical Korean life from the rural past. Homes have been reconstructed. See the earthenware pots where beans are fermented. Homes and furnishings are on display. Interesting place to walk around for a bit. In the heart of Seoul so access is fairly easy. Lots of other activities on the grounds as well.
Historical,Went here the 2nd time with my family. There's no entrance fee as well and you can pretty roam around the whole area and take good photos. If you're more into learning the history and culture in Korea. You should go here.
Beautiful place,"Namsangol Hanok Village is very close to Chungmuro subway. It was Chuseok when I went and there was a taekwondo exhibition, lots of food and people walking around wearing hanbok."
lovely and quiet,"i went in winter so it was very quiet there were a few people around but not many very close to Chungmuro station but i walked from myeongdong so it wasn't very far at all, there is a Hanbok rental store just outside if you want to dress up bit i was flying solo so i passed on that but he village itself was so pretty and fun to explore, i wondered around a bit and stumbeled on a huge time capsule which was quite cool"
Experience traditional Korean culture,"It is less crowded than Bukchon Hanok Village and the vibe is a bit different. It is also a nice place to try on the hanbok and take photos. If one cannot have time to visit the Korean Folk Village, this Hanok Village can be a substitute as it is in Myeongdong and there are some performances or activities that tourists can enjoy."
Traditional houses ,"Very nice area with traditional Korean houses. The houses are well maintained and decorated. Nice garden yard area, which is very peaceful. Pleasant place to walk and spend a casual afternoon "
Beautiful ,"The scenery is amazing. My favourite part was the pond in the back with swimming fish, where i could sit down and meditate. We even saw a cat running across a bridge. "
Quiet Stroll Through Traditional Houses,"If you like quiet and peaceful strolls whilst enjoying a good view, the NamSanGol Hanok Village is for you. There's not much going on here besides looking at traditional Korean homes (aristocratic) but the walk and sightseeing is quite quaint and serene.But in all honesty, this place can easily be a hit or miss. I went to the Korean Folk Village a few days before I came here so I didn't enjoy this scenery much (even though it's just as beautiful here). So be sure to plan out which village scenes you attend first before going to several. One is usually enough, there's not much difference for two visits. I recommend the Korean Folk Village more."
Architectural,"5 mins walk from Chungmuro subway station (exit 4). Free admission but closed on Tuesday. Namsangol Hanok display Hanok (traditional Korean house) from several wealthy family. Personally I prefer Namsangol Hanok compared to Bukchon Hanok because there are many activities in this place which opens to public, flatter walking path and we can ""peep"" the internal hanok. "
Quaint,"In Korean, this means ""village of traditional houses in the Namsan Valley"". It's in the Pildong neighborhood in Junggu district of Seoul. They try to be authentic to the period, which adds to the charm. We saw many people coming in traditional attire and posing for photos. Very lovely garden to walk around with plenty of benches. "
Good place for photos,Went in mid June close to noon time and it was a bit sunny. Temperature was still a cool 27 deg C so it was ok to walk around. The scenery is nice and is good for taking some photos but otherwise nothing very interesting.
Interesting walk,"If the weather is good, I'll recommend a visit to this place. The architecture is lovely and a lot of the houses have rooms decorated in traditional style, allowing you a peek into Korea's past. It's not a 'walk in and look' - you can stand outside the door and look in, craning your neck around the sometimes dark corners. But there are plenty of signs explaining what you're seeing so you don't have to be well-versed in any history beforehand (although it definitely makes the experience better).We arrived towards the end of the day when everything was being packed up. I imagine it's more lively in the late morning/early afternoon when activities take place, stalls are open outside the main gate, and people walk around in traditional dress. But if you've been slowly walking the area like us, I'd still suggest to drop by. It's a very lovely area with a nice park just next door that makes for a nice stroll. There is also a gift shop which, surprisingly, has some nice and affordable souvenirs. I am not sure if this is an attraction I would've gone out of my way to reach - which we definitely had. But if you have the time, and if you're interested in seeing what Korea looked like before, then do find a nice day and go."
A hidden jewel not mentioned by most tourist attraction lists -,I have been in Seoul several times and never made it to this Traditional Garden and Hanok Village. A local Korean friend of mine discovered it with me on a nice Sunday afternoon. It is only about a ten minute walk from the Catholic Cathedral.
"Nice scenery, otherwise a bit boring","The weather was nice, so it was beautiful to walk around and take some pictures of the nearby garden and small river that runs through. Otherwise a bit boring, but if you pass by anyway have a look."
Peaceful place for a stroll or picnic,The Hanok homes here are lovely but they are only a small part of the appeal of this village. There are some beautiful walking paths and picnic areas in the park around the Hanok. It is a great place for a stroll or picnic. I enjoyed seeing and listening to the babbling stream that winds throughout the village. It is a fabulous place for photos.
Peaceful,"I thought this place was perfect for taking a walk. It was very quiet and peaceful when I was there. The hanoks are fun to see, but there aren't very many of them. It's free, so it's great to check out if you're in the area."
Seoul Trip,"Beautiful place rich of history, better to be with a tour guide to know all the stories behind which will make your visit more enjoyable."
Experience Korean Architecture,"I walked down from N Seoul Tower and took a quick walk through before heading to my next activity. It was a cold day when I visited, but it was still beautiful. I have a hunch that it would be a little more interesting at night with lanterns and lights and Seoul Tower in the distance. I would say that if you are in the area stop by. If you are going to Bukchon Hanok Village, then I'm not sure that there is anything new here. Although there is a lovely photogenic pond, so it's not a waste of time if you want to see both."
A Good Place to learn About Korean Culture,"Namsangol Hanok Village offers few things to the visitor to learn about Korean culture such as Hanbok fitting, archery making, rice cake making or tea ceremony experience by paying a bit of cash. There is no entrance fee if u just want to explore and see. The hanok setting is very nice and you can learn how the traditional Korean house back then. Fortunately if you go in Spring time, u may see a bit of Cherry Blossoms as well as the other pretty flowers. If you go deep down to the center of the park you will find Seoul's Thousand Years Time Capsule which they burried in 1994 to celebrate Seoul's 600th years anniversary which contains cultural properties. It will be open in 2394 in celebration of Seoul's 1000 years anniversary. "
Cool,"Visited as part of a half-day, multi-site tour. It was a quick walk around and we were able to learn a bit about traditional Korean lifestyle and villages. Be sure to duck under the little walkways between buildings because you might hit your head (don't say I didn't warn ya!)"
Beautiful ,Even a grey day could not influence the experience at this place. Two facts helped a lot. Paper lanterns with great figures brightened the impressions there. And there was a foto shooting for an egagement which gave life to this place :-)
A place to get in touch with Korean traditions ,"This village is much better than I expected! I heard from other people it was pretty much traditional houses and nothing too special, but I have to say I really liked it and would visit again. The architecture is impressive and village is quite big. You can really have a feeling of how people used to live in the ancient times in Korea. They also have a nice gift shop with beautiful and original gifts. "
Very nice but small,Very nice place you can see all traditional houses but unfortunately very small town you can finish it less than half hour 
Time Capsule in Namsangol Hanok,The village with traditional houses from different places of South Korea. There is the Time Capsule on the territory of that village. 600 hundred items from modern life are buried there in the ground so that 400 years later (when Seoul celebrates its 1000 years anniversary as the capital city) it could be opened by future generation. Amazing!
Awesome Self-Guided Walking Tour,"Beautiful area to walk around, it's very scenic with the traditional houses and the background of the Seoul industrialized city! Information/tourist booths can be found scattered around with maps and suggested directions to walk around the area. It is hilly, which I personally love, but could be hard on people who have any knee/leg/feet/etc. issues. There are tea shops scattered about and other stores as well. We had tea at a fantastic tea shop along the path!"
Small Village Near Namdaemun,"I walk here from Namdaemun Market. This is such like small village with traditional Hanok Village. If you go to Or before go to Namdaemun, please have a visit at this area to take a photo. It will not take a long time."
Best in Spring!,Enjoyed every side of it since we went there during spring. lots of flowers and cherry blossoms. there are also people and couples in hanbok who are also game to take picture with. good for family bonding too as we see lots of them having a picnic
Traditional Korean House Village ,來南山谷韓屋村逛逛韓國老建築. This is a reserved village for traditional Korean houses. The outlook of the houses are very Chinese house like. But the inside is more Japanese oriented (this is my be due to that Korea was once the colony of Japan). It’s definitely a good spot to visit in Seoul. 
Very cool attraction,"Very cool attraction - also it’s free! The houses are very well preserved, and it’s cool to walk around and see. "
Enjoyed the peaceful garden and traditional houses,"We visited Namsangol Hanok Village on a weekday morning in summer. Beautiful garden with lots of ponds, pavillions and of course the traditional hanok village.A big place to walk around and a good place to learn about Korean Seoul culture. Definitely should visit Seoul Millennium Time Capsule where they buried 600 items in 1994 and to be opened 400 years later. What a romantic idea!We enjoyed walking around the Hanok village where there are different styles of traditional houses.Apparently, there are some ceremony, performances and hands-on activities for the visitors throughout the week. Be sure to check out their website before you visit if you like to experience more. A perfect place to spend a peaceful day in Seoul."
Full of Korean traditional house,"First you don't have to pay to visit this nice place. You can see many Korean traditional home, and there are some performance you can enjoy in the evening. You can even dancing with the performers. There are also some spot where you can try some Korean traditional game here. "
Better than Bukchon if you want to see Hanoks and like touching things!,"My take is this is a better bet for seeing Hanoks because Bukchon is a upperclass residential district set on a hill (people still live there, so you can't just walk in!) In Namsangol, it is a reconstructed village (mostly of old houses that were moved there, and 1 replica), so you can walk around all you like - the other nice part is that it is near Myeongdong (Chungmuro), so easily accessible, and not hilly (unlike Bukchon!)"
Worth a visit,"Went during their taste of korea, that had samples of eats, drinks, and carving demos. Pretty neat experience. Got some goodies to try and take home."
Well worth visiting,This is a great place to visit as historical house have been moved into this lovely park setting.There is a tea house and many places to admire the garden like setting. I loved having the time wandering among the ancient houses.
Must see,This is one place that i would highly recommend when you visit Seoul. Its like traveling back in time. Its very fascinating to see how Koreans lived during those Joseon/Shilla era and how they built the houses with those intricated designs. There's no entrance fee and you can ask for a guided tour as well free of charge. They also provide wheelchairs for seniors who cant walk too long which was really great since im traveling with 2 senior citizens. 
Mid autumn festival,"It was fun and crowded with Korean to celebrate the mid autumn festival. Great experience, there was shows for the whole day, stalls for younger to participate in crafts, Korean families were picnicking, and food trucks selling Korean food. The houses were in good shapes with lots of interior details and we were able to understand how Korean lived before..my boys were learning and asking what were this, why and how. Overall it was great cultural experience to learn."
Underwhelming ,Pretty empty in my opinion. Not much going on. Just drab and unexciting. Not really worth your time checking it out. Free entry. Metro exit 3
Great free tour,"This village is good for seeing historical Korean buildings. It offers free 40 minute tours in a range of languages (Chinese, English, Korean and Japanese). Check before you go what days and times have your language. "
Well preserved traditional houses in the heart of the city,"My friends and I stopped by this place on our way down from Seoul tower. Tranquil surroundings, but without activities or sufficient signboards in languages other than Korean, it is just a location with traditional houses"
Traditional but Underwhelming,"I enjoyed getting to see the traditional architecture at Namsangol Hanok Village (남산골한옥마을). I think this place is most suited for photographers and those with a strong interest in Korean culture. As a tourist, it was a little underwhelming as it is essentially just walking around and looking at the buildings. There is an area where you can watch martial arts or drink tea but it is otherwise a sight-seeing location only. If you are doing the Seoul City Bus Tour, it's worth taking 30 minutes to stop and look at it as it is free admission."
