review_title,review_body
Quaint traditional village,Went on a day tour that included Namsan Hanok Village. Had a nice walk around this quaint traditional village with beautiful architecture. The guide provided interesting narratives.
A hanok village meant for tourists,"We visited here using the subway and exited at Chungmuro station. Entrance was free and it was a beautiful place to visit. We had a nice look around. You can even see the N Seoul Tower from here. Plenty of tourists but the place was interesting nevertheless. Many well-preserved hanoks, pavilions etc."
Korean Folk Village,"Architecture is beautiful, this place is clean and it is free to get in. This recreation of a traditional Korean village has free shows, plenty of refreshment stands, historic recreations and is also the home to many Korean TV shows. There is a group of student offering free tour. They will answer your question about the village."
Nice place,This place is a replica of old traditional Korean villages. The entrance area is like a park and inside there is a ticket counter and a cafeteria. One can buy tickets for hiring traditional Korean dress and having a photo shoot in it for one complete hour. Overall a good place to spend time knowing abt the old Korean era and their lifestyle.
Beautiful quite village in the centre of Seoul,"Beautiful, tranquil area in the midst of all the hectic of downtown Seoul. Gives a good understanding of the traditional Korean lifestyle. Try to find and catch the 1 hour Nap Experience for W2000!"
An awesome Stroll before Night time in Namsan Tower...,"We thought it would be just a simple historical stroll through and head to namsan in the evening and end the night in Myeongdong. Well, the place is beautiful as you take in the gorgeous surrounding , landscape, historical structure and just the vibe on the place. The small details was what interest hubby and i . Beside the pond there are batches of small strawberries growing in the flower beds, and we notice some herbs here and there too.. When you walk around you will see pine cones which the shape is something Ive never seen , some kind of berries (which i wasn't sure can be eaten or not) and just the flowers are beautiful. Take Ur time and breath in the fresh air and somehow the place exudes calmness. I like that there will be a corner for anyone to try some local traditional games. The only setback is would be awesome if there was someone to explain the game to us or maybe they should put some multi-language boards on instructions of games . Lolz.. TIPS: its free to enter, Its a beautiful,place for a picnic soooo many places for some down time.. Theres a Gimbap store directly at the road leading to NamsanGol... Absolutely love their prawn kimbap and kinchi jigae... Yums!! We even take away 2sets of Gimbap for later... Enjoy!!1"
Good place to appreciate ancient Korean lifestyle.,"Bring your camera because you are going back in time. The houses were replicate of old Korean houses. There are some demonstration of Korean craft. Hanbok experience is also available but it's not free. What I like most is the Taekwondo performance at 1pm. There was a booth outside the village which indicates ""free tour for foreigners"". I waited there, but nobody came to give tour, what a pity. I hope there can be more interactive activities in the village. "
Very nice,Walking along the streets and watching the architecture and life gives you better idea of understanding the life of Korean people.
Tradition,"Absolutely amazing place to discover Korean tradition. You do not pay any fee to enjoy this place, but the traditional green tea do not taste nice for many people..."
convenient,"Being situated at Chungmuro station exit 3, this place is very convenient. There are various activities to take part in each day (check out the schedule when you are there) eg archery. There is small cafe inside where you get a discount for the drinks if you are in hanbok. Much to explore inside which I have not finish despite the fact that it is not big. There's even a small temple at the entrance. This place is also near The KoreaHouse where traditional performances are held. "
Quaint but not a must see,This is a nice little replica of a traditional Korean Village but not something I would say is a must see. It would be better if there was more information about what you are seeing.
Good place to visit - small but quaint,"I gave this place a 3 star rating because we didn't get the full ambiance of this visit. Due to a holiday in Seoul, many of the venues were closed but we managed to walk around the grounds. If you're in Seoul for a very short visit this place would be good to visit because you can probably see it all of it within an hour or two. I wouldn't mind visiting this place again while it is in full operation."
Great Cultural Experience!,"I know that Bukchon Hanok Village is popular among toruist. But this is the place where you can see traditonal korean house and learn some korean history. It looked like an excellent place to do many traditional korean stuff like caligraphy and tea ceremony. When I went there, they provided us the opportunity to enter the house and 'take a nap'. Usually, you are bared from entering.If I had the time, I would rent a Hanbok and take some pictures here. It's nicer to wear a hanbok here and take pictures compared to taking pictures at the palaces."
Historical Look at regular Life in Korea,"No one lives in this village anymore, but the buildings give you an insight on what life would have been like before the 20th century"
Lots of fun and culture,"Great place to visit for any type of traveller. I has lots of fun there, tried traditional costumes, have taken fantastic shots of traditional buildings, the parks are amazing."
A Glimpse of Korean Culture,"This is a must see for a first timer in Seoul Korea. We went here first hour in the morning. Had our breakfast at a resto nearby. At the entrance we were greeted by a volunteer student tour guide, it was a free and good to learn more about the culture from a local. We were able to experience their games. It felt like we were in a Korean Drama featuring old Korean era. Overall, we had fun and highly recommended."
A place to visit in the morning,"If you're an early riser, most malls will not open until 10:30. So this place is a place you might want to visit.Here you're find a few sample of one style houses. A stroll in an adjacent part is also a nice experience. Plus, this place is just next to a subway station."
Second visit to show my wufe,I came here in 2016 and it was much quieter. It has now been built upon and more houses added. This old hanok village is not its original site. It's a beautiful serene place though especially the stream and rockery. Ideal picnic place. Free city wifi can be picked up here if you cannot pull yourself away from Facebook 
Learning Old Cultured at Namsangol Hanok Village,"We get there using Subway Line 4 and gett off from Changmuro Station Exit 3. We ask somebody here about the direction and here we are...we enter the gate of Namsangol Hanok Village.You can get brochure and card stamped beside the Tourist Information.we enjoy watching the buildings and park. we can sit and enjoy the ponds to relax or walking to the park.After enter the gate, you will get the ball with huge open building. this place is for meeting all the people who lives in this village. Beside the building there.s a bunch of traditional house of Korea.you can buy a ticket to learn Hangeul, or learn how to make the Korean traditional game, or how to make Hanbok, etc.You can walk around to see clearly from close the part of the house, such as living room, kitchen, bedroom, study room, work room, praying room, etc. you can see the pict i send.for me it's interesting one and grateful i found this awesome place."
If time ,If you have lots of time in Seoul....see this places. But if you have few days and not much time...you can skip this village. It's a bit hard to find if you don't have a map on you mobile!It's a regular old village 
Small Area With Beautiful Architecture and surroundings,"The buildings were beautiful and so were the surroundings. It's not a large area to visit, but I liked that it was not crowded and it was very enjoyable walking through the area. My sister, niece, and I rented hanbok from the rental place right outside. It was more expensive than the rental inside the village, but the hanbok were beautiful and the husband and wife running it were very nice. The woman even did our hair for us. I'm a korean drama fan so it was so fun - I felt like a character in a historical drama. Lol."
Great experience at the tea house,I stumbled upon their tea house by chance and had an amazing experience. All by myself in a beautiful and peaceful tea room I had an amazing tea with blooming flowers. Very transcending experience.
Korean life,"Very interesting to visit thus village with traditional Korean living, a bit hard to find from our tour stop but defibately worth a visit."
A pleasant surprise!,These are beautifully restored historical buildings that are mostly residential. Go there first thing in the morning when the sun is best for taking photographs and before the tour groups arrive.
No entrance fee :),This place is walking distance from the train station. The traditional Korean garden will welcome you as well as the view of Namsan Tower. The Korean traditional houses have been restored to preserve the original atmosphere of the area. It is ncle to try hanbok and take pictures at different locations here. It is not tiring to go around unlike the other palaces and hanok villages.
An OK visit but the hanbok rental is cheap :),"This place is near to our accommodation so basically we just walk to go there. If you are using subway, stop at chungmuro station, exit not sure. The layout of this place is just ok for me. You can see a few hanok for a few different rank. We go there twice, the first time to visit, and the second time is to try their hanbok. After surveying for a few days at a few location, we figure out that at this hanok village, we can wear hanbok at krw 10,000 for 1 hour. Other places range around krw 18,000 to krw 20,000. The hanbok is beautiful enough so no complaint. Just that you need to be there early, if not - maybe you have to wait for quite some times before your can try it out. Just a reminder, before you enter this place, there will be a shop just outside this place that also rent hanbok. If you don't mind paying higher it is ok. But thekrw10,000 per hour hanbok that I'm talking about is inside the hanok village"
An oasis in the middle of the city!,"The park was well situated right at the heart of the city. It was walking distance from our apartment. It gave us a taste of Korean culture. We were able to take lots of picture-perfect shots! What's more, no entrance fees and you can stroll around the park at your own sweet time."
Beautiful,Full of atmosphere. Lots going on. Partipation in Korean games. The stream passing thru was very photogenic. Young ladies in costume made it for me.
Fun to walk around in,It's nice to see the older part of town but important to remember that people live here. We were informed that the locals are afraid to leave their doors open as tourists simply step inside not realizing these are private homes. 
Great guide,"We had a wonderful guide who was in the eighth grade! Harry was his name! He volunteers once a month to help tourists navigate their way through the village. He was up on his history which made the village more enjoyable to visit!! He was very knowledgable and most courteous! Fabulous village, warm people, and a delight to visit! "
Namsangol,This is a great place. Peaceful and full of history. Located by Chungmuro Station. Nice view of the Seoul tower
Nice to see preserved culture,"Nice place to go for an hour or two. Preserved historic village in the the middle of Seoul. It is free and close to public transportation. If you are not a local, then this would be a nice place for you to learn about Korean culture and some history. "
Well worth a visit,"This Hanok Village is well worth a visit and has more to see than we had expected. There is no entrance fee and you can spent a pleasant hour or two in the park and viewing the traditional houses. There was live music when we visited on a Sunday afternoon and many families were out enjoying the atmosphere. This is at the foot of Namsan, so combines well with a walk up to the North Seoul Tower."
Well-Kept,Well-kept memoir of Korean history. Very accessible -- through Chungmoro subway. Different versions of Hanok houses --- with cultural shows. The park is nice and clean.There is a tea house --- where you could try the traditional tea ceremony. Souveneir shop have nice and reasonably-prices mementos. Free entrance. Overall nice experience.Recommended to all tourist who are staying near Myeongdong area (less than a kilometer walk from Myeongdong Entrance).
Korean Folk Village,When we visited this place you will be reminded of the Koreanovelas. The place is clean and so relaxing to stay at.
"Cool,serene,magical place","I missed this place in my last 2 visits to Korea..there are so much more to see , new places, new attractions, changes to keep tourists come back for new discoveries "
Cherry Blossom,"Traditional House Of Korea, good place to go and take a picture and Cherry Blossom. Big Enough and very beautiful place."
Loved the architecture,"This is a place with many traditional Korean homes, moved from areas from around Seoul, almost like a North American pioneer village.Architecture is beautiful, place is clean and it is free to get in. The surrounding park, Namsan park, is lovely in its own right. Both places have many opportunities for photos.Nice outing."
Visit history and a TV set,"This recreation of a traditional Korean village has free shows, plenty of refreshment stands, historic recreations and is also the home to many Korean TV shows. If you have a Korean friend be sure to get some photos with the cut-outs of the current TV Soap Opera locations, they will be so envious!We found the folk dancing attraction especially fun. The dancers performed amazing feats of body control, and even though the Korean music is s little jarring to western ears it was truly worthwhile, and its free, along with several other performances."
Interesting to see the traditional houses ,Not a must-see in my opinion but worth going to if you're already in the vicinity. Neat to walk around and see the traditional houses but when we were there there was hoards of tourists so it was hard to enjoy it or even get a good photo. 
Free admission to see Traditional Korean houses,Must see when you visit Seoul. You get to see the traditional houses of Koreans. In here you will also find replicas of some houses of famous people in Korean history. You will also get to see the Time Capsule of Seoul within the area.
A must see for history,Beautiful partly reconstructed ancient village showing the way of living centuries ago.Very interesting vor historically interested people
Traditional Korean Houses,"The Admission: FREE admissionThe Village: The ancient village from the Joseon period, traditional Korean houses. Good photo opportunity. You can participate in traditional culture experience programs, reservations are required with fees. The Location: Subway Line 3 or 4, Chungmuro Station. Exit 3 or 4"
Korean culture and architecture,"Traditional architecture and living habits of old Koreans are the things you will find here. Admission is free. Located near to the Chungmuro exit. It is very scenic. Overall, worth a visit."
Preserved History,The traditional houses are very interesting. When you visit the place be courteous to people living in the community. 
Cute hanok village by Namsan Park,"We went to N Seoul Tower and Namsan Park so Namsangol Hanok Village was on our way. We liked the cute little village. If you are short of time, you can see (maybe fewer but equally impressive) hanoks by Gyeongbokgung Palace. "
Traditional village replica,"I visited this place after seeing Bukchon and it was nice to see the houses open with furnitures to give a better idea how the people lived in the past. While I was there there was a group studying calligraphy, but I could not see them because the windows were closed. Some of the houses were moved to the village, what I found it was really amazing. There is a courtyard in the back where you can try traditional kids games, unfortunately I could not do because the instructions were in Korean and I did not do the tour. I went there early in the morning and it was quiet. Tourists can try some traditional activities but none were available at the time of my visit.The entrance is free and the place is located in Namsan Park, so it very easy to go from there to N Seoul Tower.To reach Namsangol Hanok Village take the Orange line 3, Chungmuro station exit 3. The entrance is just past the gas station. From there to go to N Seoul Tower, just go to Chungmuro Station exit 2 - just along the street from exit 3, and take the circular bus 2 or 5. You have the opportunity to get off in the bottom of the tower and go up a steep hill or get off close to the cable car."
Furniture,"This is a good place to come and see the houses with furniture in. So many of the museums show the houses as empty, but here they have collected together typical furniture so give a more complete look at how the people lived. Live 3 or 4, stn: Chungmuro exit 3. Free entrance."
Insight into Korean living,This village is a created area. The houses have been moved to the site. You can therefore see inside the houses. There are explanations and workshop areas.
compact reconstruction,"The exterors and interiors are meant to be authentic reconstructions, and by and large they are more chock full of refurbished exhibits. It's a good place to see glimpses of what living conditions may be like in the past, but they look very new. Can be done in 30-40 minutes if not watching a show at the pavilion or strolling through the park behind the reconstructed hanok sets. "
Visit this place on Chinese Lunar Year,"This place wasnt closed on Chinese Lunar Year eventhough many places were closed. In here you could see beautiful Korean traditional village.This place had Lunar Year Festival and there were some events for tourist who came here, such as - free rice cake- making of sweet rice puffs- making of mask and kite- traditional korean show (percussion, arts, etc)- traditional korean gameSome of the events were free, you can see my photo to know more.So visit here, if you dont know what to do in Seoul on Lunar Year."
Beautiful Village,"When the location is only 5 minutes walk from the place i stay in chungmoro, it's easy to reach. It's beautiful during the winter as the snow covers the roofs and giving great views for photos. But it was too cold during my short visit to this village as i only manage to wander around for only 30 minutes. "
Worth a visit. Free entry. Interesting housing. Beautiful scenery. ,"Very close to chungmuro station. Get out exit 3, don't go up the slope, walk straight past the petrol kiosk, follow the sign and you're there in 3 min. Nice environment and atmosphere. They moved some actual hanok onto this site. So they are not really new replicas. We went during the lunar new year festivities period and they had a lot of traditional crafts, activities and shows. Quite fun! But too cold as it was snowing hard. Fun place for kids to run around too. There's also a park at the back to explore if your interested. A nice walk around the village and feel lost in time. Transported to a different age. A gentle walking course for both young and old. "
Old Style Village,It's just another old-style village in Korea. It's just 10 minutes walking from Myeong-dong. Best hour to go: after 6 p.m. (it will be night and empty!).
Loved it!,"I loved the Hanok village, as well as the details about the history of the village. I also went to Bukchon, but it was difficult to really see a lot given that they are being lived in."
Traditional Korean Village right in the city,"I visited this village on a Sunday end of November, which I believe is the low tourist season for Seoul.Admission to this village is free, and there are free guided tours offered by volunteers.I requested for an English speaking tour, and was given a private tour by an ajusshi who spoke good English. He gave me a great overview of old Korea, the architecture, and the living habits of Koreans.I really enjoyed the 1 hour cultural immersion, and came away with a much better appreciation of Korean culture and history.Will recommend the free guided tour for history buffs and lovers of cultural visits."
close by myungdong,really great place to feel korean traditional cultureit's close from my hotel good accessibility.
Great Cultural Experience,This is a great place to learn on the living styles and habits of old Korea. It takes you back to the scenes you would have watched in the television. There is a centre outside the entrance where you could rent a Hanbok for photography too.
A Real Korean Village to Visit Right in the City,"A good place to spend your time and see how an old Korean village look like. Admission is free and right in the city. Highly recommended for tourists who want to take photographs of Korean houses, the urns used to make kimchi, and lifestyle. "
Nice place for photography ,"It's a nice place to explore the culture and history. Probably take 1 hour to walk around and there's no admission fee. You can rent hanbok outside the village for 20,000₩ for 1 hour. "
Cultural Village,"Visit on a weekend when there is a planned wedding in progress. The houses are of an older period and give a free taste of the authentic Korean culture,"
a taste of the Korean culture,We went here during the spring season which is a nice timing to witness the cherry blossom trees. It's great to explore the Korean traditional houses - like you're back in the past. Also you can see the Namsan Tower from afar.
"The real, live korean stay for a common man","Though we visited it towards evening, we could find the architectural beauty of the houses quite fascinating. The winding climbing narrow lanes take you into another world to feel the difference. There is beauty in every angle. We wish we could visit and explore the whole area. One should visit this area to experience the Korean peaceful past. Though we were prevented to to take photographs outside some houses. You get Mobile Information centres here which is a very rare thing."
"Good for a visit, its a museum and living village though","This is a free open-air museum located a short walk from exit 3 of Chungmuro station. Dont walk to the Korea house!There are five houses transplanted here. They are suppose to represent the homes of people of the different social classes during the Joseon period of Korea's history. Over weekends there are expected to be renactments of traditional Korean wedding around noon, so time your visit!Because there is no guided tour of the place, you are pretty much on your own. The Hanok village museum is part of a larger park. Sometimes there are cultural performances. Overall it is a good place to get an appreciation of traditional homes. Elsewhere, you either pay or it is a real residential area and cannot easily access. Real Hanok villages are well outside in the rural, so this gives a nice introduction."
It's alright,"Thought id so some historical sightseeing so i went to visit the hanok village. Easy to find in Seoul, this place is definitely interesting and get a sense of history of korea. However all you're doing is just walking through old villages and theres nothing informative. Probably spent an hour here, it was alright but once was enough"
"Small, nice for short stop","The place was a lot smaller than what I had imagined. Not a lot to see, but a great location to take pictures. Go here before you head to Namsan Tower. "
Enjoy the cultural village for free,"This is a lovely village and garden, smacked in the middle of metropolitan Seoul. The best part of this place is that there is no entrance fee. There are also free guided tours in English, Japanese and Chinese.I was the only person in that tour and I had a private tour cultural tour of the village. My tour guide spoke excellent English and she was very willing to answer all my questions.The gardens surrounding the village is also worth a visit and there are a scatter of art pieces around the garden."
Nice display of traditional homes and interiors,"These yangban (educated upper-class people's) homes did notoriginally exist together but were aggregated in the area to preserve their historical architecture. There are added-on experiences you can purchase, I went for the traditional calligraphy. After a brief lesson, you use brush and ink to write the Hangeul word on canvas. If you do not know Korean, the instructor will give you a word to use. There is also tea ceremony experience and hanbok (traditional clothes) wearing experience."
