review_title,review_body
Nice area,There is a tourist office close to the Metro exit. Go in and get a map of the area. We found the lady in the Tourist office very helpful and her English was good.Honestly the houses were very beautiful but not a lot to see or do. There are Hanok houses on two sides of the road. Once you walk around and take a few pictures then you are done.When started on the same side as the tourist office and then cross over and finished on the higher ground. There are steps at the top which lead down to a street which is really arty and has lots of places to eat. We went to the first Korean place we met and had a great meal for small money.
Absolutely beautiful,Forget about the boring and uninteresting Bukchon Village. This is the one you want to see. Many houses of the olden corean days. Very nice walk. Highly recommended.
"Nice, take a picture with hanbok","The village is very quite and nice.I have experience in take picture with hanbok.The name of hanbok studio is Ariang, just the right side of village. You can rent the hanbok for 01 hour, the fee is 20.000wonOr you can take picture in the studio (they will photoshop for you and print 03 pictures) with the fee is 10000won/person.It is very nice and tradiontional."
It is close to the Chungmuro Metro Station and the admission is free,"The Hanok Village is close to Chungmuro Metro Station and the admission is free, do pay a visit when you are around the area."
Interesting way to learn,"The village offers a lot of information that you can learn about Korea's rich culture and history. For someone doing a transit tour, the place is really amazing."
Rich in history,A short walk from the Chungmuro subway stop on the #3 line. Take the #3 exit from the station.This is a collection of historic buildings many of which were moved from their original locations. Spent half a day enjoying the Village and the grounds. 
Dated,"Really let down by this place, my kids (6 & 8) were of the age where one could get on all the rides and the other couldn't, all the rides for the younger one was really baby'ish. The place is generally very tired "
Nice and beautiful,It's a lovely village but nothing to do that much. Nice place to take a photo and look at old village style of korea
Quick peek into Korean culture,Two things you must do here 1. Rent hanbok to wear for photo taking (so pretty!)2. Go to the tea house in the village and have a nice cool quencher in summer 
Beautiful snow day,It was snowing and we immediately made our way here. It's so conveniently located near the station. Snow covered all trees n pavement. You would not believe this place is right in a city. It's beautiful and we were do engrossed in snow activities and picture taking that we forgot about the indoor tour around the house. There is this nice little eatery near the entrance that supposedly serve 'ugly but tasty gimbap'...We were too full to add that in our order but we saw that it was popular. Loved it!
culture village,i discovered this place when i was walking to Myeong-dong.i quite this place and it just under the N Seoul tower.it has tea room and time capsule too.
Going back to olden days of Seoul,"This is a place everyone must go if you are in Seoul, you can see unique buildings and lots for shoppers. Enjoy the olden days of Seoul here."
Pretty,English and chinese free guided tour is available. Easily located at chungmuro exit 3/4. Pretty structure . They have a time capsule garden at the back which is worth a visit.
Namsangol Hanok Village,A must visit place for tourists. It has a lot of tradition houses and the location is very clean. Great place for photos too.
"Not enough information, or diversity is housing type, to be more than a photo op","After spending a wonderful afternoon at Lin An Tai historical house and museum in Taipei the previous year, I was looking for a similar experience. This was not it. Unlike Lin An Tai, there was very little information provided on site at Namsangol, and nearly nothing provided to explain the style, age, and architectural influences of the collected homes, nor what the individual rooms in the home would have been used for (other than an occasional note about a main room or a temple.) I suspect that this lack was not only in English, as the number of signs was very limited. It's a pretty area, surrounded by a very metro neighborhood, so might be nice for pictures, but I would have rather spent my time at something truly interesting and historically informative."
Namsangol Hanok Village,"Peaceful beautiful. Autumn leaves were awesome. I sat by the pond for a long time just breathing in the air and scenery, wishing I never had to leave. Love love looking at the hanoks too."
Traditional hanok village,"Exit Chungmuro Subway Station and walk a few minutes to the village which is at the base of Nam mountain. It a little small compared to others around Korea but you can see many similar buildings and features. I recommend getting a drink and snacks before entering, I happened to go when they had a martial arts demo and there were many activities for children. I don't think they have these activities everyday. You can spend an hour or two walking around so if you need a break from myeongdong shopping, this is a nice spot."
Worth A Look,"A small village in the middle of Seoul,about a 10 minute walk from Myeongdong Station.Interesting Hanoks and you can participate in various activities if you wish to.We were very lucky as the Korean show Infinity Challenge was filming there and we were able to watch and see some of the celebrities."
Traditional village near Mt. Namsan,"Village may not the the biggest or the most authentic one, but it is located near Mt. Namsan and you can have a nice walk to Namsan Cable Car Station and to NTower, so it is good to put these attractions together if you are in the area.You can't go inside buildings, but it gives you some idea how such traditional houses looked like."
It's a right choice to experince the view of traditional Korean houses from Joseon Era,"I went there during winter and it was freaking cold, but the snowy view here was priceless. Ice houses were built during this season and you could take lot of good photographs. There were a lot of traditional houses that could be explored and they're well-maintained even those houses were built thousand years ago from Joseon Era, but I still could feel the original and the beautiful scene. Namsan Hanok Village can be accessed by taking metro Line 3 or Line 4 to Chungmuro Station Exit 3 or 4"
A little hint in story,"the Hanok , living in One of them too is Something no to miss even if you are on a strict Budget, One night of treatment in a Hanok is worthed "
Must visit,"An old village which they have reserved well. I luckily was here when they held a traditional wedding so it was a unique experience. The landscape, the houses are beautiful. Can also wear hanbok, the professional photographer will shoot for you in one hour and you get two printed photos, plus they send all pictures by email to you a few days later. Love it :)"
An underrated gem.,"Original houses in near-original condition. You must have or join a (free) tour guide. The buildings represent the heart of Korea. Under-floor heating, for example, has influenced how they sit, eat and sleep, and socialise. Even the curve of the familiar curved roof ridges differentiate them from similar Chinese and Japanese buildings, in an idiosyncratically Korean way."
Hanok Village - Should be better ........,"From Seoul station, take a bus to the village. It should be more fascinating as the name is , only very few Korean traditional houses so travelers could rent gowns & have pictures taken as a memory of their trip to Korea.Nothing exciting , just walk around the alleys, drop by to have tea, beverages or some little fast Korean food. Only if you have finished all the interesting attractions, drop by if you have time."
Easy was to see korean traditional architecure,"Another option in Seoul to see more examples of Korean architecture, especially if you don't want to navigate the alley ways and climb your way to the Bukcheon Hanok Village.This tourist attraction is usually quite busy, especially during the warm months. On weekends it's overrun with tourists and weekdays with school children as many school have picnics and field trips here. However, if you want a chance to take more pictures of Korean style houses, it's at least worth a stop by. "
A little bit boring,"After visiting a lof of other Korean folk villages and the palace, I think this artificial Hanok village is a little bit boring. "
Traditional Korean Houses,There were few houses on display and getting inside the house is not allowed but you can still see the interior of the house for picture taking.
Just plain average,The only reason why I'm going here because it is within walking distance from my hotel. Just an average experience. Nothing special. 
Interesting cultural village..,"Alhough smaller and kinda replica compare to Bukchon, this small museum village is interesting to learn the way the korean lived. The village range from low to mid level living quarter. Recomended for kids, but dont forget also to visit the Bukchon version."
Real old Korea,This is located in the center of Seoul and can feel the real old Korea style. It is good to walk
"Good hanok village, kids friendly","We went here from Namsan park, because our guesthouse was at the back of this village. All the scenery was beautiful. When we came, there was no event here, due to winter time. But our kids had so much fun to look around. I recommended this place for family, with young kids, who want to see hanok and inside the hanok. It is easy to walk here. And it's free."
Interesting Ancient Village,It covers quite a large area. Quite a number of interesting buildings and antique things to look at. An open area for traditional games. A good view of N Seoul Tower too. Easy access by public transport.
lovely but not worth more than a couple of visits,nice to know a hankok village sits in the center of Seoul. memorable but won't offer anything beyond imagination.
Namsangol Hanok Village,I went there at night time around 6p.m and it was kind of scary because at that time there was no one there and there were just empty buildings all around you. My advice for you is to go there during day time.
Go to Bukchon Instead,"Not that attractive compared to Bukchon. More on a ""man-made"" Hanok Village. Nothing much to see. If you are pressed with time, you can actually let go of this."
2 hours at Namsangol Hanok Village,"it's free admission, if you have a few hours to kill, make a visit.good for photos, and get to know how the Korean houses look in the past.Walking distance to Insadong."
Nice free attraction,It has 5 Joseon-era houses that have been restored. Volunteer guides are available during the weekends who can give more details about the houses. The park surrounding the area is a nice place to relax. One of the better free attractions in Seoul.
Hanok architecture,To have a look at the traditional Koran architecture it is recommended to visit Namsangol Hanok village and enjoy in peace a stroll through nicely lined houses and a park.
Nice Scenery,Nice place with lot of ancient village. Good place for photography and it is free admission. It be easily access via public transport. 
Beautifully maintained,"Love the village. There's also food festival when I went there, and I get to try making some of their traditional sweets for free. There's demos for making traditional clothes and so much for. In all, there's a lot to see here. "
A more peaceful ancient Korean Heritage,This Namsangol Hanok village have 3 blocks of ancient Korean Nobles' houses which were moved from Buchon Hanok village. All the houses are still well maintain. It is very interesting to know how the ancient time the rich nobles Korean houses structure were build to keep away heat of summer and remain warm during the winter. This Namsangol Hanok houses are different from Buchon Hanok village because there are no residents reside in . Therefore the interior are still remain the same and not modernized to reside people.
Nice cultural place,"Namsangol Hanok Village has a traditional house for you to view.The place allows you to have a feel of the local traditional culture. The get there, take the metro to Chungmuro Station. Get out at exit 3. "
A compilation of traditional folk houses,Visit the namsangol hanok village to learn about the tradition of korean and what they stayed in during the past. There are also details such as their living culture. You also got to try out the traditional costume in here.
Nearby,yes there is such a traditional korean place at the nearby town and only few walks away from the highway and subway. it's great walking around and having a somewhat experience of the tradional korean lifestyle
Very Nice,"It's a great place to stroll around in, experience and feel traditional Korean culture. The place is quiet even with a lot of people milling about."
Loved It!!,"Traditional Korean Village, This village has five restored traditional Korean houses and a pavilion, a pond, which make it a perfect spot to take a walk.There are spots where on the ground traditional games are made. During the weekends, traditional marriages are shown at Bak Yeong Hyo's Residence. The groom and bride in traditional attire, you can quickly grab a foto with them.We loved this place!"
Calm park and old traditional houses.,"I visited Namsangol Hanok Village a beautiful October day when weather was great. Saw an amazing taekwondo show, walked the tranquil park. Sat in the sun and watched the nice colors of the trees preparing for fall. Not many people. Great if whether is good. I spent 2 hours here.Also strolled around the traditional houses. The had different traditional activities to try, like dress up in traditional Korean clothes. Didn't try any of that. Really nice place if you want to get away from the buzz in the big city!"
Save it for dead last on your trip,"The buildings are genuine but the ""village"" is an artifice. Essentially, it is a collection of 5 wealthy families’ homes relocated to this spot and landscaped to appear to represent a natural setting.“Homes” is really a misnomer; these are the equivalent of today’s mansions. Though not overly picturesque or photogenic, they are, when examined patiently, a good glimpse into household life during that period (including how they used fire pits under the various living quarters as radiant heat).Try to get here as soon as the place opens. As the day progresses, it will inevitably become completely over-run by busload after busload after busload of Chinese tourists. At no other sight will you see such a concentrated number of tourists from China. I don’t know why but this place is apparently a very popular, “must see” sight with all the tour groups. It amounts to a large number of people occupying a relatively small parcel of land. At times you will find yourself very distracted. It’s quite strange because there are no busloads of anyone from any other country.This is far from a “must see” sight. I would save this as filler at the end of your stay in Seoul; don’t risk sacrificing any prime sight or sights on your list to go here.On Wednesdays and Saturdays there are Taekwondo exhibitions by children and young teens, which adds to the touristy, carnival-like atmosphere. Keep in mind, the village is closed on Tuesdays; although you can walk the grounds, access to the homes is not possible.I wish they would re-name two stars ""below average"" because ""poor"" has a distinct negative connotation. I would give it two stars but for that reason."
An insight into the past,"The Hanok Village is a collection of traditional Korean houses which have been moved onto a complex and rebuilt as they had been. It gives a fascinating insight into how Korean families lived in the past.We went at a quiet time in the village, around 16.30/17.00 so there were few people around but there was no food or drink place open despite the normally long opening hours of the café!"
Treasure and Historical,"Treasure.....this place amused me. I thought this place will be located in a very hidden place. but I'm wrong, is located in a city, it definitely gives me a WOW feeling. Also, is kinda impress that the building remain so well and beautiful. Overall, nice place"
Namsangol Hanok Village on Chuseok,"Overall good experience. There were quite a lot of people- especially families with children. Only a few food stalls mostly selling traditional rice cakes, hotteok etc.They also have a special event schedule for the day with some traditional dancing and other performances."
Below expectation,"This place is small. We expected expected a bigger Hanok Village with real living people in it like in Hoi An, Vietnam. By the way, it's free and this is our first Hanok Village visit in our life."
I would pick something else to visit,Suggested by our guide. It was relaxing but I think there are other attractions more interesting. We saw the old ways to make Kimchee.
Interesting history tour,We did a tour go during the week less visitors . Our guide was very informative with the history of hanok . The houses had been shifted there from another place . It gave you a inside view of how they slept cooked and lived life in there village years ago
Not worth the time,Please ignore this place as it has nothing interesting or worthy about it . Totally deserted and barren - went with high hopes only to crash it
Walk around ,Free entry. Easy to get around. Not sure how wheelchairs manage the high step in to each area We walked to this coming down from the Seoul tower through Namsan park and then back to exit12 beside hotel Also plenty of water toilets and outdoor exercise equipment Hilly and many steps 
great place and great experience,"I came here during Korea's summer vacation week - I think. so, when I arrived, there was a 'free walking course' by teenagers - about 16 years old for them to practice English, and also a teacher assists and encourage them to speak english and also introduce how traditional houses build as smart house, i.e : heat from in-door kitchen is circulated to main house."
Surprisingly good,"It is conveniently located, not far from Chungmuro station (line 4) exit 4. Free admission and you can get to experience a traditional Korean village there more leisurely than bukchon hanok village, which involves a lot of tough walking.The hanbok experience and arrow making class (fee applies) are the highlights of the visit. The hanbok there are new & beautiful and you are allowed to take photos inside a traditional Korean house, which is great in my opinion."
Traditional historic Korean village.,This place features a variety of houses and other buildings in a beautiful garden setting showing how life was hundreds of years ago.
Not much there,Unfortunately in the winter a bit of nothing and wouldn't really bother. I think in the summer they do more activities there.
Hidden Gem!,"I'm glad I found this little gem on the way to the train station. There was also a photo studio where you can dress up with traditional clothes, get your photo taken and even walk around around the village! It was pretty cool. Overall, I still consider this a little treasure."
better than Buckchon,"I'm visit two of Hanok village at Seoul, this place better than the other one (Buckcon). But, Namsangol is like a museum, there's not a real village as at Buckcon. But, you can taking a photo better than because the buildings looks real. suggest for visiting in the morning, not to crowded and you can enjoy the garden."
Nothing noteworthy,"This hanok village with its handful of traditional Korean houses was a bit boring for my tastes. The 5 houses all looked the same to me and there wasn't much information about them, apart from who they were built for and when and some architectural details. You could not go inside any of the buildings, so my visit was very short."
Nice walk! What I was looking for!,Loved walking the streets in the early morning. had the place almost to myself. Some nice viewpoints up the hill! Great walk!
Finding it was an accident but well worth the trip,"Me and my wife was looking around Myeongdong and just decided to walk....well we walk pretty far and then we found the village. It was great seeing how my ancestors lived many years ago. The design of the building was very nice as well. I find it hard to believe Koreans were so short back in those days. The houses were pretty small in height and my wife's head touched the bottom of a doorway, and she is 63"". If you keep walking towards the rear of the village you will stumble across the time capsule. I also played a game of tuho and out of everybody that played, I was the only one to get my dart into the small hole. You have to try it, pretty sure it would make an ""excellent"" drinking game as well lol."
A peak inside a tradtional house,If you want to get the feeling of how houses were traditionally furnished this is a good place to go. You can also walk around it in traditional clothing for $5. A great place to take pictures. The houses were moved from other areas so there is a good amount of space to walk around them as opposed to bukchon. Bukchon has more houses but you can only go in the few that are stores or workshops. 
You have to see this place,Spent a few days here on return trip to USA. There is so much to do and see and this is a must see. An oasis in the city. Very beautiful and easy to find with local map. We walked there from Myeongdong shopping disctrict. 
Worth taking a look at,"Our hotel was nearby so we strolled around for few hours. You get nice pictures here and it's free, but there's not that much to do around the hanok village. Few pretty nice cafes here and there but not much more, worth going for the ""old village""- type of pictures though."
A great village to visit after the Gyeongbokgung palace,It is great to combine this village with the Gyeongbokgung palace at the same day. It is easy to compare daily life of royalty and normal citizens of Korea. It also has a time capsule to celebrate Seoul 600th anniversary.
Visit during the harvest festival,"If you get the opportunity to travel here during a traditional festival, particularly the harvest festival then there is a lot to experience and interactive activities too"
In to the housing culture ,"With the help of a korean friend, now we understand how they used to live, the traditional way of celebrating theirs ancestors and the day by day.It was nice place to be and spend no more than 2 hr there, the kids loved it because it was not a long walk."
A short break with nature in the city,"I have been to this place just by pure luck when we were wandering around with my mum. Sadly it was lunch time and that's why most of the workshops were on break but still it was good enough to make us happy with its nature and well designed structure. We bought many items from the gift shop inside. It is not the cheapest but definitely normal prices; if you find something you like, definitely go for it."
Great place to familiarize yourself with history and culture.,"This place is a good stop if you only have a few hours in Seoul. You can see old style houses, try traditional games and activities, eat traditional food and watch cultural shows."
"At base of N Seoul Tower, great for photos, not to visit.","Our next stop was the Namsangol Hanok Village. By the time we found it, it was high noon and it was too scorching hot for my liking and I admit, I was acting like a spoiled brat. The village was literally close to the N Seoul Tower which made for a great photo opportunity, but other than that I would not recommend this as a must-do when visiting Seoul. Heck, when we got there we just sat on a rock under shade for about 30 minutes pretending to soak in the serenity and beauty of the area, when in reality our foot was sore and probably blistering."
"Interesting, cultural",The background was really great for photos and it was interesting to see how the Koreans lived long time ago.
A Quick Visit to the Past in the Heart of Seoul.,"I walked to this village from Chungmuro Station. Seeing how much of a metropolis Seoul is, places like this will bring us to the past. The traditional architecture and art of Korea can be seen here, well preserved and maintained. It's right there, just amongst the tall buildings. Visitors can go for a walk around the village, learn hangeul, play traditional games and try on hanboks. At one of the houses there, traditional hanboks can be rented at less than KRW6000.00, a great bargain compared to other places I've read/found out that charges more. The lady who was in charge of the hanbok rental was very kind. Noticing that I came there as a solo visitor, she helped me took my photos like it was a photoshoot almost everywhere in the house :D The signage there had English translations. The village is a huge area, I wish I I had spent more time there. There's free public wifi in some areas in the village."
