review_title,review_body
Nice Bridge,"Stunning bridge. My Korean host picked me up from the airport and we drove over this amazing bridge. Just a pitty there was not a chance to stop and admire the bridge or take some photos. Travelling by car in Korea, I found as a very ""rushed"" affair, not many places to pull off the road and take pictures, or to relax, it is just very busy and you have to go fast, but the bit of the bridge that I noticed was very spectacular."
"Well designed bridge, great view of changing tides","Incheon is a city that has seen growth since ICN (Incheon intl airport) opened as the main gateway into Korea for international flights. This bridge shows the modern changes that have come with this change. This bridge is a pleasant drive and you can see the low and high tides very well, and all the ships docking at the busy port. A nice drive in from your flight from whichever country you might be flying in from."
Worth the price!!!,"When I first realized that the inchworm bridge costs 7,400won for a sedan I was thinking...NO WAY JOSE! I'd rather swim the 21 km to the airport. But as I was driving around finding a place to park. I thought. Yeah, sure I can swim, but then all my luggage would get wet. So, I swallowed my pride and paid for the bridge. It was great!! High above the water and great views to boot! It also only took 35 min from Olympic expressway! It would have taken me hours to swim across! Take the bridge...you'll thank me later"
Beautiful,"Makes the trip from the airport fast AND beautiful. This bridge is the longest in East Asia as of last year (I think they're building a longer one in China though). It is a beautiful piece of architecture, especially lit up at night, and features stunning views of the harbor."
What a Bridge,"Great drive and an amazing structure to say you have driven over, looks great day and night but best views are naturally doing the day"
the pride of incheon,Amazing structure and has to be the pride of Incheon. 21KM in length and over the sea. We stayed at Songdo area and the journey to the airport took less than 30 minutes which would have taken more than an hour through the city. The sight of the bridge at night is magnificent. Do visit the Bridge information centre for detailed explanation and pictures of the construction.
Lovely bridge,"I first saw the bridge from the plane, and when I drove on it, it was marvellous. The architecture is superb, soaring arches with the sea shimmering underneath. I did not see any place where i could stop and take photographs, this is my only cavil. "
It is a great bridge,You will see it on the way to the airport and is quite magnificent. Enjoy the view from the road all the way to Incheon.
Nothing impressive ,"It's just a bridge! Not high, not original from the side of design and architecture. Not impressive and picturesque (((( very utilitarian and non monumental. Rama 1 and 2 bridges in Bangkok are much more unique and breathtaking "
Nice view especially at night,"I go to this Incheon Bridge Observatory at Songdo, Incheon and I found this place is really interesting.At sunset, you can take a picture of beautiful sunset view and when the sky gets darker, you can take the pictures of beautiful and amazing Incheon Bridge. Unfortunately, it is quite hard to get the very good picture of Incheon Bridge since there are not too many lights and the distance between this observatory is quite far so Incheon Bridge will be seen really small in your camera lens. However, it is worth place to visit especially if you want to have a city escape or simply bring your pets to take a walk in this area is very recommended."
impressive long bridge,it is described as one of the longest in the world of its kind .... it is most of all useful cutting the trip from airport :) 
The best driving road,The best driving road. Sceneray is absolutely great. You can see peaceful views for sky and sea. Very good.
Artistic Engineering,"From every direction, this bridge is aesthetic and impressive. Seven miles long, with a suspension section and a long causeway. I'm just sorry that I used my smartphone camera instead of lugging out my DSLR to get better shopts of this wonder. "
Good bridge,Over the last few years I watched the construction of the bridge whilst on stopovers in Incheon and the last couple of times I stayed overnight at the hotel owned by Korean Air in the city and the bus used the bridge to and from the airport..Fine piece of engineering. I didn't know at first that we were on the bridge - it was so smooth.The bridge cut the travel time to the hotel from one hour to 30 minutes
Engineering Marvel,"Endless, thrilling to ride for about 15 miles connecting the Incheon airport to Incheon city. Can take great pictures if you sit by the window."
goes on forever,didnt think we would get off it as it went on for ages. gives you a good view of the city and the harbour while you are on it at least.
very long,it is 15 Km highway bridge. it's amazing.I drove a car. I expected trembling but not. 
Very Nice.,I enjoyed the view of the bridge both in the mornings and evenings while during night time it has the best view ever.
Engineering Feat,I little spoilt by the weather this impressive 22.4km span is an engineering marvel well worth seeing.
Impressive Engineering Feat.,Seems to go on forever. You see it as you land at ICN or drive on it if you are traveling by vehicle to/from Incheon city. Unfortunately there is no place to part and enjoy the view from the bridge.
Quite Stunning,You cross the bridge driving from the airport into Incheon. It is quite stunning. We were told it was one of the longest bridges in the World. It is actually the 7th longest cable - stayed bridge in the World and the longest in Korea. It just seems to go on and on. Unfortunately we only sped along it on the way to and from the airport and there was no opportunity to stop and gasp!
Long bridge,"Longest bridge and sea view.. I passed this bridge to reach the hill temple from airport.. It just a looongg bridge, it would be better if there's a stop for taking picture"
