review_title,review_body
fun-filled activity,"I really enjoyed this activity, a good way to break away from urban living and experience a different kind of activity. Each tunnel has different attractions that you can look forward too, everytime you pass the tunnel."
For a fun filled adventure ,"We visited Gangchon Rail Park as it was part of our tour package that we bought on Klook. Went by tour as we were unsure on how to get here by public transport as I googled it and it looked pretty complicated. Even though it was sunny when we went, it was still cold about 0 degrees, and even though you will be doing most of the cycling, please ensure that you are warm enough as it can be quite windy when you are cycling through the tunnels. 10/10 for the amazing views while cycling and would recommend renting the VR goggles for the last tunnel. After the ride, you will have to take a train back. The train is called a “Romantic Train” although nothing romantic about squeezing in the indoor train cabin. It was probably because it was too cold to be in the outdoor cabin. "
Funny experience!,"It’s far away from town, we joined a local tour that included the transportation. The scenery is spectacular all the way, even in tunnels , there’re decorations! "
Chasing the sunset with our rail bikes,Booked the last slot at 530pm which was great because we could catch the beautiful sunset as we cycled past the route. Passed through various music themed tunnels from classic to romantic to dance pop which livened up the 40 mins route before we took the mega red train back. Easy activity even for the not so fit as you don’t actually have to cycle a lot. There is a engine that helps to keep it moving most of the time. 
New experience out of seoul,Was part of nami island tour package. We took 2 seater and went in oct. Remember to wear thick jacket and go to the toilet before the ride as the weather is quite cold during late noon time. Will recommand this for couple and familyAnyone know what is the song name in the light tunnel?
Fun experience!,This place is part of the itinerary for our day tour after Nami Island. The ride was pretty easy as most of it was downhill. The scenery was beautiful and passed through themed tunnels.
Probably the highlight of my while Korean trip!,The ride was easy and the view was wonderful. Whole experience was awesome and really enjoyed the whole tour with my family
"Pretty view , amazing experience. ",Good weather in september 18th... we took 4 seater bike... pretty view .. you must try this... in finish line you can buy your photo including frame for 10.000 won... 
Very fun activity with friends,"It was a fun activity and a new experience to bike along an abandoned railway, such a good use. The bikes were comfortable and the views were stunning, and the tunnels were very nice to see as well. It was a bit of a workout especially on the uphill climbs but it was not too bad, very manageable. Recommended for group of friends and families but not if you’re traveling with little children or seniors, as you might have to pedal for them, and it was not a quick ride. "
"Fun, relaxing with a bit of exercise.","This place always gets crowded with visitors so it recommended to book ahead or be early in this attraction. We got this ride as a part of our tour package (on sale via airasia activities and Ktourstory).The Rail bike runs on an old rail tracks in the area. The seating capacity is 4 so if you are only 1 or 2, you may be sharing the ride to other guests.There is a photospot before the entrance to the tunnel, make sure you spot it and smile at the camera to be able to get a good souvenir picture at the end of the trail. Purchasing the souvenir picture is optional but the photo quality is good tho.The tunnels are decorated with bubbles, stars and lights for enjoyment.The whole area is so scenic with the river and the vegetation, it really does make you feel relaxing in a rural country side of Korea.And make sure you don't run too fast or too slow since there are other bikes ahead or following you.We just loved the place, even the small waterfalls at the resting area and the train ride going to the exit. Loved this trip.BTW, recommended for all ages."
Great family activity. Fun with great scenery and exercise to boot,"Gangchon rail park is basically riding 2 seater or 4 seater rail cars by pedal power along an approximately 20-minute ride along a scenic route along the upper tributary of the Han river.The route is nice and scenic, can be very peaceful.You also go through 3 tunnels which are specially setup with lights, music to add a little spice and interest along the way (with VR on the last tunnel)Kids loved the trip and lots of scenic countryside picture opportunities (you cannot get off the bike in the middle).The park runs in intervals so you book for a specific time and a whole bunch of (individual) cars run in that group, so you will likely have a car in front and behind you.There is also a picture taking near the start of the run which is similar to other theme park rides which takes a picture and at the end of the run, there is a stall which shows the picture and lets us purchase a copy in a frame (remember to smile)At the end of the run, there is another train which will take you to the final destination P.S. At the start of the rail park there is a mini Zip Line activity which is suitable for small kids, not too expensive (10,000 Won for 2 trips - there and back), something the kids loved too."
Great scenery but rather short,"We started early in the morning on a 4 seater. It was a good day out in the open, fresh air and great scenery. There where 5 tunnels each with its own theme. The last one was the one with the VR. The kids had the VR - think can do without. Mostly downslope but getting stuck behind slower carts is a bit of a pain. Found it too short. "
Fun Ride on old rail way tracks,"Before your ride, I recommend trying the restaurants just outside entrance of the rail park . They serve a very sumptuous chicken dish. We encountered a large crowd queuing at the entrance of the ride. But once we started we had a good time.It's a fun experience pedalling over old rail way lines. The ride brings you pass small farms with vegetable plots, the rail way lines follows the banks of a scenic river. There were 3 tunnels. Going into the tunnels were fun, it's like going into a disco with loud music, flashing lights and bubbles blowing at you. Generally it was a easy ride with down slopes and flat runs most of the way. "
Country Rail Park Fun,"Bicycle pedaled carts on rails?! Up to 4 people in a cart which is pedal-powered by its riders. Most of the trek was either down hill or level through the beautiful country-side. Pedal through 2 or 3 dark tunnels, each uniquely themed with lights or bubbles.Although, located 1 1/2 hours from Seoul, I’d recommend this activity. "
Rail bike experience,"Took a package to the Nami island and La Petite and came upon this rail biking exercise at Gangchon Rail park. It is a 8 km rail track where one needs to cycle on the rail where the whole duration takes about 1h 20 min. You will go through three tunnels, first tunnel is a happy tunnel with bubbles blowing at you, second tunnel with music and the third one is a VR where you need to purchase additional 3000 won to experience the effects. You get to see the beautiful scenery as you work hard on pedaling the bike. Just make sure not to drop your phone on the track though. It has been a fun activity."
Very Trippy,"Can’t believe that too many copies of this experience exist. You get a peddle car for 2 or for 4 and you set off as part of group of cars. Very peaceful along the farmland except for the rumbling of the cars on the rails. Going through the 3 tunnels along the way was very trippy, each with a theme. Our KKDay bus was waiting a the end for us."
Exercise and Relaxation,"A rail bike trail through a very scenic location with lots of greenery and fresh air. A very fun bonding experience with the missus. They have themed tunnels (bubble, starry, Techno) which I enjoyed although I did wonder about the ajusshi and ajummas in the car ahead of us when we entered the EDM tunnel lol. Overall very fun."
Fun adventure and great workout,"This is one of the highlights of our vacation. As a family we were able to bond due to the fact that we were able to paddle the bike as a family of four through beautiful terrains and entertaining tunnels (yes they have bubbles and music in the tunnels). Try to enjoy this ride on a sunny day and don’t forget to smile when the camera takes a picture of you. Stop by the souvenir shop for the printed picture and glass frame for 10000 won, and I guarantee it’s money well spent on a beautiful souvenir. Afterwards enjoy the ride on the romantic train, but it’s basically only a ride on a train that’s filled up with benches. Overall. it’s an amazing experience for the whole family"
Worth it To Try,"We enjoy beautiful scenery along the way. The journey take 40 minutes for ride, 20 minutes rest and 20 minutes by romantic train to ganchon old station. We love it. "
Must do,Pick the 4 seater so that you can take turns pedalling. The lines may be long but they move really fast so dont worry. Dont bring any bulky bags because there won't be any space for it. You can bring food and water. Your departure point is different from your arrival point so plan accordingly. Took the klook tour together with nami island and garden of morning calm.
Surprisingly Good,"We had a 4 seater and a 2 seater bike costing 56,000won after discount. I have to say the bike ride was very fun and enjoyable regardless of age from young to old. While we get to enjoy the scenic views along the track, there were also tunnels which we will ride through which really surprise us and made us look forward to seeing and experiencing what was inside the tunnel prior to every entrance. Greatly recommend to try."
Memorable experience along Bukhanggang river,Very fun and enjoyable rail bike experience. You get to enjoy nice breeze and scenic views of the river at your own pace.
Surprisingly Good,"This was my last stop for the day after visiting nami island and I’ve to say it was really an interesting one. Weather was great other then the occasional flies getting in the way, the view was surprisingly amazing. Really enjoyed the entire ride esp with the different themed tunnels that added that extra fun element. "
Great way to spend an hour or so.,A little expensive if you are alone as it costs 13000 per car.A two seater or a 4 seater which you pay more for.Peddling was easy as it was mostly downhill.Because so many people are on it you are constantly slowing down as you catch up with the person in front.You go through a few tunnels.some with music and lights.At the end you catch a train which takes you to a place where a shuttle bus takes you back to Gimyujeong Station where your car would be.All included in price.
Nice but not amazing,"Good queue system.Bikes were easy enough for use.Had a four seater bike.The tracks of 8km were not downhill all the way. I remembered paddling hard for half the time. This means sweating in 10 degree weather with my jacket unzipped.Scenery was nice. But simply not amazing. Nothing breathtaking. Nice means nice.. Amazing to me would be niagara falls. This? A local knoll with a local river. Normal. Nice. Nothing bad about it.3 tunnels had themes to them. Was cool. After returning your bike, wait for the shuttle train to fetch all customers to main road. Then need to walk again for about 10 mins to the shuttle bus back to start point.Would i do it again? No. Once is enough. Tks."
Bad time to visit,"Easy enough ride for people of any age or fitness level. Mostly downgrade. Tunnels were cute with bubbles and sparkling lights. Final tunnel was too loud with flashing lights but teenagers in front of us seemed to enjoy. First week in April, sunny but still too cold. No color on any of the trees, ground still brown. Better to come in the autumn I've heard. Return train was crowded. Get a spot on the right side of the train, better views of the river. "
"Gangchon Rail Park - Good bicycle ride, good exercise for the the family","Rent a bicycle built for two and embark on a ride that takes you through a series of unused railway track that offers breath taking views of the farms, lakes and mountains along the railway track."
Stunning view,One of my favourite part while travelling in South Korea is the rail bike. If you are the type of person who loves nature then this activity must be in your to do list in Korea. The view are beyond amazing! 
Wonderful Experience with Toddler!,"We were still apprehensive whether to ride the rail bike with a 16 month old toddler. But since we were at Nami Island (nearby), must as well! It turns out to be an awesome experience for a first timer like us! The tunnels were interesting, the autumn scenery breathtaking. It's also slow and safe enough for us to babywear or sit our toddler on our lap. For more words, photos and video about our experience, search keywords: ""joogostyle gangchon rail bike review"""
countryside,"other than the typical railway cycling where you will be able to witness the beauty of the countryside, there is also VR cycling which is different from most places."
Awesome adventure!,"We didn’t know what to expect. Thinking that we will be cycling normal bikes, we were pleasantly surprised that we will be actually cycling rail bikes on the rail tracks! Beautiful scenery along the tracks and the weather was cold. Thus, the activity warms our cold bodies. An activity not to be missed."
Kids had fun,"During spring time it must be beautiful scene, when we were there it was late autumn but it was enjoyable anyway. You can go there all year round but they will stop operating only during the rainy day.From Seoul city, it took about almost 2 hours (plus walking and get lost). Since the railway route was quite confused to us so we arrived there later than what we booked the time but it was fortunate there were not many people on that day so ticket officer still let us ride without purchasing new tickets.Most review recommended to purchase ticket in advance and I do agree. But if you would purchase in advance you need to arrive there 30mins before your booking time. What happened to us we just got lost and arrived there one hour delayed. VR can be rented at ticketing office and not via online, you will received VR at the last tunnel of the ride.It might not be worth for adult to play with it but for the kids they kind of enjoyed it.(Shooting monster)When the ride was done, we had to wait for about 20 mins to get a train (Romantic train route) and then take some walk to get on a bus back to Gangchon Rail Park. It was kind of one way ride.These were all included with the ticket fare.We were there when it was cold and blanket can be rented at ticketing office."
Fun Activity & Amazing Views,"This was the first time we were experiencing a Rail Bike in Korea. It lived up to the hype surrounding such an activity. We thoroughly enjoyed the about an hour-long experience. It was a bit short in my opinion just as i was thoroughly enjoying the biking, but nevertheless, the proximity to the hills, river and the countryside was overall the ideal experience to relax. Suggest to take the 10am slot so that it is not too cold or misty but there is a good dose of sunlight without being too hot. Also, if you are looking for a slow, relaxed biking, then opt for the last few cars so that you are not pressured to have to speed up. There were a fair bit of very gentle slopes along the journey, so I personally feel the ride is very bearable even for those who are not generally fit. That is of course, assuming you are going at a slow and comfortable speed without needing to cycle quickly all the time. We took our time to venture around the village at Gangchon, instead of opting to take the shuttle bus back to Gimyujeong station. There are several eating outlets and restaurants along the road leading to Gangchon train station. The walk from the shuttle bus pick up point to Gangchon train station takes about 15 minutes. From Gangchon, there is an option to visit the Gugok falls as well, reachable via bus 50 at the bus stop near the shuttle bus pick up point. (bus 50 comes only once an hour)"
interesting work out but poor scenery in late autumn,"It was rather expensive. we paid about $15 SGD for person. Come in early autumn for the fall foilage, or winter for snow scapes instead."
Awesome ,"Wanted to skip this attraction but lucky we decided to proceed. Advise to make a booking before going down as the rail ride has hourly time slot and crowd is there too. Total rail ride is about 30-40 mins which brings us to another location wherewe will be transferred to a train which takes about 20-30 mins. From there, we can either walk to Gangchon station(one station away from the original station of the railpark) or take the free shuttle bus back to the railpark entrance. The whole rail and train ride is Super scenic and beautiful. Seeing mountains with beautiful autumn leaves and along a Long stream. They named it romantic Chuncheon and is definitely renowned for that. Will strongly recommend visiting this attraction. Needs to allocate at least 2 hours for this activity. "
Worthwhile attraction,The Ganchon rail park is an old train track that was converted to a rail park. The attraction for this park is that you pedal your way in a track inside a small bike train car. You can do the bike train for 4 people or 2 people. The route has great and stunning views of the river and mountain side. We had fun pedaling our way to the other side of the track which passes thru tunnels that have different themes. The stunning views of the route make this attraction worthwhile.
First Time Riding a Rail Bike,"One of the attractions included in a 1-day local tour trip. Fun experience in riding a 4-person rail bike passing through several tunnels. Bad experience was the front bike stopped for taking pictures (found out later that they were local Korean women) and created a rail jam, all bikes packed together. It started to rain heavily half way on the bike however thanks to the local tour company as they provided raincoats for all of their customers."
Book Earlier Times!,"I joined a tour to visit this rail park, during Korean Thanksgiving. Everywhere was packed with people and the traffic was very congested! So once we arrived and wait till our turn for the rail bike, the sun is gone.To be honest, the view was great, and is a nice experience. But without the sun, everything seemed a bit dull and temperature a bit cool, and the destination felt a bit far.Tho i would still recommend to have a try!"
Book ahead!,"Just thought I would leave a review here. We went on the way back from Nami as a sudden decision. It looks fun, but we couldn't go on as it was booked out. If you want to go, would be wise to book ahead so you don't miss out "
Great view and a great experience,"If you ever wanted to ride a ""bicycle"" on a railroad, this place is for you. Visitors are able to ""cycle"" on a modified bike along what used to be a railroad across themed tunnels and fields of scenery. While the ride got tiring at times, I enjoyed this place as the views were absolutely amazing and the place also put together some quirky tunnels that we had to cycle through. Quite an interesting experience.Would recommend visiting this place as part of the tour, as getting here from Seoul alone is not easy."
A Great diversion for a few hours with great views!,"This is a pedal bike on a railway where you can choose either a 2 seater or a 4 seater. The 2 seater is more expensive. The entire experience takes about 1.5-2hrs, depending on how fast you cycle. After you complete the 6km ride, a train will take you back to the beginning at Gangchon station. I am very tall and could not pedal. Therefore, the other 3 riders made up for my slack. If you do choose to come here, try to do so when there is an overcast - unless you are looking to get a tan. It's very hot during the summer and there's very little protection from the sun. The best part of this ride are the majestic views of the Korean countryside. There are some tunnels with light and sound shows, but they only act as segways to the next landscape scenes."
Exciting Riding With Nice Scene,We do take the 2 seater instead of 4 seater eventhought the price is higher. But we do enjoy much with the beautiful scene and cold weather during the riding. This is really fun and exciting.
Interesting ride,"This ride is an hour away from Seoul. There’s options of 2 and 4 seater bike. Booking can be made online. It seems fully book when I arrived as all the seats were taken up. The ride bring you through a couple of tunnels and some greenery views. Interesting ride, we took it as it’s was on the way while we are travelling to another part of Seoul. Probably won’t recommend if to make a special trip down just for the ride "
Very nice railbike experience ,"My kids loved it so much! It was so fun for them to do railbike, they enjoyed the journey! beyond our expectations ❤️ "
Fun and entertaining ,"Gangchon is a beautiful place to visit and to experience the rail bike ride and train ride.We drove in from chuncheon city area and arrived at the park in 15 mins. It was an easy drive and there was a carpark right infront of the gimyujeong station. Parking is free. Pls book your tickets in advance online via various sources like klook or kkday. There will be different time options for you to select. The entire experience took about 1.5-2hrs, depending on how fast you cycle. After a 6km ride, a train will take you to Gangchon station. Thereafter, you will have to walk about 500m to where the shuttle bus awaits to bring you back to the starting point, or you may opt to stay in gangchon or go on as per your itinerary. We took a 4 person rail bike and my 5 yr old daughter enjoyed it the most as she did not need to peddle at all, the parents did the job! The railbike will enter a few tunnels along the route, 1 is a bubble tunnel where bubbles would be floating about as you ride through it. My daughter loved that tunnel! At 1 point, they would take a foto of you and you may purchase this foto when u complete the ride at the foto booth for 10,000won.We had an amazing time at Gangchon railbike and would love to visit again in winter sometime in the near future for a different view and experience!"
railbike in korea,"very good entertainment, railbike from one point to another point, then go with the big train to other point then can walk a little bit in this area, there is a big bus very many buses to go back to trainstation of the beginning point, is all incl the price of the railbike. please when buy railbike mention to buy the AR view, is very fun dont mind what time as all is full but 1730 is ok take that one, then just stand in quee, as you are at 1200. waiting list. "
Fun experience,"Did not expect much when coming to this rail park but indeed enjoyed it! Scenery was great, streams, paddy fields and mountains. The place is slightly off city centre but I got a tour there so it was easy for us to get there. Sad that the paddling part was relatively short - roughly 30-45mins for 6+km. The other downside is when there are bikes too close to you and you have to keep a lookout to prevent accidents but such things can’t really be avoided. Depends on how crowded it is on that day as well.Should try at least once if you are travelling to Seoul."
Cool,"The view was fantastic. It’s fun actually except that it’s a bit tiring. The tunnels surprised us with music, bubbles, light, etc. It’s cool and entertaining for adults and kids. "
Not in Seoul!,"Please be aware that even though the Gangchon Rail Park is described as being in Seoul, it is realistically at least 2 hours from Seoul by any means of transport!"
Too hot for summer,"Despite having booked the slot at 12pm. We had to stand in the sun till 12.20pm before we finally get up the bikes, with the person in charge speaking in korean for the past 20 mins and I had no idea if i was in the right queue. The cycling portion was quite interesting since it's my first rail bike experience. However, the view was pretty normal. Maybe going in autumn or spring will be better?After around 30 mins of cycling, we had to get off our bikes and wait till the last bike to arrive before we had the romantic train ride. Again, the view was pretty boring on the romantic train ride.We had 2 choices after the train ride. Either we can walk for 1.3km to gangchon station. Or walk for 10 mins and there is a free shuttle bus back to Gimyucheong station. We chose the shorter route which is to take shuttle bus. 10 mins walk under the hot sun and when we arrived at the shuttle bus the driver was not there and another 10 mins under the sun before the driver finally came and opened the door. Recommend people who are interested, to come on a cooler season or a more interesting season. If not, do prepare yourself for the sun and very normal green views. "
