review_title,review_body
One of the most interesting and fun exp for allfye,"Total tour duration about 1.5hours. Suitable for everyone regardless of age. Didn’t had to paddle much as it was mostly downslope. The ride was fun and interesting. Beautiful scenery and interest tunnel with specialised theme. Bring a wide angle camera to capture all your picture!Paddle for 20mins and there’s a pit stop for you to buy photo and snacks. End of rail bike. After break, board a bigger train to the end stop with rest of the people who started at the same timing as you. Everything is in Korean and no English, we had no idea what we were waiting for untill the bigger train arrive. There was nowhere to go at the the pit stop, no toilet as well. Minus the no English translation, everything was fun!! Highly recommended "
Railway below the mountain,"Rain didnt stop us in trying this activity. The store sells rain coat and even shoe cover to prevent us from getting wet. You will pass by tunnels with different teams. You can see the mountain, fields and rivers along the way. I would like to come back here during autum or cherry blossom to enjoy the view"
Better to visit in Spring or Autumn,"Was there with my 2 teenage girls in early April and the ride was good. However, I believe that the scenery would be much nicer if it's spring (later part) or autumn. The trees were still bare and no flowers when we were there but the view of mountains was good. Have to book the timeslot earlier (through online), otherwise you might have to wait for 2 hours for your turn (tour groups comes in batches)"
Unique activity,At first I was hesitant on taking this activity as it seems boring but I was wrong. My wife and I really enjoyed this. We get to see the suburb places in Korea. Although you need to have energy to do this activity. You will be pedaling until the pitstop to complete this activity. I suggest to be in active wear when doing this activity. Must try!
Change of date ,I have made a booking but the system showed a different date during the booking process . I have been trying to contact the trip advisor but can’t get thru the line and there is no email that I can send my request . 
Not in Winter,"We came here with the tour from Seoul. Definitely did not expect the temperature here is so much colder than Seoul. The Bike ride should be very fun and scenery. Unfortunate, the temperature was just too cold for us to enjoy. We wanted to ride faster so we can finish our trip earlier; but as we moved faster, so do the cold wind on our bodies........... Not coming back no more."
Nuce but tiring,Scenery along the rail was nice but I find the VR inside the tunnels to be too artificial. The entire was also slightly tiring especially for elderly people and young kids.
Great!,"Fun afternoon at the gangchon rail park taking you through all the scenic routes by a now disused railway, me and my partner got a couples carriage and you have to pedal your way around, great fun and great views definitely recommend if you have a couple of hours to kill!"
"It's fun, but it's way to cold at this time of the year","The rail bike is fun. Basically you'll bike for 6 km (mostly downhill) and then you'll take a train to the old Gangchon station. There's a shuttle bus to take you back to the starting point at Gimjujeong station. They decorated the tunnels with lights and the sound effects are also cool. The scenery is quite beautiful along the way too. On the down side, it's way too cold to do it in late January (it was -28 degree Celsius that day with windchill factor) and I could barely feel my toes and fingers. The small train was not heated (kinda a norm in Korea -- most subway stations and train stations are not heated either) and the bitter coldness took away the fun partly. Besides, it's about 2 hours away from Seoul. It makes more sense to do it as a bundle with Nami Island, Petit France, and Garden of Morning calmness. As we've been to those places already, we came just for the rail bike and had spicy chicken lunch in Chuncheon. I think it's not that worthwhile on its own."
Rail Biking! Nice new experience.,"We tried the Gangchon Rail Park, and took the Rail Bike. It was freezing, as heavy snow wad falling, but it was exciting and a new experience for us. We would try this again, if we ever get back to Seoul."
Totally excellent experience!,"This is a unique and excellent experience in the South Korean countryside. I visited in winter (January) and the area had a light amount of snow around.Most of the rail bike journey is downhill, therefore, you don't actually have to pedal much.I want to do this again in the summer months."
"Great, fun, special unique for a family","Depends on the number, you can get 2 or 4 seats car. Staff will help you to take photo. Honestly, they are the friendliest staff you will meet in Korea. A couple of minutes are enough to judge. At the beginning it is a downwards slope, so a little cycle is required. You will pass through short tunnels and river on your right. You will enjoy the scenery. Balance your energy and keep something till the end. One rider front and back should be ok and can swap. After all cars reach the end line, a train will escort all to near by station, so finish line is not the same as end line. Ride start each hour, first come first serve."
A different experience during winter,The rail bike is an excellent different activity. It is cold during winter so must peddle so that we dont feel cold. Scenery was beautiful during dec. Be armed with heat packs. 
Fun Ride,"It was -9c when we did our rail bike activity but it didn’t stop us, not that we can stop also after you have started biking. ;-) The route brings you to the pretty sceneries of river with mountains as their backdrop. A relaxing ride, don’t need to feel in a hurry, and the paddling is a great exercise/movement while being blasted with cold winds constantly. Go on with full winter gear when you are there during winter. The mid stop gives you a chance to rest your legs and buy some hot food n drinks while waiting for the train to return to the final stop. "
Fun and interesting activity to do along with Nami Island visit,"Fun to ride the rail bike and get to see the scenic views of the countryside. It was a leisure self peddle ride and we did not find it to be tiring.The activity had a 40mins self peddle ride before stopping for a brief stop and transferring to a 15mins train ride. At the end of the ride, a short walk to the shuttle bus to take us back to the entrance. Total time 1.5 hours.Probably the only cons is to have to wait for slow 'riders' who clog up the track in front of you :)Overall, we would recommend this activity as part of the day visit to Nami island.To get to this place, you will need to take the ITX-Cheongchun express train to gapyeong station and transfer over to the normal train on the opposite platform. Do remember to tap your Tmoney card on the transfer machine. Stop at Gimyujeong statntion."
Fun but chilly,Biking is about tedious for people with long legs. Scenery during ride is enjoyable but do put on full winter gear (including mask & beanie) as it gets really chilly. Unique and fun experience that everyone should try out
Tiring but awesome..,Great place to go if you have a young children..great experience for my family as we cycle using the rail bike and enjoy the scenery..
"Fun two hours, but could be run better",The 45 minute ride can be pretty fun...they did a good job of using a defunct rail line...some of the tunnels have some cool lighting and even offer a virtual reality goggle section for an extra 1000 won...the problem is there is only one rail line...and all it takes is one group to hold up the line by taking selfies or just not pedaling at a decent pace...the bikes need to be spaced out better...or separate by slow/fast riders...
heavy snow and rain,"I booked the tour to nami island + petite france+ gangchon rail park through KLOOK .While nami island and petite france were great this was the worst experience we had at our holiday in korea.The railbike was our last destination of the tour so it was arnd 4pm when we boarded the railbike . It was already raining heavily when we boarded the railbike but the rain got worse 5min thru the ride and it started snowing heavily.since u need to stretch out ur legs to pedal and the shelter doesnt cover ur legs if u seat at the front. Me and my daughter had to endure the heavy snow with our two layers of pants,shoes and socks soaking wet when we finished the ride while my father and brother who sat behind werent as wet tho still to the extent of getting their pants soaked. we were just too cold and uncomfortable to enjoy the beautiful scenery creating a terrible experience for us. people frm our tour also had their clothes and shoes soaking wet when they finished the ride . We then had to endure 50 minutes of the train ride which nobody cld not enjoy at all with such soaked clothes when evrybody was just too cold .since the ride is q far frm the city at seoul we still had to endure 2 hours of bus ride back to seoul.Therefore i strongly recommend u check the weather forecast before u go to the railbike ride as u will not enjoy it at all in case of bad weather. Especially during winter, I strongly recommend for children to sit at the back in case of bad weather. While i didnt have a good experience there i wld try and go back tho no during winter and strongly recommend u not to go there during winter if theres bad weather."
The Fun ride ever for with kids. ,"Arrive at Gimyujeong Station, walking distance to the entrance at rail park. The day we when was raining. It was unexpected. Just prepare urself a poncho. U can bought it at a nearby shop in the area. The mnth we get to used VR for uder tunnel ride. So much fun especially for kids.the ride is cool enuf.Theres 10-15mins interval break and change for a train inside of ride. *for muslim, pls note that there is no halal food out there. Just bring light snack for ur lil ones like i did. HeheAfter finish ride, proceed and follow the crowd to get a free shuttle bus back to gimyujeong station. Basically aftr ride, just go to straight and turn left side and straight till u saw gs25 n turn left and turn right after u saw few busses. "
A new try. Fun but crowded,"A new try for us. We were unluckly that there's lots of people playing railbike that day causing a traffic jam, otherwise it would be fun."
Views and Tunnels were AMAZING!,"I didn't know too much of what to expect, but my experience was very pleasant! It was very easy pedaling through as there is a lot of momentum throughout the trail. the views that you ride through are amazing and breathtaking as well as being a breath of fresh air from the bustling city. The tunnels that you go through are so fun and at times i wished we went through more! Only downside to it is that at times there could be alot of slow traffic since if one group decides to slow down it affects everyone! the second half of the experience you ride a old steam train which was very pleasant also!"
Pedal to the End,"The concept is pretty neat and fun to ride in a cart and peddling with friends or family. It was a good distraction to the usual tourist offerings but after a while, I simply wanted to reach the end and get off. If you can, do not engage during the hot humid summer months. It is no fun. The 6.5 km peddling did not offer much of nice sceneries and the tunnels were the only reprieve from the hot weather."
Fun rides with family,I booked gangchon railbike via funtastickorea and incorporated in the last leg of my private van hire day trip.It is a 30min drive from nami island. I booked 5pm bike but the sun was still scorching hot. My young kids could not reach the paddle but they have fun on the railbike.The ride starts from Gimyoujeong station. The mixture of beautiful scenery and themed tunnels made the whole ride enjoyable though the 50min ride was quite tiring when on upslope. We were given 3free VR spects for trial in one of the tunnels. But we couldnt really figure out how to shoot the monsters by pressing the side buttons.There's a 15 to 20min break at the rest stop where you can grab a snack. The final part is the 15 to 20min romantic train ride ending at gangchon station. My whole family enjoyed the railbike package very much.
HIGHLY RECOMMEND!!,"If there were 10 stars I would give 10. Despite the long traveling time, my friend and I decided to try rail biking at Gangchon rail park. After exiting at Gimyoujeong station exit 1, turn right, and the rail park sign should be visible. We went on a Tuesday, so the crowd was not that bad. Even though we reached at 4pm, we managed to book 2-person rail bike for 6pm. The trail was relatively easy to bike through, as it involved quite a number of downward slopes. There were also interesting tunnels the rail bike passed through; my favorite being the 'happy bubble tunnel'. The view was SPECTACULAR even during summer! We passed by many fields and streams, and it was not as hot as expected, as there was wind while cycling. My friend and I were surprised when the trail ended, as it seemed far too fast. The timing was great as it was less sunny, and we managed to catch glimpses of the sunset nearing the end of the rail biking.Overall, a great experience! Highly recommended if you can afford the traveling time :) would definitely go again!"
Very interesting experience,I went there in April this year with good weather. It is not hard to finish the whole trip but it is quitter far away from the down town. The view is so nice and my friends also enjoyed playing there!!! will go there again with other people.
Summer @Gangchon Rail Park,"Was there in end Jun. We booked the 1st timing at 9am on a Monday. Hoping to avoid the crowd and also, not too hot for the rail bike and more time for other sight-seeing places. We took train from Myeongdong at about 6am and reached Gimyujeong stn at about 8.15am after few changing/transferring trains. Not that difficult to travel on your own actually. Rail Park was just few minutes walk from Gimyujeong stn. Ride was not tedious at all, after 50mins, there was a rest stop followed by a romantic train ride and free shuttle bus back to the stn. Fun and nice experience. But not much scenary actually."
Lots of fun,"When you go to Nami,don't miss Gangchon rail park..At first i can't imagine how to ride in the same time with others..maybe with 50 people..but when i saw so many railbikes there..it was so exciting.We move together and rode the bike..especially when moved so fast and saw beautiful sceneries and also tunnels.really fun!"
Very fun activity! So worth it!,"We booked this activity as part of our anniversary trip and it was one of the hightlights our trips! Unbelievably, we had so much fun. We had so much laughter with all the thrills and fun we had. I surely clocked a lot of my ""steps"" in my activity tracker. Highly recommended activity not only for couples, or family but a great bonding for friends too! "
Fun day trip from Seoul,"Went to the Gangchon Rail Park with my wife and 2 boys. We booked as part of a one-day tour out of Seoul that also included Nami Island. For us, the Rail Bike experience was great. The staff knows enough English to help you understand the basics of operating the four-seater bike we used. The rail bike uses tracks that are no longer used by proper trains and it goes on a gradually downward slope for a great part of the course. There are a couple of flat stretches where you have to pedal, but it doesn't require a lot of effort. The tracks go through rice paddies and along a river and through a couple of tunnels, some which are themed (bubbles, star lights, and a war/fire mildly scary for smaller children). It is a great getaway from the frenzy of Seoul, although the KPop played at the station at the start of the course is a bit off-putting. The views, especially those overlooking the river are great. The tunnels provide cool relief if you are doing the course in warm weather. If in Seoul with family, I highly recommend this day trip activity."
Interesting rail bike ride,"We went together as 3 families with young children. According to my husband, the rail bike ride is the best attraction for the entire korea trip. The railbike is an interesting concept. Though it was an 1.5 hr attraction, we cannot feel really feel that 1.5hr has passed. In fact, time passes very quickly. There are 3 tunnels along the way which make the ride even more interesting. All adults and children enjoyed the ride except that we dont understand why we need to take the train back, it will be good if we can take the rail bike back. Nice scenery and great attraction! "
Remarkable,"Rail bike is an interesting and unique, a must-try activity for all visitors. While pedalling the bike on a discontinued railroad tracks, we enjoyed the beautiful scenery of Bukhangang River area. The track is long enough to enjoy the views but not too long to make the ride too tiring. We passed by a few tunnels, made interesting by music, lights and even bubbles.The bikes can accommodate up to 4 pax. The ride starts from Gimyujeong Station and ends in intermediate station. From there, the journey continues by taking a train to Gangchon Station.Two thumbs up!"
Fun! Favourite activity in Seoul,"Love this ride, it's fun with good view along the rail. Every tunnel will give you a little surprise. You do not have to ride your way back~ there is a train ride back to a designated pick up point. Something interesting other than shopping and food hunting in Seoul. "
Rail biking in korea!,"We went in March it was a little cold as the start but once we were moving was fine. It was a beautiful and unique way to see the countryside. The park was right in front of the station , we booked online and it was as easy as that. It only takes up 2 hours so afterwards we zip-lines across to Nami Island and spent the rest of our day there."
Amazing views!,I took the 1 and a half hour rail bike tunnel route and it was amazing! The countryside view was very beautiful. I also went through a few tunnels during the route and each of the tunnels had a different theme and was well decorated. Would definitely recommend this to anyone. 
Fun!,Had no choice because the family already booked this in advance. It was fun until we had to follow an old couple which could not catch up with the rest of the group. Over-all it was ok.
Definitely a must-try activity,"Our family enjoyed this activity when we were in SK. We enjoyed not just the experience of rail-biking, but also the beautiful sceneries of the countryside. The best part for my kids are passing through the different tunnels that have different setups - bubble, lights, and especially the VR tunnel, which my son absolutely loved."
Fun activities,"visit this place with booking one day tour location is nearby to nami island around 20 minutes by cari went to this place with tour because i want to visit 4 places nami island, petite france, rail park and garden of morning calm which location os nearby and dont want to waste my time waiting for local bus and trainbike are so fun if u visit with family and friendsu can enjoy farm view while u are bikingu also will enter a few tunnel with music and lights insidethey have stop area for resting and u will transfer to train and no more bikingstart area and finish area is different placeso if are coming with no tour you need to follow the sign on finish area for taking shuttle bus to start areabiking in spring, wind was cold so u can use mask to cover your nose but overall it's not tired activities it was so fun and my family love it"
OB & YB competition. ,"Our family enjoyed a lot this place. It was a very unique and unforgettable experience. They built on the site where the train on the Gyeongchun Line stops, Gangchon Rail Park is a popular tourist attraction where visitors can pedal along old railroad tracks while taking in the lovely Bukhangang River scenery. We competed and the OB team won the game and the lunch as the prize!"
Cool Thing Must Do in Seoul,"Ganchon rail bike suitable for those who like outdoor activity while see the beautiful scenery of the Ganchon. The riding experience was fun and not strenuous at all and we enjoyed it. It was as we had expected. There were 3 tunnels along the way that were decorated with loads of lights and music. Everyone of us have a great time cycling along the rail. Overall experience is very good.Actually, the rail was all flat or downhill for about 50 minutes then take train to the destination. Finally, we take shuttle bus back to Gimyujeong station."
Great experience ,Went to the park in early Mar'17. Booked the tickets via klook as the official website is in Korean language only. It's easy to cycle and great way to enjoy the nature. There's a rest stop before you transfer onto the 'romantic train' where you will enjoy the rest of the park with the driven train. Shuttle bus provided at the ending point to bring you back to the start point where kimyoujeong station is. There's also a dal komm coffee next to the park. 
Railbike for 80 minutes for 10 KM,"Start at Kim Yujeong station( named after a korean poet) Worried if it was too strenous having to pedal constantly for 80 minutes. Actually, the rail was all flat or downhill for 40 minutes then. take train to the destination. you can take shuttle back to Kimyujeong station. or go from gangchon station to next destination."
Great experience,It was a good experience. U will love the 30 minutes cycling on the rail bike. I went during winter so I could still see snow. The view around was really breathtaking. U can book this through KLOOK apps and it's easy to use and book.
Lots of fun,I like my trains and what a great use of some old track. We could do with a few of these in the UK. The rail park is well organised with cars? Bikes? Trolleys? for 2 or 4 people. They are well maintained and not hard to peddle. A lot of the route has a gentle decline so you don't even have to peddle much of the distance. There are set departure times so bikes leave en masse. For good reason because after a few km there is a picnic spot and then a train journey to the far end of the track where coaches return you to the start. The route follows a pretty river valley and passes some mountain hillsides and smallholding farms. Works well for all ages and easily accessible by train from Chuncheon. 
Boring place,Its my first time to take a rail bike .... i have no idea why its popular.. Cant believe that i heard Gangnam style again here.... every each tunnel they turned on some old song.. well of course it depends on person but fot me... this is waste of time and money. Kimyoojung station is beautiful tho
LOVE IT! tiring but spectacular view,"Can easily get package of Nami Island + Rail Bike + Petite France from Funko or Trazy which include transport that transfer us to these places, pick us up from and to our accommodation area and entrance fee. Started off with safety guidelines by the safety officer to a big group of us riding at that timeslot. No regrets. Love the experience or rail biking. Distance is quite long though. Can be tiring. We rode in a group of 3. One of us must keep paddling or the bike will stop and that will cause hogging on the track. Although, we started off with a cold day, I can guarantee you that you will be taking off your jacket by the end of the ride due to perspire. The surrounding view is just spectacular. Went through several tunnels with music and lights inside.At the end of the ride, we will have to transfer to a train that brought us back to our coach. The view thereon is even much scenic.. Overall, it was tiring but worth it. LOve Love...."
Unique way to experience scenery,"This place is located in Chuncheon, so it take about 2 hours to reach here from Seoul. Upon reaching the station, the entry sign is large and obvious so you cannot miss it.It's not actually really tough to cycle the rail bike, but do not believe that it will move by itself as mentioned by some others! The bike eventually came to a stop if no one is cycling, except when on downhill of course~ Slowly take your time and cycle and you will find that it is very enjoyable, like a mini workout with great scenery and ""oppa gangnam style!!"" (try it and you will know what i meant!)"
New Exciting Attraction,"This place located around 1 hour train ride from Seoul. A little bit tricky when you have to change train from one to another, but we manage to arrive without a problem thanks to the informations from internet :). Located just beside Gimyujeong Station, the entrance already make us amaze. Even though it was freezing at that time, we had a very great experience. Fully recommended, for couple or family."
Lots more fun than expected even on a freezing day,"Some part of the route is scenic. it doesn't required a lot of physical strength. I can imagine that it can be a romantic ride for young couple. There is photo spot that takes photo automatically and you can buy it at 10,000won. After the rail bike ride there's a concession stop and a few souvenir stops while waiting for the train to arrive. "
Unique attraction which you have to try if you visit Korea,"Visited this attraction as part of a tour package. Its about half hour drive away from Nami island.Besides the railway, there was a cosy cafe nearby.The whole ride was approx. 8 to 10km long and took around 1 hour return trip.It was very scenic and went over a wide river too.After one half of the journey, there was a turntable to swing us back the opposite direction.We rode this on 23-Dec so it was right smack during winter and the temperature that day was 0 degs celcius so it was really cold, windy and snowing lightly. Not recommended to ride in such weather.However, it was a very unique experience which I recommend to try when visiting Korea."
