review_title,review_body
Beautiful,"It is beautiful, and with this ticket you can also see the garden in the same day, I would recommend going at sunset, but make sure you leave atleast 40 ish minutes to get all the way to the top or you'll have to be rushing if you want to get to the top to watch."
Stunning,"Make sure the sky is clear when you head to Suncheon Bay. Try to be at the ticket counter about 1-2 hours before sunset, then you'll get a view that you don't forget so fast!!"
Beautiful colors and nice park stroll,"We spent about 1-2 hours walking in this nice park, with beautiful flowers and nicely sewn grass, apart from the city noise.It is advisable if you have a free afternoon and wish a quite place "
Superb great scenery on the hilltop,"At first, I thought that Suncheon Bay Eco park is a wetland with just reeds, crabs and mud skippers. We walked the long boardwalk and managed to walk till the end of the steeply hilltop and we realized that the scenery from the hilltop is omg spectacular! Worth visiting!"
Surprisingly good,"We visited in May 2014 to do the ""sunset walk"". This was further (and steeper) than I expected. The walk accross the boardwalks to the start of the hill was lovely and the climb to the the observation point through the woods, with the smell of wild jasmine, was much better than I had expected. Although the first part of the park was a bit ""contrived"" with the planetarium and cafe and manicured gardens, the rest of the park is wild and beautiful."
Check if it's open first,"Apparently, this place closes when there are Avian Flu scares in order to protect the birds. We arrived a little after it had reopened, but even then, there had been measures put in place to protect the birds: one, you go through a purple xray looking machine to disinfect you; two, the boat tours were out of commission. So, if you don't want disappointment at the door, do call ahead and make sure it's open. Their website might not have anything up about the park being closed.If it is open, you're allowed in up until one hour before sunset or so, which mind you, is not exactly enough time to get from the entrance to the top of the mountain for the famous ""sunset"" view, which is quite pretty. We arrived at four pm and leisurely walked through the reeds and up the mountain to the main observation deck (note that there are a couple of observation decks..., you'll know you hit the main one when the road ends). The observation deck has three levels, but it fills up with tons of people with big cameras. From above, you can see the birds lining the waters. There are tons of them. Once the sun sets, most people leave, though no one will kick you out. People just seem to want to get out before the park gets dark (there are zero lights). As slower walkers, we ended up using moonlight on our way out. Overall, a nice experience. The boat tour might have been nice too, but then, you never know what you're carrying on your clothes or what not."
Splendid and serene,"It was a regret that I couldn't spend more time there. The huge reeds field and the bay, I felt very tranquil taking a stroll in the park. I would love to visit it again during the autumn season, where it will be filled with exotic colours of flora."
"Suncheon Bay, green, green reeds in September","A coastal wetland more beautiful in April/May I was told because of the colours. At only ~2 USD (2,000KRW) too, though access is not too convenient from Yeosu town. I took a bus then a taxi there because the connecting bus was just hourly. The reeds are taller than the average person though you cannot stand inside it as I had imagined when viewing the internet photos. Not that I was trying to hide from the police or something. A breathtaking view to me, nonetheless. Don’t forget to observe the various mudflats inhabitants that could just escape your sight if you pass by too quickly, not to be missed by nature-loving persons. I walked maybe more than 2 kilometers to a hill within the wetlands to have a spectacular view of the mudflats and loose some fat on the go. Worth it. On the way up the hill one can see the green padi fields far reaching to a small mountain range. There was also a boat ride along the meandering stream through the wetland but I didn’t try that. Yes, I would not mind coming again in April/May to enjoy the brown, brown, reeds of Suncheon Bay."
Suncheon Flower Festival,"If you love touring botanical gardens, waterfalls, and garden features while seeing hundreds of varieties of trees, flowers, flora, and fauna then this is a site NOT to be missed! Bring a Korean-style picnic lunch or snacks though as the on-site restaurant was pricey and left much to be desired."
A Beautiful Display of Nature,"It was a blasting experience of scenery. From the moment I walked into the main wetland area, I was greeted with a vast area of reeds which swayed and rustled. There wasn't a crowd when I visited the place and hence could experience the full power of the serenity of the place. Behind these reeds were mountains added with a very blue sky and pretty clouds. It was therapeutic. Looking down from the sides of the board walk, there were many crabs scuttling around minding their own business. Occasionally on wetter patches of the mud, I saw mud skippers. Following the board walk, it led me to the path up a hill to Yongsan observatory It was quite a long hike but it was very worth it. The view which greeted me was too satisfying. I would recommend taking the hike an hour before sunset and do make sure the weather is not very cloudy (else it is likely that the sun would be covered by clouds). Do go there if you are a nature lover."
No place like this in the world,"Suncheon is an extremely beautiful and serene place of South Korea. We arrived there by KTX, grabbed a taxi driver to take us several places for 8 hour shift day $150 flat rate. This park was the second stop after temple visit. There is a train ride inside the park with a small fee that will take you around. I thoroughly enjoyed relaxing coffee time in the Cafe. It is a romantic place to visit with a lover....indeed, I have a fond memories of this place. We spent about two and half here before we headed to old traditional village which was located not too far from here. Scenery of late Autmn was absolutely breathtakingly beautiful. A MUST place to visit while in Korea. The World flower festival park was also worth visiting if you are serious macro photographer. You can easily spend a whole day here.... I shall return in Spring time of 2014. By Sunny.Kim65"
Suncheon bay is great but...,"Last time I went there, the ecogeo Expo has begun and it kinda ruins the serenity another reviewer mentioned. Go there after the expo ends. There are too many people that you have to stay in a queue to look around. "
Serene!,"I expected that Suncheon Bay would ""wow"" me and I wasn't disappointed. The view from the hilltop is magnificent! My son enjoyed the short train ride to the Literature Center. I enjoyed my walk on the boardwalk. On the day we were there, the tour guide said 100,000 visitors came on the previous day. Wow!"
Quiet unexpected....,"the whole of the Suncheon Bay area is a designated Eco park and there is a lot to see. Take in the Bay, walk across the boardwalks through reeds, up the mountain for the view and watch the hooded cranes. Also go to the Wetlands park with its newly created gardens and traditional buildings and just absorb the experience. The 6 month long International Garden Expo is located next door where you can explore many gardens from across the world. This is relatively new so these show gardens and their installation are still rather hit and miss - its certainly not Chelsea Flower Show or Chaumont, but give it time, in a few years' time it will be quite something else. I hate crowds so make sure you are out early if you want to miss the masses of visitors that will invade these Eco parks."
Where you can enjoy the panoramic natural.. Very good.,"CYC ( 2013.4.19 ) There was a great place to walk and enjoy nature. This place consist of tidal flats, reed, small river and sea. view of things consisted was complete harmony of nature, I think. This place was massive, so if you enjoy this place, you need to walk and hiking about 4 km in round-trip. About 1km walk through a forest of reeds, and should be approximately 1km hiking. If you enjoy this place, go until observatory. I would like to recommend here."
An easy way to experience the beauty of tidal flats,"Although much different than the mangrove swamp and tidal lands of the Sunderbans in West Bengal, India, the tidal flats of Suncheon Bay are very accessible to the public. Its extensive system of well-built boardwalks makes it easy for all to get right up close to the different sections of the flats. Excellent documentaries in the experience buildings showed how beautiful and diverse the area is during the seasons, thus making it a great place to revisit. The upper floor of the observatory building has some free high-powered viewers which allow visitors to see birds farther away, or just to enjoy during inclement weather."
Excellent hiking site,"Trails up the mountain, gift shop had lots of interesting items. Beautiful natural setting with changing landscapes according to the seasons. Very unique ecological experience."
Simply Breathtaking,"This offers a great breakaway from the rustle of City life. The endless fields of reeds and tidal flats offer nothing but picturesque sights. For those who are physically fit or those into photography, invest some time to go a hike up the hill. You will be well-rewarded with an unparalleled view. Do not forget your camera! There's going to be a huge event here next year."
Suncheon Bay,"One of the most unique and beautiful features of Korea's southern coast are the tidal flats. These tidal flats are of enormous ecological importance. Suncheon Bay is one of the most picturesque tidal flat locations in southwestern Korea. The site is spread out over a wide area, protecting various endangered species. The natural formations of the reed fields are a wonder of nature.I believe Korea has 4 natural areas that are truly exceptional. Within the mainland Seoraksan National Park, Jirisan National Park, and the Southwestern Coast Tidal Flats. On the volcanic island of Jeju, the entire island is full of natural wonders above and below ground.Visit Suncheon Bay in the spring when the reeds and flowers are spectacular sights. Suncheon Bay is one of the highlights in Jeollanam-do, one of Korea's best regions for nature."
Treasured Gem,"Having lived in S. Korea for two years, this tops as one of my favorite places to visit! I went down to visit the Yeosu expo and that was just crazy full of people, I'm not a fan of crowds so this was a literal breath of fresh air. It was peaceful and beautiful and I could hear nothing but the sounds of the reeds swaying in the wind. Hubby and I decided to trek the hike up the mountain at the end of the deck trail and it was worthwhile to see the view. The drawback is that it's sorta in the middle of nowhere but I suppose it's the price to pay for such beauty."
Suncheon Bay - Eco Bay where you can meet real nature,"reed, migrant birds, little baby crabs in the mud with very cute goggle eyed goby!! this goggle-eyed goby who sleeps 6 months during winter, pops up from the mud field and digs in the whole of the mud. that was nice secene I ever saw. wonderful nature. if u hike a bit to the top of the observatory, u can see whole Bay with nice rustic & peaceful, pitoresque secene... if u go to the little muse at the left side of the gate, there is introductory filme which takes 5~7 mins, in English, French, Japanese, Chinese and Korean! Year 2013, they will open gardening fair next to this bay for several months from spring to fall, so it would be better chance to visit here together. Personally, I prefer the fall season for the sightseeing in Korea so I recommend u to visit here in fall... u will gonna love it."
