review_title,review_body
Mind Blown,"It was completely the biggest and I'm so jealous of the students studying in such a prestigious university, I'm so in love with its vast architecture and the long wide staircase at the front, not to mention the varsity jackets are smashing! "
Interesting place to walk around,"This place is huge and filled with students. The surrounding areas are worth a walk around, especially up the slope to the church. There are plenty of eating and shopping places around too. "
Shop till you drop!,"It's a great place to shop for clothes, bags and accessories! I find that the clothes here are sold a reasonable cheaper price than those at Dongdaemun and Myeongdong for similar or same designs (Please don't buy clothes at Myeongdong as they will rip you off - the only thing you should buy there is cosmetics) However, I suppose the clothes here will be more suitable for girls of 18-25 years old - if you are going for the Korean girl college look! There are also several shops which sells handmade bags at around 10000 KRW. It's really affordable to shop here! "
Just an ordinary university campus,"There are a few pretty buildings and the campus ground is well maintained. Nothing stunning, just a small university."
Uhmm...,"If you're fan of K-reality show so yes, otherwise, see know reason to visit, feel free to skip this spot & head straight to Hongik statio, where definitely more fun & happenings."
Delightful Gardens,Beautiful place to see the cherry blossoms as well as all the flowers that bloom there month after month in the spring. There is also a soccer field if you're craving sports and have a soccer ball. It's a great place to walk around when you're on a date. Then again so is Yonsei University campus...
"If u r already in this area, its worth it to visit.","Its nice to look for maybe half an hour around this beautiful university and visit the small museum there, but only if u r in this are anyway."
For young people and nice environment ,"This place mostly the stuffs are for youngsters. However, if you want to just take photos, this is also a place for you to look around and take pictures too. "
Shopping Galore,"I went here because I read that it was a great place to shop. We taxied here and didn't visit the actual woman's university (though I hear it is lovely), but instead shopped and ate around the university. Because we were next to a college, the prices were definitely lower than we saw elsewhere in South Korea. There were also tons of clothes and shoes and beauty stores. Since I'm a plus-size gal, I wasn't able to buy any clothes as the sizes probably went up to a Medium/Large max (US size). However, there were tons of a food stalls and restaurants so we ate a lot (there's a little old lady who made really delicious takoyaki). The whole shopping area is maybe 3x3 blocks. However, it is very steep. So I highly recommend starting at the top and work your way down. My mother had a hard time walking at some point and had to take a break. "
Shopping time,We go there for haircut. Always want to do different thing. Heard that that area has many hair saloon. So go there for haircut. Never expect to see many shopping. They sell things cheaply!! 
Beautiful uni for photos,"It is the most beautiful uni i have seen. Great to chill out, take some pictures and have some good memories over school days. "
Nice for a walk or a family Sunday,"Very nice place and archtecture, a mix of modern and classical style, with a lot of green. Recommend the place for taking pictures and family walk with kids."
One of my favourite place!!,Very beautiful university.. For Ewha Street..Best ever!.. I bought a coat..very nice autumn coat at very reasonable price..so many clothing stores.. trendy fashion..suitable for teenagers and shopaholic too..
beautiful church,The most attraction was the church just in the main entrance. beautiful views around. The shop there was cheap that i bought 2 bags of Chia seeds for around £3.
Very cool!,I took sooo many pictures.. The imensity and the architecture is breath-taking! What you have to do is to go to the park and from the top of the stairs take a picture of the whole building(library). I definitely recommend it! 
"Beautiful school, some cheap shops, and great street food","The campus itself is really pretty and a quiet reprieve from the noise of the city. The library is stunning and the surrounding area offers lots of cheap shops that cater to the college crowd (and their budgets). Not as touristy as Myeongdong and less crowded than Hongdae. If time is limited, I would suggest just Hongdae though since the surrounding area has more to offer in way of restaurants and shops."
Love the outer view of Church,"First women college in Korea. If you're a fan of running man, this is a must-visit-spot for you. Definitely worth a visit. All kind of foods available across the street as well. "
Cute Stationary stuff and young ladies of Seoul,"Lots of cute stationary stuff and of course, the young ladies of Seoul are everywhere. Mesmerizing architecture, East-meet-West and make sure you visit the famous Ewha University's terrace. Enjoy the sunbath especially in winter is surprising pleasing. A buzzing place to visit. "
Beautiful place to visit & shopping for ladies,"My family enjoyed strolling through the street foods as soon as we exit the station and walking towards Ewha Women's University Campus.There are lots of shops along, on your left and right side of the road. Shoes, hair saloon, clothes & some branded name retailers.We were amazed at the architecture of the Campus, with classic & modern design infused together.Lovely place to visit!Tips to the venue:- Go to Station Ewha Women Uni,exits # 2 & 3.- 5 mins walk."
Great Shopping,"We didn't actually go to the university, we just went for the shopping and the food! Originally we went there for the bagel place in the evening, which is conveniently also located next to Annie's Pretzels (delicious). We ended up coming back the next day because we liked the area so much and wanted to shop more. The clothes and accessories are cute and the shopkeepers are not as pushy as other, more popular shopping places. You can't haggle at all places (usually the bigger stores) but the prices were generally quite cheap. After shopping I retired to Angelinus cafe which was very comfortable and had a nice view of the street. Overall my favourite shopping experience in Seoul."
Pretty university ground for photo taking,"This university has many beautiful grounds for photo shoots. I'm especially attracted to the stairsway and I think our whole family can spend half a day here. Other than that, the best part of visiting here is the food and shopping area just right outside the university. Pretty good for a campus life. "
best street food and good shopping,Visited in winter again and went there at least 3 days during my entire trip. The street food were the best my friend and I have eaten during this trip that we found ourselves going back there just to eat. Shopping was good and cheap too. The university campus itself is also beautiful. My friend and I had a good time taking photos there.
Is a good place to shop and eat,"When here after Hong dae and like this place better, although there is not so much performance but the shopping and food is nicer and cheaper... "
Best of the unis,"I'm slightly biased, having worked here back in the day, but the Edae campus is positively gorgeous in the spring and autumn, rivaling Kyunghee University in its foliage. The impressive 'Gash"" carved through what used to be the Lover's Hill in the middle of the campus is definitely to be seen. In the nearby Edae/Shinchon area is the usual gamut of cosmetic/ coffee/ café shops you'd expect wherever young women congregate."
Excellent Place to laze about with family,Lovely place to spend the morning and/or afternoon on a cool Dec winter. Lots of shops to put into practise your bargaining skills!.Always found it enjoyable to walk the streets & lanes with the kids while wifey goes around searching for a good bargain. Had a nice toast & coffee with both my son & daughter at Isaac's Toast which lies smack in the middle near to where the area selling shoes are located. Strongly recommend this place whenever you're in Seoul ...
Lovely University! while there are many good things to shop!,"The University is so attractive that i wish i could study there.There are lots of coffee shops, restaurants and little shops.The shops are very good price compare to other areas and the quality is better than in Dongdaemun. I will definitely go back there to shopss till i drop again!!"
Pleasant trip,Very cheap food and cheap clothing and shoes. Juno hair was also their and three of our family member had our hair cut. Very professional hair stylist and the saloon was very big with many hair stylists.
Lovely college and great surroundings to explore,"This is my 2nd visit to this lovely area. We were blessed with beautiful autumn leaves this trip. We love this place because it has such a youthful atmosphere where shops and restaurants caters mainly for young adults. Ladies would love this place as fashion houses sells mainly ladies clothings and reasonably priced. The university's grounds is worth a visit and good photo shots can be captured. Before you leave, it is worth having a meal in one of the many restaurants here. The food is tasty and cheap.Recommended place to visit."
Women college , unfortunately if your not a student you are not allowed to walk on the premise of this college. It is conveniently close to the subway and there are good restaurants nearby.
Good school for girls,This universiity is well know for the elite Korean women. Nearby this place is good for shopping too.
Beautiful University and wonderful neighborhood to wander around,"The architecture of the campus is amazing. So many beautiful buildings. A hidden gem indeed. Nice place to visit and walk around (I went in the morning during classes, I did not stay too long to avoid bothering students, teachers and people studying and working there).Also during Autumn the landscapes were even more enchanting. They have nice shops inside, where you can buy nice stuff from the University.Also the surrounding area is nice to visit, good restaurants and good shops."
Beautiful university,"A very nice place to take photo , love the architect building ,shops and eateries nearby. Easily accessible by subway"
an iconic uni in Seoul,"This is one of the first women uiniversity in Seoul opens specifically for womens to further studies. there's a shopping alley near the uni that sells stuffs women loves (shirts, shoes, makeups etc) and the price is comparatively cheaper here than Myeongdong. This place also full with cafes, restaurants and street food vendors. "
One of the best public places to See Autumn,"This University resides along a very trendy street. It is opened to public and we spent the time enjoying the scene and taking pictures around the campus. You will see may tourist who came especially to visit this place.My parents enjoy the view very much. out of the campus, you will see a lots of small shops along the street. There are lots of trendy accessories, clothes, shoes and bags for the ladies."
Sight and Shop,"I've been here twice, spring and autumn. And I would say, it's one of the must attraction in Seoul. After a round at the university grounds, shopping area is just a stone throw away. Got hungry? No problem! Lots of restaurants to choose from."
Beautiful campus,"Gorgeous campus regardless of which season it is. Probably one of the best places in town to see autumn foliage. Would be great if visitors observe good manners and do not cause excessive disruption to the students as it is, after all, an educational institution."
Nice shopping Street near this uni!,"Love the shopping street here and all the cafes, Prices for shopping here is good too as compared to shopping at Myeongdong shopping area and also it is less crowded here. If you visit this area, go and try this fantastic eatery which serves very goooood unique bimbimbab, ""Alchon Flying Fish Roe Bimbimbab"".... it is damn good and cheap at KRW 3600/bowl! "
Make this a destination ,"This is an easy walk from the subway, the surrounding open market for food and clothing items is interesting, and the campus is really excellent. The architecture of the central building is unique; we also toured the excellent museum which had an historic ceremonial gown exhibit as well as Joseon Dynasty porcelains. The English descriptions were highly informative. In November, when we were there, the Fall colors were still on the campus trees. We truly enjoyed walking around the campus enjoying the varied architecture and charming paths."
Autumn and Winter - Cold but Beautiful Campus,"Designed smartly, this campus is one of the most unique I've ever seen. During autumn and winter, tree leaves get red and yellow, making it perfect for shots. Around it, you may find lots of coffee shops, clothing * cosmetic shops for girls. Recommend for young couples."
Beautiful campus,"Due the fact that our daughter is studying in that particular university we spent hours walking up and down in the campus area having once a birthday party outside. We found campus to be a peaceful place with old and modern architecture, places for picnic etc. Happy to having been able to see this historically special university."
$10 (U.S.) Handbags and Backpacks,"There's shopping around this university that's famous for selling designer's copies of handbags and backpacks for around $10 U.S. There's also clothes and shoes, and highly discounted cosmetic products that is as fake as the bags (I was told). You get what you paid for..."
1 of the most beautiful campus,I loved this campus. It's very beautiful. We spent quite some time just walking around and enjoying this very spacious and beautiful campus. They also had their own museum and church which anyone can visit for free. 
"Beautiful autumn leaves, shopping & cathedral","A great spot for photography and capturing the alluring beauty of red autumn leaves just before winter beckons. The cathedral, long flight of stairs, spacious grounds is a good change after some shopping."
Modern and beautiful university,"I didn't realise that the university would feel so modern! The university has different kind of architectures, which can be interesting to see. There's a lot of green areas at the campus, so it doesn't feel like you're in the middle of Seoul."
Impressive architecture,This campus close to a bustling area of Seoul is impressive as far as its architecture is concerned. A high building with all student facilities is kind of burried on the ground. Have a look from Pera's Café.
Absolutely beautiful in August,I've read and heard how interesting this place is in terms of its architecture and grounds. My family visited in autumn and the place was breath-taking. Colorful Autumn leaves enhances the beauty of the architecture of the university. We spent about 2 hours in this place. My mum is in her eighties and we pushed her round on a wheelchair. I was very happy to note that the place is wheelchair friendly. Do pop into the University to check out their extensive gym and facilities. There's lots of cafes nearby to enjoy a relaxing day after walking the grounds.
Please visit the school during the weekend,"I would advise tourists to visit during weekends as the university is in operation and it is for students, definitely NOT for tourists.It is sad to see the school has turned into a tourists' selfie ground."
Bustling university town,"Plenty of things to do in this university town- awesome shopping for clothes, shoes etc. There are also cafes to chill out and lots of street food! Highly recommended to spend an afternoon here especially for girls who want to shop for clothes. "
Interesting place,For a university this sure is a happening place... lots of shops and eateries at decent prices... had fun here exploring the nooks and crannies 
Place For Your Portraits,Take some time to take some profile photos with unique background buildings & scenery. Very beautify during the autumn time. Best is to bring a long a mug of coffee or tea and relax on the bench in the campus garden. 
Lovely view,This place is in my to go list when in Seoul. Amazing view and surprisingly quite peaceful eventho it is near to the shopping street. 
Very romantic place to go,The university is totally different and very beautiful. At night it is very romantic. Lots of street food.
Modern university with historical buildings as well,"This is just across the street from the shopping area, and it's worth dropping by for photos of the scenery and architecture. Lots of cafes and cosmetic shops around (Olive Young, Watsons, Holika Holika, etc) since it is a women's uni, after all, and food carts as well that sell everything from waffles, fried chicken with sauce, skewered kebabs to Korean snacks. There is a croquette shop that I frequent whenever I drop by. Also, there are ATMs around if you need to cash for shopping! "
Beautiful architecture,"This was my first time to visit this uni, but was excited to see it because of all the pictures I've seen. I love how huge and clean the campus is, the architecture made of glass is perfect for a photoshoot. The buildings are like those in Europe, it made my heart leaped and just tried to take it all in. It was definitely an eye candy.I couldn't imagine how it's like to be a student there, I would love to hang out on those steps while studying or just roam around and sit on the wooden benches. Perfect also was the weather when we went there.BUt I noticed there were a lot of tourists roaming around taking pictures so I dont know If some students/classed were disrupted because of this.Shopping is also perfect for tourists after roaming the campus. They said Ewha is already cheap when it comes to shopping but I find the coats still expensive but designs were really nice. It's soo confusing what to get because they really have a great selection. Truly Koreans are very fashionable.There are also restaurants in the street.better spend the morning in the campus cause not much tourists then shop afterwards."
Beautiful Campus,The university campus is large and beautiful. Can find good bargains and pretty cheap clothings from surrounded shopping street areas. 
Beautiful University and don't forget to shop at the street!,"University is open for public to visit, it's so beautiful i hope i could study there :)There's some nice food nearby too. Try Nene Chicken Ewha branch and you won't regret it! Their snowing chicken is the best. Cosmetics and apparels can also be found around Ewha university at a cheaper price compared to Myeongdong. A must visit place especially for girls!"
around this area,you can shopping around this area. Architecture this university is very unique. i hope i can studying in here :(
Gorgeous Campus,Beautiful campus and well cared for. Everyone was polite and helpful. The architecture is stunning and worth the visit to experience the campus.
Nice walk around the campus,"My friend spent a semester studying here so I crashed her lectures one day--and i fell in love with the campus. it's really nice to walk around the campus, chatting up with the local students"
Pleasant place to walk around,"Don't really have anything specific to expect for a university. It turned out a nice place to walk around and enjoy the atmosphere and environment there. The famous wall at the entrance is good for photography. The design of the garden at the front entrance is nice. If time is right (for cherry blossom or red leaves), it should be a good place to visit again."
Historical Woman's University - Worth a Visit if you have time,Ewha Womans University's campus is a pleasure to walk. The modern architecture of the newer buildings was impressive. Walking the streets around campus was fun.
Spending an afternoon around Ewha Womans University,Interesting university area surrounding Ewha. Many stand alone boutiques and shops as well as the whole plethora of familiar korean skincare stores.The haircuts here are also slight less pricey than an average salon in Seoul city centre. Lots of sidewalk food stalls to eat from.
Awesome Architecture,"Beautiful university! Don't forget to do some shopping around the area, there are several streets with clothes, cosmetics, etc. One of the good place to shop!"
Interesting designs,"The university is beautiful with its unique architecture. Didn't really walk into the university. Do take note that they don't want visitors to disturb their students, so do follow their rules when you are there. There are also shops opposite the university. Do walk around this area and enjoy the view."
Beautiful University - Awesome Architecture,Nice architecture of the buildings and has a good atmosphere for studying. It was a huge area and nice view and really relaxing to walk around.
the shops opposite ewha university,"best, best, best and awesome place to be with.. around the area, so many street shops to go and super duper cheap."
Nothing much,"My expectation is very high after reading the reviews. But, I'm quite disappointed as it doesn't seem anything special about the university. But, the stairs which are built between the classes is such a nice view and excellent idea of architecture!"
Place of intellectural beauties,"The first time I visited in sunny weather. What a spacious old college style, with precious woods and glamorous buildings. I took a relaxing walk under sunshine. Advise to go in early morning with fewer or even no visitors. The only thing that made me feel unpleasant is the signage at main entrance appealing the Mainland China visitors not to photo on the students, and I opine it is discriminating to Chinese travelers for all."
Academic ambience and window shopping indulgence,"I came from Singapore but none of our universities (be it National University of Singapore or Nanyang Technological University) are located within very close proximity from a shoppers' paradise but both Hongik University and Ewha Womans University in Seoul are surprisingly and amazingly within the radius and close proximity of a modern shopping belt. Probably, there are research studies that revealed that undergraduates perform better when they are able to relieve their exam stress and anxiety through window shopping. While in Seoul, I stayed at BoA guesthouse; Hongik University and Ewha Womans University were within walking distance from the guesthouse. I took about 40 mins to walk to Ewha Womans University. I had read that Ewha Womans University is one of the top most prestigious universities in South Korea and the world's largest women educational institute. The university was built in 1886 by an American female Methodist missionary who named it `Ewha' which means `pears in blossom' after noticing a number of pear trees at the campus site. Among the many graduands were Former First Lady of South Korean Presidents. I took a walk around the campus and found the `American colonial' architectural style of the campus buildings amazing. The `foreign flavor' of the campus setting gave an impression that the university is located in America . The garden landscape around the campus was well manicured and beautiful. The environment was peaceful and tranquil and very conducive for learning. The sculpture of the female American Methodist missionary was also erected near the entrance building. I have great respect for such a lady whose contribution had benefited millions of women in South Korea. South Korea inherited Confucianism from Ancient China and the doctrine of this philosopher demonstrated little respect for the advancement of women's education in feudal society. The Sage equates the status of women to that of the `mean Man' whom he had difficulties in handling them. It was surprising that the South Korean authority permitted the founder to open such a private higher institute of learning solely for women in the 19th century when Confucianism still enjoyed great status in South Korea. Today South Korea, even the President is a lady. South Korean women now enjoys equal status as men. The emancipation movement for woman would not have achieved the intended results without the great contribution of people like this founder of Ewha Womans University, Mary F Scranton, who champions for the right of women to attain and achieve higher academic excellence. The area around the university is a great place to shop and Ewha Womans University is a great University!"
great place for shopping,I really love Korean fashion so I loved here more than dongdaimoon. It is very modern and there is many sales. I would recommend you go.
No Reason to Visit,"It is a university for the women, and although it was constructed back in the day, but I personally cannot find any reason to visit this place. It's not beautiful. Just plain university."
Nice Architecture.,"Thrilled to find out how open this university to everyone that it became a tourist attraction by itself. Loved how the classic western buildings complement with the modern style landscaping, especially the sunken stairs."
Great night out,Students put on small restaurants as part of a university event. Plenty of food and Soju.... a great way to start the evening!
Pretty,Its so pretty there. Would love to go to school there. I bet theres a lot to explore but i went on such a hot day i just couldnt do it... This place also had other things to offer like shopping and cafés
University near Sinchon,"This is 2 stops away from Hongik University. The University itself is ok, there is some good architecture, but around it the food is mainly bad cheap student food, unlike at Hongik. If you want really great food go one subway stop away to Sinchon."
