review_title,review_body
Wonderful Architecture,The University grounds were very pleasant to stroll about in but we did not venture into the buildings itself as it is a learning institute afterall. We went into the gift shop and browsed around in the shops in the surrounding areas. A pleasant and relaxing way to spend a few hours in this area.
IT`S NOT FOR TOURISTS!,"This place is a University, not a Zoo or something. You should not go inside, unless you gonna do gentle. Please be quiet and just walk around outside of buildings. That`s all you can do. This place is not a place for tourists."
A Hogworts in Seoul,"Great place to take pictures with many Hogworts-esque type buildings dotting the landscape. Not surprising since the school was founded by Mary Scranton back in 1886. The shopping streets around the campus offer lots of merchandise, but if you venture inside the campus, you'll find even better bargains because some of the stuff sold outside (like face masks) are actually available at student prices."
Lovely area to walk and shop,"Visited the Ewha Women's University to check out the architecture (which was really nice) but was also pleasantly surprised by the whole area! Lots of shops, cafe, restaurants around the area which you can go to and spend your day there. Particulary enjoyed the shopping as they had many interesting stuff which I didn't see at other parts of the city.This has got to be one of my most favourite spots to hang out in Seoul!"
Good place for photo taking,Beautiful place for photo taking. A lot of street foods and shopping around. Must visit this place if you like to take photos.
Autumn in Seoul,Very nice view... The shopping center near the university is not expensive. The near restaurant served delicious food.
Architecture at its best,Appreciate both the modern architecture and past. University canteen is open to the public. Outside you'll see food cards and a lot of shopping stalls.Good to visit in autumn. Drop by the University museum as well.
Gorgeous campus!,Visiting this university during autumn can make you decide that it is not a bad idea to pursue your education here because the really beautiful campus is such a conducive place to study! The entire campus can give you such happiness that I can't describe in words. Must visit!
Beautiful campus with history and architectural pleasure,"This university is the first women's university established in Korea. When you take a walk around campus you will find a very interesting architecture going underground, but also find old buildings with its own charms as well. Make sure to stop by their souvenir shop as they have pretty and cute nick nacks that girls and foreigners will like."
Beautiful autumn leaves ar Ewha University,"Beautiful early American style buildings are hallmarks of this university ... full autumn leaves colors in well landscaped gardens add to a romantic feel that make the university feels like a park than a place of higher learning. With the young girls (woman university) patronizing the many small retails shops selling fashion accessories, clothings, shoes and food stalls immediately off the gates of the university, the whole atmosphere is one of youth, vibrancy and innocence.. a must visit place when visiting Seoul"
Fun place to shop and eat!,"We had a really fun time at this place! Don't bother eating before coming, there are plenty of interesting cafes and street stalls here. You could easily eat your way up and down the streets and around the university. The shopping is mostly for young people's things like fashion bags / clothes and stuff. Take the train to Ewha Women's University station and there will be signs on where to exit. We came from exit 7 and ate our way down to the university and back. Despite being a sunday, it was not crowded and there were no street performances. But for us, we were looking for a chill time so it kinda fit our mood anyways. Good to go if you have the time :)"
We love the shopping atmosphere and small snacks here,Good shopping place. Vibrant and price is lower for clothes compared to other places. Most likely cathered to students. Like the little eating places around where you can get sweet treats. We went on a Sunday afternoon seems abit queit as lots of cafes not open fo biz. Maybe should explore on a weekday instead.
one of the must visit,Very beautiful and spacious campus. Perfect for photo taking and also a relax walk. Most of the clothing stores at the shopping streets caters to young adults. In my opinion the clothing are cheaper compared to other shopping streets.
If you have time to spare,"Not exactly a must see but if you have time to spare and are into youngish college age clothings, you might want to check it out, though the items are similar everywhere. We went there just to have a look at the university scenario. "
Best place to photoshoot,Going in autumn sure u will see the great sightseeing . Too many visitor in weekend better going in weekday if u want shoot the perfect picture 
Women university,"Many place for great picture. Shopping street around university. I've visited in sunny day, so lucky"
I want to study there,"I wish I could study in such a beautiful university like Ehwa. So nice, esp in Fall. It's a must-visit if you go to Seoul."
Very nice environment,"We took subway line 2 to Ehwa Womans University using exit 2 (exit 3 can also be used) at the station with the same name. This is the largest university for women in Korea. It was an easy 5-10mins walk to the university. There is a cafe at the entrance and the grounds are nice. We went on a rainy day and the drizzle limited our walk around. Nevertheless, it was a nice area to explore."
Not only uni...find the best price dress with affordable price here,"After strolling around to the famous shopping place listed at Seoul like Myeondong, Hongdae etc etc, well i can guaranteed in here you can find a dress, bag with super affordable price comparing to the famous shopping area.Mostly same design, but the sell it much more cheaper...so this area so damn recommended for ladies.The ewha uni building design also so interesting,gothic and modern building design you can see in here...such a lovely place....!!!!!!"
shopping!,"Another shopping paradise for youngsters and teenagers, conveniently located at Ewha Womans University Station (Subway Line 2) exit 2 / 3. Cécica Hair Salon which is more affordable is also located here (not sure if they have other outlets though)"
My Family Summer 2017,"Edae was on our list this year whereas we were here on 29 July 2017. So excited to be here, taking lot of pictures and many shops available here with cheap prices. The shops offer mostly for ladies and few for man. I loveee being here (a shopaholic just like me) where i bought cloths, bags, cosmetic etc Surely we wanna come back here again ^-^"
Good looking University,"Pretty funny that the 5th ranked university in Seoul gets top billing as an attraction. We visited and the campus is very pretty. The building structures offer both archaic and modern designs. The underpass is just amazing and you will know what I mean when you visit. Outside the campus is filled with stores, shops, cafes and eateries."
Best place for clothes shopping!,"The area is known for affordable and trendy clothing and it did not disappoint. If you are looking for Korean fashion, this is it! Prices start from as low as 5,000 won. Didn't have time to visit the university grounds but heard that it's worth it.Literally shopped till we dropped and was recommended a KBBQ place by a shop assistant. Best place for KBBQ! Cheap and good:) A pity that we did not take down the shop name (it was in Korean) but the place is somewhere right at the end of the shopping street and has a cute pig as its mascot (hope this helps?). There wasn't any tourists while we were eating there."
Ewha Woman's University area good for shopping,"Very similar to the shopping in the Hongik University area in Hongdae but a bit smaller. Depending what you are shopping for, you may find bargains there as well. It's worth a visit to compare the difference. Personally, I like the Hongdae area better."
Wonderland,"Words cannot express how much i enjoyed the walk from subway station to Ehwa University, with all beautiful trees. Lots of cosmetic shops and food stall, along the street. Very friendly people. Love this place to bits."
Everything what ladies need,"Near Eawha Womens University, there are so many interesting shops, which have what ladies needs, including fashion, accessories, shoes, + delicious foods. Variety of design items. Worth visiting! Despite hot weather so many people on the street near the university."
Marvelous!!,"That long pathway is a refreshing sight! It's a picture perfect place so not having that selfie and jumpshot would be a pity! And the food at the canteen inside one of those glass walls are superb, yummy and cheap! Go try them out! "
women's shopping heaven indeed !,"Bags made in korea - good quality and cheap ! 10,000won only !! women can spend whole day shopping ! remember to bring your own shopping bag !!! lots of cafes here to rest your legs as well. most of the things sold here are made in korea. have a tour into the university campus as well, very huge !! there are some push carts outside the university, they are cheaper than those shops. i bought a couple of t-shirts from there at 7000 won only !"
New Architect and Old Buildings all at the same place,"An interesting place to visit; whereby one can see the modern building with glass panel at the entrance,with a very big garden compound and further away, the old school buildings and church buildings. I would like to study there if I have the chance. There were shopping streets outside the University, but you really need to have strong legs muscle to move around the areas as there are uphills, and down slopes. Many different food outlets around the area too; like Japanese, Chinese besides Korean food, so one will have no problem looking for their favorite bites."
Beautiful uni,"Nice buildings, lots of places for pictures, big shopping area nearby.Feel the youth vibe of Korea here."
University town,"Although it is called university it actually provides education from kindergarten up to college level, there is even a dormitory for foreign students. The university compound is very big, it's like a small town. All students and the teachers must be very healthy from all the walking exercise in the compound."
Beautiful campus with good shopping nearby,"Located next to Ewha shopping street, this university campus is a nice place to take a break, relax and appreciate the architecture."
Great for photos and shopping,The main attraction is definitely the huge walls/hallway in the middle of the university. Nice place for photos and probably great to just stroll around in spring or fall (we went during summer).Right beside the university is a shopping district which girls would love. Definitely a place to visit at least once.
If you love architecture ,I do so I thought the design was marvellous and made some great photographs. A massive escarpment beautifully lined. Within a 5 minute walk from the metro station of the same name. Thanks for the vote if you found this review helpful.
Shopping Good,A good place to buy inexpensive clothes. One of the places you can find clothes at 5000 won. We went other areas and same clothes cost more. Also lots of eateries and coffee joints
Beautiful university with good shopping,"It s a lovely university with a surprising underground lecture room and class room. The revolutionary new architecture is complimented by the old buildings , left from the period when it was a missionary school and college. The university is only a short distance from the Ehwa metro station. but along the way there is a lot of shops which cater to the university's students ( mainly young women). so it s a great combination of shopping , visiting a tourist site and then eating an inexpensive meal. ( the main target audience for the restaurants are university students ). another surprising thing you will see is the number of food deliveries when you visit the campus. we saw on average about 10 motor bikes for food delivery in the 45 mins we were on the campus ground. "
Fun place for shopping ,"This is a fun place to shop as there are many clothing stores selling cheap clothings at 5000 won or 10000 won. Besides cheap clothing stores, there are some that are more expensive clothing stores too. If you are not into shopping, you can still pop in to this place as there are many yummy eateries selling waffles, cake, coquettes and restaurant. Can spend 1-2 hours at least walking about here. "
Beautiful campus - great picnic spot,"If you come in late May, make sure you pick up a cold drink as you walk through the campus. It's gorgeous and the main plaza won an architecture award, great photo spot. You can get some inexpensive hair appointment right outside the campus. My local friend recommended the puff cream pastry at the campus bakery."
Amazing Buildings,"Ewha Womens University was crowned with tourists who took lots of photos there. Its nice buildings and environment make it is famous for the tourists to visit. Especially teenagers who watched Korean drama series, Ewha Womens University was the places for many series scenes. Ewha Womens University is surrounded by lots of shopping stores and coffee shop. I recommend everyone who visit Seoul to go there once in your trip. "
This is where the cheap shopping is! ,"Nice shopping streets in this area, clothes, fashion and skincare. Honestly, the prices here are much cheaper than in Myeongdong. I managed to get a pair of leggings at KRW5,000 here and in Myeongdong they quoted me like KRW15,000.People here are friendly and street food is yummy too. "
nice campus and spot to hangout,"We spend 1 hour here due to our impression of the buildings and flowers plus the weather is so nice. This university is called as edae. These areas very nice spot to hangout with friends and a lot of shops along the way from edae to sinchon area. Just walk around and mostly you will find the price is much more cheaper then Myeongdong. If you really want to buy schoolbags, please buy here (around edae). Mostly cost 10,000won instead of Myeondong (35,000won)Mostly, all women clothing here. The price range is 5,000 - 10,000. However, you cannot try all these cloth."
"hangout spot, nice campus","we stayed in Jongno gu, so we took Line 2 at Eurijo 3 ga to Ehwa station (only 10-15mins). we have spent 1hr in the univ campus, mostly due to the impression of the unique buildings. then we wandered around for shopping and trying the local street food. This area is famous as a hangout spot, dynamic atmosphere and youthful culture. Lot of shops surrounding the univ, you could spend all day there if you are shopaholic. The price seems cheaper than other shopping area like Myeungdong or Insadong."
Clothes shopping street,"Mins walk from Ewha Woman Univ. subway, Exit 1. The whole street mostly filled up by coffee house, boutique, selling casual wear. I targeted on casual wear and the pricing between KRW 5,000 to KRW 10,000. However, there is no trying on these casual wear and mostly are T-shirts, blouses, short pants/dress. I was able to grab some to be my souvenir and happy with the purchased."
Stand out campus,Unique view of education is portrayed by this highly reputable university in the heart of Mapo gu. Filled with beautiful landscapes and complemented by the beautiful students. It is a stand out institution. You can simple walk in and marvel at the blend of life on offer.
"Started out for students, but slowly gaining popular among foreigners.","What meant for students has started to gain popularity among foreigners. It was meant for students as they have little spending power but due to good products and reasonable price, it become popular with foreigners and now has been a tourist worthy visit place."
Nice campus ,Nice campus with beautiful surroundings. A lot of students walking around and they even have a souvenir gift shop for you to buy stuff and photo shoot places
Ewha,"Beautiful Campus. Fun walk. Surrounded by lots of Coffee Shops, some restaurants and even shopping.."
Good for sight seeing and architecture,The campus is huge and the famous underground classroom is a must see shot! You can spend around 30 mins to 1 hour here. There are shops and cafe inside the campus as well. 
Great shopping!,It is a great street to shop! There's also many food trucks along the way so you can shop and eat at the same time. 
Beautiful university,"Coincidentally pass by this uni when we walk around this area before check in hotel. We spend about half an hour here. We are here during spring season, but no chance to look for cherry blossom. And it's freezing cold when the day we at here. A lot of tourists visit to the campus.We only tour outside the campus. Take some landscape photos here. Many shops and cafeterias nearby the university. Good for shopping and eat."
Full of small shops for the young!,Has lots of small shops and roadside stalls. Had an interesting experience at the road side stall eating their twirled fish cake in a small soup bowl and their famous tteok-pokki. It was sure spicy till I cried and had runny nose!Stalls are indeed plentiful...spreading to 2 sides of the road leading to Ewha Womans Uni.Good for the ladies who love shopping. This is not a high end shopping area and there is so much to window shop if that's one of your past time.
Beautiful university campus,"Lots of photo opportunities in this university. Other than that, nothing much to do around this area. There are some street food nearby outside which sells the typical food, and some shopping too."
Nice Uni,Interesting mix of nature and old-school buildings. Looks quite different in the different seasons thanks to the trees and greenery.
University that amazed me every season I visit,"Ewha University will definitely amazed you in every season! My first visit was 5 year ago and it was summer. The weather was nice and warm, the trees are covered with green leaves and people are sitting on the grass enjoying the afternoon.And my second visit was last year winter. It was freezing cold. The leaves were gone and was covered with snows. It was amazing! It's the most beautiful university in Asia!Aside from the university, you may take an hour to stroll the area. There are many store, cafe and restaurants around."
Beautiful University,"A very beautiful university. Nice to wander around leisurely around the uni and also at the shopping street outside the uni.Close to Ewha Womans University subway station, just walking distance."
Very nice stroll around the campus.,"Visited this place cause it is a good option for early morning (since shops are still closed). Quite a nice stroll with a European feel. Convenient as it is near subway station and after the visit, the nearby shops are open so we can do some shopping as well."
Most amazing university ever.,The university is massive and have many unique buildings. Great place for photo taking. There is a garden in the middle for a great walk. Do take your time to climb the steps and have a great view at the university.
Good bargain of cosmetics,Most of cosmetics company that establish a cosmetic shop along the street near this university give a good bargain of cosmetics products. I prefer to shop cosmetics in this area rather than in Myeongdong. <3
Unique modern architecture for a university by Dominique Perrault,Check out the images on the internet and you will be amazed. Very serene surroundings. Just before reaching the university at a nearby ministop & am/pm store came across cherry blossoms too.
Nice area,Nice area to walk around in with many stores and places to eat. Quite easy to get to by the mrt or just by foot. 
Nice Architecture,This place had beautiful scenery & buildings. We had their Korean sushi inside the university. Walk around the place during autumn was really cooling & refreshing!!
Beautiful building!,"If you have a limited time schedule in Seoul,this is a place you can skip.It is a really beautiful University and a campus where filled with many curious tourists. "
Shopping Paradise,Clothes were super cheap and its superr nice!! Didn't get to shop much as I was left with little money. Would recommend to visit here first then myeongs=dong as my miney were all spent in myeongdong!
Great shopping district,Great spread of eateries of local delights.Shopping around the alleys with cute shops with its own taste of uniqueness and cuteness. Great spread of product varieties
Nice little university district,Impressive women college; grand building design and landscaping. Definitely a fun shopping area for women. I also tried a street food along the main Avenue. An egg muffin sort of breakfast; creatively served in a little cup. Only $1.
beautiful place,"beautiful university, combination of modern and contemporary building design and landscape. and not to forget affordable fashion district around the university. worth it!"
Lovely in Autumn,Beautiful school with lovely foliage scenery during our visit in November. Lots of street food and shops outside lining the streets leading to the entrance of EWHA.
Shopping around the university,"Many cheap and good shopping around the university. Also, many cafes and restaurant which are reasonably priced."
Beautiful campus,"It is a very gorgeous and elegant campus. The campus is close to subway station, short walking distance. On the way to the campus, many retail shops and street food vendors!!! Cheap & yummy snacks~When I arrived at the campus, I couldn't tell I was in Korea because the architecture of the building is so European to me. They have nice cafe & book store on campus too."
Gorgeous University!,"Aesthetically pleasing to visit! Lots of people around the area, the university is no different from a touristy landmark. The college buildings are amazing to look at. And the campus is close to lots of shops and brand name outlets. A one-stop center for all women needs, that is for sure. If you are looking for cosmetics, clothing and street food (not forget to mention a number of coffee shops with instagram-worthy design), this is the place. All said goods and services are priced from low- to high-ranged price. Definitely a safe place to visit as a female solo traveler - but of course, use your common senses no matter what. I went there as the winter is transitioning into spring - GORGEOUS. Visit, just visit! "
Honeymoon @ Ewha Womans University ,We were at the Ewha Womans Fashion Street so we walked a little to this University to take photos.We heard this is one of the top uni in Korea. Looks ancient.If you have a chance just pop by and have a look.
Very easy to get to and a good place for shopping and eating.,Ewha Womans University is easily reached via Seoul's metro/subway and the station is named accordingly so it is impossible to miss.The University itself is beautiful and has it's own visitor centre showcasing it's history.There are many retail shops and eateries in the vicinity and the products are majority catering to the ladies.The location is easily accessible by train and it is a great place to visit for both ladies and gentleman.
nice walk during shopping!,Ewha Woman University is right next to shopping area. The building and garden in the university entrance are nicely designed and you can enjoy different views in different seasons. It's a nice area to visit and take a few snapshots during the shopping with friends!
Shopping around Ehwa University area,"I used to visit Ehwa Univeristy to go shopping whenever I visited Seoul. This was my favorite place to hang out to buy clothes and accessories. However, I stopped going when it got popular with the tourists as it gets too crowded and the shops are not as unique as it used to be. The best years of my life shopping at Ehwa was the late 90's to early 2000's. I recently visited since my cousin attends school there and got to see how different it looks now. I guess times have changed and I moved on..."
Shopping place ,"It is a nice place to shop cosmetics and any skin products with lowest price compare to myeondong shopping street or else. But children won't like this place because mommies won't stay just for one or two hours in this place, a whole day won't be enough too"
Beautiful trees and maple leaves,"It's something u will never get to see in Singapore. It's a womans university but it looks like a tourist spot with so many ppl taking pictures outside. We did not venture in further, took pictures with the kids and left after 30 mins."
Modernized walkway going to the University entrance facade,"Great choice if you want to experience a youth type of activity as this is a place where there;s a need a long walk prior reaching the fascinating atmosphere of the university. Along the way you will bump in to different stores, street foods, coffee shops and mini attractions."
Cheap Shopping for the girls!,The shopping area around the area is considered relatively cheap as they cater mainly for the student crowds. There are also tons of eateries around and the prices are considered cheap.This is a place worth visiting!
Breezy and beautiful scenery!,"Beautiful architecture, breezy and traditional meets modern building. Picturesque and beautiful scenery. Many shops and great shopping nearby."
Shopping Time!!!,Ewha Womans University is a most beautiful university in Seoul. And there are many shop for shopping. There are cheap and very cheap.
