review_title,review_body
Beautiful architecture,"It has a beautiful campus and unusual architecture. This time I visited their museum near the entrance. Many tourists come here to take photos, mostly with the far end (hill-top) as background. It is also breath-taking going up to the far end and then look back towards the city."
Big and Nice Uni,"The young girl student here are freedonly wear their outfit to Uni. Around the Uni, there is alot cosmetic shop, cloth, cafe and etcBe alert and bring enough cash and card as here is the cheapest shopping palace ever."
Fascinating architecture,Really great architecture. fell upon it by chance as we were walking through Seoul. The buildings and architectural layout were fascinating.
Great area,"Spectacular architecture and clean, also the surrounding area is great for shopping on a budget. We had some coffee and toffee grapes."
Ewha Womans University,"This place is worth to visit. The campus is beautiful and the architecture design is special. Besides, there are many photo spots around here. After that, we went to shop at Ewha shopping street."
Nice,"this university is huge and breath taking...education all under one room, they even have a chapel, surrounding area is serene"
Beautiful campus,"We went to the university expecting seeing a beautiful campus. We found it worth going. We visited the University Archives and learnt much about the history of the University and some prominent graduates, this made the visit much more meaningful. "
Such a beautiful place worth a visit!,This place is so beautiful! The buildings reminded me of Hogwarts in Harry Potter. Instagram worthy!
Beautiful Place,"Stairs and more stairs every other part of this beautiful place. Very beautiful buildings and structures around. Cheap, hip and fashionable ladies clothing sold nearby. You will spend..spend..spend if you are not careful.."
Worth visiting!,Finally had a chance to check out Ewha Woman's University. Worth a visit! Beautiful architecture and yummy food too!
Nice place to take photos!,"I came here on Chuseok Holidays so not much people except tourist who busy taking photos on a hot day! We can only hang out at the spots to take photos but how I wish I can go in the school to see the class, student cafe etc. Other than this, just along the Ehwa subway have whole stretch of shops selling clothing, cafes, fast food and mart."
Beautiful architecture for amazing pictures!,"Visited the campus for half a day, many good spots for taking photos! Just outside the campus were stretches of shopping streets mainly for cosmetics and stationaries."
Place to take picture,"In here usually lots of people take pictures with the interior of this university. However, there are so many stores and restaurant that you can explore nearby the ewha womans university. In the nearby area, they also provide some Halal foods for the muslims. So don't worry"
Beautiful and vibrant ,The university for women only has a humble beginning. Today it is one of the most beautiful and prestigious university in South Korea. Academically it excel and becomes an icon here. The surrounding area becomes a very vibrant shopping and dining heavens with very affordable price. 
I get why this is so popular,"I mean... the architecture was incredible. Out of this world. I know I haven't been to Europe so I can't compare this to anything else but we were quite mesmerized but the overall vibe of this area. Funny story: My sister and I sneaked in to the cafeteria area (which prolly for students only since you need access card to get in) surrounding the infamous stairs. I really wanted to go there since they have Baskin Robbins Ice cream VENDING MACHINE. We managed to enter the area and guess what happened next: I tried to pay using my travle card and lost it in the machine. The cafeteria lady tried to help us by saying ""Maybe you should call this number"" but we only have wifi, not local mobile number. So I had to buy another travel card to be able to go home.Anyway, we walked around for a bit and found shopping street and bought some cheap tshirts. Overall nice experience, and someday I will go get my ice cream there!"
So pretty,"A beautiful university campus with lots of fashion streets around it, can visit if you are interested and walkable to Sichon"
Unique and iconic building,"It's amazing, a university has turned into a tourist place. The buildings in Ewha are very unique, you won't regret going to this place. After visiting Ewha, you can shop at the nearby shopping area."
must go in my opinion,"Must go, to visit the incredible architecture of ewha womans university and to shop - especially if you’re female. The stuff they’re selling are one of the better price points. There are some shops catering to male, or unisex. Many simple fakes (shirt with supreme, patagonia, champion logo) costing KRW 5,000. there are also shops selling food and drinks around"
Great shopping!,"Since its targeted at university students, things sold here are much more affordable compared to Hongdae and Myeongdong areas. Managed to get a good deal for shoes at the ABC mart, which are not found elsewhere. Not as crowded compared to popular touristy areas and shops tend to close slightly earlier around 8-9 pm. So would be good to go earlier. Located conveniently near the subway station and would recommend girls to visit this place for good deals :) There is a also a cosmetic wholesale area here that provides below market prices for certain brands."
You need only come here to shop in Seoul if you're a girl! ,"The shopping here is really cheap around 5k or 10k won at the min. and the designs are all trendy. You can't try the clothing and they're largely all free sized. For girls who can't find clothing in other areas such as gangnam bcos the general Korean free sizes are too small, this is the best area!Dont really bother with hongdae (not that cheap) or myeongdong (expensive) "
Popular Shopping Area,"My daughters came here for their clothes shopping versus actually touring the university. There were a large number of shops selling young, trendy clothing at quite reasonable starting prices (i.e. W5000 for a shirt). Many of the stores were full of young women shoppers. Be sure you know your shirt size as the stores would not let our daughters try on any shirts but they were more accomodating for pants and skirts for some reason. There was also a number of small restaurants to satisfy our hunger after spending awhile shopping."
Amazing Shopping,The shopping center is amazing. Must visit. Its located in a good location and has good cafes around. The shops are good and inexpensive. Must visit for shopping. They have a lot of shops for clothes and cosmetics
Beautiful Campus,My mother in law went to this school so we wanted to check it out. It's such a beautiful campus. Shops around there were so much cheaper than most. My daughter bought some clothes and they were so reasonable.
Very beautiful landscape. The architecture is awesome.,We went here on an early morning on a holiday because it is walking distance from our guest house. I will definitely go back to this place should I have another chance in the future.
English Speakers,"When we got off the bus, it was a bit daunting since the campus is so big. We were trying to get to Ehwa's shopping district. However, as we got on campus, there were many English speakers who pointed out the way and we stopped to take pictures of the buildings on campus as well as the walkway. It was a pretty campus."
I love to studying here (if I was a student..LoL),"This university is really beautiful !! The park is nice, the building design is the combination of europe style with modern architecture in some area. Very quite and relaxing. I'm surely the student can study very well here. Near this university, there are a lot of shopping store."
Beautiful picturesque place.,The Ehwa Womens university is easily accessible via the train.There are plenty of shops for visitors to visit along the way before reaching the university. Great place for photo taking. 
Beautiful place for every season,"I came here during winter, autumn and spring. It such a beautiful place to visit during any season. Every place worth to explore and good on picture"
Very Comfort to walk around the park,There have a garden around the campuss very cozy to walk around and enjoy the cold air on early april 2019.. keep your steps on the walk path.. dont mess it..
Instagrammable buildings,A huge university with instagrammable buildings and nearby bargain shops and affordable restaurants nearby. 
Must visit in Seoul,It is a very beautiful campus and it is tourist place. We went on public holiday and we saw so many tourist there. Good for photostop and shopping. There are many cosmetic shops and cheap bags and clothes. 
cheap shopping place,"this place is very beautiful even for tourists who don't like to shop like me, the store is neatly arranged and the lights are beautiful at night, looks like in a movie"
loved it!,"such a beautiful campus! walking amidst the students really made me want to study here as well, even bought many souvenirs!"
Interesting place for teenagers,"Teenagers will like this place for shopping and in trend stuff. The waffles ice cream was so good. Must try.My boy done his first hair colour at Juno Hair salon, the service was great !"
Lovely Environment,"Beautiful University. Was here some years back, came again as this is one of the place I will revisit. Nice relax ambience, nice shopping street, much less crowd so u could enjoy your walk & shopping more leisurely... simple & good food. Tried spicy pork rice burger, so tasty!The campus is nice to take photo. After Ehwa, walk down the street keep walking straight, u will find Sinchon station, another university street."
Beautiful University in natural beauty place!,"This is an amazing Woman's University, I don't know actually the internal education system but I can say that the outdoor environment and structure may create good education, motivative along with innovative learning environment."
Beautiful & Wonderful Campus,"Ewha is most popular university to visit due to its beautiful architecture. The place is huge and so beautiful during Autumn. Its free to visit, I have visited here twice and both time so amaze with the modern building underground. The architecture is so lovely. Never seen a university looks like this and never expected its looks like a park and became a tourist attraction as well."
Beautiful and unique,"The unique architectural mix of the traditional buildings and the more modern Ewha Campus Complex is what probably draws most tourist to visit this school. Completed with beautiful greenery in its grounds, its a perfect sanctuary in the midst of the bustling city. Albeit, it is steps away from the Ewha shopping district, which is also not to be missed."
Nice place to take photo,Suggest to come at night if you want to take nice photo when all the lightings are switch on. There's a shopping street just opposite Ehwa Womans University. Goods sold here tend to be cheaper than what you can find in Meyongdong.
"Autum foliage, old beautiful brick buildings and modern campus complex in one place","If you are visiting in Autumn and looking for beautiful foliage near the City center then visit Ehwa Womans University. It has all the colors of Fall, a great history, plus the campus complex that is able to blend the modern architecture with the old brick buildings and the beautifully landscaped gardens."
"Spacious, Beautiful Campus Especially in Autumn","A must visit attraction during autumn. The campus is lined with beautifully landscaped gardens and trees (along with yellow, fiery red and orange leaves( that is a sight to behold. The campus is basically a hive of activity with the tourists and students walking around this large and spacious campus.It is not necessary to walk the entire campus. It's good enough to capture the beauty of the campus just being hanging around the southern entrance of the campus.If you have time, the museum is a good place for a walk given that the exhibits also have explanations in English. We got quite a few nice little souvenirs as well from the museum gift shop for our friends."
Beautiful buildings and people,"It is one of my favorites in Seoul. It has a beautiful campus with historical buildings and innovative architecture.There are tourists all year round. In autumn, the campus is decorated by autumn leaves, whereas in spring it has beautiful cherry blossoms."
Nice Scenic Location,Ewha Womans University is a must visit location. The university is very nice and very big campus. This place is rich in history.
All Womens University!,"Ewha is a university that you can feel you woman side. Lol! I'm just kidding. Kidding aside, the architecture and the place was very unique and tourist friendly. "
It's so pretty,I wish I could study in this University. The architecture is amazing and there's a lot of place to hangout around the campus and in the campus itself. The scenery is also amazing. Would love to study here if I could. LOL
Beautiful architecture & plenty of photo ops!,"Ewha is famous for its beautiful architecture! Gorgeous campus with the autumn leaves surrounding it. Very nice for photo taking. After that, walk around the streets surrounding it for some shopping & eating!"
Shopping,"Great place to go shopping, the prices are great! I would reccomend going here first befire heading to the other areas.The university is spectacular."
Great architecture for photo ops,"The main sight is the steel building, looks very modern and instaworthy. aside from that, the nearby building is colonial style church-like hall. overall, if you like architecture design do visit this university, it's worth the short walk. "
Good looking University!,"The university has an amazing architecture and landscape. Since this is a university, you will see students going in and out of their classes. Good thing they didn't mind us taking pictures inside the university. Probably they are already used to tourists and even locals having photoshoots. Overall, enjoyed our visit here."
beautiful university,"everytime i went to Seoul, i took a walk into this university, nice and comfortable place, during March and April, cherry blossom inside the university attracted many visitors to take photos"
Beautifully Old and Modern,The Ewha Woman’s University was a pleasant surprise. It has a nice quiet campus with old European styled buildings next to an architecturally interesting underground building somewhat hidden in the hillside. We spent a pleasant hour or so strolling and taking pictures.
"It is a university, not a park.","Ewha is one of the oldest universities in Korea. It has a beautiful campus. But remember, this is a university, not a park. Please respect students and keep silent. Avoid taking photos of students. (You can really get in trouble)"
beautiful university,I read the reviews before going and it did not disappoint. Walking the grounds of this beautiful campus and reading about its amazing history was inspiring. 
Worth a Visit,"This is a real campus like most other university does, but the building and overall surrounding does look very beautiful and pleasant, the student is so lucky.The slope path way in between two campus complex is really brilliant architecture design. Everyone is having fun walking around and having Instagram session,Don't forget there is actually few more sights you can explore inside the campus & outside of the campus as well, we found some of our Seoul best deal at the shops outside campus."
beautiful campus,"Very beautiful campus, especially the front gate.Or I can't say it is 'gate', because there is no gate!Very wide and open front!And the steps are astonishing also.Very worth to see and visit inside the campus.非常漂亮的校園，尤其是正門，或許我不該說這是正門，因為這面根本沒有門。校園前方非常廣且寬闊！且校園裡面的階梯也非常壯觀。非常值得一去！"
Beautiful campus-a must visit for architecture lovers,This place is justifiably popular to visit due to its beautiful architecture. Most people ignore the museum which is small but has a good collection of art and historical artifacts and is free to visit. I have never seen a university that looks like this one.
Incredible architecture,"You feel like you're in old Europe and a 21st century futuristic location all at the same time. Enjoyable to stroll around, no entry charge. Lots of studently priced shops and eateries nearby"
Beautiful,We walked around the sculptured park and took many photos. The park area is very wide and suitable for families. 
Beautiful University,Wonderful campus worth a lot of pictures. Caffeteria is quite decent. A lot of walking and steps but worth the trip.Outside the main gate is a lot of shopping (Target audience is female university students) and food.
Beautiful University,"I really love the scenery, and the university in korea is open to everyone, ehwa university is known as women university, but what's it special is the building and the scenery itself. it is kind of well-mix between some modern design, and old design. i suggest you while shopping at the nearest street, take a look at the university."
Nice view,I think this is great during Autumn bc of the view. Great for walking also because there are also many shop for clothes and shoes.
More than a university,"what a surprise when we actually see in our own eyes the real magnificent arcitecture, amazing with great histiry... must visit."
I love the environment there,"I proudly say that this is the best open university concept among the universities I visited so far. I love how convenient it is for students to buy shoes, apparel even foods. The environment is so warm with great facilities. I am so in love with this university. "
A beautiful university,The university is surrounded by beautiful garden with a twist of modern and historical buildings. It's nearby the metro station hence I would recommend to visit this place.
I wish I had the energy to go on top!,"There were a lot of people when I came, students and tourists alike. I wish I went to school here. Looks really nice. The garden is nice as well, but I got really tired going up and going up the stairs to. after a few snaps, I just went around Ewha. But really, it's a nice place. The structure and everything about the school looks rad."
Quite a nice stroll during end winter time,This is one of the place that i stumbled upon accidentally. Parts of the school premises are opened to public and it actually pretty romantic place to be with your partner. 
Beautiful,It's architecture is so beautiful and got the somewhat nostalgic atmosphere 10 mins walk to the University you'll find a Line characters toy shop with huuuuge Line bear take a time to drop in during your visit to the University....btw its sometimes very crowded with tourists
an university disturbed by visitors,"Its beautiful landscape, scenery and a fashion street (famous of 10,000 won bags and 1,000 won socks) at the entrance attract thousands of visitors. I agree the students are to some extent, are disturbed by visitors, especially the tourists from all over the world. I would suggest visitors just touring the outside of the buildings and have a walk around the area near their famous library."
Nice architecture,This university campus has become a popular tourist attraction and the university has put up signs warning against nuisance caused by visitors. Some nice buildings are worth seeing especially its sunken library building with steps up to roof top. The campus layout is attractive but not as magnificient as Yonsei University.
Check out Dominique Perrault's architecture,"I went to visit a few years ago mainly to check out the building designed by Dominique Perrault. The campus is nice to stroll around. There is also a museum which is worth a visit. The university gift shop stocks up some nice items, in case you are interested. I went this time to get some gifts for a friend/family. There are cheap eats at the food court, and also some nice cafes. This time, I noticed there is an arthouse cinema too. Well worth a visit if you are in Seoul."
Back to School,You can have a lot of beautiful picture surrounding the University. There are many food stalls and cafes where you can just sit and enjoy a book for whole afternoon!
Every lady will love this street,Lovely street for shopping either for clothes or make-up. Ladies must visit this place and you will definitely fall in love with this place. Street food also available along the way and you can fill your tummy while shopping around the street. 
Simply beautiful,"Each time I visited Seoul, my itinerary would include the university as it had a beautiful setting, with youthful students. The campus has beautiful cherry blossoms in late early April and golden Ginkgo leaves in early Oct. As usual there are many tourists particularly in the afternoons."
Beautiful!,Very beautiful campus. The scenery and the architecture was wonderful. Beautiful to take several photos. 
Made me want to study again!,"The university was such a nice place. Definitely a must visit! Once your done exploring the uni, you can go out and go shopping! Loved this area!"
A beautiful place with stunning architecture,"Well worth a walk through the university grounds, looking at the amazing glass and concrete section, with beautiful gardens at the top. Go to the information centre and you get a free talk by a student on the history, which is actually very inspiring. "
Visit if have spare time,"One of the spots for modern architecture tour. Ewha has its sunken campus by French Architect Dominique Perrault. Don't miss out Sun Tower by American Architect, Morphosis, which is just along the road outside the campus at the west.The campus is a pleasant place for a leisure walk. Recommend not to spend too much time especially this is in fact a campus where tourists cause disturbance.The district is small. The shops around Ewha are those not of prime quality but prices are competitive. It is nice idea to try a haircut in Korean style especially for girls."
its just an university,trust meits just an university and its parkits not a place for tourist and travellingbut if u want to see the university u can come here
Ewha Womans Uni Station,Alighted at Ewha Womans University Station. Another marked on station that one must alight for. Walking to the university and it was totally a picturesque view. No regrets coming to this place even just for some photos. Walking down the streets of Ewha is also another recommended place for shoppers. Real good deals you can get from here too.Beautiful scenic accompanies the trail. Do remember to compare prices from different shops selling the same items if you wanna save furthermore.CheersJazlyn
Beautiful Architecture,"It is a famous women's university. The architecture of building is very interesting and beautiful views. The surrounding area The tree is not only shade, but also a very beautiful. In front of University close to the shopping street. It is similar to Myeongdong. It is a clothing store, shoes and bags in the alleyways. The clothes are not even a lot but that is cheaper."
Great architecture with a variety of shops close by,"EWHA university has a very interesting architectural design, it was done in collaboration with a French Architect which tried to give it a nice elegant and modern finish. The surrounding areas is quite charming, with many small streets and shops where you can get lost in as you explore the city"
Beautiful grounds,Worth a visit if in the area. Nice landscaped spaces to walk about with views of the city. There's a visitor's center that can provide information.
Shopping at Ewha,"After visiting the shopping centres at Dongdaemun, shopping for clothes at Ewha doesn’t have much appeal. Designs are not as good and the prices are much more expensive. There are many restaurants and cafes catered to young people. I found Belif Cosmetics shop there which I didn’t find anywhere else. I bought more stuff from shop carts and the MRT shops near there than any of the regular shops. If you are a bargain shopper for clothes like me Dongdaemun may be more suitable. We didn’t visit the university itself. "
Beautiful university,I was in awe of this University. It is very pretty and a lot of pictures can be taken. The area around the university is also nice and touristy with all sorts of amenities. It's a must visit if you wanna see some nice architecture (the uni building).
Impressive,The university was very huge. Architecture was great as well. Didn't see much on the day of visit as it was too windy.
Wonderful campus,Beautiful campus with museums and attractions free for visitors. A great place to sightsee and the shopping areas around the campus are very affordable for students as well as travellers on a budget.
Great place to shop and beautify,"Agreed that it a nice place to shop. However, i particularly like to visit the hair salon here. I find that it is cheaper than those at Hongdae and its much quieter too. Huge campus but too bad my attention was drawn to the many little retail shops rather than the campus itself."
Good campus!,Really a huge campus! The view is so great! It feels like you aren't in the campus xD Many tourists come here. Good place!
Impressive campus,This is the oldest women's university of Korea. The campus is impressive and the central addmin building is mainly underground done by a French architect. A welcome center gives you the history--founded by Americans. Downside--very hilly. 
Cheap shopping,Plenty of cheap shopping to be done and it was very convenient to come here via metro...It is also safe and opens till late evening.
Great to shop,"Things cheaper there due to cater for University students, easy to navigate and plenty of shops and restaurants there"
