review_title,review_body
What the fuss is all about,"Ehwa University is not too far away from Hongik University and they are served respectively by their own metro stations. Whilst Hongik is grungy and organic, Ehwa has a feel of stateliness about it. On top of the mound is the longstanding campus that's built by foreigners and it still proudly stands to these days, giving it a sense of tradition and history. In actual fact, Ehwa University is one of the most elite female university in South Korea. I truly wouldn't know how students there can concentrate in their studies noting that there are throngs of tourists that are taking selfies and wandering aimlessly around the campus the whole time. The key part of this University will be the Red Sea parting looking architecture designed by Dominic Perault. From afar, you look as if you are climbing the stairs that are flanked on both sides by rising waves. When you get closer, you start noticing that the rising waves happened to be window opening of university campus that's built in accordance with the gradient of the mount. It's cleverly done. Naturally, where there are tourists, there would be shops selling duty free stuff, cafes and restaurants and there are oodles of them nearby. Worth coming here for a look."
More than a common university in the city,"People talking Ewha in Seoul, it equates with a designated elite class of young ladies in S. Korea, with high academic standard, social status, and privileged status from the mass. Most parents spending most of their resources hopping to send their daughters into the university. Outsiders are not allowed going into the campus area, and just allowed to visit glance around the front park, buildings and a cafe at the reception park. But you might already be influenced by the ambience and surroundings, and pushed to take lots of photos. There are more than 30+ cafe just sitting outside the entrance of the university, and with several streets crowed with street hawkers. A good place to go in Seoul."
another shopping area,Just take a subway to Ewha Woman’s University Station (Line 2) Exit #2. There are shops everywhere along the busy road. You can also go into the university to have a look
A huge university,"Ewha Womans University is a huge university and is an ideal place for photograph. However, do check out the timetable there and avoid the students. Basically, it is just a university and nothing much different. There are only tourists without students if you go during the wrong timing. The Ewha Womans University Shopping Street outside is definitely better."
Ewha Womans University," In the three---month summer holiday, I take a visit to Seoul. And I also want to know more about the culture and study of different countries. The easiest way to know more about it is to get in the university to feel the atmosphere. So I take a visit to Ewha Womans University. We go there by subway. Actually, subway system is quite convenient for us to use. The surrounding of the university is also a commercial circle, like food stores, fashion shops and so on. I go shopping around the university with my friends firstly. The clothes are reasonable and fashion. You have a lot of choices. Then, we enter the university. The campus is really quite large. It also has many trees. This is what I enjoyed mostly. It is a nice place for people to take pictures. I advise those people who enjoy taking pictures need to have a schedule plan in order to arrange better time."
Great architecture!,"I recommend to visit this place at night. Search for the lit architecture and take a picture, it's definitely beautiful! Outside of this university is one great shopping area especially for women - a lot of cheap finds."
Beautiful campus - shopping paradise for girls/women,"The campus is beautiful! Great mixture of traditional european architecture with new, modern elements! Make sure to stroll around campus and just enjoy the view!Don't miss the art museum!! Right by the main entrance are a great number of stores, that will be every girls shopping dreams come true. Better hold on to your credit card ;)"
Will make you re-consider,A walk through the spacious campus can make you re-consider and think about getting a degree from here.You can feel the history and prestige in the air and everyone is very helpful around.The library looks great and is huge.
Nice walk round the campus,we walked outside the buildings and it was beautiful to take pictures. There is a kind of stately feel as you walked round the campus but it's not all buildings. There were trees and areas where you can sit around and enjoy the November cold. Good for photo-taking.
big and beautiful campus ,it's was my second visit.the campus is opened to public so long as visitors are well behaved. we were glad that it was not prohibited from visiting after there were incidents that students were affected during their lecture.everywhere in the campus is great spot for photo shooting. there's places for rest and relax as well.worth a visit!
"Stately, Pretty Buildings","Ewha Womans University has a beautiful campus that is fun to walk around. Possibly their main attraction is a ramp downstairs that leads to a huge stairwell back up. It is quite impressive, and fun to take photos around. I did not enter any of the buildings, aside from the shops lining the aforementioned ramp/steps. So I can not talk about the interiors, or classrooms. Oh- if you want to save the calorie burning, there is an elevator that takes you from the bottom of the ramp up to the top of the stairs area. The elevator is inside the glass building housing the shops!It was neat to walk around and see university students in another country. The surrounding area has well-priced clothing and make-up shops. Definitely worth checking out, as walking around is free. But if you miss it, don't beat yourself up."
Experienced the prestige ,A nice compound with spectacular views and architectural designs. Autumn colors added stories to the university and the prestige experience is worth a short visit if your time in Seoul permits
Beautiful University,"during autumn , this place is really beautiful...add that with the youth energy from the students, its a wonderful place to visit. The architecture is beautiful!"
Ewha Womans University walking street,"You will find the goods/foods at this area is much cheaper compare to Myeong Dong and Dongdaemum.you may spend a days to walk, shopping and site seeing at this area. "
Nice place to taste the street food,Ewha Womans University is easily accessible by subway train. There are plenty of street food to be savoured. Must try the Beansbins Coffee ice-cream waffle.
"A bit difficult to visit , as the signs ask you not to, if you're not a student",The signs ask you to politely refrain from visiting unless you are a student. So if you are a bit naughty you can still have a little bit of a wander to see the older buildings.
Not only an university,"Ewha Womans University is a good place to visit, not only the environment is good but also the shops around that area are great...Good quality and design shoes....Gd cafes...... and some small shops in those streets have good clothes."
Modern and classic university,"Ehwa University is definitely a worth going attraction in Seoul. The university distinguished itself with other universities by the uniqueness of most of the building inside, which you can see lots of lecture halls renovated from church. I visited this uni twice already and surely will bring my friends/family there during my next trip!  "
"Beautiful campus ground, cheap buys at nearby street and alleys",I doubt most people go to see the campus. Despite the heavy rain we still managed to get in to admire the beautiful landscapes and campus layout. The highlight however is the cheap clothing along the alleys and backstreet. Upon leaving the subway station you see the main street. Go to the backstreet running parallel to it and you'll find many shops selling clothing at bargain prices. Then use the savings to buy yourself coffee at one of the numerous cafes. 
Amazing structure,The under bridge idk what they call it was stunning. The gardens on the side as well. There are also shops outside the campus. It's a very wide campus and good scenery. A must visit for tourists.
Beautiful building!,"The pyramid looking building is as stunning as the pictures..which is the main reason people visit the University afterall. The surrounding area is small but charming, with a short little drag selling your usual cosmetics, clothes and some street food. There's also some cut cafes and restaurants down the slope infront of the Uni. There's this particular cosmetics store down there that sells goods for at least 40% cheaper than all the branded stores..DON't buy anything from there. It only welcomes tourists and for good reason! They either sell imitation Chinese products or stolen goods ;)"
Beautiful Campus,"The campus is simply beautiful as it was designed by French architect, Dominique Perrault. You can take many amazing photographs here. The shopping street is also great and you can get good buys, even for men. It is also accessible via metro (alight at Ehwa Women's University)"
Feels like in Europe,"This campus has unique, modern and amazing architecture. Really love this place! I would be very diligent if i were one of this campus student"
"Unique, beautiful university",This university's design is very unique. The area is very beautiful. Love the feeling of Autumn at this place. 
Dominique Perrault architecture,"We were here for the campus centre by French architect, Dominique Perrault. Such a beautiful and brilliant design. Definitely worth visit!"
Interesting and scenic,"Went there on a weekday in the afternoon, so it was not crowded. Nice setting with interesting architecture. Even on a weekday there were many overseas visitors. It was a sunny afternoon so it was ideal for taking photos. One could walk around quite freely except for restricted areas. The central V-shaped walkway was the centre piece of the university and it looked great in the late afternoon when the sun was setting."
Nice place,It's one of the most old university in South Korea they say. It's known as woman university but don't worry cause man can go in there too. It's open for public and they have strict open time.
Shopping area,"This university is faamous not only for the enviroment, it is also the surrounding area has lots of restaurant and cafes as well as shops. Don't miss out all the shops... just can't stop crzay shopping. "
Shopping,We probably did most of our shopping here. There are so many stores along the Ewha Womans University street. The deals are amazing as well! 
Baroc biuldings!,A very beautiful uni built on a hill so you need to go up lots of stairs if you want to see all the buildings. The street leading to it are full of shops that sell cheap clothes and shoes. lots of things to eat. a small park where you can rest and refresh.
As an university its amazing but...,The campus of this university is amazing and its worth a visit. But remember its a university. You get to take a stroll through the campus which is amazing. It also got some nice looking buildings.
Good place to go around,Ewha university has few nice places where you can take nice photos. A plenty of restaurants and shops available for shopping / dinning. A good place to visit during your Seoul stay.
Korea's first women's university,Large campus with modern design for some parts. You will also find a lot of shopping Streets very crowded in the afternoon. 
"For shopping, eating & taking pictures","Edae is a must-see place in Seoul. You can check out the Artbox (stationery/cute goods store) right outside the station. As you walk towards the university, there are also lots of shops along the main road and stores with cheap, trendy clothes if you walk into the streets (mostly for women). This is a great place to photograph. I went in the beginning of May so the flowers had just bloomed. There are lots of restaurants and coffee shops around to choose from. I ate at an awesome shabu shabu restaurant hidden up the hills. & there's an Auntie Anne's nearby! (I love pretzels.)"
Beautiful university!,"I gonna say their campus is so beautiful, a great place to take photo. we went in and had lunch at their food hall. there are shops in the campus as well. Be sure to check out the shopping area located right outside the uni."
Many restaurants and shops in the area,You'll find some great restaurants and many shops in the area. It's a nice place to visit. Especially try to find Italian restaurants.
Beautiful University Campus,This is an oldest woman's university in S. Korea. The campus of this university is worth to visit especially in autumn time. The buildings here are in classic style. Many tourist come here. Recommend to visit during weekday.
"Little ""England""",Was amazed that so many tourist flocked to visit Ewha Woman's University the whole's largest female uni & one of the most prestigious uni in South Korea. It is located in a small town very much like in England. Spend some time to the University Museum - it's free entry.
Stunning campus and shopping area,Spend an hour or two in the campus walking around and end up shopping at the shopping street before having a cup of coffee nearby.
Worth a walk!,I always saw this campus through Korea shows and wanted to come for a look. Glad that I came because the buildings are so interesting. I didn't get to walk around for a long time because it rained when I got there. Definitely come with someone so they can help you take some good pictures! 
An architecture documentary made me come,"Honestly I had seen a documentary on the newest part of Ewha campus and I was interested, so I naturally visited. The newest part built by Dominique Perrault Architecture is impressive and enchanting. It somehow beckons you to come and explore more of the university grounds. If you love architecture and want to see how an addition to an old campus works wonderfully - visit. Even if you aren't that interested around Ewha are wonderful shops and places to get a great outfit."
A stunning campus,"The campus is, in a word, stunning, and close to the famous Ewha Women's Shopping Street. It is a good place for a stroll to appreciate the architecture on display. Green and well maintained. The terrain is quite hilly so be prepared."
"Best shopping area for women, stunning campus!","I walked outside the area of the library and the main church. the campus is huge but very clean and impressive with the little green areas. The entrance of the library makes a great place for pictures. When you visit this area, you will notice the the shopping area nearby. And this is an absolute must place to visit for those women who love shopping for bargains and deals. Most of the items vary between 5.000-15.000 WON. I literally spend an entire 8 hours here with my friend shopping around. "
Really nice uni,"Well, I was there for a conference so we got to walk around the area and use facilities indoors. Area is lovely designed, and architecture is really awesome. Peaceful, clean and nice outing "
Nice architecture,"The architects have done a good job with this place. The main attraction is definitely the 'valley' which curves under and up again. The campus buildings are of note too - if you have time, do walk around. Head to the university streets for affordable goods thereafter."
Women's Education is important ,"I am pleased that Korean women were able to get an education due to Lulu E Frey. I enjoyed the history, architectural and culture element today. There are a few good pieces in the Museum and the one on filial piety caught my eyes. The renovations of the university grounds took a long while. The modern lines complimented the old building very well. "
Worth a visit,The architecture is great with a mix of old and modern. It's nice for a quick walk around and there is a small free museum at the entrance with a nice sample of Korean art and wood furniture (and air conditioning of you just want to wonder around and cool off for 15 mins)
Designed buliding,"If you love to visit a good place and good-designed building, you should go here! Not only take photos but along the street you can shop and eat a good stuff and food. For women you will love here you will find the cheap and nice clothes and skincare product all day and night."
Cheap shopping,The shopping street area is not big so can just spend some time here before moving on to those underground malls with equally cheap clothings. Came here just to check out the Uni..
fine architecture game,"it's super interesting to see the main building, with the famous downhill staircase, and the surrounding nature."
Love the street outside the university,"there are many stores selling beauty products, tibits, shoes, bags, and accessories. There are also cheap eats along the road. A few reasonably priced restaurants around the corner as well."
Beautiful university campus and museum,"This is a resubmission with changes. ID#: 378445951Take Subway Line 2 to Ewha Womans University station, exit 2 and walk a few minutes towards the campus. Stop at the Visitor Center on your right and learn about the history of the university and visit the gift shop where they have a very nice selection of items. Walk around the campus complex designed by the French architect that did the Pompidou Center in Paris. Make sure to stop at the Museum where you will find Korean paintings, ceramics, metal items and sometimes special displays. It is a museum where you can get a good view of Korean art in a pleasant atmosphere and in a short period of time. Outside the Museum there is now a trendy coffee shop. If you have time, walk on the streets outside the campus and you can find MANY cosmetic stores, clothing shops (note that they do not let you try on the clothes), shoe stores and the best bargain in Korea: socks for $1/pair (they make great gifts). In addition there are many inexpensive eating places--my favorite is Albab Restaurant (2nd street from the campus on the way to the subway), it has bibimbap for $4-$5 and many other dishes.If you go at night, the area is bustling with young people. The stores and eateries are opened well into the evening hours. This is a fun place to visit."
"Love the Campus, love the street","I visited this campus in April. Campus is so 'Europe' and love the environment so much. You can see 'Li hwa' everywhere ( this is the name where it come from, I think). Cheap clothes and accessories for woman when you walk down from the street. Prices lower than myeodong. There are some stalls located along the street and nice try. Be a one day student when you visit this spot!"
luxury university,"it must be a good thing to do learn in this campus, with complete facility and luxury place, very clean, quiet "
Cheap fashionable clothes and delicious street food,"A university area that's vibrant and full of people. There are food carts lined up and scattered all over, with cheap but delicious food. The clothing stores tend to sell similar items. Some store owners are friendly and will let you haggle down the prices. Most of the clothing are of one size though but there are stores which cater to tourists and sell larger sizes. You can get the trendiest clothing from here for a very good price! Stores do not stay open until late because it's a student area!"
One of the most popular University in Korea,"I had a assistant professor gave me the tour of the school. It was surprisingly large campus with lots of characteristics from contemporary to modern buildings, flowers are all over the campus which was so nice.I can see Starbucks to McDonald right outside of the campus, most chain stores are there."
Beautiful Campus but it only tood me 15 minutes to finish it all,"Visited this famous campus and while it is no doubt, one of the most beautiful campus, the area is just too small for me to make an effort to come here just to visit. Spend more time around the campus if you're into woman's fashion, sweet shop ... basically, everything woman related"
Beauty Products and Fashion Galore,"As the female university is in the area, there are many stores selling beauty products, clothes, shoes, bags, and accessories. There are also cheap eats along the road."
A tourist spot for youngsters and the like,I did not expect that this is an attraction aside from the market near the university. I suppose that it's not only students who come here often but also those who want to buy in the market and those who want to see the aesthetic beauty of this university.
interesting architecture,"Spent about 30 minutes inside the campus to admire the architecture, which is beautiful. It has a nicely manicured garden great for pictures. Huge number of clothing, shoes and accessories shops outside the campus. Lots of street food and cafes in the area too."
"Nice Campus, nice view of Seoul's night view","We had some time to kill so we decided to visit this women only school. The school was founded by the missionaries in 1889 (?). Very nice job of landscaping here.. so beautiful. Buildings were all sitting on the hills, so there's some hiking to do get there. Once you are on the top of the hill (where ladies dormitory buildings are), you have a wonderful view of Seoul's night lights, as well as the view of the Namsan Tower. "
Great shopping street,"We went there by cab and stop right in front of the university. Pity we did not explore the campus though but the area was good for shopping and more so if you are on a Budget. You can find some street kiosk selling food and some cafes here and there. Of course, not to mention Korea cosmetic stores that you can practically see it everywhere you go."
this campus is sooo pretty!,"go walk around Ewha Womans University, its really prettyy. go walk around the Ewha shopping street just outside the university, affordable clothes! "
Ewha Uni landscape of beauty,Ewha Womans University is a private women's university in Seoul founded in 1886 by the American Methodist Episcopal. It is the world's largest female educational institute. Ewha Womans University is one of the prestigious universities in South Korea.We visited the place because its such an awesome campus.
A university which is also a tourist attraction,"This university is specially catered to girls and women. It is open to public and there is a beautiful garden (not sure it is as it does looks like one to me) at the centre of the compound where you can take a walk around, taking pictures etc. Along the way to the campus, there are rows of shops that sell fashion apparels, bags, accessories, cosmetics and street food too. The things there are relatively cheap maybe it is near the school. Good place to shop around (though area not big) if you are looking for fashionable stuff."
Great shopping area!,Love the shopping here. Most shops are selling from 5000-10000 won clothes!!! Some street foods along the road. Did not go into the university to check it out.
incredible campus,"incredible campus to walk around or play games in the grass, recommend walking up and down the street just in front of the uni for food, snacks, bubble tea, and cool little clothing shops."
Very beautiful and unique architecture,The architecture design of this building was unique and the landscape of the surrounding was very beautiful especially during spring which will be so colourfully.
Unique building structure,The campus is large and hilly. It has interesting building structures that one can browse around. It is about 5-10 mins walk from the subway station
"Ladies shopping, minus crazy crowd","A good spot in Seoul for ladies shopping if you cannot stand crazy tourist crowds. There are quite a selection of street food too. Do expect to see many ladies on the street, not a problem at all but quite fascinating."
Shopping,"I happen to visit Ewha University when I was shopping around the area. OMG, ladies this is the best place to come shopping for clothes if you're on a budget. Most of the shops here sell their items less then other locations on the exact item plus you can negotiate too. Sellers can speak decent english and they're all very nice. Ewha University is very beautiful too. There were a lot of tourist visiting here."
Beautiful place,"I was in awe of the beauty of this place. Also jealous of the students who get to study in this beautiful place! Best to come during winter, where the sky is blue and you can take nice photos. You can shop and checking out the fashion street, with plenty of selections for clothes, cosmetics and dessert cafe. We are not sure why majority of the tourist would not visit here, but it's definitely a must & highly recommended for me, at least in my opinion!"
Amazing library,Nice place to take lot of photo or just relax with your take away coffee at library stairs.It's one of tourist attraction.
Good place to shop arround,"I stayed in a hostel less than 3 minutes away from Ewha Woman University main gate, and it is a great place to stay. There are a lot of clothes shops arround the streets, and a lot of delicious food. The university is also really pretty, but there is nothing much to see if you are not a fan of arquitecture"
Grand university,Beautiful university conpound. Another good choice for shopaholics n food hunters. Surrounding environment is peaceful. Worth to visit!
A place of history and significance,A long history of looking down at women ended here and freedom and significance sprang out. Buildings are nice and the new library is beautiful. Take time to walk around and learn the background and history of the place. Worth the time if you are interested in a deep insight into Korea and it's history 
