review_title,review_body
Interesting experience if you are nearby,Firstly do not travel here for the sole purpose of this attraction otherwise you will be disappointed. Was around the area as I went to Loveland. The Korean GPS number gives you the wrong coordinates so follow my direction. When you exit Loveland turn left and it will be ~100m down. You need to drive further up past the point where it says start and make a U-turn in order to start the experience.
So mysterious!!,"Due to the bad weather and rain, my friends and I just managed to experience the mysterious road inside our tour guide's car. The car is moving upward when our pretty tour guide turn off the car engine and the car keep moving up... If you have the chance, experience yourself!!!"
Interesting. ,Ok place . If schedule tight may skip the place. Nth special. Just a short vehicle rolling to upward slope. 
"The car will go in reverse, even though the slope is in the opposite direction","The taxi driver showed me this while I was headed to Love Land (nearby). He put the car in neutral near the convenience store area, and even though it slopes downward, the car will roll backward. It was cool, free, and quick. I would not divert from an itinerary to experience this, however if you want a free thrill, check it out."
Nothing special,"Was in the area, so decided to have a look at this phenomenon.Turns out to be optical illusion.Tourists were trying to get their cars rolling ""up"" the slope, children were trying to get bottles rolling, and local drivers were getting annoyed making more aggressive manoeuvers than usual"
Nothing much to rave about,Its a road with a convenience store beside it. Children would have fun to see how the water flows uphill but other then that not much else
Now I know the mystery,When I heard there is a mysterious road in my tour itinerary. I was thinking what the he** is that? Now I know. The world has lot of unanswered questions.
Really mysterious ...,Is just a short road to be amazed. Not worth to travel so far. Saw people trying to roll water bottle on the road and ignoring oncoming cars. 
Surprise,We went here by bus. We were not allowed to get off the bus. It might be a nice moment but not if you sit in the rear part of the bus.
Optical issue,Basically this is interesting place ... might be mystic but in fact it is optical fake which makes you thing that items go up to hill. In fact road still goes down.
Unbelievable uphill and downhill rule.. it is against..,The stretch of road looks like it's uphill but rolling a water bottle will make it roll uphill instead of downhill. It's interesting to explore.
Gravity hill,"Since Jeju is best travelled by car, the mysterious road (it's actual name) is definitely worth checking out. Putting the car on the apparent downslope in neutral gear will make the car move backwards and vice-versa...freaked us out until we discovered the optical illusion behind it. Be careful of all the other cars trying it out as well as pedestrians attempting something similar by pouring water onto the road surface."
Not sure what the mystery is....,2nd time here but still not convinced about the mystery...only thing is that the car can move on its own without stepping on the accelerator
Not worth,Not worth the long drive to find out the mysterious answer in less than a minute. Is all within one eyesight !
MYSTERIOUS ROAD LOST ITS EFFECT??,We drove along mountainous route 1139 from SEOQWIPO to this place before heading to the airport. We drove very slowly from the start to finish point and didn't feel the illusion effect. Some said to see the effect one needs to roll a bottle on the road. I dunno.. i just drove on without stopping. I would however recommend those who drive to drive along route 1139 skirting the mountain and reaching the 1000m height.
Optical illusion,"Interesting spot but nothing to WOW about, just an optical illusion so when you are traveling ""up"" the slope but in actual fact, you are going ""down"" a slope (a few degrees). Roll a bottle and you would be able to tell the difference."
Nothing mystery,"This mystery road is just a small portion of a long road with many undulating slopes. There is sign broad showing the start of the mystery. Both sides of the road has plantation indicating the road is up slope. Vehicles with engine killed will moves slowly from the start point with the plantation effect. At the ending point when out from the vehicle, looking at the road as if you are on the top of the small gradient.According to academic research, it is actually down slope but due to side plantation causing people to view wrongly."
Guess it would be cool if I had a car ...,"I came here by bus .. so I waited for the bus and cars to go on neutral and watch them drive up he hill hands free.Some people poured water while other rolled a water bottle.Since this attaction takes less than 15 minutes, i would suggest also going the Jeju Art Museum next door :)"
Uh...It's Neat? I Guess?,"Don't go out of your way for this, lol. It's not an ""attraction"" per se, but if you are driving and this is on your way somewhere (like it was for us), you may as well check it out for the five seconds of amusement you will get from it."
Family with young kids,Its indeed mysterious rd!! A kind that cannot be found anywhere else.. Very unique n puzzled s we did experimented few times from the start to the end...
Just a road.,"If you're a free and easy traveller, I'll totally not recommend you to travel to see this mysterious road. If you're on a tour bus, this is an interesting experience. "
"Cool, but not a must. ","We had a taxi tour and this just happened to be on the way to a museum. It was neat to experience and see, but I wouldn't stop by if it was out of the way. "
Not worth your time ,The only thing mysterious about it was what was worth the mystery of the road. If this is attraction worthy... Oh well. Some people are amused by the littlest things. Must be nice. 
Honeymoon @ Jeju Mysterious Road,"We gave a 4 stars owing to its mysterious element.The 100m stretch of road appears to be uphill but it is actually and in fact downhill. This can be done by several experiments. E.g. pour water on the road, put a bottle of water and it will roll towards the ""uphill"", walk or run backward along this road; you will feel the difference whether it's uphill or downhill.There are a few stalls selling food so you can eat and think how this is possible."
A really mysterious road!,"We went to this road and true enough, mysteriously, the van moved despite the fact that the driver stopped the engine. whew what a mysterious road!"
Mystery needn't to be solved,"It is a good experience to be there and see how mystery the road was. We were with our kind tour guide that gave us an experiment to test the road. Pour water and see where it flows, true enough it was a mystery (still need not to be solved)."
Mysterious....,"Not a must-visit but it's good place to explore for first-timers. The stretch of road looks like it's uphill but rolling a water bottle will make it roll uphill instead of downhill. It's interesting to watch. Since I self-drive, there is no exact gps phone number for this but you can key in Loveland and you will see signboard to mysterious road. Parking here is free and there's a nearby convenience store and one can chill at caffe bene afterwards."
A normal sloped road,A normal sloped road which may not be worth it if you have limited time on jeju. A little over-hyped.
Mysterious indeed,"We were on a tour bus when we passed by the road. There were quite a lot of people so we couldn't really go down and take pictures. It was literally a 5 minute driveby. Luckily, I was near the front so I had a view of the road and it's optical illusions. I recommend coming with a rented car or taxi, not with a big group. Then you get to really appreciate why it's called the Mysterious Road. I heard from our tour guide that some golf ranges in the area have the same effect to. Golfers should ask around so you can play there. "
So mysterious...and we feel nothing..not impressed at all,"My suggestion... not a must tourist attraction to target..Find another truly mysterious attractionAlthough attributed with story about when and how this mysterious road appear to be odd, still nothing can retain in memory Skip it from your agenda"
Try and figure it out!,It was amazing! One seemed to be on a uphill yet the car was moving backwards. And vice versa. Try using an empty water bottle (cylindrical in shape) to test it out as well.
2 minutes of joy,Nothing much else to write about except that it will take you 2 minutes to experience this and is really close to Love Land which is something you should checkout.
Mysterious Road,Unusual phenomena as our stationery car that was on neutral could roll upwards by itself. Other than that nothing to shout about 
Amazing! ,Was feeling really amazing when passing through this road. The tour bus was moving even though the driver has turned of the machine. Recommended anyone coming to Jeju to try this herself/himself.* TK 
Unique road,Visit if you are free as there are other roads like this in many parts of the world. Objects roll up the slope appearing to go against gravity however its due to an optical illusion. If you visit make sure you try it yourself.
Car moving on its own,"When car stops the engine, it goes on its own. Other than this, nothing special. However, we have tried to use wheelchair to see whether any similar effect, its not working."
Unique road,"I forgot why, but in this road even your car have been turn off , your car is still moving, but i forget the reason"
For the Inqusitive - Jeju Mysterious Road,Nothing spectacular but wouldn't mind a stop by as its along the way to nearby restaurants. Should try the hot rice cake and fish cake though.
Worth a 5 minute stop,"Looks just like a normal road, except that due to the slant of the trees it appears like things are going uphill. A trick of the eye, and a cute experience."
Optical illusion street?,"It is just a street; however, I was surprised when I put down my Evian bottle water n it started to roll by it self (fast enough) even though it was put on a flat street."
Mind Boggling,Spent no more than 30 mins. Witness how nature trick our mind. Looks as if it is an uphill road but in actual fact it is downhill. Have a bite at the stalls beside the road.
The Mysterious Road,We came to The Mysterious Road and it's said that when you're going uphill but actually it's you've going flat Road or otherwise!But I couldn't feel anything so in the end we just took some photos and go to another destination.
Sloppy road,Nothing special about this road. Not recommended just to travel there unless u got nothing else to do. Just some eyes tricking stuff 
Good fun!,This is where physics takes over. Let the fun takes over. What you see don't really make sense until the guide explains it to you. All in natural surroundings and in good time. Don't forget to try out the street food there while you are at it. Made my day. Cheers again! 
Interesting,"The driver dropped us there on a rainy evening. It was a nice experience because it makes you wonder why would the vehicle move 'upwards' after the driver has killed off the car engine. Due to communication barrier (a Korean driver), she could not explain it well to us. However, it is still interesting."
Very short quiet road,It's a short quiet road so do keep a lookout when you are near. We tried to pour water but it didn't go against gravity as mentioned.
Impressed for this Mysterious Road,"Actually originally didn't think to visit this place. But coincidence have the chance, me and my travel partners was shock to see with our own eyes for the water and bottle both run to the upfront road which its was suppose to be opposite way....Make youself drop by to see this amazing effect while you around in Jeju. This place is just very nearby the Sex Museum which we didn't go but passby~"
Check it out!!,We drove there since we have a rental car.Indeed the vehicle moves uphill on its own when in neutral.Interesting.Need to figure why though!
The road where things roll uphill?!,"This is a very interesting place to visit. Our driver put his car in neutral gear, turned off the engine and put his keys on the dashboard, and the car rolled uphill! We got off and watched other people put bottles of water on the road and they rolled uphill as well! It is actually an optical illusion, but still a strange sight to behold. You don't have to stay here for long - maybe 30 minutes will do."
Cool !,Been here since in tour itinerary and feel amused! Our big bus with 30people in it still able to run when the driver put the engine in off position! And it's quite fast as well maybe 20-30km/hr When we off from our bus and try to pour a water they go to the side or even go up instead of flow down. Recommended tourist spot to visit and try by yourself!
Amazing,"Curious a lot but not much time belong the legend story about this road is looking down n the cover of seems getting up by tree for side of this road. We tried to engine off and its moving forward, nice its like magic. "
mysterious road 😁,"Trying this if you hire a car and drive thru it.basically turn to neutral gear, car will move eventually.suppose a down slope instead of up?Go experience it! is nearby Loveland. "
Amazing experience,With regards as unable to download the recorded clip. Was a fun experience. Located just outside of Famous Love land. A start & end point we clearly shown. 
Gravity defying magic,"There are sign posts to mark the start and end of the 100 metres stretch of the Mysterious Road. Pretty fun to play ""magic"" with family and friends. Put your car to neutral gear, release your foot off the accelerator and notice the car moving ""uphill"" on the road. Recreate the same effect with a bottle or ball rolling uphill. The Mysterious Road is actually a gravity hill i.e. a place where a slight downhill slope appears to be an uphill slope due to higher surroundings, creating the natural illusion that water flows uphill or that a car left out of gear rolls uphill. Worth a fun stop if you self-drive!"
Pretty Unique,"Visually, the road is seen to be an uphill road. But when the bus driver turned off the engine and release the brakes, it starts to move forward. Quite interesting. But don't purposely go there unless it's part of the journey. Not worth."
Mysterious,The bus and car will still move while the enhine turns off. Use a bottle of mineral water to try. Just stop and try. 
Only worthwhile as part of a tour package,"It is only mildly interesting as part of a tour package which include this as a drive-through attraction.Plenty of cars & coaches stop & have their engines turned off to experience the ""rolling uphill"" mysterious effect.It is quite interesting to see how this phenomenon and the perception of the surrounding environment to the naked eyes has come so far to give birth to a tourist attraction. It could also double as a quick pit-stop to grab some snacks & skewers at the food store along the road.Hint: Get there, spend 5-10min walking one way forward, and then walking backward, or lay a half filled water bottle on the road, to crack this mystery."
A little mysterious but quite interesting,it is kind of mysterious to the naked eye but in real fact it is just your eyes playing tricks on you. Interesting though
Not that special,"If you have a lot of things you want to do in Jeju and are driving to do them, this is just kind of unnecessary. I actually had a hard time getting what I was supposed to do and once I did it I was like, meh, that was kind of a waste of time. Just keep driving to your next location."
Fun to do for 10 mins,Was fascinating to watch cars and buses stop and roll uphill. A skateboard would gave been useful. My insect repellent definitely rolled uphill for a bit.
Mildly interesting,"Few hundred feet of road that makes you feel like your rolling uphill with the car in neutral. Best is to begin at the start point from a full stop place the car in neutral and release the brake, the car will begin to roll very slowly and it appears that you are going up a slight incline. I would not go out of my way for this... although I did. If you have plenty of time or nothing to do because of rain then why not."
Unique,"Couldn't believe eyes when the car started to go ""uphill"" even though the engine has been turned off. My son and nephews put a water bottle on the road and it rolled ""uphill"". Very unique "
You have to try it to believe it,"Tip: when you are on that road uphill, please put the car into NEUTRAL gear & switch OFF your engine. That's the only way to test. You will then see that the car is indeed going uphill when gravity tells you that you should be descending downhill on that slope.Having the engine on would offset the effect.Try it."
So mysterious,This road is a must place to visit. It is weird and so cool. You can experience something that you never see before. I recommend you to come to here if you visit jeju.
Science experiment,Bring half full water bottle and try to experience the car is moving uphill without engine running! Don't forget to give hazard signal when you try this experiment ;)
"Small, but worth a visit","I have driven pass this place coincidentally It's quite unique place, worth a visit. A few shops, restaurants, café, and street food markets."
Only if you have plenty of time,We stop here on the way to the airport. It's quiet interesting experience when the car moves. Can't help laughing inside the car as the power is off but it still moves.
Uphill the Mysterious road on Neutral,"Put your rented car on neutral going ""uphill"" and experience it. Mysterious probably because for most it’s a baffling experience having your car in neutral but going uphill, backwards or forward – hands off the wheel and feet off that pedal. The place is on the way to Jusangjeolli by way of the Mount Halla route from Jeju town. 5-10 minutes (no crowd here) and you have covered one of the “touristy” sites in Jeju. A woman attempted to see what would happen with a plastic water bottle placed on the road, nothing did. Why would any vehicle with so much metals built into it got pulled but not a plastic bottle? Go figure. I have encountered a similar experience at a site in Saudi Arabia near Madinah which has a longer stretch for that “mysterious” experience. "
Impressive but too short,"Just like everyone already mentioned, the road is indeed mysterious as the car would really move uphill on its own. However, it is only a very short stretch of the road. But I would still recommend it if you are self-driving and it's your first time in Jeju. Definitely, something you have to experience.You can also head to the museums that is nearby too after going to this road."
Mysterious?,"It is indeed mysterious as to why this spot is named as mysterious road and promoted as such (there are road signs giving directions to the spot in the city). I think the road is not steep enough so that when the car is put to neutral, it goes too slow to create an impressive illusion."
Maybe good for family with kids,"The place is good only for families with little children.Kids will be excited about the fact that a car(or bottle) seems to go up on downhill. However, for adults? Not really...If u have plenty of time to spend on the road."
Kind of odd.,"Drove to this portion of road after Mount Hallasan. There is a sign that says ""start of Mysterious Road"", but it neglects to tell you to put your car in neutral at that point. We didn't do it and were wondering what the big deal was. After having waited in a slowdown of cars we decided that we didn't want to try again. Had a great laugh!"
Review of a 14 year old girl,"For some reason, we did not manage to see the optical illusion during our visit. However, the environment was nice so we had quite a great time there."
Not so mysterious,"Don't make a special trip to see this place, Only interesting if you pass by. I mean, it's only a piece of road where you turn off the engine on the incline and watch the car roll for a few yards. We've got more interesting mystery spot in Santa Cruz, Calif."
Fascinating stop,It's not just any road. Free your gear and drive uphill! Is that possible? Not according to science. But you could do so at Jeju's Mysterious Road. Sometimes your eye may play tricks on you. Find out how on this road.
Only Stop if You're in the Area,"This site is just around the corner from Love Land, so if you're in the area or need a restroom, stop. Otherwise, don't waste your time and gas just to drive here.When you see a bunch of cars with their hazards on, moving very slowly next to the 7-Eleven, you know you've arrived. Put your car into Neutral and watch as you slowly appear to roll up hill."
Amazing!,It's the magic of science that explains all what a human naked eye cannot see or realize if not explained. Must see this magic trick of earth's wonder. RockNroll!
A fun out door illusion,"Not a must visit, though a spot of fun if you have 15 minutes free as your vehicle seemingly rolls its way 'up' a hill."
Outdoor illusion,"Jeju-do best attraction, the Mysterious Road (Dokkaebi Road) or Goblin road as folk story say, it was the goblins who does the trick.. sound interesting. Young and old will find this place fun and mysterious. All you have to do is just stop your car at the designation point, on the double sign(emergency light), off the engine, release the hand brake and let the car move up the hill by itself, 'Yes.. roll up the hill'.The best is, this attraction is free of charge. Along the Mysterious Road, have a few food stall, try out the grilled black pork sausage and many delicious food. For those driving, key in the number 7126988 (yup.. heading to Loveland, you will reach Mysterious Road first), most people stop by here on the way to airport."
Vision trick,"It is just a vision trick. The road appears going up when it is really going down, so cars and buses can glide down when put in neutral. The way the trees at the side of the road is planted tricks your vision. Coming from Canada, we have seen it similar to the one in Moncton, New Brunswick. "
Fun iĺlusion,"We intentionally left town on an alternate route so that we could see this road, and it was well worth the extra few minutes. Follow the directions and have fun! If you want to view the road correctly, then pull into the parking lot behind the pig monuments :-)"
mysterious,"if you go by walk don't bother to go there, you can't notice anything apart from cars driving very slow"
Mysterious Road!,"It is really a mysterious road!!! It is a upslope. However when u off engine, the car will move dwn by itself"
A brief stop on our trip,Our tour guide took us there and the road ahead seemed to be uphill when viewing from our tour bus. Our driver then put the bus in neutral gear and amazingly our bus moved slowly up (actually down) the road by itself. An interesting optical illusion. 
Fun to visit it if it is on your way,To experience something different something unique not know how the car keeps going with the Engine turned off. We did it on our way over and our way back to the hotel. It was fun to see all the tourist on the roads waiting to see each car going without the start of the engine.
Very close to the main road for a quick visit.,"Our driver/tour guide took us here on the way back to the hotel. Actually, he said it was his first time there as well. My 17-year old son and I felt the uphill rolling and it was a weird feeling. Not sure why it was doing it, but we saw some tourists pouring water on the pavement and watching the water rolling uphill. Many years ago, I took my son to a similar ""mystery road"" in Manzanillo, Mexico. Back then, may be he was too young to feel it, or may be I was a terrible tour guide, but this time he finally got it. So, it was fun for us to take the quick detour and had some laughs. Oh, and it was free and there are road signs tell you how to experience the ""mystery""."
"Not that cool, but worth it if on the way. ","We had no plans to see this, but on our way to the airport, we stumbled upon it. Put the car in neutral and slowly rolled ""up hill"". We laughed for the 15 second experience and went on our way. Certainly not worth going out of the way to get there. "
Amazing,"You put your car gear on neutral without stepping on the accelerator, the car will move by itself even though the road is flat. There is 7-11 next to it. Within 5 minutes walk is The Loveland."
Optical Illusion,Put your vehicle on neutral and it will seemingly be rolling uphill. Very intriguing.Unable to figure out how it happened but definitely have something to do with the way the trees were planted along the road.
Need to drive in order to have a full experience,"Drive yourself to the 100m stretch of road. When see the ""start"" marker, put your gear to neutral and you will notice that the car is moving forward even as you are going uphill without engaging any gear. Pretty interesting short experience. "
"Wow, explain that!",Arrived and saw many tourist came by bus just to check out the road. We tried with our car and it really goes up the hill with free gear. A place shouldn't be missed if driving from jeju city to seogwipo.
Similar to Mystery Spot in Santa cruz just a little weaker,The car can move uphill in neutral gear. Water will flow uphill. Ball will roll up hill. These are the things that happen in mysterious Road. 
Mysterious magnetic field road?,"This place near Sex Land, our chauffeur driver show us (by turning off the machine) that the car still able to move even the machine is completely off."
