review_title,review_body
Holiday,Heard about this road from our tour guide. We experience it in a bus. The driver stop the bus n turn of the engine...the bus will drive itself. Pretty cool experience 
Really Mysterious,Experience the car to move backward even though you are not reversing the car. My kids and I enjoyed the experience.Worth it.
Interesting place to visit,It is an interesting place to visit. There are some fruit stalls nearby and selling nice oranges and grapes. 
Not So Exciting,"The attraction is not so exciting but still worth a visit if it is your first time in Jeju. This attraction is also pretty near Jeju's Loveland, an interesting and popular attraction that is not mentioned in TripAdvisor. "
Doubtful attraction,Not the only place in the World to claim fame to a road that looks uphill while running downhill. Didn’t get any excitement from this “wonder” of the World.
Just another magnetic hill,"A magnetic hill. Interesting if you’ve never seen one before. Otherwise, just another hill where your car appears to roll uphill. "
Not amazing,Went to this as part of a tour. The view from the coach as your “defying gravity” is of a coach full of people craning their necks not straight ahead which you need to get the perspective. This is something thats maybe worth doing on the way to somewhere else but don’t go out of your way for it.
Great fun,We drove past it on another parallel road and didnt realise how fun it was! So we made it a point to visit it and try it out before we returned the rental car. The speed went up to almost 20km/h! We didnt encounter any local motorists though there were some tourists placing water bottles to see them roll up the hill :)
Not a wow ...,"I wouldn't say this is a must visit attraction. Our driver took some time to show us this place since we were passing thru. The kids found it somewhat interesting, we spent about 10 mins trying out the optical illusion in the car."
It’s all in your mind... no mystery here,"I tried walking and rolling in car to feel the effects of such claims... no luck, felt cheated... at least the kids had fun."
Just so so,"It this is on the way to your other destination, then no harm dropping by. We just drove past by the road, then came down to take some picture. A 10 min pit stop. Nothing fanciful. Not a big deal to give this a miss. "
Up ??? Down ...,IncredibleSeems to go uphill ... but in fact go downhill.Pure optical illusion.To be seen once. Car at neutral point.. and see what is happening.
Nice to drive along though.,We passed by this road. Our guide explain about this mysterious road. We did not get down anymore but nice to dropby if your sked will allow. 
Dokkaebi Road,Have fun seeing the car rolled up the slope while in neutral gear. There are lots of people there videotaping the effect.
Optical illusion,We visited this stretch of the road and experienced the slope of the road. The driver stopped the engine and switched to neutral. To our big surprise the bus picked up speed and rolled downhill. 
Watch cans and cars move uphill unaided.,I was there watching a child put a can on the road at the entrance to the car park and the can rolled uphill.I then put my car in the same place in neutral and filmed it rolling UPHILL.I can only assume that the road appears to be uphill but must be sloping down.Unless there is some other scientific answer.It is worth the effort to see it for yourself.Bottles did not work like an empty can.There is an Archery range there so you can practice some archery as well.
Let it go! WOW!,"We heard and saw this on TV and view to visit when we get the chance so of course we had to see for ourselves. We had impression very crowded road but there were only a few cars. It was about 4pm. We were able to follow another car uphill turn around, follow to the start point.We put car on neutral then let it drive us. Very strange. It just move slow motion like haunted road feel.We stop by at a mart for coffee. There is a cafe too. A few people cos winter not nany tourists strangely, we saw a van and a bus doing same thing, just gliding down.It was just nice finally seeing and experiencing this in jeju."
Can't feel anything,Not sure if there is a certain period of time to get this feel. Tried a few times but nothing seems to be as it mentioned. 
Mysterious Phenomenon ,It’s does appears that the law of gravity is defied! Haha. Big ample car park available at site if u drive. Nice lady at the stalls along the road facilitated my science experiment by lending me a water bottle to roll on the road. And yes! It does appears that the water bottle was rolling uphill against the law of physics. Its worth a visit if u are in town! 
"Indeed, it is mystery","We went here to get the experience for the gravity feels, and its totally worth it. Our car moves on its own without using any human forces. One of the interesting place for tourists spot and attraction. "
Mysteriously hard to judge,"We did this as part of Yeha bus tour - South Course - we were in the back of the bus, so it was really hard for us to see, but apparently, you put your vehicle in neutral and it rolls the opposite of what you would expect. I'm sure the experience would be better in a car."
Not mystery but science,"If you have kids, bring them along to let them understand how science can explain mystery and how eye perception cannot be 100% accurate. "
The road is interesting ,This is a interesting road drive whereby even the engine is off the car will even go upslope. It is worth to go there for an experience. 
I dont see anything here,I cant tell any mystery about this road. Maybe becoz i dont drive there..so i cant tell..this place is just walking distance from Loveland..
Kids will like it,I did have fun doing the experiment inside the car as I switched off my car engine. Some kids tried to use water bottles to do the experiment but I don’t think it worked too well. 
Fascinating Phenomenon ,"There is a start point specified on the road. I stopped my car, put car to neutral and released the brakes - the car started to move slowly forward and up slope! From inside the car, the road is up slope, yet the car is like rolling down slope on neutral gear. Fascinating! A must try if you are self-driving. "
Definitely mysterious ,"This road defy the law of gravity. When a car is on neutral gear and foot off the accelerator, cars can actually go “uphill” on this road!"
Interestingly “nice”,It’s mysterious enough to wonder who started to make this as one of a tourist attraction. Apart from being mysterious there is nothing much to see. 
Mysterious Road (Dokkaebi Road),"The drive there was pleasant as you passed through many scenic places. Saw some homes with unique design.As we were at the start of Mysterious Road, our taxi driver switch off the engine and let the car just roll “up the road”. Was wondering how could this happen!!! We witness some other vehicles doing the same. Our taxi driver took a bottle of waterAnd pour it in the middle of the road, the water didn’t flow backward. A group of Chinese tourist ,were doing the same thing, the guide say it’s a scam. But the truth is “Optic Illusion “Nice backdrop of mount hallasan "
Just a road. No experience to be gained.,"Though the name makes it very mysterious and people become very curious, it doesnt really add to any experience. Not worth the hype it creates. "
Not very excited ,I did not enjoyed this road. There is nothing espectacular about it. They turn off the engine and place the bus on neutral and the bus moves going down an up a little hill...
Overated attraction,"Many tours include this spot for tourists. I personally find it over-rated. It is an illusionary experience where the environs surrounding the particular stretch of road gives one the impression that it is not what it is supposed to be. Some guides would even spill water on the road to experiment. Interesting - yes, but I would not include it as part of a tour itinerary. "
Hit or Miss,We went there and did see something but it’s probably a hit or miss place unless you have time.There’s a nice cafe with a huge garden there though.
Enroute,"We visited Mysterious Road on our return journey from Hallasan. We tried rolling water bottles, but failed lol. Eventually we did the touristy thing of shutting the car engine and letting the car ""roll up the slope"". Interesting."
Almost missed it ,"We missed this and had to make a detour to find this signage cos there were tour buses blocking it by the road. There were alot of tourist and students when we arrived. The myth is true, it does roll upwards! "
Mysterious road trip ,did a slight detour this place before returing to airport. the road was pretty empty except for one or 2 cars that were already. Did a u turn to face up the slope from where we got in. Followed the sign where to start and put it to Neutral and experience the pull up the slope. It was over with about 200-300m stretch and turned into the carpark beside the shop. Didn't really feel anything strange or excited about it. 
Only if you have spare time,"At eye level, the short stretch looked like an upward sloping road, but it was actually a 3 degrees downhill slant. A bit out of the way, would not recommend making a trip there unless you're from Jeju-si enroute to Hallasan National Park. Many of the 'mysterious bottle rolling uphill' videos have been posted on youtube in case you want to see the mystery! The real attraction here was the huge iconic black pig family statue. It was detailed and incredible. LOL"
Funny if you are with friends :),"We went there with a local guy who show us the mystery. We were in a group of friends and found it quite funny that our car rolled downhill why it looked impossible. I think it can be boring when go along. It's just a short stretch of road, nothing spectacular, just for fun. Visit if you are in the area, but I would not make a trip just to go for this specific attraction."
illusions!,Illusions make you see the road going upwards but in fact gravity shows it is going downwards. Interesting.
Believe it or not,We tried putting our water bottle down to see if the bottle roll up downhill.. errmmmm... Yeahhh.. not disappointed anyway
Optical Illusion,Good to visit this place for an understanding of why it's happening. Optical illusion of the Dokkaebi road and the story behind its discovery. Short road distance about 150m from start to the ending point. 
Interesting road,Using bare eyes to look at the roads it appears to go up while actually its going downhill. If you put a water bottle on the road it will slide down. Interesting.
Fun to visit if in the area. ,This place is just outside the love land . There is a huge parking lot just behind this row of shops. In front of these shops selling sausages and fruits is the road . You can borrow a bottle of water and row it down the road and miraculously it will come to a stop and row backwards! Opposite the road is a grazing field where you can see cows . Ok a visit if you are in the area. 
Fascinating for young kid,"My 4 year old found the road very fascinating and he kept mentioning mysterious road throughout the day. It was probably just an average experience for adults but if you are travelling with the little ones, it may be worthwhile to spend some time to bring your kids to view this road."
Rolling upward the hill...,Interesting place. Just a eye trick because of surroundings. Not worth if you go there intentionally 
Beautiful stretch,"Mysterious Road (Dokkaebi Road) is a beautiful stretch of road, and is right in the middle of the forest."
Small but interesting,"It was interesting but not too mysterious. It's just a trick of the eye because of the surroundings. Anyway, it was a fun little detour and makes for good videos/pictures to show my students back in the States."
"Not worth the detour, but if close by, why not?","We went here as a detour and sure it is a tiny bit interesting... but would not recomend any detour here, many fabolous places on the island to spend time on instead."
"If you pass the street, take a look. If not, no need","Its just something like a less than 50 meter road with ""strange"" situation. Not worthed if you intentionally go there. "
Fun time defying the odds,We heard about this and immediately thought that we should come by to see it for ourselves. Initially we took a bottle thinking to place it on the road as we were too shy to drive in our car. But the bottle was too light and the wind actually was moving it instead. We saw ppl just came and did what was suggested. Just put the car to neutral and do not step on the accelerator - the car will move forward despite it’s an uphill road. We did that twice as there’s not much car around. :-)
Our car can really move uphill!,Very interseting to see our car moves uphill with the engine off. My tour guide explained the reason behind this but I still don't understand XD. Try to pour the water and the same thing happened.
Where the car rolls uphill,"Very interesting road on the way from Jeju City to Hallasan. Haven’t quite figure out why at a certain stretch the car actually rolls upwards on a neutral gear and without brakes. Probably an optical illusion but I didn’t stay to figure out - better just take it as a mysterious road, it’s more interesting. There’s some statues of pigs nearby, symbolizing prosperity and many children. Take a picture, touch the pig’s head. "
"Interesting visit, switch off the car engine to experience ""rolling upward""","There was a tour group with a guide when we visited. We saw his demonstration of water flowing upstream and a water bottle that roll upstream too. very interesting, when you switch off the car engine and witness the car rolling upwards."
Just nice to visit,"We just pass by this place to try and observe this mysterious road. Well , it is kinda so. We did not get off of our coaster anymore since our driver show it already to us."
Mysterious Drive,Nice experience. You will require to stop the car and change the gear to N and you will feel the car start moving slowly even though is sloop.
Meh,"Underwhelming. We needed a stop and there were some interesting shops nearby (persimmons and mushrooms, I think) so it wasn't a total loss, but not worth the detour. "
Really fooled me,"This mistery road is about half kilometer long. Stop you’re vehicle at the start of this road, put the gear in neutral, and turn off the engine. Your car slowly climbs up a pretty steep slope. At least what it looks like upward slope. It is really hard to believe that the upward slope is an optical illusion and it in reality slopes down. I have seen magnetic hill in Moncton, Canada and they have a road like this. But there is just below a mountain slope and the optical illusion is very understandable there but here there is no such thing, just a plain stretch of road. I really could not figure out how your eyes are deceiving your brain. Not a big deal,but worth experiencing it if you are in Jeju."
just a road,just a road where if you stand and poured water or dropped a coin usually they just stay in place but on this road it moves as if the road is not straight
Very misterious,To arrive in jeju misterious road you can go by bus or private car. If you use private car you can try how misterious that road. If you go by bus you need to walk to arrive in jeju misterious road. 
Quite....interesting?,"There is a start sign & stop sign. Upon reaching the start sign, switch to neutral gear, on hazard light, and keep your car engine on. It will start to move forward on a uphill slope. Very slowly. Of course, do be alert and keep your eye infront and foot hover on brake if necessary.It is a one lane traffic, so not all cars are stopping to be wow by this nature forces, you might be honked by other drivers for slowing down and doing this anti-gravity act. Well... just ignore them. They will move on by cutting your lane.There is a convenient shop next to it and car park. You can park your car there and come down to try it with a half-filled water bottle. It will perform the same too, rolling up on a up-slope.However, beware of cars. There is still on-coming traffic."
What is the point?,Unless you are passing in a car it seems pointless to search out this road. Even then I did not see many cars staying more than a couple of minutes and most people seemed bemused
Strange but true,Our taxi driver took us here after going to Horseland (by the way there are better horse places). The driver switched the ignition off placed it in neutral and it rolled up hill rather than down. A very odd experience. If you are passing by it is definitely worth the experience.
For the fun of it,"Just go and remember to turn on hazard lights, and neutral gear. If you are in the wrong direction you may just roll backwards “uphill”. Lol.Do beware of impatient locals speeding hy..."
Good experience,We manage to visit this Mysterious Road while on our way going to Hallasan but we are unable to try the road on our own. The road is really mysterious but the length of the road is not that long. We just try the road by using a mineral bootleg water and it is really awesome. You can try Visit it if you are curious about the road.
Never come!,waste time because the mysterious road is less than 100 meters only. it is also dangerous because all locals will try to cut off your vehicle at a speed.
Mysterious Road in Jeju,My wife and I visited this road last year during our 4 days tour of Jeju. It was a good experience but once is enough. Jeju is a really wonderful island to visit and we will definitely come back in the future
There’s something mysterious about the Mysterious road ,"If you’re driving around Jeju Island, this place is a must. It took me a while to figure out what was the big deal (mysterious) about this road but after I figured out the way it was described to be, it was definitely cool and somewhat mysterious. So here it goes: you drive upto the starting point of mysterious road and put the car in neutral gear. The road certainly looks like and uphill, however the car drives forward until 100m to the end of the mysterious road. Anti-gravity huh? I’m not sure of the scientific explanation for this phenomenon, but I recommend you experience this if you’re driving around Jeju Island. Takes only 15 minutes and certainly worth the time and experience! "
Start from the sign ,"We drove here using waze , got to start from the signage point beside the road , try to put the gear to neutral and it does move. It's a short drive like 1 -2 minute here . Then we park our car near the 7 eleven and use the restroom . "
It's strange but fun,"Quite confuse why my tour leader brought us here until he did some experiment about this road. So it's a downward-hill that looks like an incline. Couldn't understand how it can be happen, but my bottle keeps moving upward"
nothing special,"it's only an eye perspective view. when we see the car slowly run up while the machine off, the road actually go down. Nothing special"
Nothing to shout about,"Ok it’s a road that looks like up hill but your car can move forward. In my opinion you can skip this unless you are on the way. While we were on this road, one car started honing us for being slow. He later turn in to love museum rushingly!!"
Magic road,Fascinating 100m. Our car rolled down when on Neutral and the road is flat... Bottle of water rolling backward. Same goes when water was poured on the ground...
Not so mysterious,"We may be doing it wrong but when we tried to put water on the road nothing really happens. but we were amused by the cows on the other side of the road (a farm, i think?) and big statue of pigs.. :D"
Family vacation ,We visited these stretch of the road and experienced the slope of the road. A good family vacation. Thanks. 
Big surprise,"When you reach the place you bet your life that the road goes uphill. The driver stopped the engine and switched to neutral. To our big surprise the car picked up speed and rolled downhill. your eyes were cheated by the bushes, trees and surroundings."
Not So Mystical,"Went there. Nothing about this road is mysterious or mystical. It is simply based on illution. Well, for anyone who curious about it can try to pass on that road. No need to spend so much time there."
Its extremely bizarre!!!,"my tour guide brought us to take a look at this ""mysterious road"", my coach driver just switch to neutral gear then the coach start to move by itself and in constant speed, the road seems flat and straight but its not and its just within a mere 100m distance, my guide told us that scientific proven is becoz of wind. An interesting place not to be miss. Try it out yourself to feel the excitement."
Didn’t find anything mysterious ,It’s a small road with sign START & END stating the start & the end of mysterious road. But to be frank....we didn’t find anything mysterious. 
You have to be there to believe it is real.,"Turn off your engine, it will push your car uphill.The speed was fast, it is not magic, it is a real thing.You have to see it in person to believe it. If you go there after sun set, it will give you a chill.Must see place on Jeju island. I believe if you a tour, you will get a chance to experience it."
Didnt work,"Tried with car, stroller, water bottle in the rainNothing workedDrive all the way to this road in the rain for nothingStarted trying it at the ""start here"" sign"
Interesting experience ,"It was very weired and interesting. If you are going there, try to turn off your car and test it if the road tricks you! You will be very surprised! "
Amazing!!! mysterious road,"This road is truly amazing, its 100 meters mysterious street , people really stopped and test how the mystery going."
Amazing road,"You really need to put a coin or can on the road to see the illusional effect. You think you are going downhill, but it is in fact the opposite."
Not As Expected,Read about it and found it really interesting and we decided to go take a look but pretty disappointed as we all tried but it was not working. One good thing was that it's not a wasted trip as it is very near to Jeju Love Land/ Park. 
Good for a passby,"Good experience, but not so special as there are some other place in my home country that seems similar to it. We are on a group tour, upon reaching the road our driver stopped the engine, the bus continued running, the tourguide did some explanation, something about magnetic features of the area, if you will look around its just like an ordinary road."
Not much time needed to experience this place,"If you have some time to spare, it is recommended to check out this place. However if you are in a really short trip, IMO i dont think its worth to drive here as its just a road, unless you are on your way to love land."
Cool,"It probably takes <1 min on this road as not much time is needed at this place. The vehicle will appear to be moving up slope when the engine is offed, should only visit when you are just nice passing by the area, purposely detour just to see this road is not needed to me."
Interesting,"I've never done something like this before so it was a first time for me. We tried it in one direction but it didn't work, but when we tried it in the opposite direction (heading away from Loveland), it works and the car accelerated to 13 km/hr whilst on neutral. I would recommend a visit here if you haven't done something like it before."
Interesting ,"Close to the Jeju Loveland Park and worth the stop. Mind boggling how a car moves up a hill, merely a trick of the eye."
Underwhelmed ,This really just felt like wasted time on the tour. These optical illusions can be found almost anywhere and is not a part of what I would consider makes Jeju-do a unique place to visit.Do yourself a favor and skip it. 
Mysterious road,"Took quite some time to find the road. I was there few years ago and I find it very interesting, but this week when I bring my family there, I was very disappointed. We drive pass a few small stalls and want to try on the road and the nearby stall owner was very rude and tell us not to park in front of him. Thus we drive up and down slowly and try on the gravity without having the hand break on. It's a 5 minute thing, will not go again."
Cool experience ,"So we are sat in the car, put on neutral mode and the car actually moved! This is a really cool experience and it only takes a minute to do- I have seen mysterious roads on the travel channel before but this was my first time doing it- if you find yourself on Jeju island check it out!"
A quick stopover,Spending a good 10-15 mins would be enough for this site. It was fascinating. You should try rolling an empty bottle/can on the road and see it roll forward on a uphill road. (optical illusion).
Cool but not worth it,"Experiencing the Jeju Mysterious Road was cool for a few minutes. But that's about it.If you're gonna drive a few hours just to see it, I'd say just look for another attraction. But if it's just near you, go ahead and experience it. "
Awh! So cool!,Have you been to a road where cars move on it's own? This is my first experience. It's so cool and the car just move along the stretch of flat road. What could be the reason? Our guide said that it could be the magnetic effect from the earth. It's something that you can only find it here. Well!! At least for me it's the only one of this kind so far until I discover more. Regret no photos taken here coz it was raining when we were here for this experience.
