review_title,review_body
"Interesting, but...","The exhibits are well presented and many have English descriptions. Also, the route is well marked, so it is easy to follow. Visited during a school vacation, so there were groups of children visiting. They were quite noisy despite many signs with 'be quiet' (in English and Korean), but the museum workers did not seem to care. Seemed a bit inappropriate in a place like this. To be fair, this becomes less of a problem once you get out of the main exhibit building.Also, the presentation seems a bit one-sided, as it focuses strongly on the Japanese occupation and the crimes committed during this period. For example, some (more 'neutral') exhibits have only Korean descriptions, but most about particularly bad torture or mistreatment of inmates also have descriptions in English, Chinese and (of course) Japanese. No-one can deny that the occupation was terrible, but the facility was also used as a prison by Korean governments until 1987. Little information is given about the 40+ years after WW2. Still, very educational and well worth a visit. "
There are mosqitoes in the woods behind the prison.,"The prison museum and the surrounding area is interesting and for photographers a good place to visit. I also entered the woods in the hills behind the prison and found some flowers and bugs to photograph. The bugs were quite easy to photograph. Patient and still while I was photographing them. A tip for photographers here, for close up photography I got better results with my smartphone at close distance than with my dedicated cameras.The only drawback was lot of mosquito bites we had on this visit ;)"
Sobering experience,"I have been to Korea so many times, we hit all the top tourist places...decided to check this out with my son. It was a bit chilling knowing all the suffering that took place...not only at the hands of the Japanese, which was absolutely atrocious...but also at the hands of the various Korean governments which was just as bad. It was sad thinking back to the suffering of the Korean people had to endure throughout history...recommended to understand Korean history better."
Interesting history well presented,"Firstly make sure you don't come on a Monday like I did as I found it closed (I should had known to check) I did return the following day thou, well presented and once again minimal cost to the attraction gives a good overview of how the prison adapted to the required changes over time with Japan's occupation. If you are interested in these sort of attractions certainly worth a couple of hours spent here."
Must visit. Very under rated,Travelled to the museum from myeongdong for under USD6. Museum is tourist friendly with descriptions in English. The tour route is nicely planned to so you wont have to wander around and just follow the arrows. We were lucky that there was an exibition on the student uprising which was very interesting. Per person cost about 2400 korean won
Facinating,Really enjoyed the enjoyed the gardens which this building is situated. Some excellent picture taking. The emotional story is well described too.
Learn about the independent movement of Koreans,"Lively educational facility that demonstrates and memorialize the efforts paid by the people who struggled for independence. The prison was designed by the Japanese. It showed the prison lives and the brutality of the Japanese. Detail descriptions in Korean, English, Chinese and Japanese."
Worthwhile and educational ,"It was a worthwhile trip and educational for us as we learnt about the prisoners of war and how they were tortured. We were able to see the cells too, the gallows and many more. Good experience!!"
A Great Place to Educate Yourself on Japan-Korea's Relationship,"This is one of the only Museums that you have to pay for, but even so I have been to this place three times now. The compound is a nice escape from the busy streets of Seoul and the information inside is very educational. They have pamphlets in English, Chinese, and Japanese. Most of the information panels are in English and Hangul. However, the prisoner stories tend to only be in Korean."
"Worth a visit, very educational","It feels like going back and living in the past. It was -4 degrees Celsius when we visited, I can feel how cold or how hot it will be to be in one of the narrow prison cells.Passing through the torture room was spine chilling/hair raising. It was sad to know the human cruelty experienced during war. I admired Koreans for the bravery and for the love of their country.We were amazed by how the prison building and other things during the war was well preserved. Walking distance from subway station Dongnimmun St. Exit 5, A map guide to the prison history hall.Before exiting the Prison History hall, there is a souvenir shop near the rest room and the exit gate.Not all information are translated in English :("
A good way to learn some of the history behind the Japan-Korea conflict,"A very enjoyable experience that has both hangul and english lettering as tour the facilities. When I went there was no guided tour, but it was easy to find your way around in the intended path as a result of arrows/signage. Incredibly cheap when I went, only 3,000 KRW and right off the subway line! Great for an afternoon visit."
A Great History Lesson For All,"This former prison and history hall shows what lead up to the Japanese occupation in Korea in 1910 and what happened after that. It's a very sad history but will make you thankful for the blessings that you have. You'll see where prisoners, who fought against the Japanese soldiers were tortured, put into prison, biographies of male and female prisoners, and pictures of the people that died there. It's a sad reminder of how evil war can be.You can visit this place within an hour to an hour and a half. It's closed on Mondays (if a holiday falls on Monday then it's open on the holiday but closed on Tuesday). The hours are from 9:30-6:00pm from March to October and 9:30-5:00pm from November to February. The cost is ₩3,000 for adults, ₩1,500 for youth between 13-18, and ₩1,000 for children between 7-12. However I wouldn't recommend bringing young children here. It's located at Dongnimmun Station (Line 3), Exit 5."
Displays some of the ugly past of Japanese rule in Korea.,"Seodaemun Prison is well worth a visit to get a perspective of the Japanese treatment of Koreans during the occupation (1895-1945). Very interesting factual information and models give you a real life perspective of what it was like and how prisoners were treated. The wall of prisoner photographs brings you to the stark reality that young or old, you could find yourself imprisoned here - or worse...."
Prison,"Right by Dongnimmun St. Exit 5. Entrnace fee is 3,000 KRW. There is a small gift shop with good souvenirs from the place. Two floors. Good piece of history"
Bitter taste of the past,"Every country had a war , revolution or something like that. But when you see the real places understand life has a bitter taste for them. Dont miss the photo gallery at the end of museum."
"scary place, to get a feeling of the japanese occupation period","dont expect lots of artefact, this prison is standing to remind every Koreans that not so long ago Japanese came and tried to exterminate their freedom. If you are not Japanese, you should go and pay respect. visit the adjacent building where people were put to death (hanging) and realize how much different Korea has become today."
A dark page in the Korean history,"Unlike other reviews I felt a little disappointed with the availability of English translations (about 2/3rd of all signs) or English subtitles on videos (only 1 out of 4/5) as without a guide I'd like to read everything to get a good understanding of what's on display. Nonetheless gives the museum a good impression of the horrible time during Japanese suppression. Spent about 2,5 hours. Entrance fee is comparable to other museums, couple of Euros per person."
Worth a visit - educational and mostly in English,"I found this a very educational visit as I knew little of the Japanese rule over Korea. Most of the information was in English - not everything, but definitely enough to make this place a worthwhile place to visit. The park next door is a nice place to wander through too. "
Must visit when in Seoul,The prison is in a little memorial parc that is definitely worth visiting. There are free guided tours done by students who want to learn english - so not a professional tour but quite good. The visit is well organised and everything is in both Korean and English. It's quite sad to see everything that happened in Korea and to all of those men and women who only wanted freedom. You won't leave that place unaffected and it'll make you realise that freedom should never be taken for granted. Amazing place. It'll take you a few hours to visit the whole prison.
"Eerie, but Interesting ","Came here upon recommendation by a friend, and it didn't disappoint. It was a wonderful learning visit, but a little heart wrenching at some point. Definitely a place for history lovers. Spent about 2hours here, after reading all the English descriptions that was available; some exhibits didn't. The site was easy to find from Dongnimmun station. After paying 3000won for the entry, I was free to explore the grounds. The first block was a kind of a introductory exhibit where the history of the prison was introduced. There were many blocks on the ground. However, there was a certain flow indicated to tell you which block to go to next everytime you exited one. It felt like I was moving through a story, and it helped me to not miss out any exhibits.I happened to visit on the day when many schools trips were taking place. Groups and groups of students were all over. It got a tad annoying because they were noisy (didn't help when I was trying to have a moment of silence). But, their noise and chattering was appreciated I was walking through the eerie torture chamber and execution house. Those places sent chills down my spine, and good thing there was laughter around to lighten the mood a little. "
Great place for history,"We quite like these sorts of things when travelling, and this one didn't disappoint!Although it was quite emotional to see what the Koreans went through under Japanese rule. But was definitely an eye opener."
Interesting place and a little eeiry,This is a museum of Korean life under Japanese occupation. There are lots to see and well worth a visit. Use line 3 and short walk from the station.
Korean History Lesson,"We went on a tour with an english speaking guide which made it much more interesting. Some of the signs are in english, but not all.This prison was used during the Japanese occupation and then after independence it was used as a regular prison until just before the Olympics (1987). You certainly hear a lot about the brutality of the Japanese during this time and they spirit of the Koreans who fought against it. It is certainly horrible to see how people were kept in tiny cramped cells and the torture they endured, just because they wanted their country to be free. We didn't hear so much about how the prison was operated after the Japanese left or what sort of people were kept there.Much of the prison has been rebuilt as a memorial for future generations.It is in a very nice park at the foot of a Mountain. It is easily accessible from/right next to, Dongnimmum metro station and costs about W3000 to get in. Only for those with a particular interest in such things."
Political History Tour,"A very interesting museum that takes a visitor from the colonial period through the 1980s. The story of Korean nationalism plays out through the displays. While there is little regarding the prison's use during the period following liberation, I was pleased to at least see some acknowledgment of the abuses suffered at that time by reformers. While the preponderance of the displays are in Korean only (this is Korea, after all), there are still enough English languages boards to inform the English-speaking visitor. This is a well done museum and a recommended stop for a visitor to Seoul - especially one who wants to understand the still-strained relationship with Japan and the emergent Korean nationalism that was torn apart in the Korean War. "
Quick tour enough,First reaction better than last. I wouldn't do this over other attractions. It's light on English details and very recreated v authentic. Good quick history lesson. 
Insight of history,"Amazing complex not far from the city center that tells a lot of the hardship korea had to face while under japanese occupation.Shocking to see what humans are able to do to each other,but thru this hopefully we are able to learn.After all it is a prison,and it gives a feeling of sadness but also in a good sense."
Informative Yet Fun,"We visited this early in the morning with at least two school groups. The prison was well preserved and all the placards had very good English explanations. It took us about 2 hours to walk through. I found it a sad history and interesting insight into the way the Japanese attempted to suppress the spirit of the Korean people. The school groups were fun to watch as the engaged with the various exhibits. Go, it helps to tie the occupational history to the Korean War and see the beginnings of separate states. "
Good place to learn some history,Very nice place considering the genre. We were met by a volunteer tour guide who spoke excellent English and was very up on the history of the prison. It was a good place to spend the day learning a little history.
Eerie and intriguing ,"This place most certainly reached my expectations.The entrance to Seodaemun Prison Hall starts off with some background information. The entire area itself is large with several of buildings to visit. After the entrance building is where all the creepiness begins. I felt myself shiver as I walked through the other buildings. I recall seeing an entire row of cells and the silence adds up to the creepiness. There's also a hospital, memorial hall, and work out area that was all part of the history. There were also hand prints and image of each of the deceased. Along with feeling scared, was also a wave of sadness. You get to read personal notes written by those held captive which truly gives you an insight of the horrors. There are some small clips that briefly summarize the horrors. I absolutely loved this place. It's like watching an incredible historical bloody movie. Scary but intriguing. Not recommended to those with the faintest heart. "
Specially interested if you are into WWII stuff,"I guess it is a must for people that are into WWII stuff and history. It is well preserved, depicting specially the struggles of the more than 3,000 ""martyrs"" imprisioned there during the Japanese occupation of Korea, from 1910 to 1935. There is a whole section of the prison where the instruments of tortured are showed, plus testimonies, pictures, etc. Although you can follow in English, pretty much, there is a lot of stuff in Korean that it is not translated. Pretty shocking and graphic, make the actual American debate about ""water boarding"" a joke. It is not for everybody. I won't recommend it unless there is a specific interest."
Somewhat one-sided,"The prison and grounds are kept in good condition. The red brick buildings are somewhat unique here in Korea, so I enjoyed looking around them. The prison has been restored to the point that it's almost hard to imagine it as a place of torture and despair. They have recreations of various torture methods used. You can see the exercise grounds where prisoners were separated by walls while exercising, the execution room, and the secret tunnel used to carry bodies out. I am not giving this a better review for two reasons: while many signs were in English and in Korean, there were enough signs that were only in Korean that I felt like I was missing out on some really interesting stories. The other, and more important reason, is that it is so one-sided that it feels like a nostalgic, naive look back on Korean patriots rather than an objective history museum. While that nostalgia doesn't need to be completely eliminated, it should have been much more balanced. I would have liked to have heard about the Japanese guards and their lives, during and after. I really think they should have talked more about the prison after the Japanese occupation more. Who were the prisoners under the newly formed Korean government and how were they treated then? Was it similar to how the Japanese treated prisoners? I know the new Korean government had a massive crackdown on dissidents, but they are barely mentioned. If you are interested in prisons or the Japanese occupation, I would still recommend this because it is a unique look into an important part of Korean history. "
A must see for Korean history.,Our visit to the prison was one of the most humbling experiences we had. The prison was used for political dissidents under Japanese rule and visiting the museum revealed the depths of human nature.I maybe wouldn't recommend going with children that are really young as some things can be quite could be upsetting. But for anyone who is interested in Japanese/Korean history this is a must see.The museum is one of the most interesting we have visited. It is rare that I find myself reading every display in a museum but I did at Seodaemun Prison. 
Wonderfu tour guide here.,"We really enjoyed our tour here, led by a young volunteer that spoke excellent english. A must see place in Seoul for those who are history minded."
Great history lesson ,"Trying to fill my time I came across this location in my guide book and it was worth the visit. For 3,000 won you get to walk around this huge prison museum and see the suffering Koreans endured during Japanese occupation. You may need 1.5 hours to tour this huge place. Great visuals with pictures and recreations of torturous methods used on prisoners. "
A must visit when in Seoul to understand its past and present,"The halls, the cells, the buildings, the stories and the displays will open your eyes to a dark period of Korean history but rather than focusing on the gruesomeness of the events that took place here, take a moment to reflect and understand the struggle for Korean Independence, the pride Koreans have for their country. It's a solemn place so place be respectful. keep quiet and use this visit to learn more and understand Korea better. "
Step Back Into Korean History,"Very well maintained, a lot of nice artifacts and displays. Very friendly workers. A nice place to visit to learn more about a different somewhat tilted side of Korean history. Only drawback too much emphasis on how great and how hard the righteous Korean people fought off the yoke of Japanese occupation. Nothing mentioned about the United States defeating the Japanese for Korea to regain its independence, or how many Koreans were snitches and spies who worked for the Japanese Kempeitai. Nothing mentioned about how many teenagers President Park Chung Hee imprisoned there when he was president for tearing down a political poster and beaten to confess that it was his father’s idea (my father-in-law) to do that like what happened to my brother-in-law in 1971. Overall a very nice day trip in conjunction with a walk down to Independence Park."
Creepy and Necessary,I wandered to the prison one day when I had a few hours to spare. It was a hard to face reality of the Japanese occupation. But it is part of the history and I did see many young families there. There were wax figures in the torture section that may be scary to young children. (It can be bypassed since the walk is self guided). There is a replica of the prison exercise yard and several of the cell blocks. Not much in English - but really not needed.
Interesting,To be done your last day in Seoul. Shows how corean prisoners were treated by the Japanese. Edifying.
Insight into a less well know piece of Korean history.,"This is an interesting prison well layed out and easy to get to on the metro, Dongnimmun station. Located close to other major sights it is worth a visit if you like history and only takes a couple of hours. Not all the information is in English but most is. The museum covers the time of the Japanese occupation and includes a section on torture, so emotive but presented in a informative way."
An interesting piece of history,"Old prison from the Japanese colonial era turned into a museum. There is a lot of information, signage also available in English. There is also a large portion of the outside grounds available to walk around and see. Even though I went on a weekend, it wasn't very crowded as it isn't a top tourist attraction, though I do suggest a visit here to see a different side of Seoul and it's history. The whole complex can easily be seen in little more than one hour. Photos are allowed."
"Decent museum, but it's no Alcatraz","Interesting landmark in Seoul; I think it would clearer if they changed the name to the Korean Patriot History Hall because that is what the museum truly focuses on. If you are expecting an Alcatraz-type tour, you will be disappointed."
Worth a visit,Sobering reminder of the struggle that this county endured for its independence. Amazing juxtaposition in looking at the grounds of the prison yard with the skyscrapers and apartment complexes nearby.
Good Day Trip if you like history/cultural measumes,Glad we went to get to see the culture and history. The hall had a lot of different buildings to walk around and get different perspectives from different stories. Very informative and interactive.
Feel like a prisoner,"My trip to Korea doesn’t stop at garden, villages and good food. I took a detour to a prison in Seoul. This is Seodaemun prison, among the largest prison in Seoul in the past era, when South Korea is still under Japanese colonization. You can’t get too excited on the main gates. It has a watch tower, lovely red bricks wall and a metal. That is about it. Let’s go in, I am sure there are “nostalgic” stuff within. Visitors are immediately greeted with some of the tools used for locking up prisoners. The next section bring us to some interrogation chamber, torture chambers where we witness how Japanese forcing the prisoners or detainee to admit wrong-doing that they didn’t commit. I move on to visit the actual cell where prisoners kept. The classic scary element is there - long aisle, dim interior, and the metal clanking noise upon door swinging open. Many people died here. The atmosphere may be calm and peace, but we are constantly reminded of the remaining lingering soul and ghost."
Worth a visit,Interesting place. Easy to walk around in a couple of hours. Tells a very interesting story of the effects of the Japanese rule. I would have liked to hear the eye witness accounts from the prisoners but they were only available in Korean. Interesting explanations of some of the things the Japanese did to ensure they maintained absolute control over the Korean prisoners.
Interesting but not all that impressive,"Seodaemun Prison is a unique attraction amongst all the towers, temples, museums or palaces you might have the opportunity to visit in Korea. It's definitely worth visiting. The surrounding Seodeamun Independence Park (with its statues, grass paths, pools) is also nice and the prison sits it very nicely. The prison is a great yet troubling and horrifying way to learn about Korea's complex history. However, keep in mind that visiting the prison doesn't take more than an hour. And while many museums in Korea are foreigner-friendly, with a lot of explanations in English, the prison overall lacks context. This is especially regrettable because for people who might not be well familiar with the Japanese occupation of Korea, they might miss on what this museum trully means and represents. Finally, while most major museums in Korea are free, the prison, while also public, costs 3000 KRW to visit. Not expensive, but still surprising that you have to pay more to visit this than the National Museum of Korea for example..."
"This is the nicest prison you'll ever visit, but will leave feeling terrible...","The Seodaemun Prison History Hall is an epic monument that clearly shows the evil nature of the Japanese captors because there are dozens of torture chambers and methods that were used against Koreans. Yes, the Japanese did much worse when they burned down Royal Palaces and tried to erase Korean History, but nothing remains from those atrocities. Here, for example, you can see or actually step into these horrific caskets used for psychological torture. There are many other examples of how Koreans were enslaved in this museum. It's so real, you'll feel it. One of the better remnants that tells the truth of history through meticulous preservation. Plz go if you have the time..."
Interesting and informative,A well-maintained and informative place to learn a bit about one aspect of Korea's history. Quite a large compound which took around 1-2 hours to explore and even had a free digital photo booth for you to use as a souvenir. 
Interesting Spot,"I am glad that I took the time to visit this spot. It's not on my top 10 list of things to see in Seoul, but it did help me to gain some insight into the animosity between South Korea and Japan."
Historic,This place was used to be a prison when Korea was under the Japanese administration. It shows cruelty of Japanese and you can feel the spirit of the old Korean people who worked for the independence.
