review_title,review_body
A Gem of a Place,"Off the beaten path (and less busy) compared to some of the main attractions but it's a gem of a place. This place should be ranked higher on the list of attractions in Seoul. It's a very moving place with a lot of great information about Japan's occupation of Korea and there are bunch of buildings to look through. Random Information:Cost was 3,000won for 1 adult.Plan to spend 1-2 hours here.There were vending machines with drinks available.Small gift shop at the end of your self-guided tour.One of the lesser busy places to visit on the weekend."
A blatant reminder......,I found the whole museum to be a fascinating place to visit. The reminders of the Japanese occupation of Korea and the cruelty inflicted upon the Korean people were blatant and graphic. Also the era of Korean history where despotic military leaders imprisoned anyone who spoke out against the regime. The prison museum is in tact and provides a chilling reminder of life behind bars right up to 1987.
Very moving,"This attraction is a must-do for anyone interested in history. There is not a lot of information provided in English in the museum, but the story of the torture and imprisonment which took place here is made clear. The basement of the museum building is where the actual torture took place - seeing the life-sized figures in the cells and hearing the soundtrack of someone screaming gave me goosebumps! The little hut where those found guilty were executed is also very poignant. The cell block and exercise yards are the other points of interest. The prison is a bit out of the way, but a really interesting and moving place to visit if you get a chance."
Great museum,"A great museum, and a good lesson in the history between Japan and South Korea. It really touches your heart, and you can feel the despair in the walls."
Good history lesson,Interesting way to spend an hour or so. Nice film and displays. But for most people not a primary attraction. Suggest combining it with a visit to a nearby Palace. Easy to get to by subway.
A Piece of Korean History in the Middle of Seoul,"I visited this attraction because I am a huge history buff. The prison was built in the early 20th century and it gives an idea of what life was like for prisoners during Korea's colonial period. You can walk the grounds, and you can step foot inside the cells. There are mannequins depicting the horrible atrocities committed against the prisoners. There is even an opportunity to stand inside one of the Korean torture devices, which is a cubby hole (read: small closet) without any extra room. If you are over five feet, nine inches tall you are going to be extremely uncomfortable in this thing! And we read that some prisoners were left in there for days!We hired a tour guide who spoke excellent English. He walked us through the various buildings and rooms. He explained what life was like for the prisoners back when the facilities were in operation.Seoul is an exciting and bustling city. The streets along the main thoroughfares are clean and the infrastructure can handle the population's mobility. Visiting this ancient prison was like stepping into a time warp. You certainly got a feel for a time that has since passed.I would recommend this attraction. You only need to spend two hours there, at the most. But be sure to get a guide. The memories will last forever."
Seodaemun Prison History Hall,"An interesting museum that used to be a prison during the japanese occupation. It's right in front of dongnimun station and next to a big park. You'll see the huge prison walls and a small entrance. Each building has exhibits. Actually, some of the are a bit disturbing. I don't recommend bringing children. Bring a drink. watch your head when you go to lower levels. "
Favorite historical site in Seoul,"The prison hall museum offered a moving view of the deep struggles of those who fought for freedom. Some parts were difficult to see and some parts are not translated in English, but this doesn't take away from it being a very significant experience. You get to see how the prisoners were held and how they died. Very moving experience."
"Witness how freedom fighters been tortured, their cell, and executed.","I would highly recommend to spare few hours to visit this historical musuem. You get to see how freedom activist tortured by the Japanese, stay in the actual cell that housed prisoner, plus witness the actual execution chamber and secret passage to transport dead body out the prison. An eye opening experience. Very good way to learn history.https://vinshengloh.exposure.co/seodaemun-prison-seoul"
Amazing history,"I visited the prison with my dad and it was truly an amazing experience. We could really feel the history and I got a feeling what country my father lives in. I understand the silent issue between the Chinese, Koreans and Japanese. But I'm proud that they have saved this history to share. It gave me goosebumps. Definitely worth a visit"
Pre-Modern Korean History Full Immersion,Be prepared to experience the Korean version of Alcatraz except here you will find memorials of those who fought and sacrificed their lives for their people and for their country. Beautifully preserved early 20c architecture serves as a great reminder of the struggles Korean ancestors endured to bring the country to where it is today. 
Educated and get to understand Koreans from another side of history ,I have a big interested in history for a long time. I have read about north and south Korea conflicts before but I never know about this side of history when it comes to Japanese invasion. Knowing how tough this country has been through it feels a bit sad. Besides standing in the actual event place is even more sadder. For more than 80 years of the dark history this place will show you the prison that actually was to contain all the Koreans who fought for the liberation. Also underground of this prison was the place where they tortured them to dead. It's a really nice place to visit and you will know how bad we need peace in this world.
Park with dark history,"It's an open park with historic buildings, you can still see where the executions were held and depressing prison preserved. "
Really great first-hand view of history,"We spent about 2 hours walking through this prison. Most of it is as it was during use, which made for a fascinating look at how the Japanese treated Koreans during the Japanese occupation. Most of the signs are in English so I had no troubles understanding. It's a must see if you are in to visiting historical sites."
Experience History Firsthand,"If you're a history buff, this is a sit not to be missed when vising Seoul. It's a heartwrenching experience yet fascinating at the same time. A part of Korea's painful past, this site will help to understand why Koreans still criticize Japan for their colonialism of Korea. The tour is well laid out and history comes alive."
A painful history which can be felt,When I went to this old prison with one of my Korean friends it really touch me in my seoul. The brutality of the guards but also the pain and perseverance of the prisoners. It was amazing to see and feel that. This prison is part of the history and will remain that. As future generations will also need to see this. Foreigners will also learn a lot and understand the uncomfortable situation still with Japan even though it is improving.
Seodaemun Prison History Hall,"Strongly recommend for people who likes to understand more about the history, the experience of the previous generation.Fairly interesting place which takes you to a tour of a full fledged prison however, most of the explanation are in Korean. If possible get a translator, otherwise it is just moving around and seeing. Please do not miss out on the execution house!"
The highlight of my week in Seoul,"I am just so glad I got to see this unfortunate slice of history come alive. The torture, the beatings, the hardship, the desperation and isolation of the exercise yard and the solitary confinement. It's all here. Superbly laid out and wonderfully preserved for future generations. This was the best thing I did while I was in Seoul. How the prison doesn't even make the top 20 attractions is just beyond me. Please go. You won't regret it."
Needs More English,"I'm a prison museum junkie, so I wouldn't say this is a fair review. I loved it here, even though a friend said it was for kids. The most interesting part was the part showing the torture methods used in the past, which were pretty mild and child friendly.Only complaint was that many of the displayed showed minimal English without elaboration, and some were even lacking English descriptions. As I was interested in reading about the history, this was rather disappointing."
"Sobering, Yet Accessible, Well-done History Site","Seodaemun is an education in the occupation of Korea by Japan from about 1910 [yes!] to 1945. It's great place to learn about the Korean independence movement, the underground resistance, and their brutal treatment. Seodaemun was a prison a decade before the Second World War! There are four main buildings, all well-worth the walk through. The emphasis here avoids bitterness and revenge and stresses education and forward-looking. It is easily accessible via subway. It has nice amenities, including clean restrooms, refreshments, and a nice gift shop. well worth a visit. "
Amazing and humbling at the same time,"A fantastic insight to what it was like when Japan colonized and how they went about to eradicate the language, education, and culture of Korea. So sad, but we see how a young college girl becomes a martyr for her country. The daily life of the prison reminds of the Civil War POW prisons in the US. This single sight is forever etched in my memory to portray the struggles of Koreans under Japanese rule."
A bit of History I never knew about,This place was one of the last places I visited on my trip to Korea and it was by far one of the best sites to see only costing 3 wons (3 dollars). I arrived early so not too many people were there and it made it so much more interesting to feel the emptyness of those cell blocks. All the exhibits were translated to english so it was informative as well as educational.
A Sad Piece of History,Truly a moving experience. This is a definite must see to witness the atrocities and capabilities of mankind. After this visit it certainly changed my perspective on the Japanese culture and treatment of Koreans. Would fully recommend visiting and paying homage to the souls that were taken during the occupation.
Prison visit,"Well organised attraction. I was a little disappointed in the gift shop, but otherwise no complaints."
"A somber, but meaningful visit.","Want to understand what older Koreans have against the Japanese? Pay a visit to this well-explained prison museum. Disturbing at times, but always moving, the museum compares itself to other memorials to human suffering such as Auschwitz and the Anne Frank house in Amsterdam. As long as you're interested in history, you can easily spend a couple hours touring the grounds and exhibits. I would be careful about bringing small children, though. Some of the exhibits include instruments of torture. And one of the restored jail cells has an audio recording of a prisoner pleading to be let out."
Provides a Balanced Visit to Seoul,This prison museum provides a well rounded view of Korean cultural and political changes over the last 100 years or so. Well organized and mostly English speaker friendly. Right next to a subway stop.
Important in Understanding Korean History,"Seodaemun Prison is an important place to visit while in Seoul as it explains the complicated relationship between Japan and Korea. At the beginning of the 20th century, Japan occupied Korea bringing with it great oppression while forcing the people to take on Japanese customs. Of course, this was met with a lot of resistance. Because of this, many Koreans were taken to Seodaemun for questioning and were tortured by the Japanese, the most famous Ryu Gwan-sun.Many of the factory buildings are gone, but the museum’s main buildings still include some cells that housed prisoners, torture chambers, and many exhibits explaining this time in history. I think the most powerful part of Seodaemun Prison was the room which included hundreds of photos of people who had been imprisoned there. It was pretty powerful to see the faces of the people who would try to hold onto their country at any cost, including death.This museum may not be for everyone especially if you are not into history, but for 3,000 won and the chance to learn a little more about the history of modern Korea made it worth it for me.Be warned, many of the displays are in Korean only which may be frustrating to some. Also, during the week, there are a lot of school groups making it cumbersome to navigate through large groups of children at times, but in the end, it was still worth it as it's a very powerful museum."
Interesting place to go.,"This is the first prison museum I've visited. The atmosphere is very sombre and there is quite a lot to see and learn. It actually made me feel quite sad visiting this place knowing so many people suffered and died here. They have cells you can go in and some torture devices and you can kind of imagine what it was like for prisoners back then, horrible. They have a memorial hall where they have thousands of pictures of the prisoners... very heavy and sad place.... I wouldn't go again, but it was a good experience. I think I went on a weekday and it wasnt too crowded but still a few too many kids than I would have liked :PAnyway, good visit, probably about 2 hours. Also the surrounding are is nice for a walk too."
"Gloomy and depressing, but go if you love history","The second prison museum I've visited (the first being Alcatraz in San Francisco), one thing is the same - the gloomy and depressing feeling as I walked through the halls. The rainy weather probably made it even lonelier. The museum is well-preserved, and not that crowded on a weekday. You can slowly enjoy reading all the exhibits without anyone disturbing.All in all, I'll recommend this museum if you want to find out more about the history of the Independence Movement. It's a quiet place to do some self-reflection and thinking. For more photos, http://travellerelf.blogspot.sg/2014/03/korean-culture-history-seodaemun-prison.html"
Painful side of recent Korean history.,"Even though the prison was used after the Japanese occupation ended, the displays mainly focus on the harsh treatment Koreans suffered under Japanese rule. As a result it has an anti Japanese vibe, but I'm not sure how you could tell the story in a way that honors the thousands of Koreans who died without sounding a little anti Japanese.The prison is right next to Dongnimmun Station on subway line 3 which makes it really easy to get to. Today, only a fraction of the original prison complex remains standing, but you can still see the workshop, some of the cells, the execution room, the torture rooms in the basement, the walls and the watch towers. lots of pictures and more info on my blog here http://gdaykorea.blogspot.kr/2014/05/seodaemun-prison-history-museum-old-seoul-prison.html"
"This is disturbing, but an important place to see","One wouldn't call this place fun, by any means, but they have done a wonderful job of portraying the brutality of such prisons and of describing a painful part of Korea's history. It's easy to move around here, there are lots of open spaces between buildings, and it's right on the subway line. People interested in history, and in Korean history in particular, should definitely take the time to visit this important site."
Worth the trip,"It is no auschwitz take of that what you will, but it still a stark reality and a peice of history that most people do not visit. The presentation and the history lit before the actual buildings are Korean heavy, so recommended to have someone with you for translations, I was lucky enough to have someone with me who spoke Korean, but what we did find that the translations omitted certain things in either the English or Korean, so be wary of the translations that are presented for you. Overall a must see as it helps really make you realize how much S.Korea has changed in such a short time."
meaningful trip~,"makes one really appreciate the comfortable life my country is in right now. the prison, even though now its empty, gives the chill during winter and its really creepy to know people used to stay in that small cell.very easy to reach from dongninmum station and its worth 3000won to visit."
Educational and Interesting.,This museum highlights a part of Korean history that some may choose to forget. You can tour the actual rooms where they tortured prisoners. This can be very disturbing but it is also educational as you cannot forget what happened to these people. You cannot imagine living in such a place and going through what these people did. This museum is a bit far from the city center but we got there by subway and then walked so make sure you have good directions.
Well worth the visit ,This place was the prison during the japanese colonial and pre-democracy age. A lot of historial information was shown about the flighters against the japanese for their independent. 
Very thought provoking museum,I'm not usually that impressed with museums but visiting Seodaemun Prison History Hall ended up being one of the highlights of our time in Seoul. It's design is very visitor friendly and the information is presented in various interesting ways. I found the visit very thought provoking and it gave me a much better understanding of Korea's difficult history.
Interesting and provoking,"This a prison built during the Japanese occupation in 1907 to house political prisoners, men, women and even juveniles arrested for resisting Japan's colonial occupation. After the liberation of 1945 it continued to house prisoners until it was finally closed in 1987. Since much of it was dismantled before being turned into a history museum, some of it has actually been rebuilt. The main prison hall, workshops, and execution building however are the intact original, and stand as an eerie reminder of Korea's unfortunate history. The museum displays instruments of torture, photographs taken of prisoners, and you can enter solitary confinement cells to get a glimpse of how harrowing it must have been for those who suffered. LCD screens give eye witness accounts from actual survivors. Elderly men and women still bearing physical and emotional scars, describe the brutality they endured as prisoners. Although the narrative is soaked in Korean nationalism, the overriding theme is that the museum should serve as a reminder of the sacrifices made by independence activists, and it does. The tour takes about 2 hours. If poignant and sombre history is something you like to take in, then it is worthwhile. It only costs a few dollars, and afterwards you can take short taxi or bus ride to Shinchon, where you can find great places to eat, street food, arty cafes and shopping."
"A meaningful experience.
Something beyond the usual shopping, eating, sight-seeing...","So you have done the shopping in Myeongdong, that trip down to Gangnam (oppa, gangnam style! Though I know that is so ""last year"" right?). Taken pictures at Gyeongbokgung Palace, bought your breakfast pastries and rolls from Paris Baguetten or Tous le jour, bought souvenirs at Insadong, peered into North Korea from the demilitarised zone (DMZ) at Paju, what else is there to do in Seoul? If you have time to spare, take a look at Dongnimmun Gate (independence gate) and visit the Seodaemun Prison History Hall. Given years of Chinese hegemony, period of Japanese Occupation and the experience of the Korean War, Koreans are extremely patriotic (or nationalistic). See this sprit of the Korean people represented in history at the Seodaemun Prison Hall, which was one prison that housed activists of the Korean Independence Movement against Japanese occupation. Getting there: It is located near Dongnimmun (独立门- which is independence gate in Engliah) subway station on Line 3. It's on the same line as Gyeongbokgung and Anguk (where you would alight if you were going to Insadong). We had lunch at Insadong first before heading to Seodaemun Prison. 1. Alight at Dongnimmun Station (subway line 3 - orange)2. Get out fromexit 5. 3. As soon as you are at street level, look to your left. You should see a pathway leading to a brick complex. 4. Follow the pathway to the main entrance. Ticket price:1. 3000 won (1 adult) Opening hours: 1. 0930-1800 (March to October) 2. 0930 - 1700 (November to February) We spent about 2 hours at the museum. A friend lecturing at Seoul National University had brought his students there numerous times and he does not want to be there once the sun starts to set..... Other information: The Prison Hall consists of several complexes, some of which have been demolished. A good part of the original prison structures still remain and those have been converted to a museum honoring those who sacrificed during Korea's struggle for independence. The old official documents are written in Hanja (Chinese characters), Japanese or Korean. Hence for visitors whose first language is English, you might not be able to read the documents. The exhibits are introduced in English, Korean, Japanese and sometimes Chinese so one should not have much problems reading about the history of the museum, the experience of the prisoners, the torture methods, etc. TLDR: A very enriching experience that offers a glimpses into Korea's tumultuous past and a representation of the spirit of struggle in Korean's independence movement. "
"Its good, but all in Korean","Its an interesting museum, but 90-95% of the writing to explain stuff is in Korean. Walking here is interesting but with the lack of any explanation it is hard to understand what is what.When I went there was a school trip which consisted of kids that looked the age of 8 going to a prison museum, an interesting school trip I do say. From what you can understand, it shows what the prisoners went through during their time."
Humbling and Educational,"This prison is right off the 3 Subway Line. You take Exit 5 and walk right up to it.The day we were here there were many school children also touring the facility. There was a small fee to get in, but I don't remember exactly how much. We were able to do a self tour and most of the museum is in English. I've been to Alcatraz and the Eastern State Penitentiary in the USA. These looked very similar...until you get to the torture part. So Sad. Then the memorial wall of photos of all those children killed for being Independence Fighters. This was very educational as I feel like I didn't learn much about Asian history in the States. The part of the museum that was most moving was the installation called ""Independence Fighters and Me"". This is a small room with mirrored walls. Pictures of Independence Fighters are on wall....along with yourself. Such a moving piece."
Funny place to visit... great for photos,"I stumbled upon this place by reading an article about Seodaemun, one of the former eight gates of Seoul. Instead of finding a gate, the searches led me to the Seodaemun Independence Park with Seodaemun Prison as its signature attraction. Instad of going alone, I invited friends who wanted a “Seoul Tour”.Getting there from Nambu Bus Terminal is very simple, and finding the entrance to the prison is very easy. Asking someone, “hey do want to go to prison with me” was the most difficult part until I explained the details of the journey. The prison hasn’t been actively used as it’s original function for a few decades and serves as a very interesting museum. After purchasing a ticket, we were guided to the first exhibit hall that explains the history and gruesome details of the various functions this place has served as besides being a Korean jail. There are guides who speak English that will explain everything for you. The first building has both upper and lower levels you need to see.Inside the first building on the upper level, there are art exhibits with pictures of the prisoners (both men and women), videos and other historical items (shackles, documents) present. The basement area has the more graphic scenes. We walked through what the interrogation rooms and cells looked like. We got to peek through and catch glimpses of wax figures depicting scenes of what happened in each room. Further into the basement is the hotbox and solitary confinement cells in which we were able to cram ourselves into. We shackled up with props provided and took a lot of funny pictures with other vistors.There is also another building representing a large area of cells. It starts with a processing room and leads further down a long hallway. Some rooms are locked in with wax figures and others are open. We locked ourselves in a few for fun to see what it was like (since we aren’t criminals).Afterwards, there is a large courtyard for the kids to run around in conjunction with Independence Park. We decided to head back to Myeongdong for lunch. There are many other features located in the area, like one of many entrances to the nearby hiking trail, but we were too hungry.To get to this area from Nambu Bus Terminal or any place in Seoul, connect to the #3 subway line heading for Daehwa. Get off at Dongnimun station (326). Leave the station from exit 5 and there will be a sign for Seodaemun Prison in with 10 meters of the exit. Follow the signs up the narrow path up the hill to the main entrance. The cost is 3,000 won for adults and 1,500-2,000 won for kids (sorry, I don’t have any)."
