review_title,review_body
"Interesting historical site, try to avoid the school tours ","Well thought out museum that gives an insight into Korea’s history and their relationship to Japan. As others have mentioned, if you are unfortunate enough to coincide your visit with a school tour then this really detracts from the experience. It is difficult to be affected by the torture cell displays when you are surrounded by screaming kids whose teachers do not control them. The museum staff also do not intervene. I also liberated a young man who had been locked in a cell by his ‘friends’. "
Prison Museum,Very interesting history with a clear anti Japan sentiment coming across through the historical story being told. 
history and education ,"an easy subway stop spent 2 hours (go later in the morning after the school kids take their tours)download the app, wifi is free in the buildingswatch the touching videos of former prisoners. there's enough in English about the Japanese occupation "
Piece of history,"It's very easy to get there, by using the Orange subway line, hence I would absolutely recommend going. If gives you an amazing insight, of the status of Korea, during the Japanese occupation. Even if you're not to interested in history, it's worth to pay a visit to get a general view."
educational experience,"Easy to get to this interesting museum from the City Tour Bus or subway - line 3 (Orange line) to Dongnimmun station, Exit 5 and a very short walk to the entrance. Open from 0930-1800 in the summer months and 0930-1700 in the winter Tuesday - Sunday. Entrance is only 3000 won per adult and, if you are really into history of this time period, it is possible to arrange for a docent guided tour in English, Japanese, or Chinese a week in advance. Recommend reasonable walking shoes and weather appropriate gear as the museum has several buildings to walk between and rain or excessive cold could make it a little uncomfortable. Time spent here varies on your interest in the subject -- there are exhibits enough to spend almost a whole day here however, a good overview could be completed in 1.5 - 3 hours.The Seodaemun Prison History Hall/museum is separated into several sections that cover 80 years of history (1908 to 1987) of the Seodaemun Prison. The different exhibitions offer information regarding the Korean peoples struggle for independence during the Japanese colonization and the life of those imprisoned by the Japanese in these halls due to their roles in the independence movement. It is a striking presentation of this relatively recent bit of history. Most of the exhibitions have English translations. It does get a little crowded and school groups do come through. Not the first museum I would recommend visiting when in Seoul however, worth it if you have the time."
History learning,"This is formally used as a prison during Japanese Colonial Age. Now, it's a history museum for locals and foreign visitors.- The area is huge and there's not enough air conditioning. Try to avoid visiting in hot summer.- Things are well-maintained. Torture cells locating B1F are hideous.- A large Tageukgi(Korean national flag) on the wall of the building is a popular photo spot. Local visitors take photos saying 'manse(hurrah)' as mourning sacrifices in the past- The entrance fee was 3,000 won and it's a bit surprising because many museums or memorial halls in Seoul are free."
eye-opening,"there is so much to learn about what happened during the japanese occupation. this is a prison where koreans supporting the resistance movement were imprisoned and tortured. you can walk through the prison halls where artists, poets, clergy were housed with artifacts from those times. there are recordings (almost couldn't bear listening to the cries that i cried myself) of those that survived the prison. the exhibits show recreations of interrogation rooms. there's lots to read and take in so i would allot at least 2 hours. powerful."
wow,"I was not expecting it to wow me but the setup was actually very good. It was not just empty rooms but displays and explanations of what each room and each building represented during its active days. Huge place as well. It shows how it was before, and the struggle by Koreans just to gain independence. This is one attraction that helps explain why South Koreans are very nationalistic and very proud of their independence."
Seodaemun Independence Park,"We were at Seodaemun Independence Park which leads to the Seodaemun Prison History Hall. We didn’t get to visit the Prison as it was quite late in the afternoon and near the closing time.The park is like a green oasis compared to the noisy traffic just blocks away.There is a impressive archway, located at the entrance of the park, which was modelled after the Arc de Triomphe in Paris. This was where previously the envoys sent by the Chinese emperors to Korea were being received.There are stairs which leads to Dongnimmun metro station. Very convenient."
Really interesting place ,I would certainly come here if you are in Seoul. Set in a peaceful park it is hard to imagine this was a big prison for Koreans fighting for independence who were kept here by the Japanese. You can going into the cells and learn about the torture endured. It is a huge place. Took us about 2 hours to get around. Most of it is in English but it does sort of give up in a few areas. The main messages were were translated and delivered. There’s a gift shop. 
Very humbling experience,"I was very lucky to have a free tour guide for this. A very intelligent and well spoken kid ( he was only 14! ) was offering free guide for foreigners. Now everything became more meaningful as he went over the entire history of the prison and of Korea during those days. I do understand even better now why Japanese are not well-liked in Korea. Lots of kids with their teachers, which is great. Respect for all the martyrs. Do yourself a favor and visit this place."
Make this a priority,Visit with a local or a guide to better understand the history behind the prison hall. We were fortunate to tour the place with Luke from Meteor Youth Voluntary Club. He was well versed with the history and walked us through the exhibits providing interesting information and anecdotes of the famous prisoners incarcerated there. A solemn place indeed makes one marvel again at human courage and self sacrifice of these individuals. 
Seodaemun Prison History Hall,"Nowadays, Koreans can enjoy a modern, democratic and independent country. There are many factors in South Korea’s success. In order to understand why South Korea is the way it is now, we have to look back in the past to see how everything started and to understand a long, painful way Koreans have passed.Empire of Japan had interests in seizing the Korean peninsula. In 1905, they made Korea their colony, finalizing in effective annexation in 1910. Korean emperor, Gojong, tried to seek for help from western powerful countries but nobody came to the rescue and Japanese could colonized, with violence, Korea. Few can imagine all the suffering and oppression that Koreans had to live during Japanese colonial rule. Japan ruled directly through the military and any Korean dissent was ruthlessly crushed. They build a colonial prison in 1908 that served as a major site of oppression during Japanese forced annexation. Seodaemun Prison, firstly named Gyeongseong Prison, was built to accommodate 500 inmates, considering that the entire capacity of all prisons around the country was of 300 inmates only, but as Japanese full-scale aggression initiated into Korea, many Koreans independence activist started rising. Therefore, these fighters got arrested and imprisoned there, raising the population of the prison reaching more than 3000 people around 1919 as many patriots were imprisoned during the March 1st Independence movement. Until independence was achieved in 1945, many independence fighters were executed or died from the brutal treatment received in the prison.Metal bars, cold bricks and guards from the prison could not silenced loud voice seeking for restoration of sovereignty nor could break down their loyal spirit inherited from the Righteous Army in the Joseon dynasty. Within the prison’s corridors “Daehan Dongnip Manse!” (Long live the independence of Korea) could always be heard. And little by little, it started uniting all Koreans into one purpose, independence. Korean independence activists created organizations domestically and overseas were they planned resistance strikes. They used many strategies as a method to push forward the recovery of Korea’s national sovereignty, especially the ‘Heroic Struggle’, in my opinion is the smartest tactic that could be done considering the conditions they were living in, which targeted Japanese figures and pro-Japanese Koreans with violence trying to make heavy blows to the Japanese imperialists.Nowadays, Seodaemun prison is a museum that shows all the pain and struggle that patriots suffer within its prison cells. You can see how their spirit was unbreakable and you can share all the oppression and humiliation caused by Japanese. Even though the prison is empty, the independence patriots’ spirit can still be felt.100 years has passed since the March 1st Movement rallied the Korean people against oppressive Japanese colonialism. This epoch-making movement, their actions and their activist should never be forgotten because from it we can learn that freedom and peace are not given for free, you must fight for them. We should keep this legacy of our ancestors and treasure it because these are two biggest gifts we could inherit. In order to have a brighter and better future, it is important to learn from our past. As a final remark, we think, Yu Gwan-Sun words: “Even if my fingernails are torn out, my nose and ears are ripped apart, and my legs and arms are crushed, this physical pain does not compare to the pain of losing my nation” wraps the inherit spirit of every Korean."
Would have loved to learn more,"In the first building there was at least some general description in English in each display, although the description for the individual items were almost exclusively in Korean. In the second building there is no description at all in English, it’s all in Korean, and very detailed it seems like. I would love to know what they said. I asked the staff if there was a guided tour or an audio guide in English, but no such luck. A lot of the written information in English seems to have gone through Google translate, because sometimes it was tricky to decipher the actual meaning. There is a lot of focus on the atrocities carried out by the Japanese colonial regime, and rightfully so. But it barely even mentions that it was used for more than 40 years by the South Korean dictatorship which was not known for treating dissidents kindly. Moreover, there were a lot of schoolchildren running around shouting and laughing, which didn’t feel very respectful. "
Should-not-be-missed place to learn about history of Korean people,"It was on 5th May, which is Children Day in Korea, a beautiful day with blue sky, cool breeze and of course holiday break. I awarded myself a visit to Seodaemun prison to know more about Korean history and I was so curious to discover a different part of Seoul. This place seems like to be out of the beaten track for many tourists visiting Seoul, including myself. Before coming to Korea, I have not heard about Seodaemun prison. Seodaemun used to be a prison since 1910 by Japanese to torture and later execute Korean Independence Movement followers. The first thought pop into my mind was that this place would be scary, dark and horrible, and it was indeed horrible and terrifying once I entered the museum. I feel a bit guilty to say this but for someone having no idea about Seodaemun’s history; however, this place is a hidden gem of a hustle and bustle Seoul, stunning red-bricks halls, large playing ground with some green corners with a green grass field, trees and flowers… It was a bit crowded today, many school students and families visiting (probably because it was on Sunday and Children Day). I walked around the courtyard first, enjoying the nice weather and alive vibe at the courtyard.Walking around, I did not believe that these buildings used to be a horrific hell, where people were jailed, starved, tortured and killed. All the nicely elegant appearance outside of these red-brick wall buildings was completely deceitful. Inside the exhibition hall, there was a number of artefacts grouped into several displays, relating to the Independence Movement in Korea and the terrible mistreatment and torture of Japanese during their colony period. The basement under exhibition hall was not the place for the faint of a heart person, it was extremely unthinkable acting of violence. I have seen these terribly horribly unsympathetic torture methods for many times, but I still could not stand with it for any seconds. It was so dreadful that I just wanted to get out. I watched the video of an old man who was a Korean patriot. Seeing what he suffered after being ceiled here in Seodaemun, I just could not hold my tear and I do not think any of us can fully understand the hardship he and other people hold here suffered and their strong belief and determination to fight for the independence of their country and for freedom and happiness of their people. I still remember his saying “I am happy now because all Korean people are now happy”. Seodaemun prison was now served as the special museum in remembrance of the dark history of Korean and Korean patriots. This place could be a bit of propaganda against the Japanese to someone. Just leaving the anti-Japanese attitudes I so often hear, however, this place, filled with its dark history, is a historic place to teach people, especially youths, about the sacrifice that made up Korea today, the value of independence and freedom and the horror of the war. Personally, this visit was an emotional experience, knowing more about the history of Korean people and discovering another part of Seoul. As Winston Churchill said, “Those that fail to learn from history, are doomed to repeat it”. So, I do hope that there will be no more wars around the world and there will be no such horrific mistreatment that happened here in Seodaemun will be repeated any other places.How to get there:[Subway] Dongnimmun Station (Seoul Subway Line 3), Exit 5. You can easily see the guidance to the entrance of prison right after leaving exit 5."
Profound experience-highly recommended,"Easy access-right off of Dongnimun subway stop. Brought my teenage son so he could get a sense of the Japanese occupation and the Korean resistance movement. We had visited the Seoul Museum of History the day before, but the Seodaemun Prison History Hall truly brought the content alive. There’s no comparison to walking the actual grounds where political prisoners were once held. As others have commented, I only wish more of the exhibits were translated to English. Also I noticed there were tributes to student/worker/pro democracy activists, but they were only in Korean, and I wish I could’ve understood what they said."
Chills on prison hall,The place is starting to get crowded because they are celebrating their March 1 Independence movement. You can tour the whole facility for 45mins - 1.5hrs.Close to Seodaemun Independence park. 
Impressive,"A visit to the Seodaemun Prison will leave a lasting impression. We went on a calm Sunday morning. From the subway station (exit 5) you will walk straight to the former prison. The museum details the cruelties commited by the Japanese in the early 20th century, but gives little information about the time when the prison was in use during the second half when a lot of Koreans whom critiques the Korean government were imprisoned there."
"Easy to get to, moving exhibits, but noisy groups","Take the subway to the Dongnimmun station on the orange line. Leave through exit 5 and when you come to street level you can see the wall of the prison and easily follow signs to the entrance. The exhibits were interesting and moving. Most of the placards are in several languages, including English, so it's easy to follow along. I was disappointed that one of the prison halls with stories of individual prisoners only had information in Korean but there was plenty to see otherwise. If you're unfamiliar with the Japanese occupation of Korea I recommend doing a little reading about it before your visit. I had just finished reading ""The Living Reed"" by Pearl S. Buck and it made my visit there so much more meaningful. I also recommend following the route in the pamphlet they give you to completion. Some of the most interesting and moving exhibits were at the end.I had the same unfortunate experience with loud groups of school children (there were at least 3 large groups there) as another reviewer. Trying to experience a museum while large groups are moving through at the same time is not something I enjoy. However, I had started the museum around 1pm which is a common time for field trips to arrive. After the exhibits in the central building I took a break outside and sat in the shade for a bit. Walking around after 2pm was much easier. Some of the groups had left and the remaining ones had spread out. So if you find yourself bothered by large groups I suggest just waiting a bit."
Absolute must visit!,"I can't believe how amazing this museum is, absolutely chilling and surreal. It's so important to intake in the history of the country you are visiting and I had an unforgettable experience. I also had a local with me as some parts are in Korean and he was able to read and explain it to me. However be warned this can be a very emotional experience."
Like a Korean version of jewish memorial,"A place which reminds South Koreans of the brutal colonial rule of Japan. A nice place to see what Koreans suffered before earning their independence. A place to show respect. People are free to take photos, but it is important to remember that people died of torture here."
"3.5 stars, Interesting place to learn how Koreans suffered under the Japanese",I have been to a few prisons and this one was pretty interesting although I would have liked to see more displays about how the prisoners lived. More models and displays would be good although there were a few. Walking around the prison and imagining the painful history was interesting. There is also good hiking nearby and I would recommend going hiking early in the morning and then visiting the prison afterwards (especially in summer).
Such pain and suffering,"This prison history hall wasn't on our radar for our first visit to Seoul but for our second trip I was looking for something a little different, to discover more of the history of Seoul, and we certainly got it here. Seodaemun Prison operated from 1908 to 1987, in 1988 it was designated National Historic Relic No.324, then in 1998 the History Hall was opened. The Prison History Hall is located in Seodaemun-gu, easily to accessed by Subway Line 3, Dongnimmun Station, from here it is a short walk. Our self-guided tour prison history hall complex cost 3000 won each and lasted 1.25 hours using the brochure that we were given at the ticket office. There was plenty of the information to read (Korean and English text), the displays were excellent and conveyed the significance and at times were quite emotional. The torture chamber was the most alarming with descriptions of the variety of tortures conducted on prisoners, at times with sound effects. On the day of our visit the museum was well attended by nationals, young and old, and families. A very interesting morning."
Interesting Place,"We have been to many prisons around the world, and this one had its own unique way to memorialize its prisoners. Instead of death masks or head molds we have seen elsewhere (of newly executed prisoners), here we saw many molds of prisoners’ feet. These were presented on individual prisoner plaques, with a three-dimensional view of the bottoms of their feet."
Overrun by Poorly Behaved Children,"I was really excited about seeing this. As we walked around, there were no less than 50 groups of children (likely on field trips from school). The children were running around, screaming, and in my opinion, being completely disrespectful in an area where many people died so that they could have freedom. Their teachers largely ignored the behavior, and used microphones with speakers to talk to the children creating such a loud a chaotic environment that we could not possibly concentrate on the tour. The reason why I give it one star is because even though there were signs all over asking for people to be quiet and there were staff members in every room, I didn't see single staff member as the children or teachers to abide by the signs and be quiet. We left with headaches, shame :("
So sad what people can do to each other,This was another find by accident. We spent a full day here and had a day of sadness & amazement of the human spirit. The people were so badly treated but seem to still keep their spirit and pride. 
A MUST!,"You may need to toughtlen up a little bit when you come here, but overall, it's a very good experience when you want to learn about Korea. However, there are some texts without English :( Despite that, I still enjoyed my time here. There are only few tourists around. Most people who were there when I came were students and those who are in their mandatory military training. So if you want to stay off the touristy track, do come to this place. Admission is only 3,000₩. :)"
A Surprise,"We originally decided to visit here to fill in time, and so glad we did. The whole site has been refurbished and takes at least an hour to complete the route they suggest. Very good displays and explanations in English for us. As you walk around you could imagine what it would have been like for the prisoners under Japanese rule. Usually places like this only keep 1 or 2 buildings as a museum and destroy the rest but here you get to view basically the full occupied site."
View of Japan-Korea war,If u r interested in history of Korea u have to visit this place. The place is an old prison used during war agains activist. U may see torture and u ll feel how was hard for them to live there. And in addition if u r so sensitive u may be feel bad.
"Under-rated Historical Site in Seoul: 3,000 won for Adults","This location does not really pop out when one searches for places to see in Seoul. This historical site is very touching and biographies of those who have suffered under Japanese Colonial rule is very sad. Tour of all the buildings and walking the ground should take about 1-2 hours. 3,000 won for Adults1,500 won for Teenagers1,000 won for Children1,500 won for Soldiers"
Good for History Buffs,"Visiting on a very cold winter day, it was a very sombre place that outlines the history of the Japanese rule over Korea. Womens underground prison was interesting and the details that keep the memory of the suffering alive are interesting. Not the best English translations, but you get the general idea in the selection of exhibits and information on display. The metal die casts of feet; photography images and small artifacts paint a sad picture of the unsettled time in Korean history. We visited while half the place was out of bounds due to a festival rehearsal, but the stunning voices of the opera singers throughout the dreary halls of prison cells seemed fitting somehow and made the experience better! Subway station directly at the main gate; basic toilet facilities and a small souvenir shop. Not the best museum in the city but definitely worth a visit."
"Interesting, could do better with more language translations.","Prison was overall interesting and I could feel the solemn atmosphere of the different spots. However, they are not as inclusive in the sense that a lot of the signages are still untranslated and it makes me feel that I am missing out a little on the small details. "
Seodaemun Prison History Hall,"Seodaemun Prison History Hall is a monument of Korean history which chronologically illustrates Korean history of last 110 years. That alone is a reason why visitors of Seoul must visit that place. By visiting it, each individual can understand that part of Korean history and incredible power of will of Korean people to stand for themselfs. So it is a must see attraction in Seoul"
Good if you have time ,"Very close to the station - worth a visit. Unfortunately not everything in English, only really the sections about the torture/horrendous acts undertaken there. If you like to read everything at museums you may be a little disappointed. If you only have time for one museum I would go to the war museum but if you have time then definitely come here. "
History!! With a caveat...,"This should be a top attraction in Korea. The prison is actually a museum, that depicts not only the facilities of the prison and the atrocities perpetrated in it, with graphic pictures and, mostly, reconstruction of tortures with dummies, but also tells us the history of Korea's occupation by Japan (1910-1945). It is well organized and therefore easy to follow. Not everything is also in English but most of it is. The caveat is that I found it a little biased. It focuses strongly on the Japanese era and clearly is a strong criticism to that, which is OK. However, there is nothing about the period 1945-1987, during which the prison was run by Korea, after their freedom from Japanese occupation."
