review_title,review_body
Nice walk,We had a couple of hours and we went there Hanok village for a relaxing stroll. We were not disappointed! The old houses are super well maintained and the view of the city's skyline mixed with the old houses was breathtaking!
Quieter part of Seoul.,"Spent only 20-25 mins strolling around the traditional village area, but ended up spending another couple of hours enjoying few roads that has all small art shops that houses very pretty range of artwork, postcards, souvenirs, paintings and more! Prepare your cash! The neighbourhood is very peaceful, walk slow and enjoy your quiet time here."
Worth it,We spent two hours and took lots of pictures. One day it will disappear. A very pictoresque area. A purely walking area.
Worth a few minutes walk through.,"If there you must go up the hill. We followed the signs to the Observatory, but never made it the whole way.Disappointed in that we had hired a private guide to show us all over Seoul, but because there is no place to park near the 'village' (which is practically downtown), he just dropped us off for 30 minutes on our own with a designated pick-up spot."
Nice to see a bit of preserved history,"I liked walking around this village and soaking up the cute architecture, but also the idea that these little walkways have been walked up & down for many many years. Get up to an elevated spot and clock roof after roof in the old style - nice!"
"Lots of walking and stairs, great view at the top.","You can walk here after visiting Gyeongbokgung Palace and have lunch is one of the many small restaurants. There is a lot of walking on hilly streets and stairs. It is not all original, most buildings have been renovated or are new construction but still with the same style as the old ones. This is a residential area so cars are allowed and the residents stand outside with signs asking visitors to be quiet. There are lots of shops and restaurants"
Nice,Had a nice walk here. Full of shops and tea houses. Some sold traditional handcrafted items. Would recommend it. 
Crowded but interesting.,This is a residential neighborhood of very old homes. The houses are not open to the public but the streets (many very steep streets) are interesting to roam about (quietly because people actually live here). Great for photographers. Many visitors rent Hanbok costumes and pose for photos. Lots of little shops and places to eat along the way. Streets can be crowded on weekends.
Beautiful from a distant ,"as this is still an actual residential area the inside of the house can’t be seen, but it is the interior + exteriors that makes the Hanok ever interesting ... fine other hanok villages that allow you to have a meal in it I.e onion cafe "
Should visit but will probably not revisit ,"The taxi ride from our hotel in Gangnam-gu to Bukchon Hanok was 32000 won. What makes it worse was that the Naver Map direction didn't bring us to the correct spot. We were left at the end of the street near a park and had to walk for 20 minutes looking for the old village. Well not exactly old. Its a residential area with old houses and people still live in it. Snap some pictures and good to go. One of the checklist. And oh yeah, decent amount of climbing needed especially when with kids "
Quaint Village - Go Early!,"I wish I had read the prior review before wandering over to Bukchon Village. I have been to the neighborhood independently (not part of a tour group) a few times and it is lovely however, very crowded. The area is located very near Insadong, Gyeongbokgung Palace, and Changdeokgung Palace so a combined visit is absolutely possible. You can get a little map of the area that slows ""8 views of Bukchon Village"" which is a nice guide for a non-guided tour visit. Walking through just to enjoy the small homes, stores, and tea shops is also possible and enjoyable. The major downside to visiting this area is the hordes of tourists dressed in Hanbok trying to take the perfect picture down the quaint alleyways - difficult to just enjoy when you are trying to dodge disrupting their photoshoot."
Not what we were expecting,"Visited with my family on Sunday morning.Perhaps our expectations were unrealistic (was expecting a real old town/visit to the past experience), there were signs all over asking visitors to behave (talk with lower voice, not get in, not peeing, etc.); to me is just a nice residential area where the people living there seem to be annoyed by all the tourists.Took a few pictures and headed to Insadong, that was more fun than this."
Early morning visit was perfect time,"We visited early before people were up and loved walking the quiet streets.It was magical.But by the time we left, hoards of tourists were arriving .The neighborhood is a major tourist attraction,so if you want to capture the magic,go early."
Long walk but what a view!,"You'll need your walking shoes to get up there. Steep narrow roads but for those who love Korean architecture, this is a must see. Fantastic view of Seoul skyline from the top of the hill too. Breathtaking. Got to keep your voice down though because there are people living in the houses."
Must visit for tourists,"Its a long alley filled with Korean traditional houses. It just gets crowded with tourists. As i know, there are still people living in them so visitors are discouraged to make too much noise. I didnt go walk further because there were too many people."
The Past Retained,"Located between the Gyeongbokgung and Changdeokgong Palaces and just a short walk from the Anguk Metro Station you will find a little section of old Seoul retained. It is a mix of old and new, traditional and tacky but it is very interesting. Take the walk from Exit 3 from the station and walk up the hill . The place is well-signed and maps are available of the area showing the preferred walk. It is about a 3 KM walk and some points give good views of the city and the old buildings with their tiled roofs."
Neighborhood With Many Traditional Houses,"Bukchon Hanok Village, in a Northern hilly area of Seoul, is my favorite neighborhood in the city because of its distinctive traditional architecture, known as hanok. Boasting several hundred of these homes, it has the largest number that still remain in the metropolis. On my most recent visit to Seoul, I took a friend here to introduce her to this earlier-era style that relies on natural materials. The one-story, tile-roof houses with patterned walls, first designed and built in the 14th century, feature an interlocking framework of uwooden beams that rest on blocks of stone. Other elements often used include earth, clay, straw and paper made from mulberry bark. The traditional courtyard garden remains hidden from the street.We stopped first at Bukchon Tourist Information before the village for free maps and brochures. The man working there spoke excellent English and proved to be most helpful. But we did not go there directly. Instead, we stood looking confused about where to go at a crossroads and were approached by a mobile tourist information rep. Dressed in a red jacket and red hat, he was in the area to offer assistance to tourists, armed with English, Japanese and Chinese language skills. I have never witnessed this service in other cities worldwide. These reps can be seen throughout popular tourist destinations in Seoul and have steered me in the right direction more than once.As we ascended the hill, the hanoks suddenly appeared and the modern city had been left behind. Many of the houses have been turned into tea houses, restaurants and workshops, but there are still private residences galore. Two women in yellow hats and yellow vests with “Please be Quiet” in English, Japanese and Chinese emblazoned on the front and back walked along the narrow alleys, often putting an index finger to closed lips. I also noted a poster on one wall, requesting visitors to be quiet. It appears that the residents would like less noise in their neighborhood.We arrived here in midday and it was like tourist central. Despite efforts to keep noise down, many visitors could have cared less. One even noticed a gate ajar and rushed into the courtyard of a private home to take a photo. But there were plenty of photo ops along the alleys and at the top of the hill, where a stunning view of Seoul could be captured. We headed off to more quiet streets to simply soak in the atmosphere. In the past, I have gone here in early morning and the whole area was naturally quiet.Bukchon Hanok Village can be reached by subway line 3, Anguk stop. Take exit 2 or 3 and follow the directional signs."
Nice traditional architecture in the middle of a bustling city,"When we visit anywhere new, I always like to have some historical places to visit as well as seeing how local life is at present. Having seen lots of castles and shrines already, a traditional village, where people still live, sounded like an interesting place.It really was beautiful, and in some places, the contrast with these ancient homes ith th buildings of modern Seoul in the distance showed how the city has changed. There were several girls walking about in traditional hanbok costumes, and that enhanced the feeling that this probably had looked the same hundreds of years ago. All of that, I liked. A lot.But, if you head to Seoul, or anywhere in Asia in the summer, it's going to be hot. Because it's hot, it's not the peak tourist season, but that doesn't mean that tourists aren't out in force. Just like us, hundreds of others decided to come here mid-afternoon; it was very crowded. In order to get decent photos of the architecture, etc.. you have to be pretty creative in angling your shots, or at the very minimum, wait it out for enough people to walk by so you can get a picture.I would guess that this is pretty typical no matter what time of year you're here, so if I were going to go back, I would head there first thing in the morning, when the residents are about the only people you'll see in the streets."
A cultural village,A beautiful little village portraying Korean's culture and modernism. Wear hanbok to take exquisite pictures.
Love the surrounding,Its a very pretty housing complex to walk in small alley. The houses are very pretty!! There are 2 side areas that you can visit. If you get lost there are local guide which offering you help to reach the area. 
Beautiful ,"Hanok Village I will fully recommend those who need to take pic and enjoy the view of the village. It was beautiful and the village offer many things such food area, shopping and souvenirs. "
Must to visit!,"This is a MUST! to visit, this place is definitely one of the most important historic places in Seoul, you can find lots of souvenirs and also rent a traditional Hanboks dresses and much more."
Traditional ,Narrow streets with more traditional korean houses. Very crowded with many tourists though. Few souvenir shops and a couple of cafes.
My favourite thing to do in Seoul,"Excellent part of the city - beautiful houses, nice little shops, good food - great for walking around and get lost ;) Artsy and beautiful area, close to the main palaces. Cannot wait to be back!"
Wow! Ancient Homes in the Midst of Bustling Seoul,"After visiting the palace, I continued my walk and ended up here at this ancient portion of town, where I believe the homes are about six hundred years old. I walked the alleyways to get a real feel for the homes there. In this area you will also find cute shops and some restaurants. I felt very safe walking around by myself."
Stunning houses and streets,"We visited as part of our Seoul full day tour. Stunning houses and streets. If you visit you need to be quiet. The residents love their little community, but it is popular with tourists as it's so stuuning. "
Pretty but busy,"Very easy to get from subway, very pretty, and the people dressed in traditional costumes looked amazing, small than I thought it would be but worth a visit"
Nice place to visit,"This village is an area in the city center of Seoul very famous because you can find there the traditional houses, where nowadays people live. Actually I expected them to be more authentic, but in fact those houses have been renewed and they have just tha appeal of a traditional building! I went there on a Saturday afternoon and in the streets there was also a handmade market with lot of jewellery and artisanal products. The place is also full of bar and cafes where you can have a break dipped into this tipical atmosphere. "
Not that great ,This village is actually local residential area. There were shops that provides the traditional hanbok where tourist can walk around and take pictures. You don’t really feel welcome there as there were few protest signs on local unhappiness. 
Culture to touch,The Hanok Village is a great place for you if you wanna explore the culture parts of Korea. You can rent a hanbok (traditional cloth) or vitit old houses and get some tea. 
A touristic thing...,"It has been a pretty long walk from Gyeongbokgung but, actually, there's nothing to see.it should be an ancient typical korean village, but it has become a tourist thing, with shops and many coffee houses.There are many other places in Korea if you want to see a typical village."
Experience the old way,This Korean traditional houses are interesting and for me a must experience. The traditional villages have lots of alleys and the house have open air in the center court with rooms around it. We stayed in one of them in order to have the sleep experience. Sleeping on the futons and enjoy the close community. 
Korean traditional houses,"This place with Korean traditional houses is very popular for tourists for sightseeing. There's a place where the tourists can get experience the korean traditions such as Tea time,korean traditional game,... It's really interesting place for visit. "
Highly recommended to visit - Mix of modern & quaint buildings,"Very pleasant to stroll around the village which is mostly made out of quaint buildings. Although a tourist attraction, it's still a residential area. Some parts of the village are quite hilly so be prepared for some steep walking. Along the main street, it has some nice cafes, restaurants & souvenir shops. Overall, visiting Bukchion Hanok Village must be one of the items in your itinerary when visiting Seoul."
Amazing place,"Great place, great atmosphere, a must visit before even other places. Need an hour to two hours minimum. "
Lost in the city,"A small town outside the city, a must to visit in Seoul. You also have great view on the city. Take time to walk around and not only go in THE tourist road !"
Tour With Oppa,We did a tour here of the village. I loved it. It's a beautiful historic site with lots of interesting history and it has been apart of different KDramas. Lots of walking but worth the trip.
Beauty!,"These streets are unique and must be seen. Although there are guards to warn us to be quiet, you can observe today’s artists houses. Perfect!"
Traditional village but not too old,You should keep silent when you go here and the contour is going up so keep your energy. I love Jeonju Village much better but this is also a nice place.
Very quaint. Just feel sorry for the residents ,"The village is close to the main palace, set close to some trendy shops and cafes.It's a great place to wander and get lost.It attracts a lot of tourists so worth remembering this is a residential area and the locals deserve to be respected. There are people around trying to get people to keep the noise down and stop you from entering the doorways of houses."
Small area but worth it,"Good to visit the place and see the traditional houses.Try to find EGG DROP sandwiches, they sell really good sanwiches. It was very sunny in summer, so pls bring your necesseties. I think qinter is the best time to visit the place. Bec we wanted to try thr traditional costume but it is too hot so we have to pass."
"If you don't have a teenage girl, it's quite boring","Girls who like to dress up will find it amusing to stroll the streets with the traditional Korean attire. For the rest of us, however, it's quite a boring place. Tourist-trap prices, not very pretty (lots of electrical wires hanging low between houses, looks somewhat run-down), and quite exhausting to go up and down the streets in the humid heat of summer with no clear aim, except seeing some old houses here and there."
Put comfy shoes on for this hilly walk,This was really enjoyable walk to the top. There's a lot of unique shops at the bottom and a Cafe at the top that has a 5000won entry fee as it doubles as an art gallery. Be careful not to slip if it's raining and note there are a lot of signs to keep quiet as it's a residential area and even people enforcing the silance. Families with loud kids take note
Bukchon Hanok ,"Great place to go. There are free guides - our guide is Seong II Yoo. The walk around the lanes, stories about the past, architecture and history Great place to visit "
An afternoon immersing in traditional culture of wearing Hanbok,"We rented the Korean traditional outfit, Hanbok and wore it at Bukchon Hanbok Village. It was a scorching afternoon but certainly a great experience of being like a Korean for an afternoon. This activity is recommended to people who are looking to immerse in Korean traditional culture! "
Uphill walks,"It is actually a beautiful Korean village filled with Korean styled houses. However, it is located on a hilly area. So do expect some uphill walks while there. There are signs posted around the area and staff wearing high vis vests patrolling to remind tourists to keep their voices down as it is still a residential area. Interesting to see the Korean styled houses."
"Beautiful place to visit but, be polite!","This is a very nice and quiet area of Seoul. Well conserves streets, you can imagine the old Seoul walking among those streets...but is a real neighborhood so be respectful!!!"
Walking along Bukchon Hanok Village,"We were there leisurely walking through the streets of Bukchon Hanok Village. It was a memorable one for me seeing those traditional korean houses. I regret not having worn the Han Bok custume. It could have been so challenging walking with that custume. It was worth the visit. If I have the chance to visit Seoul again, I would gladly come back to this place again."
Fascinating place,"Fascinating area, still inhabited by regular people not just kept as a historical landmark. We stayed at one of the guesthouses in that area. Authentic hanok house. Amazing experience. Highly recommend to anyone. The only downside - streets are never empty, crowds of tourists are everywhere. Unless you wake up really early. Crowds take away some charm from this place. "
Past meets present. Bring comfy shoes.,"Bukchon was really the only thing I wanted to see in Korea. We went on a tour and I was quite disappointed, not by the village, but by the tour guide who rushed us through. It also started pissing it down raining. I managed to get some decent shots which I have to edit, but I could have used more time. The houses are all still inhabited and are worth upwards of a million dollars each. Although the facades are required to be preserved, the interior of the houses are all very modern and updated. There's signs asking tourists to keep their voices down, no loud pictures, music or talking. I guess some rude westerners had caused problems in the past. Anyway, bring comfy walking shoes as there are a lot of hills in the village. Bring a wide angle lens as well."
The old style architecture of Korea ,There are many houses with the traditional Korean architecture. It is worth to wall around. Koreans are respectful and they expect tourists to be respectful too. So it is nice to keep voices down while going around the neighborhood. ;)
Bukchon Hanoi Village ,Beautiful village with interesting architecture. It’s a residential area so it’s important to be quiet and respectful when walking around. Cute little shops and lovely views.
Nice but not really special ,It is nice to wonder around. But if you have only a few days....skip it.To may people.....Ok lots of small nice shops.... but as soon as you know you are out of the district. So practical there are just a few nice streets...
A must see ,"The neighborhood has the largest collection of privately owned hanoks, or traditional Korean homes with tiled roofs, stone floors and amazing wooden doors, in Seoul. It’s located on in a hilly neighborhood nestled between Gyeongbok Palace and Changdeok Palace which are both walkable for this location. While I strolled through Bukchon Village up, down, back and forth it may feel like a trip through the ages, the neighborhood is not frozen in time. Some of the hanoks are still private homes, but others have been converted into tea houses, coffee shops. These are neat little places to get a look inside on of these beauties majority of them be historically updated renovations but they kept it to the err of time. I really enjoyed my time even while it rained. Remember people still live here so a quiet ordinance is in place and is patrolled. "
Nice residential area,Nice place walked for about n hour n then left for palace which is near by old traditional houses n people still live their so u need to b decent by not disturbing them n making noise or knocking doors Lots of art houses traditional shops and cafes 
Traditional Korean house,This is a cluster of Korean houses (Hanok) situated nearby the palaces in Gangbok.Most of the houses have been modernised but maintained the traditional Korean architecture design.It’s on an incline and may be a challenge for older people or parents with strollers.Generally a residential area and will have to observe general etiquette when visiting this area.
A nice traditional village,"It's a nice traditional village that located in a big modern city. Here, you can admire korean traditional architecture through hanok house. There are some cute souvenir shops here. It takes time if you come here for the first time because there are many corners so that you have to explore to looking for nice spot for photos. Be quiet because it's residence area. You can rent hanbok outside and come here to take some great photos. And don't forget to check Baek Je In museum house. You can enter the house. It's really nice"
A route only for the healthy and adventurous,"We spent so little time there in the morning, as we brought our parents. We visited a nice cafe inside that served delicious muffin and drinks.Some of the routes are steep, and require good stamina. Heck, we just stayed for around 30 min walking and maybe another 30 in that cafe. We just had a couple of good photos (since we were all dressed in hanbok) and left.Maybe if I travle with friends someday I will visit this village again, maybe even make a traditional stamps or two. But travelling as a family... I won't recommend this place."
Nice place to visit but there are so many people,"Many nice traditional houses, there are so many shops and cafes on walking street. But it’s so crowded, some people talk loudly even though they have attention boards. It made us not enjoyable, although its great place to visit. Luckily we went to another part, its a short street. less people "
Very pretty,"Picturesque village, can have a walk around, and look at the old style buidlings, also lots of souvenir shops and food"
Picture Perfect ,We rent a hanbok in Bukchon Hanok Village. It was a beautiful place for taking pictures in a hanbok. Many historic and ancient korean house there. Overall it's beautiful.
Long walk for nothing,"It was nothing like in the pictures, and way more smaller. If you come here, you won’t be able to understand what is a traditional Korean village. It looks like it just visited to be the perfect instaspot, but even for that, you’ ve to be in the perfect position, otherwise it’s nothing."
Beautiful but busy,A super place to see some traditional Korean architecture but it can get busy with tourists taking photos. Be sure to get there as early as possible to avoid the lunchtime rush and enjoy the cultural alleyways in peace.
Traditional Korean Houses,"Lovely neighborhood with privately owned hanoks. Start out at the Tradional Cultural Center and pick up a free detailed area map. The Cultural Center has restrooms and displays of typical hanok houses that you can peek inside. Shops and restaurants are along the way although on a Tuesday morning there did not seem to be many places open but the crowd was also sparse. Signage is good at helping one find the way. Some of the streets are steep. We took the metro getting off at Anguk Station, exit 3."
Korean national dress optional!,"Probably the quaintest part of Seoul, this neighborhood is a great place to spend a Sunday morning. Wander up and down the hill and look at the beautiful old houses with incredible details. There are cafes, small shops, and galleries dotted around for refreshment or a spot of shopping. There are also shops renting our Korean national costumes, perfect for an IG moment!"
Nice To Walk Around - 很值得走一走,"It is nice to walk around the area if you are in the city. Up & down hills with ancient houses, nice small shops & restaurants, cozy cafe & design goods, this is the area worths to spend at least couple hours. Popular cafe houses, restaurants, photo taking spots & local and ancient life sightseeing can be all found.如果你在首爾，這裡肯定適合走一走，上坡下坡於老房子、很不錯的小店和餐廳、舒服的咖啡廳和設計小店，這個地方可以花個幾小時慢慢走一走，有名又受歡迎咖啡、餐廳、拍照熱點和當地又古老的生活在這裡都找得到。"
