review_title,review_body
Lovely Place to Explore,"When I travel I always appreciate finding historic districts. Bukchon is an old neighborhood made up of mostly classic style Korean homes. You can meander down and around small alleys and there are surprises along the way. I was lucky enough to have a sweet snack being cooked in the doorway of an older man's home. Not sure what it was, but it was like a carmel cookie. Very yummy! The other good thing is that it is an easy walk from Bukchon to the Palace so if you like to walk, you can see a lot in an afternoon."
I wanna live here!!!!,Actually this was my second time in seoul. I have heard about this village which is near the palace but I got no time to visit back then until this trip. And I was regret I didn't do that on the first trip. It was amazing and lovely village. You might get a bit tired from climbing up the slope but trust me it's worth. The area is really big so I suggest you guys to go to the information Center for the village and the staff will show u on the map which way to go and what is interesting to see so you don't have to walk the whole area and save a lot of time. Along the village track you can see a lot of houses that open for a small museum or a craft shops. For some reason you can also rent and try on the Korean tradition dress Hanbok for 7000 won. If you are a big group of people pls noticed that silence is required for this area!!
cute collection of ancient houses,"Up a set of stairs and along narrow passageways are lots of old (looking) houses that follow the ancient design for this area of the city. It has been renovated loads but there is still a strong sense of what it was. In amongst the grand houses are fancy shops, museums, and galleries."
Overrated Tourist Trap,"I would say avoid this as it is mostly a tourist trap, with shops all over the place. Instead visit the Namsan Hanok Village, it is quieter, cleaner and is pretty much the same thing."
Old Korea ,This is a wonderful walking tour of an area of Seoul that had been somewhat preserved. People still live here and there are signs everywhere asking to respect their privacy. Stop at the Bunchok information center first to get a map of the area then hit the streets with your camera. A wonderful flash from the past. Great views of traditional Korean rooftops. 
awesome,"walked with two young children...everyone enjoyed the day. stopped to buy souvenirs, ate street food, took tons of pics of architecture...wish we had known about guest houses in area!!"
Nice to get away from the city,Nice place to stroll around. It shows some of the Korean history. It is worth having a look around - you get away from all the busy streets of the city. On a nice sunny day you can get great photos.
Very cute,They houses were great to see. Very traditional and very nice. I found myself getting disorientated a bit but there are many info centers around that can help set you straight. The maps are good and in English and the street signs also have English.Cute shops and some nice street food.
Hipster street and wonderful,"The main commercial thoroughfare in Bukchon has a ton of adorable shops, stores and coffee places. It's also immediately quieter from the 6 lane streets, so you can easily wander and window shop. I also loved the residential area of Bukchon but because it's a populated residential area, it is a bit awkward to be wandering with packs of other tourists around people's homes. There are a lot of signs up asking people to be respectful, and the residential area is technically only open until sundown - but most streets I turned down had several dozen people on them. It's hard to keep several dozen tourists quiet. You won't be able to wander and absorb the feel of the place easily so I'd recommend checking it out briefly and then heading back to the more commercial area to explore some intriguing alleys and shops. "
to feel Korea's quiet atmosphere,"For photographer and walker. I like this place. Very quiet at day and night. There is one place 'Garage coffee', roof terrace with nice view, draft beer and foreign waitress."
a glimpse of the past,"this is probably my favorite place in Seoul, as I went there twice in my one week of stay! you feel like you've traveled back through time and every street corner is perfect to capture some great pictures! there's also many shops and coffee places that are tucked in the little streets, it's a nice escape if you want some quiet time and walk around the old housing and tea houses- it's truly a beautiful area to visit! "
Alternative to shopping,"one of the best places in Seoul to visit on a lazy afternoon durin winter.If you're into nostalgic and quaint-stuff, then Bukchon Village is the ideal place to visit."
Great place,"A very unique experience in this place, spent half a day strolling in the alleys, observing Korean traditional houses and take a lot of photos in the process. Made our presence as quiet as possible to avoid causing disturbance for the local residents as we saw reminders on the wall."
You should go there,"Authentic village Seoul, with wooden houses, great view to city. You must keep silence, staff on the streets help tourists."
Charming,"Despite the swarm of tourists, this is a charming area to wander and where one can experience what Seoul was like before the high rises arrived. "
Walk and Marvel at the beauty of Bukcon,"Visited this in July 2014. Started off from the tourist center at Bukchon. Took off on its suggested route. It is a beautiful neighbourhood. There are Tourist Helpers along the route who can speak English, Chinese and Japanese to guide the visitors. Lots to see around the neighbourhood with shops, eateries, places of interests."
Lost in time,"What a great use of time if you want to see something that takes you back time 700 years. What fascinating architecture that you can touch and sense. As you walk the streets and view the houses, you are able to step into some of them and and see what the elite class considered their homes. There are not many places where you can see and touch history."
It's just a neighborhood.,"This was probably my biggest disappointment in Seoul. Yes, the houses are somewhat old-fashioned, but you can see similar architecture all over Korea. Personally, I felt like I and the other tourists were being very intrusive - it is a residential area, after all. I'd only check it out if you happen to be in the area, and even then I wouldn't stay for more than a few minutes."
Scenic place,"We enjoyed a nice walk through this neighborhood and took many photos. Although is was packed for the Lunar New Year, we managed to escape the crowd by leaving the main path.Great area to see how the people used to live. May photo opportunities.Grab a map from the small tourist stalls in the area. They suggest different kind of walks and good explanations."
Wouldn't see it anywhere else. Go high ,"Get lost in the side streets and explore. The higher you go the more you can see. Narrow streets that overlook the city below. Worth hiking up the hills for a unique perspective of the architecture.very touristy with lots of popup shops. Some homes open for a fee. I heard one say 800 won each just to go inside and look, no thanks, found a free one around the corner.Take your time and get lost. You'll find your way back eventually. "
Unique place for photos,"I like those charms of traditional Korean houses and the simplicity of beauty.It was a sunny day in winter, all wonderful scenes."
Great Experience,It's fab place to be to see how the OLD korea looks like. It's a short walk but it's worth it. I took so many pic there.
Unique perspective ,The architecture is beautiful in this historic area and you really get a sense for what the city might have felt like a few hundred years ago. It was really neat. 
We were having fun with Hanbok.,"Hanbok is the traditional Korean dress with vibrant colours. To try on it, you have to pay 7000 won including entry fee. Nice place to have fun and feeling Korean traditional culture there. You should try!"
Huge Hanok Village,"Hanok Village in the big city of modern Seoul. Should join the ""Bokchon Hanok Village Walking Tour"" for the first time to check out the important points."
Charming,"Bukchon is a lovely area, well worth exploring. Old-school Korean architecture and lots of independent cafes and restaurants serving authentic Korean cuisine. Also art galleries and shopping. Not to be missed."
Bukchon: traditional Korean housing renovated for today's living!,"Bukchon is one of the most delightful areas in Seoul to spend and hour or two comparing old Korean hanoks(not so many of them as more are being renovated every year) as they were originally built with beautifully renovated hanock for today's modern living. It is both interesting and informative to see how the modelling of these houses are enhanced with the use of pale wood panelling and modern fittings.Some hanok owners are offering home stay experiences, well worth a visit if not one or two night's stay!"
Absolutely Go and experience the Charm of an Old Seoul Village,"Just like some of parts of Tokyo, I love the low rise, old neighbourhoods that have been renovated but have kept the charm of an Old Seoul Village. It's walkable, and a lovely combination of the old with new shops and cafés. Charming! "
Like traveling back in time,"Going here really does feel like stepping in a different place and time, so very different from Seoul's modern buildings. We had a free walking tour from the Korea Visit Org (highly recommended, the guides speak good English and are very friendly -- plus it's free) and it was enjoyable.Only thing is the entire walk can be very tiring, especially the uphill areas. My two elderly companions didn't enjoy it as much because of all the walking. Wear good shoes, maybe trim your itinerary a bit if you're short on time. This is a place best made for slower walks and absorbing the scenery."
Where history comes back to life,"I went there very early in the morning thinking that there would be less people and easy to get around. I was right! It can be a bit difficult to find your way and manage to see everything, but there are maps and dirrections to help you. Even if it is a turistic area, people live there, so try to keep your voice down a bit!(just a small advice)"
Good for taking photo,A nice place to visit. There are many Korean style houses which are in good condition. 
Traditional bukchon residences,"If you have time, do make a visit here to view the architecture and streets of this residential area. Views from some of the streets are awesome!"
Walk through the Past,It was nice to walk through an old neighborhood. So much of Korea has been modernized that it is nice to imagine what it would have been like.
Traditional Style House,Great way to spend an afternoon. Great for strolling and exploring. You can pick up a map with a suggested route at the tourist office at the foot of the neighborhood if you like.
urban hustle and bustle old and new,"Great area with very old architecture beside very new buildings. Great little shops with a focus on creativity and arts and crafts. Great walking around with some cardio up those hills (but then you can go down, too). Definitely a spot to go while in modern Seoul for a taste of the past."
What a great experience,"Bukchon...I've always wanted to visit it ever since I watched a Korean drama with my favorite actor Lee Min Ho which was filmed there...I did get a chance to finally visit the place in the fall. I was amazed at the number of narrow streets, traditional hanok houses and modern cars parked in front of them. Lots of tiny traditional tea houses are located on the main street leading up to Bukchon, which I visited. So many things aside from sightseeing can be done in Bukchon, but I only had a few hours to spare on the day I visited. There are cultural experience venues, traditional pottery and jewelry stores. You can even stay overnight in one of the specified houses. When you get to the top you have a fantastic view of old vs modern Korea with hanoks by your feet and modern Seoul skyscrapers in the distance. A paradise for a photography enthusiast such as myself. I will definitely be back there, and would recommend going to Bukchon to everyone. What a great experience. As I mentioned, I went in the fall, so everything looked twice as beautiful with fall foliage. Oh, and I did get to find the filming drama house location which I was ecstatic about."
Nice place to wander,"Get a map from the Bukchon Cultural Center before wander through the streets and alleys of Bukchon. Do note that it's rather commercialized, with cafes and retail stores that is far from traditional. But still interesting..."
Traditional Village,See and take photos in this traditional hanok village in seoul. Takes a lot of walking uphill though but it's all worth it.
A mini glimpse at traditional Hanok villages. But for a more pure experience head to Gyeongju near Busan. ,"This is a good experience to see traditional Korean housing without leaving Seoul, but it's crammed with tourists like everywhere in Korea. However the buildings are cute and it's a nice place to spend an afternoon with good weather. If on a limited schedule and you can't make it to Gyeongju check this out instead. "
Great Part of a Walking Tour Of Seoul,"Let me just say that having lived in Seoul for two years, I developed a walking tour route for when people visited. This attraction is part of that tour that can be lengthened or shortened as needed. The general route was: Begin at City Hall, walk up through Gwanghwamun Square visiting the Cheonggyecheon Stream and a possible visit to Hangul Museum under statue, continue to Gyeongbukgung Palace. Time permitting walk up through Samcheongdong into the Bukchon Hanok Village, continue down to where the tour ends in Insadong. This is enough for just about a full day of touring and requires A LOT of walking.One of the interesting things about Bukchon is that it is in a sense a 'living museum.' People still live here and these are still active houses. Looking down the narrow streets over the roof lines really gives you an idea of what Seoul might have looked like long ago.Being one of the major tourism spots in Seoul, there are a lot of tourist trap type shops and cafes. But, all round this area are some really great traditional tea shops and even little art galleries tucked away. It's worth doing some exploring. As touristy as it is, it is not as bad as Insadong and tends to be far less crowded.Well worth the walk up for a vist!"
Don't miss this!!,"This is absolutely fantastic! Bukchon is a traditional Korean hanok village in the heart of Seoul. The hanok houses are so beautiful, and I couldn't stop taking photos. It is possible to go inside some of the houses, and you can also buy morning or afternoon tea and just enjoy the atmosphere of this amazing place. The streets are quite steep, but it is definitely worth making the effort to navigate your way through them. And you'll find some great views over Seoul too. I would highly recommend a visit to Bukchon."
Very different,"Bukchon is a place to go if you are into something different, unique for photography. You feel like you kind of step back in time a bit there with the architecture. Traditional village and some unique shopping can be done there."
Beautiful yet Not enough,"been to this place the morning before our flight going back home (manila). though im satisfied seeing the hanok, but i would love to experience going inside and see how traditional houses were arranged. unfortunately, we were not able to follow the tour map and were not able to reach the highlight of the hanok village (where the abundant hanoks are located). dont forget to try a mango dessert at philippines dessert cafe. :)how to get here?we took a train from myeongdong. the nearest subway station is Anguk (orange line, line 3). take exit 3, walk few meters and take left turn for Gyedong-gil (road/street).For tour map, visit this site and print the map: http://www.visitseoul.net/en/article/article.do?_method=view&art_id=58509&lang=en&m=0004004004001&p=04"
living museum,"Bukchon is like a living museum, right in the middle of the city and within walking distance from the main tourist attractions in Seoul, namely Gyeongbokgung, Insadong and Gwanghwamun Square. Having said that, there are people living in the well-preserved village. Unfortunately, tourists did not think about that fact when they shouted at each other like it was an area full of residential buildings and nothing else. Because of this, there are signboards seeking tourists to keep their voices down which seemed to be ignored.It was nice to get lost in the village but it does not hurt to get a copy of the map from the tourist information counter at the beginning of the road.There are a plenty of hanok villages in Seoul alone. This is probably the most popular one due to its location and wonderful hilly view with photo opportunity spots you may find along the way."
Traditional Village Remind me my school days,"Defiantly worth to visit to bukchon if you want to feel true atmosphere of Korea , especially traditional village is very lovely , gotta walk a bit but there is signage on the street in English and there is even a tourist information office to assist you when you lost your way , you can spend the whole day wondering around the area ,this is one of the best place we visited in Seoul ! If you are the type who appreciates and like to experience local attractions Bukchon is the place to visit in Seoul"
Not so impress with old town,"The area is nice filling with coffee shop and nice shopping area. However, I am not very impressed for the old town part. It is nice to visit but don't expect too much."
Pity the Residents,"With so many noisy tourists milling around this small area, I felt kinda bad for the poor residents who have to endure this inconvenience day in day out. Some of the *ahem Chinese ahem* tourists were even screaming at each other to align themselves for the ""perfect"" ""jump shot"". (Dear me!)People talk about this place like a teleport to ancient times, but it's hardly the case, unless old roofs and old doors are your kind of history tours. There were no shops open when we were there (some of the houses have been converted to run-of-the-mill souvenir shops), but to see them open would probably affect the atmosphere even more!"
Beautiful Hanok Village & the cathedral,"I've visited Bukchon with my mom in one of the coldest winter day, but it was definitely worth all the chills! Its a must see sight if you are interested in Korean traditional culture and its old architecture style. Theres a free cultural museum/gallery along the hike so make sure to stop by and take a peek. (They sell souvenirs like postcards and magnets in there, too.) Last but not least, small tip for Catholics who visit Bukchon - Theres a cathedral nearby called Gahoe-dong Catholic Church, which is a historical place for the Catholic Church of Korea. The cathedral itself is a mixture of Korean Hanok and Western-style architecture which is worth a visit."
Worth a trip,Its interesting to see the old style of housing and the juxtaposition of the old and new architecture in the area. We also went to the Bukchon Traditional Crafts Experience Center there and had fun doing crafts.
A gem in Seoul,"Located in Insa-Dong, Bukchon Hanok village is easily one of the best places we visited in Seoul. The ancient traditional Korean houses are beautiful. People still live there although commercialization has taken place where houses have been sold to be converted into shops, restaurants and cafes.We patronised one of the cafes, not just to have a coffee break, but also to experience a hanok. We were given a room where we had to sit on the floor round a low table. The architecture is interesting and the sliding doors similar to traditional Japanese houses. The view from the balcony overlooking the village was really awesome. (The café was located at the top of the hill.)If you are the type who appreciates and like to experience local attractions, Bukchon is the place to visit in Seoul. In fact, the entire Insa-Dong district is lovely with its Korean-themed shops that sell wares different from what you normally get at mall and even Myeong-Dong."
Favorite Place in Seoul,I LOVED THIS PLACE.You can spend the whole day wandering around this area. Traditional design buildings and cute indie craft shops and cafes a genuinely beautiful part of the city
Nice place filled with Hanok (Traditional Korea Houses),"This place is beautiful, gotta walk abit but there's signage on the streets in English. There's even a tourist information office to assist you when you lost your way.It's definitely worth the walk up the slope. A nice place to look around and take a stroll. "
Traditional vileage,Definitely worthy to visit to Bukchon if you want to feel the true atmosphere of Korea. Especially the traditional vileage is very lovely.
No Regret,Easy to find.. stop at anguk exit 2 so cool place and i miss to get back here next year.. many hand made store that i love the moat of Korea
Very pleasant stroll around the alleys,Very pleasant stroll around the alleys and neighbourhood. The Customs and arts are excellent. People are very nice. I dined in a couple of traditional Korean Restaurants in the neighborhood and they are very delicious and reasonably priced.
Quaint and quiet,"The streets of Bukchon are lined with many hanoks or Korean traditional houses. These hanoks are protected against modern development so you can see and feel the aura of old-style Korea. As the place is situated on the mountain, it is rather steep and hilly so do be careful when walking around the place. The hanoks are privately-owned so people still live there. Due to that, there are many signs along the way reminding tourists to be quiet as so to mantain peace and quietness of the place. The main street of Bukchon has many hanok-styled cafes where you can grab a cup of coffee whilst soaking up the atmosphere. If you get lost, fret not because there are many tourist information staffs around the place and they'd be happy to give you directions or answer any of your questions."
Old part of Seoul,"This corner of Seoul is a must see, if you want to experience the old part of the city. Be sure to pick up a map at the tourist information and follow their walking route to see all the best streets. You get great views of the city too, especially the Namsan tower. Best come later in the day and take in the sunset."
Unique Hanok House,"We were here by Nov 2014 after we visited Changdekgong. We saw many unique and magnificent Hanok houses. Most of the Hanok had changed to guesthouse. It's good attraction to know these traditional Korean people living places. Also we can saw some wall paintings with beautiful picture, very cute and special."
Bukchon,"I stayed in a traditional house and slept on the floor for 2 nights. It was a little hard for my old bones but I enjoyed the experience. It was fun to walk around the neighborhood and see all the old houses. note:( I was there in April 2013, not 2014 but was not given that choice)."
Small corner of paradise,"This would have received five stars had we not visited similar areas in Jeonjo and near Andong. Nonetheless, it was a treat to see these traditional structures preserved and to wander about. Interesting cultural center with excellent maps. I think I would have really enjoyed the culture/art making classes at the center if had had more time or in warmer weather!"
Get your souvenirs here,I was ready to go home almost empty-handed. Then I came by Bukchon hours before my return flight... Very interesting things you could buy for your loved ones back home!
Traditional Korean archtectural beauty,"It is a great place to appreciate Korean archtectural beauty and functionality. It is also interesting to see how people actually live in these traditional structure with modern improvement. It is hilly but worth the cardio. There are several work shops you can vist and learn some of traditional craft. It is also close to the major touristic spots (e.g., palace or Insadong or the temple)."
Worth a visit!,Its really worth a pay to visit. I enjoyed walking around the area and seeing the architectural aspects of the houses and how the entire alleys are meticulously planned. Its a good example of having the old and the new. 
Well worth a visit to walk around these lovely traditional hanok.,"Seoul's Bukchon Hanok Village is a traditional Korean village with a long history located not too far from the Gyeongbok Palace and Changdeok Palace and is well worth a few hours to explore and take in the culture. The traditional village is composed of lots of alleys, ""hanok"", and is preserved to show a 600-year-old urban environment, but it is a residential area with people living in the traditional wooden and stone houses and so you need to respect that when you walk around the hanok.As well as the lovely architecture of the traditional homes there are plenty of shops, craft centres drinking and eating places to spend your time exploring. Pick up a map from the tourist information office as you enter the Bukchon Hanok area as this I found was a great help in navigating my way around the narrow streets. It was very popular and very busy with tourists so expect to be one of many as you walk this fabulous historic district. It is rather steep walking in places so probably not suitable for those in wheelchairs or those whom are not in great fitness."
