review_title,review_body
Interesting mix of old and new,"Great area to wander around. Go off the main roads and get yourself lost a little, you'll easily find your way back. Plenty of cafés and places to eat. It's very popular, so be prepared for plenty of company, particularly at weekends. Lots of couples in traditional hanbok dress add to the atmosphere and the views of the old hanok houses against the background of high rise modern Seoul are fabulous.Walking out of Bukchon, you're only a stones throw from Insa-dong. "
beautiful village,"The Hanok Village in Bukchon is Korean traditional houses. It is famous and one of must go to visit attractions in Korea. The Hanok Village is on the top of the mountain, so you need to walk a long and steap road. Although you will feel tired, it is worth when you arrived at the Hanok Village. A lot of tourists dressed Korean traditional clothes – Hanbok, they took pictures in this beautiful places like a Korean. I am regret that I did not rent hanbok to try. It will a good experience. Also, I saw a foreign TV show came to there. They introduced the Hanok Village and interviewed the local resident to introduce the history of the village. Walking along this road, you found the air is fresh and the hanok is total different from each other. Each house have their feature and culture. I really recommend this place to take a visit in Seoul. However, our voice should as low as possible. We should not disturb the local residents."
Just go there and wander,"Lovely village. You can't miss it. Just wander around the winding streets that some times turn into sidewalks that can end up as stairs. Don't worry if you end up in a dead end, just turn around and find another path. Charming area with innumerable cafes and tea houses on the main street. Do make sure you get off the main street, though."
Beautiful area,Really nice to walk through these picturesque alleys with its nice little homes. But it can be quite busy there with tourists taking selfies everywhere and not even respecting the property of the people living there. 
Bukchon Hanok Village,Had a little walk around here during the day. Very lovely but quiet busy. You can use the hop on hop off bus to get here which we did. There is also a lovely park surrounding which was nice to walk through. Good examples of olden style dwellings - there were written information plaques but I do not recall English - though I may be incorrect.
a glimpse of traditional Korean house,Be prepared to walk up and downhill when you tour around this area.It is quiet and you can have a glimpse of the traditional Korean house.
Perfect mix of a modern and traditional taste,"What I found interesting is, this village is located in the city, integrated with other element of the city. It is surprising when you walk in the pavement with a busy traffic and the next turn you take bring you to the traditional taste of Korean home.I learned that this area is visited by tourist massively, but I was there late afternoon so I only encounter 2-3 people, which is amazing. This is basically a residential area, so you should respect them and keep your voice low."
The greatest village in Seoul,"Traveller MUST visit this village. Very unique and traditional place of Seoul. I love every minute in this place, feel very tranquility and calming "
Beautiful and full of tourists,Very beautiful area that's full of tourists. Nice area with great views. Be prepared for the tourist crowds
Picturesque,"Quaint and picturesque traditional village. Plenty of people rent the traditional costumes and walk around taking photos. Rather crowded but fun to wander around. There are several museums around, apparently, offering insights into the cultural background. Do remember that this is still a residential area, so they request tourists to keep their voices down."
Traditional korean houses village," If you want to see how korean traditional houses & village looks like, you visit here bukchon Hanok village. There are over 900 houses packed. "
Memorable Lane,It's like going back to the past with all the older yet very well maintained homes of Korea. great street to visit!
Traditional residential area of Seoul,"This cluster of traditional Korean houses is located between the Gyeongbokgung and Changdeokgung palaces. Bukchon literally means 'northern village"". Some of these residence blocks are centuries-old. The Bukchon Traditional Culture Centre located in this area plans and operates a variety of cultural programs. A walk through Bukchon Hanok essentially means a walk through meandering alleys. Thoroughly enjoyable and pretty!"
Not what we expected... so much better,"We visited the village early morning as a stop gap whilst waiting to start our Secret Garden Tour at Changdeokgung Palace. So glad we decided to stop by as it's such a gem. Not at all what we were expecting, but so much better, a great mix of old and new. Great little shops and cafes, had some nice restaurants too. Just a shame we didn't have more time.....Would definitely visit again, would just make sure we made more time. Lovely way to spend a couple of hours."
Lovely place full of hidden gems,We had a lovely couple of hours walking round all the hidden little streets.Some good shops and very reasonable priced.
Disappoiting place,"I've heard so much positive about this place but when i arrived there it wasnt much. Its basically just a hill with traditional buildings. It's worth taking a visit when doing Gyeongbokgung and Changdeokgung Palace since its between those two, but do not plan to spend much time here."
The Way that it Used to Be,"Take the time to visit the ""old Seoul."" High atop hills, with a great view of the city, you can wander up and town narrow streets, looking at old home and buildings of the ancient architecture. A MUST SEE!"
Residential area,We asked directions at the tourist information booth and was given a map of Bukchon where he highlighted the best places to go. On arrival at the village there was a coach tour getting off so it can get busy as it is a popular tourist site. There are many signs telling people to keep the noise down as this is a residential area. However this did not stop people talking loudly or posing for photos on the doorway of someone's house. The village mixes the old traditional houses with some newer style. I felt like I was intruding into their neighbourhood and they must get pretty tired of the tourists gawping in and taking photos of their houses. The only people that seem to benefit are the shops selling gifts and the cafes and restaurants. 
overrated but the shopping is fun,"The area of Seoul is lovely - and unique. Most of Seoul is in the process off renovation and Bukchon still has some of the old feel to it. Jump into the alleys for proper food. If someone is beckoning you into a hole in the wall sort of restaurant, go in. You will be in the right place. The pictures on the wall will assist you in choosing something to eat and you will love it. Best food anywhere"
Charming sort of old area,By sort of old I meant a little more than 100 years old. That in the scheme of things not really old but still a nice hour of walking and some shops
If you don´t do anything else; do this,"We LOVED it! If you do not see anything else in Seoul this is definitely something to do. The feeling, the little shops, the beautiful streets... so sweet in the middle of the city. Do this. Short but sweet."
Love it,If you visit korea you cant miss this place i stay 2 night here and to me is not enough i wish i have more time 
Great atmosphere,"I really liked the atmosphere of the ""village"", it's quite calm compared to downtown Seoul. Really pretty."
A Walk in Korean Traditional Village during a Rainy Day,"Bukchon Hanok Village is within walking distance from Anguk Station. If you are unsure about the layout of the village, I would recommend you to visit the tourist information center located along the way from Anguk Station to the village. The staff there will provide you with the village map and even will advise on the suitable route to enjoy the walk. I visited this village during a windy and rainy day. Even though our visit was somehow affected by the strong wind and wet clothes, but as it was just a leisure walk, we still able to enjoy the walk and took memorable pictures. The whole village is residential area with people living inside the traditional house, so we have to mind our manners and avoid making loud sounds. There are a lot of picturesque spots throughout the village. If you enjoy leisure walk and traditional architectures, this is a must visit area. In addition, Buckhon Hanok Village is near to Gyeongbukgong Palace and if you don't mind to walk for another 10 mins plus, you can just walk to the palace from this village."
Join a Walking Tour,The Hanuk Village in Bukchon is absolutely picturesque. The village successfully preserves the humble yet intricate architecture of traditional Korean houses. The road is steep so wear comfortable footwear! I also suggest joining a walking tour instead of a DYI so as not to unnecessarily waste any time and effort in getting lost.
Cute little traditional street,"Very easy to do a little walk about here, streets connect to lots of little restaurants and then you are close to the Palace to so that after."
Step back in time,Great place to visit to see the traditional building styles and methods of yesterday. Its a relatively small spot so it won't take long to see a lot. Keep in mind this is a residential neighborhood and apparently the residents are not huge fans of the crowds. You'll see a lot of people here taking pictures.
Absolutely an amazing experience!,"You can choose to go with a tour or like me - walking free and easy! It is a great area full of hanoks (traditional korean houses), boutique shops and cafe. I was planning to spend half a day but turned out enjoyed for a good 5-6 hours walk with breaks in between. It was great to take a break with some ice tea and Korean snacks in a hanoks cafe.For photography lovers, you may take more than half a day like me. It was great walking round to take photos along small alleys, definitely a great trip! I enjoyed getting lost in the village although I had a map with me. For those who love to stay in old houses, there are lots of guest houses too For the cafe lover, absolutely a place to go with traditional atmosphere with some Korean tea and snacks.For those who go with tours, please lower your voice because this is still a residential area with residents. Unfortunately many tourists were still making lots of noises - even the tour guides were loud, not exactly respecting the residents. Tips: Please visit early and plan for your route if you want to avoid the crowds, I managed to avoid it.Also, you may want to bring/ purchase electronic fan if you travel during Summer like me."
Love it,Many traditional house (hanok) in there. We can also try street food in some stores. Little bit crowded but not a problem
Nyx,"2 years ago, I tried to come here from Samcheongdong and omg it was so steep. This time I tried from Insadong/Anguk stn and it was so easy. Get out from exit2, wait for the green bus no.2 at the stop across the street from Starbucks and get off at 북촌한옥마을.돈미약국 (Bukchon Hanok Village/Donmi pharmacy) to save 10 mins of walking up the hill. From the stop, cross the street and just follow the crowd. From the photospot no. 4(if I remembered correctly) which is the observation point, you can walk down to Samcheongdong using steep staircase or the not too steep/far walkway. After that you can roam around the street. if you turn right you will shortly arrive at Kyeongbok Palace. If it's too much of a walk, after you reach the ground, just cross the street and take the bus to the palace or the main road for subway stn."
Very interesting,"If you are interested in getting ""lost"" in a folk area in Seoul, Bukchon Hanok village is a good chance to do it. You can see how a Korean village did look like, how the ceilings are/were made, the entrance doors of the houses and so on. I would recommend to visit the ""sample"" of old house shown in the Bukchon Traditional Culture Center."
See old Seoul.,"I highly recommend this neighborhood. This is the only neighborhood in Seoul where you can see traditional Korean houses. Some of the traditional houses have been turned into art galleries, coffee shops and museums where you can experience traditional Korean culture (tea ceremony, arts and crafts, etc.)"
Must see!,"Bukchon Hanok village is a must see while in Seoul. Easy to get to and fascinating to walk around. I wouldn't spend a lot of time here but it is worth seeking out - just do it quietly, the locals who live there don't appreciate noisy tourists!"
See cultural houses,"Go here if you're interested in their cultural houses. There's a lot of walking and there are steep areas that at some point, my parents would just wait for us instead of walk all the way up the kinda steep walkway. It was a nice walk along the houses. It can also be considered a fun mini hike if you're up for that kind of stuff. The view of the sunset and mountain is beautiful from here."
Too many tourists on a Sunday,"I had high expectations of walking around quiet neighborhoods of hanoks which are traditional Korean wooden homes. My husband and I went on a Sunday. The streets were overrun with tourists taking photos of themselves with the homes in the backgrounds. You'll need to walk uphill to see the more interesting homes. The tiny Bukchon Tourist Office provides a good map and lots of helpful information. Go on a quiet week day. Hopefully, it will feel more authentic."
Nice views plus bought local clothes,"I enjoyed walking and taking photos ans also bought local traditional cloths for around 20 000 for myself and the same for my wife. Children version cost 15 000. Also enjoyed fried rice with hit sauce, and rice drink! "
Beautiful Korean traditional village. good for taking photo,"If you like taking picture, or you interested in Korean traditional houses, you won't disappointed. You can see a different ""Seoul"" from here, The village is quite big, you can walk up and down hill, to take a pictures. one thing I was not impress, is too many tourists, can not take a good photo with no people."
Quaint Traditional Neighbourhood,"I visited this area once in the summer and again during Chuseok in the autumn with family. It is a lovely and interesting neighbourhood to walk around.Although it is easy to get to, you must keep in mind that it is all uphill. This can be difficult for anyone with a bad knee or anyone pushing a baby stroller.It's also a short activity (perhaps an hour max of looking around) so it would be worth going to the palace nearby to make a nice day of it all. There are many cafes and shops nearby for refreshments too."
Old Town of Seoul,"When you come to Seoul, Buchon Village is the little place that really traditional and if you love korean drama, this place is really like location for Korean Drama. But please do not make a noisy since this village still home for korean citizen. "
Interesting area to walk around,A glimpse into village life. Would have liked to have a look into more homes beyond the gates. They look quite spacious. Interesting exploring the alleys and shops. Good craft beer cafe to finish the visit.
Convenient location to see traditional Hanok houses,"Great walking tour between two of the major palace attractions, so a great way to get your hanok fix. The houses are well maintained and there is a small visitor center (Seoul Hanok Center) that can provide a map showing walking tour ideas and an extremely knowledegable and friendly guide who can provide more information and show you an unoccupied hanok and talk about some principles of it's construction. It is not listed on Trip Advisor but is right off of Gyedong-gil-2 streetThere is a lot of uphill climbing. Many cute little shops and some restaurants as well as micro museums within given hanoks."
Beautiful photo spot where traditional Korea meets modern Seoul,"This is a very relaxing attraction where you can walk streets to see old traditional Korean houses. They were very well maintained. As you walk up the hill, the Seoul skyline begins to emerge in the background. This is a great photo spot!There were two helpful ""information"" givers, who provided maps of the area and spoke great English! The whole attraction took us about an hour. Signs throughout remind visitors that Bukchon is a residential area, so keep your voices quiet.Check this out if you like beautiful architecture and scenery. Probably not the #1 Seoul attraction, but definitely a cute spot to visit!"
Well preserved traditional Korean living area,"This is definitely worth to visit. I don't expect these traditional Korean buildings are preserved so well. When walking along all the lanes of this area, I felt history is around me. Also, there are few shops to on those beautiful traditional clothing and took beautiful shot with the background of old Korean building. So happy! Of course, suggest to go there during weekday because it is a very popular sport for tourist."
Disappointed!,Nothing special at the place except for korea traditional houses. Namsamgol hanok village still the best i visited at seoul.
Rich of history,I love the structures of Korean houses here. I wish i can spend my night at least once in one of the houses here. 
"Quirky area, nice walk","Lovely walk around this area. Cool buildings, nice doors. Cute shops some galleries, a private observatory which we didn't go to. Some nice photo opportunities. Busy with other people taking selfies and generally getting in the way. Nice place, I think the people who live there must get really annoyed with tourists, from the signs on the walls and doors telling others to be quite etc."
Just walk around and enjoy,This place is so cute! Loved every corner! Walk in the middle of residential area and next there are more streets full of shops and small restaurants. Very nice.
Flash from the past,Is near Sophia guesthouse I look around nice village town. A lot shops to look around. Night time is the best to shop around.
Alley-way Photo,Again another place to get that Hanbok on! There's one alleyway that has great houses. resto not so good but tourist info people always ready to assist!
Prepare your walking shoes for some cardio challenge...,"The traditional houses in Bukchon are beautiful and you would encounter small shops selling trinkets and restaurants offering local delicacies. However, take note that you would do a lot of uphill and downhill walks around here which may not be recommended for old people and with health issues. P.S. Bring a bottle of water. Trust me, you'll get tired from all of that walking."
Very nice and lovely place in the midst of mixed residential and commercial village!,"After visiting the Changdeokgung palace (please refer to my earlier review of this place as well) as part of our full day city tour, which is just a short drive away from here, our guide brought us here for a short walkabout to immerse in another different aspects of the Korean culture and lifestyle.It was about 10.45am when we arrived and the weather warm and sunny. There is a small road with shophouses located on both sides of it (i.e. cafes, restaurants, retail and souvenir shops etc), and according to our guide, this place is very famous among the Japanese tourists, possibly because they are the ones who help to spur ""tourism"" activity here and true enough, in our walk around here, we saw many groups of Japanese tourists.As we walked deeper into the small road and into the lane where houses are located (of which some have been converted to retail and business operations). The walk was uphill on stone and rocky pathways. The houses here were very nice and lovely that depicted their long past history (of course some have been reconstructed or rebuilt and one do need to pay to admit). Most of the houses were well maintained and one could easily experience the Korean's enriching culture and history.As we walked higher (actually the walking trail was a full circle walk uphill and downhill and back to where we started), we saw more houses, unique shop houses, hostels and they were very beautifully decorated with flowers. When we reached the highest point, we did have a good bird eye's view on the vicinity and could even see the palaces from here, besides the mountains!It's a worthwhile visit here definitely as one could immerse in the unique ambience of the lovely Hanok Village of the past in present time. Although the walk can be challenging for some (at certain section, it was quite steep), just take your own sweet time and pace and you will still be able to complete the walk and see lovely things. If my 80-year old mum can do so, everyone can too!However, do take note of the following to make your walking trail fun and enjoyable:Do wear pair of comfortable/short shoes here and there will be lots of walking (especially walking uphill); Bring along drinking water, umbrella and hats during summer time; and Do keep the volume of talking low as there are still many residents staying here to avoid disturbing them.Highly recommended."
Beautiful traditional houses,Nice peaceful walk along the old traditional houses. This village is quite big so remember to follow the maps which are available along the way.Hanbok rental are available as well but I would recommend rent it from the shops near the Gyeongbokgung Palace as wearing Hanbok will allow you to have free entry into the palace.
Very nice,We signed up with Seoul Tourism Board free walking tour and we were assigned a English speaking guide Jennifer. She was very detailed and showed us the Village and even corners where no tourists knew. It was refreshing to find such as quaint place in the heart of Seoul city. I highly recommend you visit this place. Just a word of advice: Please be mindful that there are local residents living in midst of this village so please be considerate to the surrounding and the level of noise that you might be creating.
Glimpse into Seoul's past,"Definitely worth walking through in between palace visits--- convenient to do so. That said, it's hard to find the exact location- I'd recommend stopping in the visitors center to get map and guidance. Gives a great glimpse into Seoul's past."
Old Traditional Place,This are has lovely old traditional houses and gives you a feel for what the city must have been like in the past. There are lots of nice little shops and galleries around the little streets. Many of the old houses can be visited for a small fee.
A vision of the past,We had read about this location and didn't fully comprehend what it would be like. Be sure to pick up a map at the visitors center and watch the film. Then just wander around. It becomes quite obvious that this is a special place. 
Difficult to find from the palace,"It's not visible as it is behind new houses. Anyway it's very quiet and well maintained. There are many stores that sell clothes, cosmetics, foods, souvenirs, jewelry and many drink shops that are well decorated and nice view."
What a great place to visit ,"So stumble out of the subway and even if you get a bit lost like us you will eventually stumble across the village. People actually live in this village so please respect their privacy when trouncing around. Be mindful of your voice. There are plenty of options to look beyond the gated doors of traditional homes. Classic is seeing a lot of Asian you study going for Cosplay, wearing traditional costumes in the crazy heat. We came along in Autumn and it was still very warm. Can't imagine how uncomfortable it will be in mid summer Well worth the visit. Once back on the main drag grab yourself a traditional tea in any of the great tea rooms "
Cool to see an old neighbourhood in such a modern city,"The area is very cool. Go to the main information centre first, they will give you a map with suggested routes. It is best to follow the routes as determining the best route yourself could get tricky."
Fascinating Village,We walked through the narrow streets enjoying the pretty houses which were well looked after. The small shops and people gazing was in abundance. Definitely worth a visit.
"very traditional, nice view","It was very close to the Gyeongbokgung palace and I'm glad that i went there. You need to walk uphill to get there, but you will get a really nice view over the city. I really like the pictures i took there. But you should keep in mind that people still live in these houses. One of the houses is open for visitors and they also sell some souvenirs. There are also many souvenir shops or food stores in this area."
Lots of walking uphill.,"If you plan to visit this folk village, please ensure that you have good walking shoes. The road to the sites are all uphill, from Anguk Metro station. There will be a Tourist counter after you exit the subway. Get a map for the Bukchon Hanok Village. There will be sites that are numbered, site 1 for a view/glimpse of Changdeokgung Palace, site 3/4/5/6 are the main sites of the folk village. "
WalkAbout in Awe,"Loved walking through this area! Fun to see the traditional style, stop in the little shops and eat local street food. Kids and adults were engaged the entire time and it is a great place to walk through as you make you way from palace to Insadong!"
Biggest highlight of the trip!,"Beautiful area. Well worth visiting. Wonderful mix of old, historic Hanok properties with modern, on-point, trendy coffee shops and shopping options in other parts of the area. We did a tour to begin with and then went back and spent a whole afternoon there!"
