review_title,review_body
Silence is golden,"The village is located nearer to one of Seoul's major palaces, Changdeokgung. You can get off at the Anguk, and start looking for groups of giggling hanbok-wearing girls (locals + tourists) making their way somewhere. Chances are they're heading to this village for their cutesy photos. This is a residential area where traditional houses are preserved for modern day use. You'll find average looking houses interspersed with grand structures with formidable gates. However, do remember that there are real people living inside these houses, so a little consideration for their peace will be much appreciate. Silence is golden."
Lovely to stroll,"Located near the major palaces in north Seoul, this village is free to walk. The streets consist mainly of residences so don't expect much in terms of shopping. Yido pottery and KwangJuYo Pottery are nearby if you want the best in Korean ceramics, however."
Great village especially with a walking tour,"Had a great time by taking a Seoul City Walking Tour of Bukchon Hanok Village - in total the duration was around 2-3 hours and the guide spoke extremely good English. We enjoyed it a lot, and definitely think we enjoyed it more than we would have if we just walked around on our own"
Beautiful place to stroll,I really enjoyed taking a walk just to look at the streets and buildings. Great place to take photos if you're renting a traditional Hanbok. 
"Nice stroll, good for a few pictures ","If you happen to be around, it’s worth it to stop by for a few pictures, but there’s nothing that special to do.Somehow I feel that the people around prefer not to be disturbed by tourists."
Nothing much to see,"We took a trip down specially to this village. To be honest there wasn’t much to see except a few streets with some older looking architecture. There’s shops renting hanbok, which adds on slightly to the experience. Wouldn’t recommend a special trip to this place unless architecture and history are your thing. "
Interesting,"I visited Bukchon Hanok Village, with a friend and it was really interesting to see a traditional style village, which is actually still a residential area. Lots of people walking around in Hanbok. Nice observation point where you can have a glimpse of the city. "
Early Morning Visit,"We were staying in a hanok (Irang Guesthouse - highly recommended) in Bukchon Hanok Village. Hence we could explore the area and the famous 8 sights early in the morning, before tour buses arrive.The other advantage of staying in the village was that we can start from the top (near 3rd view), and walk down. (So many friends who started from Anguk Station complained that there were many slopes to climb.)It was a lovely morning walk, and we found it interesting to meander around hanoks which are lived-in (and not museum pieces). There was some construction near 6th view, which was a pity as this was one of my favourite views.Enjoy..."
Feels like you're in the past,"Lovely street to stroll around and admire the architecture of the houses. It's also a residential area so it's recommended to not make too much noise. However, there are a lot of tourists taking the opportunity to take photos in every building which can be annoying. Also, it's very near to Changdeokgung Palace and Samcheong-Dong."
Soul of Seoul,Samcheong dong is a quaint neighbourhood just east of Gyeongbokgung palace. It's filled with small cafes and restaurants; art galleries and museums as well as boutiques. Here you may also find some colourful murals and interesting art installations. You can walk through Samcheong dong en route to the Bukchon traditonal Hanok village which is very close by and a great way to experience some Korean culture and history.
Good afternoon walk,Great place for an afternoon walk. Lots of cafes and what not to stop for break. Very enjoyable with good views
Very cool place to visit,We have visited this village through a free walking tour and it was great. Tour guide showed us few unique architectural characteristics of the Korean buildings.
Historical buildings and streer,"For me it’s nothing special. Just some small street with old fashioned house. Anyway, it’s quite historical as new building are everywhere in the city. Not a must-go in Seoul. "
Touristy but good,"One will have a more pleasant experience if one goes early and beats the crowds. There are a few quirky shops and photographers will have a good chance for some memorable shots.Go early, though. "
Interesting traditional village in the city,Walked around this traditional village for about 2 hours. Checked out traditional houses which partly have been converted to restaurants and shops.
"Neat, but not necessary","The are is neat. If you're looking for a nice walk, then this place is worth going to. The pictures basically capture what you'd see so you won't miss much not going. It's a little hard to find the right alleys so make sure you get your hands on a map that shows you the route that you need to walk. You can find one at the cultural centre or with one of the tourist helpers that stand around some intersections."
Authentic Korea,"Excellent in every way; especially if, like my girlfriend, you have a lifelong interest in wearing a Hambock dress which you can hire for around 20,000 KRW for 2 hours. The buildings are mostly private so enjoy the authenticity in a respectful manner."
Great place to visit! We loved it! ,"My wife an I spent several hours wandering around here. A brief flurry of snow at the start of the day added to the occasion. We went to the museum first and the helpful gentleman there furnished us with a map, which was useful. We followed the suggested route. There are lots of nice old buildings, and plenty of photo opportunities.There are also several places where traditional Korean clothing can be hired, if you are that way inclined.Overall a wonderful experience! We loved it. "
Very unique place,"Always we seen from TV drama, should drop by to see. Subway can reach. But need a walking distance, about 20 mins. If happen you lost, there is a tourist person. Who dress in red t-shirt & black pant & with a hat. They can guide you to the area.Once you reach ""Bukchon hanok village:, must be quiet . That location still is a resident area. Of course, you can enjoy the place and houses."
Traditional districts with nice walks,"More authentic than Insa-dong, BHV offers a few quiet walks along narrow lanes, mostly car-free. A nice rest from the busy capital, and an interesting way to discover a more authentic side of Korea. A bit hilly, wear good shoes. Be sure to grab a map at the visitor centre.The closest station in Anguk."
Evening was better time ,"We went to there on Evening time(around 1800~1900). This time, The Village haven’t many people to take pictures with Korea traditional cloth so we could see and took picture with only us Also we could see Soul tower from top of the village."
fast walking course for me,"This place is some neighborhood that full of Korean traditional house. It's full of cafe's and some craft studios. The architectural and structure is amazing, but for you who visit this place just for taking nice photo's you better visit this place in the morning, because it will full with tourist that you will hard to find nice spot to take photo's. And because this place is a neighborhood which is people still live in the house, so you can not walk loudly, and you need to mind the person who live in the house if you want to take photo's in front of their house door."
Traditional Housing,Such a cool thing to see while in the city that there are still old fashioned looking homes. They’re out of the way and somewhat easy to locate. They’re real homes that people still live in so make sure you’re quiet while visiting the Bukchon Hanok Village. 
Gorgeous-Must,Caught the sunset from up above! So beautiful! Walking around the old town was peaceful and scenic. Check it out for sure!
Quick walk through,"It’s a small community with some traditional and modern architectural low rise buildings. It is a real community with shops, restaurants, convenience stores, restaurants ,schools , church,etc. The major added bonus in this community is that there are many hanbok shops and few tea houses. There were few restaurants where several Korean TV programs filmed and commented. It is a good place to take pictures and enjoy a meal. "
Quick tour on a Saturday,We really enjoyed touring this village as it had old world charm and showcased the traditional homes and the korean style charming village. It’s a wonderful place for the foreign tourist to get a quick intro to old Korea. We had much fun people watching and enjoyed some traditional hot tea at the tea house. We highly recommend this place as a destination in Seoul. 
Not impressed,"It's too commercialised, shops everywhere. Shops are more attractive than culture. I'm not very impressed."
Nice Cultural Village To Wander Around,"Has quite a bit to see and do. It is a real village with current residents living beside attractions and museums for tourists. They offer workshops for several traditional arts like calligraphy, knot tying, arts and crafts for a reasonable price. I regret not planning in advance. But if you have time, go explore and make reservations for later. Classes are run every day. They take as little as 30 mins to half a day."
Ancient views,"From Gyeongbokgung Palace we walked to Bukchon Hanok Village. We got lost and good thing we found information center where they give you a map but they don't speak a lick of english. There are 2 areas of the village and we chose the left side entrance of the road. We rented hanbok for only 1 hour. Rental for an hour is 10,000 won while 5,000 won for the hair arrangement, 1,000 won for the peticot and another 1,000 won for the locker where you keep your belongings while you roam around the village. Many tourists flock the area in the afternoon so better be early if you want to have a moment on your own with no photobombers. The village is very quiet and the houses are picturesque. If only one owner of the house would allow tourists to enter his house then that would be great. We can see the actual beauty of the house inside out. It's also possible to see the inside beauty because there are houses that turned into a guesthouse but very pricey compared to other hotels. All in all its good."
Authentic ,Not so crowded and many hip independent shops among Korean traditional houses. Good place for walk! I highly recommend here. My favorite place in Seoul 
Hanok. Come early in the morning to avoid the crowd,"Came here early before I went to Gyeongbokgung Palace. The area is so photogenic, everywhere is a photo spot. As it is a residential area, there are signs urging tourists to keep the noise level down. It is a refreshing experience seeing how old Korean houses look like and comparing it to the high rises that they have now."
Nice ancient area,"It is a complex of old villages in the centre of Seoul. It took us a while to figure out the most popular place where there are full of tourists. Again, when you come to popular places, try to beat the crowds by starting the trip early. The villages are beautiful but guests are expected to make less noise as people are still living there. Many of the houses become guest houses so you can come there and stay. It is on the hill so it might be difficult for old people. "
Quaint village in the city,The Bukchon Hanok village is a lovely area just next to one of the big palaces. The traditional architecture is interesting.
it's a unique residential,"this place is private quarters for many locals so behave, be quiet and respectful. similar to walking through a french village, you could take photos of the unique architecture. bring good cameras. one of the road has namsan tower in the background "
"Bukchon Hanok Village, Seoul",This fascinating area of Seoul is on the tourist route and demonstrates some of the earlier Korean way of living and architecture. Well worth a visit.
Bukchon Hanok Village,This area is gorgeous and very historic. People still live here. It tends to get very busy so plan to go in off-peak times. It’s great to be able to see such a preserved piece of Korean history.
Korean for a day,We visit bukchon hanok village and dress up in hanbook to feel “koreans for a day” and took loads of photos. Be mindful of noise as this is an actual neighborhood where people live. Great little nooks and alleys for photo opp.
Small Narrow Maze-like Street but Full of Beautiful Korean Traditional Houses,"Enjoyed maze like street full of Korean traditional old houses. Amazingly people still lives in those houses. Watching roof tops at higher place was spectacular. If you are not sure about navigating street, join the short tour. But lost in the maze would be a fun too (if you have time)"
Nice stroll:),You will see traditional style houses preserved like in the old days situated not too far from the urbanized Seoul:) I felt like I time travelled in an instant:) There are people walking around on their hanbok dresses so it’s so fun and educational at the same time!
Can be skipped,"When one reads the blogs and travel books, this place is written up as more exciting than it is. Yes there are Korean houses on this cliffside community. But thats it. If I had known, considering our very limited time, I would just check it out on line. The time could have been used for other activities where being present would have made a difference to our experience."
Must Visit!,It was truly an amazing experience!The rental of the costumes were seamless and the lady was really helpful. The were information staff stationed at different parts of the village and they speak English and were extremely helpful.It was a beautiful village and worth the visit for anyone visiting Seoul the first time. 
Traditional architecture for a quiet walk,"This neighbourhood is where the traditional Korean houses (hanok) are located. Some houses are centuries years old and while most of these houses are still occupied by actual living people, some have turned them into shops selling teas, souvenirs, food, perfumes, etc. Good place to have leisurely strolls or people-watching while taking a sip of tea or a bite of pastry."
Heritage Visit,This is our first time exploring this place. We love their house building & their culture. They also have nice cosy cafes & restaurants. It's a must go if going to Seoul as we don't always get to see traditional house building & structure.
Amazing,"Surrounded by Gyeongbokgung Palace, Changdeokgung Palace and Jongmyo Shrine, Bukchon Hanok Village is home to hundreds of traditional houses, called hanok, that date back to the Joseon Dynasty. The name Bukchon, which literally translates to ""northern village,"" came about as the neighborhood lies north of two significant Seoul landmarks, Cheonggyecheon Stream and Jongno. Today, many of these hanoks operate as cultural centers, guesthouses, restaurants and tea houses, providing visitors with an opportunity to experience, learn and immerse themselves in traditional Korean culture,.... a must see in Seoul."
Traditional Korea,"Bukchon Hanok Village was amazing! Filled with quirky shops, delicious food and traditional architecture. It's surrounded by palaces, galleries and museums so if you plan your day you can walk through Bukchon whilst visiting palaces and galleries. "
"Not a typical village as you would expect, however full of character and arty shops","This was a very pleasant area to walk around, lots of craft type shops and many smaller clothes shops. There a number of small museums in the village area including a typical Korean house.There were many local tourist guides around offering free advice and maps. Each time you came to a fork on the map a guide seemed to magically appear with directions, so efficient.Plant places to eat and drink in the area.Well worth a visit."
Quiet Stroll in the morning with Traditional teashops,Viewing old traditional houses gives you some nostalgic feel to the the culture. Traditional architecture of the Hanok house acquaints the visitor on the wisdom of how the hanoks were built with surrounding materials available with a view of the family as a basic social unit and the how the community lived. And it is a good contrast with nearby vibrant Samcheong-dong area and Seoul’s cafe culture.
Love this village!!,Love this village!! Visited in the month of October and the weather is just right that makes this place feel so comfortable. They do have much cafe choices in this area. Will definitely come n visit again next time
A must to see when in Seoul,"We used the a Lonely Planet walking tour plan which was quite successful as we are both good walkers and not afraid of hills. The village is well preserved with many old houses with original roofs. It's sort of upmarket touristy, with not too many tacky souvenir shops, although several tourists were wandering around in traditional clothes they had hired taking selfies."
Traditional Korean houses,"The Bukchon Hanok Village is a charming village with lots of traditional Korean houses called “hanok”. Some of these houses go back to the times of the Joseon Dynasty. Bukchon lies north of the Cheonggyecheon Stream. At the time of my visit, various tourists hired local costumes and dressed up in the traditional way. There were a few shops selling souvenir items and snacks. The village has guesthouses and tea rooms. In essence the hanoks are like small culture centres where you can learn and gain experience of traditional Korean culture. It would be best to take the metro to Anguk station and walk from there. Admission is free.You should aim to spend between sixty to ninety minutes here."
What’s all the hype ?? ,Small houses have been ‘preserved’ according to korean tradition. Beautiful handicrafts and aesthetic architecture but apart from that horde of tourists clogging up narrow alleys does actually take away the charm. Understably local residents would like tourists to be quiet as possible but the cacophony of increasing decibels can be unbearable. Definitely not for a second visit. 
"Residential Area, good for a wander around!",We cheated and took a taxi to the highest point in the village and then walked down ! It is a lovely little village with houses still faithful to the original buildings. We spent a few hours looking around and checking out the little museums and coffee shops. 
Different for non-asian people,I had couple of hours before I leave for my flight. I went there. Nice place to see. You can see how the historical houses are and they are still residential and some of tgem renovated. Worth to see if you are close. 
A Walk in History,This place is literally a neighborhood for residents. They just kept their houses looking like the old houses. It is advised to keep quite here. There is a bit of walk for you here but literally almost everything looks the same.I recommend you spend 30mins to 1 hour in this place.
"Know what to expect, look for and do as part of a day of attractions","The Hanok Village is neat to see, but if you come just as an attraction itself it might be a bit disappointing. Since it is so close to Gyeongbokgung Palace, Changdeokgung Palace, Jongmyo Shrine and Insadong you should try to visit all of these things as well as the Hanok Village as they are all within walking distance.It was neat to see the buildings and there are shops where you can dress up in traditional dress and take pictures along the way as well.Things to Note:1) Keep your voices down as it is still a neighborhood where people live2) There are wonderful tea houses, I recommend you stop at one for the experience and the view. An example would be Cha Masinuen Tteul, located along Bukchon-ro 5 na gil3) There are several must see views while in the Bukchon Hanok Village. ""Bukchon 8 Views"" is where people can fully enjoy the beauty of hanoks and the alleys in the area. Seoul has nominated eight different views and has set up ""Photo Spots,"" from which you can easily find delight in the surroundings inside of Bukchon in order to develop the area as a Seoul’s most representative cultural tourist attraction. Reserach them before you go so you don't miss one :)I would probably allocate an hour or two at the most to the village if you include the tea stop."
"Expected a bit more, but still worth a visit","Having missed this on my previous visit to Seoul, I decided to make it a point to visit the village on my next visit. It's quite a hit and miss for me.Hits- The architecture in the area is a great study into how the traditional houses, called hanok, were made.- Some of the houses actually allow you experience, learn and immerse themselves in traditional Korean culture.Misses- So much reconstruction has been done to the area, it made me feel like being in a exhibition, rather than being part of history of the city.- Too many Hanbok-dorned tourists, who don't adhere to the rules (keeping your voices down as it is, after all, still a neighbourhood where people actually live), and that creates quite an unpleasant experience.I can only blame myself for not having included it as part of my list when visiting Gyeongbokgung Palace, Changdeokgung Palace, Jongmyo Shrine and Insadong, as they are all within walking distance of one another! if you're going to plan a visit, I'd set aside an hour for this place."
Pretty area,A pretty area to walk around but it might be best to go with a tour as that would be more meaningful.
Explore Jeju Island,"We were welcomed by a very sweet and professional volunteer . She explained about the History of the village with so much fun. Then were brought to a room where she promoted their products. Wow, very expensive! Even the bottle of honey costs more than RM100. "
Loved visiting this village,"We loved visiting this street. The little shops are cute, and it is a great place to get a tea. Would go here again. "
Always fun to roam the alleyways,"On a sunny beautiful day, the views are spectacular. Fun to roam around taking pictures and photos of all the ladies dressed up in Hanbok taking selfies. Cute art galleries and cafes in the surrounding neighborhood between here and the gyeongbongdong palace."
Nice walk to see Korean traditional houses,"Couldn't find the place last year and would have failed too this year although we have the ""Korean version of its location"" to the taxi driver. Luckily came across the Seoul Hanok center where the nice lady there gave us a detailed map of the area including a suggested walking route to see all there was to see. The major areas were a bit busy with everyone wanting to take photos and selfies but the majority of the path was quiet and very peaceful to explore.Came across the ""observatory"" which is actually someone's rooftop home where he charges for access to take photos. This can be skipped though. Also found a nice Korean tea house along the way that serves excellent tea in a tranquil and beautiful Korean traditional house setting."
Worth a Stop,"This beautiful traditional Korean neighborhood is worth a walk through. It won’t take but maybe two hours or so out of your day, but is a quaint little place to see"
Traditional Architecture.,"It is very sad that there are tour guide services. But it is worth to visit if you love traditional Korean style or Traditional Architecture.But please read and prepare the related information before going there. Since there are famous 8 views.If you didn’t read the information, you may miss the view. Please quite during visiting. It is because still a lot of residents living there.It is very sad that there are tour guide services. But it is worth to visit if you love traditional Korean style or Traditional Architecture.But please read and prepare the related information before going there. Since there are famous 8 views.If you didn’t read the information, you may miss the view. Please quite during visiting. It is because still a lot of residents living there."
good but. .,"A few places where you can see traditional Korean houses in Seoul. Very good place. The residents are still living, but the Chinese tourists are lousy."
Traditional houses & many cafes ,Nice area gives nice scent of traditional Korean-style. Many cafes and nice places to have a cup of tea or snacks.
Nice walk ,"After the visit of the palace we went to the village walking around the shops and houses. It offer variety of cosmetics, hand made shops which offer classes, coffee shops with nice atmosphere. Worth going for sure."
Filled with traditional craftspeople and great old homes,This is a great hilly area to walk around. You get sweeping views over the tiled roof tops and also many traditional craft workshops and stores are to be found here. Take the walk and also the area just south and east of it is worth the stroll as well.
Traditional Korea Neighborhood ,"Its a sight seeing area where you can see traditional Korea housing. Just a short distance, with 10 minutes walk you can see everything in this neighborhood. Don't forget to take lots of pictures. "
Wandering around in Joseon kind alleys,"There are lot of shop offers cheap hanbok rental as u wish to wander around the alleys and take cute picture. Its advisable to not make noise as this alleys now become residential area. Take time to walk around as enjoy the fine architerature arts. And there also convenient store, cafe and galleries around. "
"Houses where rich government officials stay, climbing up the slope is not easy","The view was great and very ancient. Feels like Kyoto. If you have issues with legs, suggest to get a cab up there. The stairs will drain your energy."
